"","gutenberg_id","text","title","author","gutenberg_bookshelf","language"
"4067",1077,"orders relating a circumstance whereby he had encountered a wild maiden","The Mirror of Kong Ho","Bramah, Ernest","Fantasy","en"
"4068",1077,"in the woods, who had steadfastly persisted that she was one of a","The Mirror of Kong Ho","Bramah, Ernest","Fantasy","en"
"4069",1077,"band of seven (this being the luckiest protective number among the","The Mirror of Kong Ho","Bramah, Ernest","Fantasy","en"
"4070",1077,"superstitious). Though unable to cause their appearance, she had gone","The Mirror of Kong Ho","Bramah, Ernest","Fantasy","en"
"4071",1077,"through a most precise examination at his hands without deviating in the","The Mirror of Kong Ho","Bramah, Ernest","Fantasy","en"
"4072",1077,"slightest particular, whereupon distrusting the outcome of the strife,","The Mirror of Kong Ho","Bramah, Ernest","Fantasy","en"
"4073",1077,"the person who was relating the adventure had withdrawn breathless.","The Mirror of Kong Ho","Bramah, Ernest","Fantasy","en"
"4074",1077,"","The Mirror of Kong Ho","Bramah, Ernest","Fantasy","en"
"4075",1077,"When this versatile lesser priest had finished the narration, and","The Mirror of Kong Ho","Bramah, Ernest","Fantasy","en"
"4076",1077,"the applause, which clearly showed that those present approved of the","The Mirror of Kong Ho","Bramah, Ernest","Fantasy","en"
"4077",1077,"solitary maiden's discreet stratagem, had ceased, the one who occupied","The Mirror of Kong Ho","Bramah, Ernest","Fantasy","en"
"4078",1077,"the central platform, rising, exclaimed loudly, ""Mr. Kong will next","The Mirror of Kong Ho","Bramah, Ernest","Fantasy","en"
"4079",1077,"favour us with a contribution, which will consist, I am informed, of a","The Mirror of Kong Ho","Bramah, Ernest","Fantasy","en"
"4080",1077,"Chinese tale.""","The Mirror of Kong Ho","Bramah, Ernest","Fantasy","en"
"4081",1077,"","The Mirror of Kong Ho","Bramah, Ernest","Fantasy","en"
"4082",1077,"Now there chanced to be present a certain one who had already become","The Mirror of Kong Ho","Bramah, Ernest","Fantasy","en"
"4083",1077,"offensive to me by the systematic dexterity with which he had planted","The Mirror of Kong Ho","Bramah, Ernest","Fantasy","en"
"4084",1077,"his inopportune shadow between the sublime-souled Helena and any other","The Mirror of Kong Ho","Bramah, Ernest","Fantasy","en"
"4085",1077,"who made a movement to approach her heaven-dowered outline. When this","The Mirror of Kong Ho","Bramah, Ernest","Fantasy","en"
"4086",1077,"presumptuous and ill-nurtured outcast, who was, indeed, then seated","The Mirror of Kong Ho","Bramah, Ernest","Fantasy","en"
"4087",1077,"by the side of the enchanting maiden last referred to, heard the","The Mirror of Kong Ho","Bramah, Ernest","Fantasy","en"
"4088",1077,"announcement he said in a voice feigned to reach her peach-skin ear","The Mirror of Kong Ho","Bramah, Ernest","Fantasy","en"
"4089",1077,"alone, yet intentionally so modulated as to penetrate the furthest limit","The Mirror of Kong Ho","Bramah, Ernest","Fantasy","en"
"4090",1077,"of the room, ""A Chinese tale! Why, assuredly, that must be a pig-tail.""","The Mirror of Kong Ho","Bramah, Ernest","Fantasy","en"
"4091",1077,"At this unseemly shaft many of those present allowed themselves to","The Mirror of Kong Ho","Bramah, Ernest","Fantasy","en"
"4092",1077,"become immoderately amused, and even the goat-like sage who had","The Mirror of Kong Ho","Bramah, Ernest","Fantasy","en"
"4093",1077,"called upon my name concealed his face behind an open hand, but the","The Mirror of Kong Ho","Bramah, Ernest","Fantasy","en"
"4094",1077,"amiably-disposed Helena, after looking at the undiscriminating youth","The Mirror of Kong Ho","Bramah, Ernest","Fantasy","en"
"4095",1077,"coldly for a moment, deliberately rose and moved to a vacant spot at a","The Mirror of Kong Ho","Bramah, Ernest","Fantasy","en"
"4096",1077,"distance. Encouraged by this fragrant act of sympathy I replied with a","The Mirror of Kong Ho","Bramah, Ernest","Fantasy","en"
"4097",1077,"polite bow to indicate the position, ""On the contrary, the story which","The Mirror of Kong Ho","Bramah, Ernest","Fantasy","en"
"4098",1077,"it is now my presumptuous intention to relate will contain no reference","The Mirror of Kong Ho","Bramah, Ernest","Fantasy","en"
"4099",1077,"whatever to the carefully-got-up one occupying two empty seats in the","The Mirror of Kong Ho","Bramah, Ernest","Fantasy","en"
"4100",1077,"front row,"" and without further introduction began the history of Kao","The Mirror of Kong Ho","Bramah, Ernest","Fantasy","en"
"4101",1077,"and his three brothers, to which I had added the title, ""The Three","The Mirror of Kong Ho","Bramah, Ernest","Fantasy","en"
"4102",1077,"Gifts.""","The Mirror of Kong Ho","Bramah, Ernest","Fantasy","en"
"4103",1077,"","The Mirror of Kong Ho","Bramah, Ernest","Fantasy","en"
"4104",1077,"At the conclusion of this classical example of the snares ever lying","The Mirror of Kong Ho","Bramah, Ernest","Fantasy","en"
"4105",1077,"around the footsteps of the impious, I perceived that the jocular","The Mirror of Kong Ho","Bramah, Ernest","Fantasy","en"
"4106",1077,"stripling, whom I had so delicately reproved, was no longer present.","The Mirror of Kong Ho","Bramah, Ernest","Fantasy","en"
"4107",1077,"Doubtless he had been unable to remain in the same room with the","The Mirror of Kong Ho","Bramah, Ernest","Fantasy","en"
"4108",1077,"commanding Helena's high-spirited indignation, and anticipating that in","The Mirror of Kong Ho","Bramah, Ernest","Fantasy","en"
"4109",1077,"consequence there would now be no obstacle to her full-faced benignity,","The Mirror of Kong Ho","Bramah, Ernest","Fantasy","en"
"4110",1077,"I drew near with an appropriate smile.","The Mirror of Kong Ho","Bramah, Ernest","Fantasy","en"
"4111",1077,"","The Mirror of Kong Ho","Bramah, Ernest","Fantasy","en"
"4112",1077,"It is somewhere officially recorded, ""There is only one man who knew","The Mirror of Kong Ho","Bramah, Ernest","Fantasy","en"
"4113",1077,"with accurate certainty what a maiden's next attitude would be, and he","The Mirror of Kong Ho","Bramah, Ernest","Fantasy","en"
"4114",1077,"died young of surprise."" As I approached I had the sensation of passing","The Mirror of Kong Ho","Bramah, Ernest","Fantasy","en"
"4115",1077,"into so severe an atmosphere of rigid disfavour, that the ingratiating","The Mirror of Kong Ho","Bramah, Ernest","Fantasy","en"
"4116",1077,"lines upon my face became frozen in its intensity, despite the ineptness","The Mirror of Kong Ho","Bramah, Ernest","Fantasy","en"
"4117",1077,"of their expression. Unable to penetrate the cause of my offence, I","The Mirror of Kong Ho","Bramah, Ernest","Fantasy","en"
"4118",1077,"made a variety of agreeable remarks, until finding that nothing tended","The Mirror of Kong Ho","Bramah, Ernest","Fantasy","en"
"4119",1077,"towards a becoming reconciliation, I gradually withdrew in despair, and","The Mirror of Kong Ho","Bramah, Ernest","Fantasy","en"
"4120",1077,"again turned my face in the direction of that same accommodation which I","The Mirror of Kong Ho","Bramah, Ernest","Fantasy","en"
"4121",1077,"had already found beneath the sign of an Encompassed Goat. Here, by the","The Mirror of Kong Ho","Bramah, Ernest","Fantasy","en"
"4122",1077,"sarcasm of destiny, I encountered the person who had drawn the slighting","The Mirror of Kong Ho","Bramah, Ernest","Fantasy","en"
"4123",1077,"analogy between this one's pig-tail and his ability as a story-teller.","The Mirror of Kong Ho","Bramah, Ernest","Fantasy","en"
"4124",1077,"For a brief space of time the ultimate development of the venture","The Mirror of Kong Ho","Bramah, Ernest","Fantasy","en"
"4125",1077,"was doubtfully poised, but recognising in each other's features the","The Mirror of Kong Ho","Bramah, Ernest","Fantasy","en"
"4126",1077,"overhanging cloud of an allied pang, the one before me expressed a","The Mirror of Kong Ho","Bramah, Ernest","Fantasy","en"
"4127",1077,"becoming contrition for the jest, together with a proffered cup. Not to","The Mirror of Kong Ho","Bramah, Ernest","Fantasy","en"
"4128",1077,"appear out-classed I replied in a suitable vein, involving the supply","The Mirror of Kong Ho","Bramah, Ernest","Fantasy","en"
"4129",1077,"of more vessels; whereupon there succeeded many more vessels, called for","The Mirror of Kong Ho","Bramah, Ernest","Fantasy","en"
"4130",1077,"both singly and in harmonious unison, and the reappearance of numerous","The Mirror of Kong Ho","Bramah, Ernest","Fantasy","en"
"4131",1077,"bright images, accompanied by a universal scintillation of meteor-like","The Mirror of Kong Ho","Bramah, Ernest","Fantasy","en"
"4132",1077,"iridescence. In this genial and greatly-enlarged spirit we returned","The Mirror of Kong Ho","Bramah, Ernest","Fantasy","en"
"4133",1077,"affably together to the hall, and entered unperceived at the moment when","The Mirror of Kong Ho","Bramah, Ernest","Fantasy","en"
"4134",1077,"the one who made the announcements was crying aloud, ""According to the","The Mirror of Kong Ho","Bramah, Ernest","Fantasy","en"
"4135",1077,"programme the next item should have been a Chinese poem, but as Mr. Kong","The Mirror of Kong Ho","Bramah, Ernest","Fantasy","en"
"4136",1077,"Ho appears to have left the building, we shall pass him over--""","The Mirror of Kong Ho","Bramah, Ernest","Fantasy","en"
"4137",1077,"","The Mirror of Kong Ho","Bramah, Ernest","Fantasy","en"
"4138",1077,"""What Ho?"" exclaimed the somewhat impetuous one by my side, stepping","The Mirror of Kong Ho","Bramah, Ernest","Fantasy","en"
"4139",1077,"forward indignantly and mounting the platform in his affectionate zeal.","The Mirror of Kong Ho","Bramah, Ernest","Fantasy","en"
"4140",1077,"""No one shall pass over my old and valued friend--this Ho--while I have","The Mirror of Kong Ho","Bramah, Ernest","Fantasy","en"
"4141",1077,"a paw to raise. Step forward, Mandarin, and let them behold the inventor","The Mirror of Kong Ho","Bramah, Ernest","Fantasy","en"
"4142",1077,"and sole user of the justly far-famed G. R. Ko-Ho hair restorer--sent in","The Mirror of Kong Ho","Bramah, Ernest","Fantasy","en"
"4143",1077,"five guinea bottles to any address on receipt of four penny stamps--as","The Mirror of Kong Ho","Bramah, Ernest","Fantasy","en"
"4144",1077,"he appeared in his celebrated impersonation of the human-faced Swan at","The Mirror of Kong Ho","Bramah, Ernest","Fantasy","en"
"4145",1077,"Doll and Edgar's. Come on, oh, Ho!""","The Mirror of Kong Ho","Bramah, Ernest","Fantasy","en"
"4146",1077,"","The Mirror of Kong Ho","Bramah, Ernest","Fantasy","en"
"4147",1077,"""Assuredly,"" I replied, striving to follow him, ""yet with the wary","The Mirror of Kong Ho","Bramah, Ernest","Fantasy","en"
"4148",1077,"greeting, 'Slowly, slowly; walk slowly,' engraved upon my mind, for the","The Mirror of Kong Ho","Bramah, Ernest","Fantasy","en"
"4149",1077,"barrier of these convoluted stairs--"" but at this word a band of maidens","The Mirror of Kong Ho","Bramah, Ernest","Fantasy","en"
"4150",1077,"passed out hastily, and in the tumult I reached the dais and began","The Mirror of Kong Ho","Bramah, Ernest","Fantasy","en"
"4151",1077,"Weng Chi's immortal verses, entitled ""The Meandering Flight,"" which had","The Mirror of Kong Ho","Bramah, Ernest","Fantasy","en"
"4152",1077,"occupied me three complete days and nights in the detail of rendering","The Mirror of Kong Ho","Bramah, Ernest","Fantasy","en"
"4153",1077,"the allusions into well-balanced similitudes and at the same time","The Mirror of Kong Ho","Bramah, Ernest","Fantasy","en"
"4154",1077,"preserving the skilful evasion of all conventional rules which raises","The Mirror of Kong Ho","Bramah, Ernest","Fantasy","en"
"4155",1077,"the original to so sublime a height.","The Mirror of Kong Ho","Bramah, Ernest","Fantasy","en"
"4156",1077,"","The Mirror of Kong Ho","Bramah, Ernest","Fantasy","en"
"4157",1077," The voice of one singing at the dawn;","The Mirror of Kong Ho","Bramah, Ernest","Fantasy","en"
"4158",1077," The seven harmonious colours in the sky;","The Mirror of Kong Ho","Bramah, Ernest","Fantasy","en"
"4159",1077," The meeting by the fountain;","The Mirror of Kong Ho","Bramah, Ernest","Fantasy","en"
"4160",1077," The exchange of gifts, and the sound of the processional drum;","The Mirror of Kong Ho","Bramah, Ernest","Fantasy","en"
"4161",1077," The emotion of satisfaction in each created being;","The Mirror of Kong Ho","Bramah, Ernest","Fantasy","en"
"4162",1077," This is the all-prominent indication of the Spring.","The Mirror of Kong Ho","Bramah, Ernest","Fantasy","en"
"4163",1077,"","The Mirror of Kong Ho","Bramah, Ernest","Fantasy","en"
"4164",1077," The general disinclination to engage in laborious tasks;","The Mirror of Kong Ho","Bramah, Ernest","Fantasy","en"
"4165",1077," The general readiness to consume voluminous potions on any","The Mirror of Kong Ho","Bramah, Ernest","Fantasy","en"
"4166",1077," pretext.","The Mirror of Kong Ho","Bramah, Ernest","Fantasy","en"
"4167",1077," The deserted appearance of the city and the absence of the","The Mirror of Kong Ho","Bramah, Ernest","Fantasy","en"
"4168",1077," come-in motion at every door;","The Mirror of Kong Ho","Bramah, Ernest","Fantasy","en"
"4169",1077," The sportiveness of maidens, and even those of maturer age,","The Mirror of Kong Ho","Bramah, Ernest","Fantasy","en"
"4170",1077," ethereally clad, upon the shore.","The Mirror of Kong Ho","Bramah, Ernest","Fantasy","en"
"4171",1077," The avowed willingness of merchants to dispose of their wares","The Mirror of Kong Ho","Bramah, Ernest","Fantasy","en"
"4172",1077," for half the original sum.","The Mirror of Kong Ho","Bramah, Ernest","Fantasy","en"
"4173",1077," This undoubtedly is the Summer.","The Mirror of Kong Ho","Bramah, Ernest","Fantasy","en"
"4174",1077,"","The Mirror of Kong Ho","Bramah, Ernest","Fantasy","en"
"4175",1077," The yellow tea leaf circling as it falls;","The Mirror of Kong Ho","Bramah, Ernest","Fantasy","en"
"4176",1077," The futile wheeling of the storm-tossed swan;","The Mirror of Kong Ho","Bramah, Ernest","Fantasy","en"
"4177",1077," The note of the marble lute at evening by the pool;","The Mirror of Kong Ho","Bramah, Ernest","Fantasy","en"
"4178",1077," The immobile cypress seen against the sun.","The Mirror of Kong Ho","Bramah, Ernest","Fantasy","en"
"4179",1077," The unnecessarily difficult examination paper.","The Mirror of Kong Ho","Bramah, Ernest","Fantasy","en"
"4180",1077," All these things are suggestive of the Autumn.","The Mirror of Kong Ho","Bramah, Ernest","Fantasy","en"
"4181",1077,"","The Mirror of Kong Ho","Bramah, Ernest","Fantasy","en"
"4182",1077," The growing attraction of a well-lined couch.","The Mirror of Kong Ho","Bramah, Ernest","Fantasy","en"
"4183",1077," The obsequious demeanour of message-bearers, charioteers, and","The Mirror of Kong Ho","Bramah, Ernest","Fantasy","en"
"4184",1077," the club-armed keepers of peace.","The Mirror of Kong Ho","Bramah, Ernest","Fantasy","en"
"4185",1077," The explosion of innumerable fire-crackers round the convivial","The Mirror of Kong Ho","Bramah, Ernest","Fantasy","en"
"4186",1077," shines,","The Mirror of Kong Ho","Bramah, Ernest","Fantasy","en"
"4187",1077," The gathering together of relations who at all other times","The Mirror of Kong Ho","Bramah, Ernest","Fantasy","en"
"4188",1077," shun each other markedly.","The Mirror of Kong Ho","Bramah, Ernest","Fantasy","en"
"4189",1077," The obtrusive recollection of a great many things contrary to","The Mirror of Kong Ho","Bramah, Ernest","Fantasy","en"
"4190",1077," a spoken vow, and the inflexible purpose to be more","The Mirror of Kong Ho","Bramah, Ernest","Fantasy","en"
"4191",1077," resolute in future.","The Mirror of Kong Ho","Bramah, Ernest","Fantasy","en"
"4192",1077," These in turn invariably attend each Winter.","The Mirror of Kong Ho","Bramah, Ernest","Fantasy","en"
"4193",1077,"","The Mirror of Kong Ho","Bramah, Ernest","Fantasy","en"
"4194",1077,"It certainly had not presented itself to me before that the words","The Mirror of Kong Ho","Bramah, Ernest","Fantasy","en"
"4195",1077,"""invariably attend"" are ill-chosen, but as I would have uttered them","The Mirror of Kong Ho","Bramah, Ernest","Fantasy","en"
"4196",1077,"their inelegance became plain, and this person made eight conscientious","The Mirror of Kong Ho","Bramah, Ernest","Fantasy","en"
"4197",1077,"attempts to soften down their harsh modulation by various interchanges.","The Mirror of Kong Ho","Bramah, Ernest","Fantasy","en"
"4198",1077,"He was still persevering hopefully when he of chief authority approached","The Mirror of Kong Ho","Bramah, Ernest","Fantasy","en"
"4199",1077,"and requested that the one who was thus employed and that same other","The Mirror of Kong Ho","Bramah, Ernest","Fantasy","en"
"4200",1077,"would leave the hall tranquilly, as the all-water entertainment was","The Mirror of Kong Ho","Bramah, Ernest","Fantasy","en"
"4201",1077,"at an end, and an attending slave was in readiness to extinguish the","The Mirror of Kong Ho","Bramah, Ernest","Fantasy","en"
"4202",1077,"lanterns.","The Mirror of Kong Ho","Bramah, Ernest","Fantasy","en"
"4203",1077,"","The Mirror of Kong Ho","Bramah, Ernest","Fantasy","en"
"4204",1077,"""Yet,"" I protested unassumingly, ""that which has so far been expressed","The Mirror of Kong Ho","Bramah, Ernest","Fantasy","en"
"4205",1077,"is only in the semblance of an introductory ode. There follow--""","The Mirror of Kong Ho","Bramah, Ernest","Fantasy","en"
"4206",1077,"","The Mirror of Kong Ho","Bramah, Ernest","Fantasy","en"
"4207",1077,"""You must not argue with the Chair,"" exclaimed another interposing his","The Mirror of Kong Ho","Bramah, Ernest","Fantasy","en"
"4208",1077,"voice. ""Whatever the Chair rules must be accepted.""","The Mirror of Kong Ho","Bramah, Ernest","Fantasy","en"
"4209",1077,"","The Mirror of Kong Ho","Bramah, Ernest","Fantasy","en"
"4210",1077,"""The innuendo is flat-witted,"" I replied with imperturbable dignity, but","The Mirror of Kong Ho","Bramah, Ernest","Fantasy","en"
"4211",1077,"still retaining my hold upon the rail. ""When this person so far loses","The Mirror of Kong Ho","Bramah, Ernest","Fantasy","en"
"4212",1077,"his sense of proportion as to contend with an irrational object, devoid","The Mirror of Kong Ho","Bramah, Ernest","Fantasy","en"
"4213",1077,"of faculties, let the barb be cast. After that introduction dealing with","The Mirror of Kong Ho","Bramah, Ernest","Fantasy","en"
"4214",1077,"the four seasons, the twelve gong-strokes of the day are reviewed in a","The Mirror of Kong Ho","Bramah, Ernest","Fantasy","en"
"4215",1077,"like fashion. These in turn give place to the days of the month, then","The Mirror of Kong Ho","Bramah, Ernest","Fantasy","en"
"4216",1077,"the moons of the year, and finally the years of the cycle.""","The Mirror of Kong Ho","Bramah, Ernest","Fantasy","en"
"4217",1077,"","The Mirror of Kong Ho","Bramah, Ernest","Fantasy","en"
"4218",1077,"""That's fair,"" exclaimed the perverse though well-meaning youth, whom I","The Mirror of Kong Ho","Bramah, Ernest","Fantasy","en"
"4219",1077,"was beginning to recognise as the cause of some misunderstanding among","The Mirror of Kong Ho","Bramah, Ernest","Fantasy","en"
"4220",1077,"us. ""If you don't want any more of his poem--and I don't blame you--my","The Mirror of Kong Ho","Bramah, Ernest","Fantasy","en"
"4221",1077,"pal Ho, who is one of the popular Flip-Flap Troupe, offers to do some","The Mirror of Kong Ho","Bramah, Ernest","Fantasy","en"
"4222",1077,"trick cycle-riding on his ears. What more can you expect?""","The Mirror of Kong Ho","Bramah, Ernest","Fantasy","en"
"4223",1077,"","The Mirror of Kong Ho","Bramah, Ernest","Fantasy","en"
"4224",1077,"""We expect a policeman very soon,"" replied another severely. ""He has","The Mirror of Kong Ho","Bramah, Ernest","Fantasy","en"
"4225",1077,"already been sent for.""","The Mirror of Kong Ho","Bramah, Ernest","Fantasy","en"
"4226",1077,"","The Mirror of Kong Ho","Bramah, Ernest","Fantasy","en"
"4227",1077,"""In that case,"" said the one who had so persistently claimed me as","The Mirror of Kong Ho","Bramah, Ernest","Fantasy","en"
"4228",1077,"an ally, ""perhaps I can do you a service by directing him here""; and","The Mirror of Kong Ho","Bramah, Ernest","Fantasy","en"
"4229",1077,"leaving this person to extricate himself by means of a reassuring","The Mirror of Kong Ho","Bramah, Ernest","Fantasy","en"
"4230",1077,"silence and some of the larger silver pieces of the Island, he vanished","The Mirror of Kong Ho","Bramah, Ernest","Fantasy","en"
"4231",1077,"hastily.","The Mirror of Kong Ho","Bramah, Ernest","Fantasy","en"
"4232",1077,"","The Mirror of Kong Ho","Bramah, Ernest","Fantasy","en"
"4233",1077,"With some doubt whether or not this deviation into the society of the","The Mirror of Kong Ho","Bramah, Ernest","Fantasy","en"
"4234",1077,"professedly virtuous, ending as it admittedly does in an involvement,","The Mirror of Kong Ho","Bramah, Ernest","Fantasy","en"
"4235",1077,"may not be deemed ill-starred; yet hopeful.","The Mirror of Kong Ho","Bramah, Ernest","Fantasy","en"
"4236",1077,"","The Mirror of Kong Ho","Bramah, Ernest","Fantasy","en"
"4237",1077,"KONG HO.","The Mirror of Kong Ho","Bramah, Ernest","Fantasy","en"
"4238",1077,"","The Mirror of Kong Ho","Bramah, Ernest","Fantasy","en"
"4239",1077,"","The Mirror of Kong Ho","Bramah, Ernest","Fantasy","en"
"4240",1077," THE THREE GIFTS","The Mirror of Kong Ho","Bramah, Ernest","Fantasy","en"
"4241",1077,"","The Mirror of Kong Ho","Bramah, Ernest","Fantasy","en"
"4242",1077," Related by Kong Ho on the occasion of the all-water","The Mirror of Kong Ho","Bramah, Ernest","Fantasy","en"
"4243",1077," disportment, under the circumstances previously set forth.","The Mirror of Kong Ho","Bramah, Ernest","Fantasy","en"
"4244",1077,"","The Mirror of Kong Ho","Bramah, Ernest","Fantasy","en"
"4245",1077,"BEYOND the limits of the township of Yang-chow there dwelt a rich","The Mirror of Kong Ho","Bramah, Ernest","Fantasy","en"
"4246",1077,"astrologer named Wei. Reading by his skilful interpretation of the","The Mirror of Kong Ho","Bramah, Ernest","Fantasy","en"
"4247",1077,"planets that he would shortly Pass Above, he called his sons Chu, Shan,","The Mirror of Kong Ho","Bramah, Ernest","Fantasy","en"
"4248",1077,"and Hing to his side and distributed his wealth impartially among them.","The Mirror of Kong Ho","Bramah, Ernest","Fantasy","en"
"4249",1077,"To Chu he gave his house containing a gold couch; to Shan a river with","The Mirror of Kong Ho","Bramah, Ernest","Fantasy","en"
"4250",1077,"a boat; to Hing a field in which grew a prolific orange-tree. ""Thus","The Mirror of Kong Ho","Bramah, Ernest","Fantasy","en"
"4251",1077,"provided for,"" he continued, ""you will be able to live together in","The Mirror of Kong Ho","Bramah, Ernest","Fantasy","en"
"4252",1077,"comfort, the resources of each supplying the wants of the others in","The Mirror of Kong Ho","Bramah, Ernest","Fantasy","en"
"4253",1077,"addition to his own requirements. Therefore when I have departed let it","The Mirror of Kong Ho","Bramah, Ernest","Fantasy","en"
"4254",1077,"be your first care to sacrifice everything else I leave, so that I also,","The Mirror of Kong Ho","Bramah, Ernest","Fantasy","en"
"4255",1077,"in the Upper Air, may not be left destitute.""","The Mirror of Kong Ho","Bramah, Ernest","Fantasy","en"
"4256",1077,"","The Mirror of Kong Ho","Bramah, Ernest","Fantasy","en"
"4257",1077,"Now in addition to these three sons Wei also had another, the youngest,","The Mirror of Kong Ho","Bramah, Ernest","Fantasy","en"
"4258",1077,"but one of so docile, respectful, and self-effacing a disposition that","The Mirror of Kong Ho","Bramah, Ernest","Fantasy","en"
"4259",1077,"he was frequently overlooked to the advantage of his subtle, ambitious,","The Mirror of Kong Ho","Bramah, Ernest","Fantasy","en"
"4260",1077,"and ingratiating brothers. This youth, Kao, thinking that the occasion","The Mirror of Kong Ho","Bramah, Ernest","Fantasy","en"
"4261",1077,"certainly called for a momentary relaxation of his usual diffidence,","The Mirror of Kong Ho","Bramah, Ernest","Fantasy","en"
"4262",1077,"now approached his father modestly, and begged that he also might be","The Mirror of Kong Ho","Bramah, Ernest","Fantasy","en"
"4263",1077,"included to some trivial degree in his bounty.","The Mirror of Kong Ho","Bramah, Ernest","Fantasy","en"
"4264",1077,"","The Mirror of Kong Ho","Bramah, Ernest","Fantasy","en"
"4265",1077,"This reasonable petition involved Wei in an embarrassing perplexity.","The Mirror of Kong Ho","Bramah, Ernest","Fantasy","en"
"4266",1077,"Although he had forgotten Kao completely in the division, he had now","The Mirror of Kong Ho","Bramah, Ernest","Fantasy","en"
"4267",1077,"definitely concluded the arrangement; nor, to his failing powers, did it","The Mirror of Kong Ho","Bramah, Ernest","Fantasy","en"
"4268",1077,"appear possible to make a just allotment on any other lines. ""How can a","The Mirror of Kong Ho","Bramah, Ernest","Fantasy","en"
"4269",1077,"person profitably cut up an orange-tree, a boat, an inlaid couch, or","The Mirror of Kong Ho","Bramah, Ernest","Fantasy","en"
"4270",1077,"a house?"" he demanded. ""Who can divide a flowing river, or what but","The Mirror of Kong Ho","Bramah, Ernest","Fantasy","en"
"4271",1077,"unending strife can arise from regarding an open field in anything","The Mirror of Kong Ho","Bramah, Ernest","Fantasy","en"
"4272",1077,"but its entirety? Assuredly six cohesive objects cannot be apportioned","The Mirror of Kong Ho","Bramah, Ernest","Fantasy","en"
"4273",1077,"between four persons."" Yet he could not evade the justice of Kao's","The Mirror of Kong Ho","Bramah, Ernest","Fantasy","en"
