"","gutenberg_id","text","title","author","gutenberg_bookshelf","language"
"1235",1077,"withdrew and the great sky lantern had ascended. Then he cautiously","The Mirror of Kong Ho","Bramah, Ernest","Fantasy","en"
"1236",1077,"crept forth, and after some further trivial episodes which chiefly","The Mirror of Kong Ho","Bramah, Ernest","Fantasy","en"
"1237",1077,"concern the obstinate-headed slave guarding the outer door of a","The Mirror of Kong Ho","Bramah, Ernest","Fantasy","en"
"1238",1077,"tea-house, an unintelligent maiden in the employment of one vending","The Mirror of Kong Ho","Bramah, Ernest","Fantasy","en"
"1239",1077,"silk-embroidered raiment, the mercenary controller of a two-wheeled","The Mirror of Kong Ho","Bramah, Ernest","Fantasy","en"
"1240",1077,"chariot and the sympathetic and opportune arrival of a person seated","The Mirror of Kong Ho","Bramah, Ernest","Fantasy","en"
"1241",1077,"upon a funeral car, he succeeded in reaching the place of his abode.","The Mirror of Kong Ho","Bramah, Ernest","Fantasy","en"
"1242",1077,"","The Mirror of Kong Ho","Bramah, Ernest","Fantasy","en"
"1243",1077,"With unalterable affection and a material request that an unstinted","The Mirror of Kong Ho","Bramah, Ernest","Fantasy","en"
"1244",1077,"adequacy of new garments may be sent by a sure and speedy hand.","The Mirror of Kong Ho","Bramah, Ernest","Fantasy","en"
"1245",1077,"","The Mirror of Kong Ho","Bramah, Ernest","Fantasy","en"
"1246",1077,"KONG HO.","The Mirror of Kong Ho","Bramah, Ernest","Fantasy","en"
"1247",1077,"","The Mirror of Kong Ho","Bramah, Ernest","Fantasy","en"
"1248",1077,"","The Mirror of Kong Ho","Bramah, Ernest","Fantasy","en"
"1249",1077,"","The Mirror of Kong Ho","Bramah, Ernest","Fantasy","en"
"1250",1077,"","The Mirror of Kong Ho","Bramah, Ernest","Fantasy","en"
"1251",1077,"LETTER V","The Mirror of Kong Ho","Bramah, Ernest","Fantasy","en"
"1252",1077,"","The Mirror of Kong Ho","Bramah, Ernest","Fantasy","en"
"1253",1077,"","The Mirror of Kong Ho","Bramah, Ernest","Fantasy","en"
"1254",1077," Concerning the neglect of ancestors and its discreditable","The Mirror of Kong Ho","Bramah, Ernest","Fantasy","en"
"1255",1077," consequences. Two who state the matter definitely.","The Mirror of Kong Ho","Bramah, Ernest","Fantasy","en"
"1256",1077," Concerning the otherside way of looking at things and the","The Mirror of Kong Ho","Bramah, Ernest","Fantasy","en"
"1257",1077," self-contradictory bearing of the maiden Florence.","The Mirror of Kong Ho","Bramah, Ernest","Fantasy","en"
"1258",1077,"","The Mirror of Kong Ho","Bramah, Ernest","Fantasy","en"
"1259",1077,"","The Mirror of Kong Ho","Bramah, Ernest","Fantasy","en"
"1260",1077,"VENERATED SIRE,--A discovery of overwhelming malignity oppresses me. In","The Mirror of Kong Ho","Bramah, Ernest","Fantasy","en"
"1261",1077,"spite of much baffling ambiguity and the frequent evasion of conscious","The Mirror of Kong Ho","Bramah, Ernest","Fantasy","en"
"1262",1077,"guilt, there can be no longer any reasonable doubt that these barbarians","The Mirror of Kong Ho","Bramah, Ernest","Fantasy","en"
"1263",1077,"DO NOT WORSHIP THEIR ANCESTORS!","The Mirror of Kong Ho","Bramah, Ernest","Fantasy","en"
"1264",1077,"","The Mirror of Kong Ho","Bramah, Ernest","Fantasy","en"
"1265",1077,"Hitherto the matter had rested in my mind as an uneasy breath of","The Mirror of Kong Ho","Bramah, Ernest","Fantasy","en"
"1266",1077,"suspicion, agitated from time to time by countless indications that","The Mirror of Kong Ho","Bramah, Ernest","Fantasy","en"
"1267",1077,"such a possibility might, indeed, exist in a condensed form, but too","The Mirror of Kong Ho","Bramah, Ernest","Fantasy","en"
"1268",1077,"inauspiciously profane to be contemplated in the altogether. Thus, when","The Mirror of Kong Ho","Bramah, Ernest","Fantasy","en"
"1269",1077,"in the company of the young this person has walked about the streets","The Mirror of Kong Ho","Bramah, Ernest","Fantasy","en"
"1270",1077,"of the city, he may at length have said, ""Truly, out of your amiable","The Mirror of Kong Ho","Bramah, Ernest","Fantasy","en"
"1271",1077,"condescension, you have shown me a variety of entrancing scenes. Let","The Mirror of Kong Ho","Bramah, Ernest","Fantasy","en"
"1272",1077,"us now in turn visit the tombs of your ancestors, to the end that I may","The Mirror of Kong Ho","Bramah, Ernest","Fantasy","en"
"1273",1077,"transmit fitting gifts to their spirits and discharge a few propitious","The Mirror of Kong Ho","Bramah, Ernest","Fantasy","en"
"1274",1077,"fireworks as a greeting."" Yet in no case has this well-intentioned","The Mirror of Kong Ho","Bramah, Ernest","Fantasy","en"
"1275",1077,"offer been agilely received, one asserting that he did not know","The Mirror of Kong Ho","Bramah, Ernest","Fantasy","en"
"1276",1077,"the resting-place of the tombs in question, a second that he had no","The Mirror of Kong Ho","Bramah, Ernest","Fantasy","en"
"1277",1077,"ancestors, a third that Kensal Green was not an entrancing spot for","The Mirror of Kong Ho","Bramah, Ernest","Fantasy","en"
"1278",1077,"a wet afternoon, a fourth that he would see them removed to a greater","The Mirror of Kong Ho","Bramah, Ernest","Fantasy","en"
"1279",1077,"distance first, another that he drew the line at mafficking in a","The Mirror of Kong Ho","Bramah, Ernest","Fantasy","en"
"1280",1077,"cemetery, and the like. These things, it may occur to your omniscience,","The Mirror of Kong Ho","Bramah, Ernest","Fantasy","en"
"1281",1077,"might in themselves have been conclusive, yet the next reference to the","The Mirror of Kong Ho","Bramah, Ernest","Fantasy","en"
"1282",1077,"matter would perhaps be tending to a more alluring hope.","The Mirror of Kong Ho","Bramah, Ernest","Fantasy","en"
"1283",1077,"","The Mirror of Kong Ho","Bramah, Ernest","Fantasy","en"
"1284",1077,"""To-morrow,"" a person has remarked in the hearing of this one, ""I go","The Mirror of Kong Ho","Bramah, Ernest","Fantasy","en"
"1285",1077,"to the Stratford which is upon the Avon, and without a pause I shall","The Mirror of Kong Ho","Bramah, Ernest","Fantasy","en"
"1286",1077,"prostrate myself intellectually before the immortal Shakespeare's tomb","The Mirror of Kong Ho","Bramah, Ernest","Fantasy","en"
"1287",1077,"and worship his unequalled memory.""","The Mirror of Kong Ho","Bramah, Ernest","Fantasy","en"
"1288",1077,"","The Mirror of Kong Ho","Bramah, Ernest","Fantasy","en"
"1289",1077,"""The intention is benevolently conceived,"" I remarked. ""Yet has he no","The Mirror of Kong Ho","Bramah, Ernest","Fantasy","en"
"1290",1077,"descendants, this same Shakespeare, that the conciliation of his spirit","The Mirror of Kong Ho","Bramah, Ernest","Fantasy","en"
"1291",1077,"must be left to chance?""","The Mirror of Kong Ho","Bramah, Ernest","Fantasy","en"
"1292",1077,"","The Mirror of Kong Ho","Bramah, Ernest","Fantasy","en"
"1293",1077,"When he assured me that this calamity had come about, I would have added","The Mirror of Kong Ho","Bramah, Ernest","Fantasy","en"
"1294",1077,"a richly-gilded brick from my store for transmission also, in the hope","The Mirror of Kong Ho","Bramah, Ernest","Fantasy","en"
"1295",1077,"that the neglected and capricious shadow would grant me an immunity from","The Mirror of Kong Ho","Bramah, Ernest","Fantasy","en"
"1296",1077,"its resentful attention, but the one in question raised a barrier of","The Mirror of Kong Ho","Bramah, Ernest","Fantasy","en"
"1297",1077,"dissent. If I wished to adorn a tomb, he added (evading the deeper","The Mirror of Kong Ho","Bramah, Ernest","Fantasy","en"
"1298",1077,"significance of the act), there was that of Goldsmith within its Temple,","The Mirror of Kong Ho","Bramah, Ernest","Fantasy","en"
"1299",1077,"upon which many impressionable maidens from across the Bitter Waters of","The Mirror of Kong Ho","Bramah, Ernest","Fantasy","en"
"1300",1077,"the West make it a custom to deposit chaplets of verses, in the hope","The Mirror of Kong Ho","Bramah, Ernest","Fantasy","en"
"1301",1077,"of seeing the offering chronicled in the papers; and in the Open Space","The Mirror of Kong Ho","Bramah, Ernest","Fantasy","en"
"1302",1077,"called Trafalgar there were the images of a great captain who led many","The Mirror of Kong Ho","Bramah, Ernest","Fantasy","en"
"1303",1077,"junks to victory and the Emperor of a former dynasty, where doubtless","The Mirror of Kong Ho","Bramah, Ernest","Fantasy","en"
"1304",1077,"the matter could be arranged; but the surrounding had by this time","The Mirror of Kong Ho","Bramah, Ernest","Fantasy","en"
"1305",1077,"become too involved, and this person had no alternative but to smile","The Mirror of Kong Ho","Bramah, Ernest","Fantasy","en"
"1306",1077,"symmetrically and reply that his words were indeed opals falling from a","The Mirror of Kong Ho","Bramah, Ernest","Fantasy","en"
"1307",1077,"topaz basin.","The Mirror of Kong Ho","Bramah, Ernest","Fantasy","en"
"1308",1077,"","The Mirror of Kong Ho","Bramah, Ernest","Fantasy","en"
"1309",1077,"Later in the day, being desirous of becoming instructed more definitely,","The Mirror of Kong Ho","Bramah, Ernest","Fantasy","en"
"1310",1077,"I addressed myself to a venerable person who makes clean the passage of","The Mirror of Kong Ho","Bramah, Ernest","Fantasy","en"
"1311",1077,"the way at a point not far distant.","The Mirror of Kong Ho","Bramah, Ernest","Fantasy","en"
"1312",1077,"","The Mirror of Kong Ho","Bramah, Ernest","Fantasy","en"
"1313",1077,"""If you have no sons to extend your industrious line,"" I said, when he","The Mirror of Kong Ho","Bramah, Ernest","Fantasy","en"
"1314",1077,"had revealed this fact to me, ""why do you not adopt one to that end?""","The Mirror of Kong Ho","Bramah, Ernest","Fantasy","en"
"1315",1077,"","The Mirror of Kong Ho","Bramah, Ernest","Fantasy","en"
"1316",1077,"With narrow-minded covetousness, he replied that nowadays he had enough","The Mirror of Kong Ho","Bramah, Ernest","Fantasy","en"
"1317",1077,"to do to keep himself, and that it would be more reasonable to get some","The Mirror of Kong Ho","Bramah, Ernest","Fantasy","en"
"1318",1077,"one to adopt HIM.","The Mirror of Kong Ho","Bramah, Ernest","Fantasy","en"
"1319",1077,"","The Mirror of Kong Ho","Bramah, Ernest","Fantasy","en"
"1320",1077,"""But,"" I exclaimed, ignoring this ill-timed levity, ""who, when you","The Mirror of Kong Ho","Bramah, Ernest","Fantasy","en"
"1321",1077,"have Passed Beyond, will worship you and transmit to your spirit the","The Mirror of Kong Ho","Bramah, Ernest","Fantasy","en"
"1322",1077,"necessities of life?""","The Mirror of Kong Ho","Bramah, Ernest","Fantasy","en"
"1323",1077,"","The Mirror of Kong Ho","Bramah, Ernest","Fantasy","en"
"1324",1077,"""Governor,"" he replied, using the term of familiar dignity, ""I've made","The Mirror of Kong Ho","Bramah, Ernest","Fantasy","en"
"1325",1077,"shift without being worshipped for five and sixty years, and it worries","The Mirror of Kong Ho","Bramah, Ernest","Fantasy","en"
"1326",1077,"me a sight more to know who will transmit to my body the necessities of","The Mirror of Kong Ho","Bramah, Ernest","Fantasy","en"
"1327",1077,"life until I HAVE Passed Beyond.""","The Mirror of Kong Ho","Bramah, Ernest","Fantasy","en"
"1328",1077,"","The Mirror of Kong Ho","Bramah, Ernest","Fantasy","en"
"1329",1077,"""The final consequences of your self-opinionated carelessness,"" this","The Mirror of Kong Ho","Bramah, Ernest","Fantasy","en"
"1330",1077,"person continued, ""will be that your neglected and unprovided shadow,","The Mirror of Kong Ho","Bramah, Ernest","Fantasy","en"
"1331",1077,"finding itself no longer acceptable to the society of the better","The Mirror of Kong Ho","Bramah, Ernest","Fantasy","en"
"1332",1077,"class demons, will wander forth, and allying itself in despair to the","The Mirror of Kong Ho","Bramah, Ernest","Fantasy","en"
"1333",1077,"companionship of a band of outcasts like itself, will be driven to dwell","The Mirror of Kong Ho","Bramah, Ernest","Fantasy","en"
"1334",1077,"in unclean habitations and to subsist on the uncertain bounty of the","The Mirror of Kong Ho","Bramah, Ernest","Fantasy","en"
"1335",1077,"charitable.""","The Mirror of Kong Ho","Bramah, Ernest","Fantasy","en"
"1336",1077,"","The Mirror of Kong Ho","Bramah, Ernest","Fantasy","en"
"1337",1077,"""Very likely,"" replied the irredeemable person before me. ""I can't help","The Mirror of Kong Ho","Bramah, Ernest","Fantasy","en"
"1338",1077,"its troubles. I have to do all that myself as it is.""","The Mirror of Kong Ho","Bramah, Ernest","Fantasy","en"
"1339",1077,"","The Mirror of Kong Ho","Bramah, Ernest","Fantasy","en"
"1340",1077,"Doubtless this fanaticism contains the secret of the ease with which","The Mirror of Kong Ho","Bramah, Ernest","Fantasy","en"
"1341",1077,"these barbarians have possessed themselves of the greater part of the","The Mirror of Kong Ho","Bramah, Ernest","Fantasy","en"
"1342",1077,"earth, and have even planted their assertive emblems on one or two spots","The Mirror of Kong Ho","Bramah, Ernest","Fantasy","en"
"1343",1077,"in our own Flowery Kingdom. What, O my esteemed parent, what can a brave","The Mirror of Kong Ho","Bramah, Ernest","Fantasy","en"
"1344",1077,"but devout and demon-fearing nation do when opposed to a people who are","The Mirror of Kong Ho","Bramah, Ernest","Fantasy","en"
"1345",1077,"quite prepared to die without first leaving an adequate posterity to","The Mirror of Kong Ho","Bramah, Ernest","Fantasy","en"
"1346",1077,"tend their shrines and offer incense? Assuredly, as a neighbouring","The Mirror of Kong Ho","Bramah, Ernest","Fantasy","en"
"1347",1077,"philosopher once had occasion to remark, using for his purpose a","The Mirror of Kong Ho","Bramah, Ernest","Fantasy","en"
"1348",1077,"metaphor so technically-involved that I must leave the interpretation","The Mirror of Kong Ho","Bramah, Ernest","Fantasy","en"
"1349",1077,"until we meet, ""It may be war, but it isn't cricket.""","The Mirror of Kong Ho","Bramah, Ernest","Fantasy","en"
"1350",1077,"","The Mirror of Kong Ho","Bramah, Ernest","Fantasy","en"
"1351",1077,"The inevitable outcome, naturally, is that the Island must be the","The Mirror of Kong Ho","Bramah, Ernest","Fantasy","en"
"1352",1077,"wandering-place of myriads of spirits possessing no recognised standing,","The Mirror of Kong Ho","Bramah, Ernest","Fantasy","en"
"1353",1077,"and driven by want--having none to transmit them offerings--to the most","The Mirror of Kong Ho","Bramah, Ernest","Fantasy","en"
"1354",1077,"degraded subterfuges. It is freely admitted that there is scarcely an","The Mirror of Kong Ho","Bramah, Ernest","Fantasy","en"
"1355",1077,"ancient building not the abode of one or more of these abandoned demons,","The Mirror of Kong Ho","Bramah, Ernest","Fantasy","en"
"1356",1077,"doubtless well-disposed in the first instance, and capable of becoming","The Mirror of Kong Ho","Bramah, Ernest","Fantasy","en"
"1357",1077,"really beneficent Forces until they were driven to despair by obstinate","The Mirror of Kong Ho","Bramah, Ernest","Fantasy","en"
"1358",1077,"neglect. A society of very honourable persons (to which this one has","The Mirror of Kong Ho","Bramah, Ernest","Fantasy","en"
"1359",1077,"unobtrusively contributed a gift), exists for the purpose of searching","The Mirror of Kong Ho","Bramah, Ernest","Fantasy","en"
"1360",1077,"out the most distressing and meritorious cases among them, and removing","The Mirror of Kong Ho","Bramah, Ernest","Fantasy","en"
"1361",1077,"them, where possible, to a more congenial spot. The remarkable fact,","The Mirror of Kong Ho","Bramah, Ernest","Fantasy","en"
"1362",1077,"to this person's mind, is, that with the air and every available","The Mirror of Kong Ho","Bramah, Ernest","Fantasy","en"
"1363",1077,"space around absolutely packed with demons (as certainly must be the","The Mirror of Kong Ho","Bramah, Ernest","Fantasy","en"
"1364",1077,"prevailing state of things), the manifestations of their malignity and","The Mirror of Kong Ho","Bramah, Ernest","Fantasy","en"
"1365",1077,"vice are, if anything, rather less evident here than in our own favoured","The Mirror of Kong Ho","Bramah, Ernest","Fantasy","en"
"1366",1077,"country, where we do all in our power to satisfy their wants.","The Mirror of Kong Ho","Bramah, Ernest","Fantasy","en"
"1367",1077,"","The Mirror of Kong Ho","Bramah, Ernest","Fantasy","en"
"1368",1077,"That same evening I found myself seated next to a maiden of","The Mirror of Kong Ho","Bramah, Ernest","Fantasy","en"
"1369",1077,"prepossessing vivacity, who was spoken of as being one of a kindred","The Mirror of Kong Ho","Bramah, Ernest","Fantasy","en"
"1370",1077,"but not identical race. Filled with the incredible profanity of those","The Mirror of Kong Ho","Bramah, Ernest","Fantasy","en"
"1371",1077,"around, and hoping to find among a nation so alluringly high-spirited","The Mirror of Kong Ho","Bramah, Ernest","Fantasy","en"
"1372",1077,"a more congenial elevation of mind, I at length turned to her and said,","The Mirror of Kong Ho","Bramah, Ernest","Fantasy","en"
"1373",1077,"""Do not regard the question as one of unworthy curiosity, for this","The Mirror of Kong Ho","Bramah, Ernest","Fantasy","en"
"1374",1077,"person's inside is white and funereal with his fears; but do you, of","The Mirror of Kong Ho","Bramah, Ernest","Fantasy","en"
"1375",1077,"your allied race, worship your ancestors?""","The Mirror of Kong Ho","Bramah, Ernest","Fantasy","en"
"1376",1077,"","The Mirror of Kong Ho","Bramah, Ernest","Fantasy","en"
"1377",1077,"The maiden spent a moment in conscientious thought. ""No, Mr. Kong,"" she","The Mirror of Kong Ho","Bramah, Ernest","Fantasy","en"
"1378",1077,"replied, with a most commendable sigh of unfeigned regret, ""I can't say","The Mirror of Kong Ho","Bramah, Ernest","Fantasy","en"
"1379",1077,"that we do. I guess it's because we're too new. Mine, now, only go back","The Mirror of Kong Ho","Bramah, Ernest","Fantasy","en"
"1380",1077,"two generations, and they were mostly in lard. If they were old and","The Mirror of Kong Ho","Bramah, Ernest","Fantasy","en"
"1381",1077,"baronial it might be different, but I can't imagine myself worshipping","The Mirror of Kong Ho","Bramah, Ernest","Fantasy","en"
"1382",1077,"an ancestor in lard."" (This doubtless refers to some barbaric method of","The Mirror of Kong Ho","Bramah, Ernest","Fantasy","en"
"1383",1077,"embalming.)","The Mirror of Kong Ho","Bramah, Ernest","Fantasy","en"
"1384",1077,"","The Mirror of Kong Ho","Bramah, Ernest","Fantasy","en"
"1385",1077,"""And your wide and enlightened countrymen?"" I asked, unable to restrain","The Mirror of Kong Ho","Bramah, Ernest","Fantasy","en"
"1386",1077,"a passion of pure-bred despair. ""Do they also so regard the obligation?""","The Mirror of Kong Ho","Bramah, Ernest","Fantasy","en"
"1387",1077,"","The Mirror of Kong Ho","Bramah, Ernest","Fantasy","en"
"1388",1077,"""I am afraid so,"" replied the maiden, with an honourable indication","The Mirror of Kong Ho","Bramah, Ernest","Fantasy","en"
"1389",1077,"towards my emotion. ""But of course when a girl marries into the European","The Mirror of Kong Ho","Bramah, Ernest","Fantasy","en"
"1390",1077,"aristocracy, she and all her folk worship her husband's ancestors, until","The Mirror of Kong Ho","Bramah, Ernest","Fantasy","en"
"1391",1077,"every one about is fairly dizzy with the subject.""","The Mirror of Kong Ho","Bramah, Ernest","Fantasy","en"
"1392",1077,"","The Mirror of Kong Ho","Bramah, Ernest","Fantasy","en"
"1393",1077,"It is largely owing to the graceful and virtuous conversation of these","The Mirror of Kong Ho","Bramah, Ernest","Fantasy","en"
"1394",1077,"lesser ones that this person's knowledge of the exact position which","The Mirror of Kong Ho","Bramah, Ernest","Fantasy","en"
"1395",1077,"the ceremonial etiquette of the country demands on various occasions is","The Mirror of Kong Ho","Bramah, Ernest","Fantasy","en"
"1396",1077,"becoming so proficiently enlarged. It is true that they of my own sex do","The Mirror of Kong Ho","Bramah, Ernest","Fantasy","en"
"1397",1077,"not hesitate to inquire with penetrating assiduousness into certain of","The Mirror of Kong Ho","Bramah, Ernest","Fantasy","en"
"1398",1077,"the manners and customs of our land, but these for the most part do","The Mirror of Kong Ho","Bramah, Ernest","Fantasy","en"
"1399",1077,"not lead to a conversation in any way profitable to my discreeter","The Mirror of Kong Ho","Bramah, Ernest","Fantasy","en"
"1400",1077,"understanding. Those of the inner chamber, on the other hand, while","The Mirror of Kong Ho","Bramah, Ernest","Fantasy","en"
"1401",1077,"not scrupling to question me on the details of dress, the braiding and","The Mirror of Kong Ho","Bramah, Ernest","Fantasy","en"
"1402",1077,"gumming of the hair, the style and variety of the stalls of merchants,","The Mirror of Kong Ho","Bramah, Ernest","Fantasy","en"
"1403",1077,"the wearing of jade, gold, and crystal ornaments and flowers about","The Mirror of Kong Ho","Bramah, Ernest","Fantasy","en"
"1404",1077,"the head, smoking, and other matters affecting our lesser ones, very","The Mirror of Kong Ho","Bramah, Ernest","Fantasy","en"
"1405",1077,"magnanimously lead my contemplation back to a more custom-established","The Mirror of Kong Ho","Bramah, Ernest","Fantasy","en"
"1406",1077,"topic if by any hap in my ambitious ignorance I outstep it.","The Mirror of Kong Ho","Bramah, Ernest","Fantasy","en"
"1407",1077,"","The Mirror of Kong Ho","Bramah, Ernest","Fantasy","en"
"1408",1077,"In such a manner it chanced on a former occasion that I sat side by side","The Mirror of Kong Ho","Bramah, Ernest","Fantasy","en"
"1409",1077,"with a certain maiden awaiting the return of others who had withdrawn","The Mirror of Kong Ho","Bramah, Ernest","Fantasy","en"
"1410",1077,"for a period. The season was that of white rains, and the fire being","The Mirror of Kong Ho","Bramah, Ernest","Fantasy","en"
"1411",1077,"lavishly extended about the grate we had harmoniously arranged ourselves","The Mirror of Kong Ho","Bramah, Ernest","Fantasy","en"
"1412",1077,"before it, while this person, at the repeated and explicit encouragement","The Mirror of Kong Ho","Bramah, Ernest","Fantasy","en"
"1413",1077,"of the maiden, spoke openly of such details of the inner chamber as he","The Mirror of Kong Ho","Bramah, Ernest","Fantasy","en"
"1414",1077,"has already indicated.","The Mirror of Kong Ho","Bramah, Ernest","Fantasy","en"
"1415",1077,"","The Mirror of Kong Ho","Bramah, Ernest","Fantasy","en"
"1416",1077,"""Is it true, Mr. Ho"" (thus the maiden, being unacquainted with the","The Mirror of Kong Ho","Bramah, Ernest","Fantasy","en"
"1417",1077,"actual facts, consistently addressed me), ""that ladies' feet are","The Mirror of Kong Ho","Bramah, Ernest","Fantasy","en"
"1418",1077,"relentlessly compressed until they finally assume the proportions and","The Mirror of Kong Ho","Bramah, Ernest","Fantasy","en"
"1419",1077,"appearance of two bulbs?"" and as she spoke she absent-mindedly regarded","The Mirror of Kong Ho","Bramah, Ernest","Fantasy","en"
"1420",1077,"her own slippers, which were out-thrust somewhat to receive the action","The Mirror of Kong Ho","Bramah, Ernest","Fantasy","en"
"1421",1077,"of the fire.","The Mirror of Kong Ho","Bramah, Ernest","Fantasy","en"
"1422",1077,"","The Mirror of Kong Ho","Bramah, Ernest","Fantasy","en"
"1423",1077,"""It is a matter which cannot reasonably be denied,"" I replied; ""and","The Mirror of Kong Ho","Bramah, Ernest","Fantasy","en"
"1424",1077,"it is doubtless owing to this effect that they are designated 'Golden","The Mirror of Kong Ho","Bramah, Ernest","Fantasy","en"
"1425",1077,"Lilies.' Yet when this observance has been slowly and painfully","The Mirror of Kong Ho","Bramah, Ernest","Fantasy","en"
"1426",1077,"accomplished, the extremities in question are not less small but","The Mirror of Kong Ho","Bramah, Ernest","Fantasy","en"
"1427",1077,"infinitely less graceful than the select and naturally-formed pair which","The Mirror of Kong Ho","Bramah, Ernest","Fantasy","en"
"1428",1077,"this person sees before him."" And at the ingeniously-devised compliment","The Mirror of Kong Ho","Bramah, Ernest","Fantasy","en"
"1429",1077,"(which, not to become large-headed in self-imagination, it must be","The Mirror of Kong Ho","Bramah, Ernest","Fantasy","en"
"1430",1077,"admitted was revealed to me as available for practically all occasions","The Mirror of Kong Ho","Bramah, Ernest","Fantasy","en"
"1431",1077,"by the really invaluable Quang-Tsun), I bowed unremittingly.","The Mirror of Kong Ho","Bramah, Ernest","Fantasy","en"
"1432",1077,"","The Mirror of Kong Ho","Bramah, Ernest","Fantasy","en"
"1433",1077,"""O, Mr. Ho!"" exclaimed the maiden, and paused abruptly at the sound of","The Mirror of Kong Ho","Bramah, Ernest","Fantasy","en"
"1434",1077,"her words, as though they were inept.","The Mirror of Kong Ho","Bramah, Ernest","Fantasy","en"
"1435",1077,"","The Mirror of Kong Ho","Bramah, Ernest","Fantasy","en"
"1436",1077,"""In many other ways a comparison equally irreproachable to the exalted","The Mirror of Kong Ho","Bramah, Ernest","Fantasy","en"
"1437",1077,"being at my side might be sought out,"" I continued, suddenly forming","The Mirror of Kong Ho","Bramah, Ernest","Fantasy","en"
"1438",1077,"the ill-destined judgment that I was no less competent than the more","The Mirror of Kong Ho","Bramah, Ernest","Fantasy","en"
"1439",1077,"experienced Quang-Tsun to contrive delicate offerings of speech. ""Their","The Mirror of Kong Ho","Bramah, Ernest","Fantasy","en"
"1440",1077,"hair is rope like in its lack of spontaneous curve, their eyes as","The Mirror of Kong Ho","Bramah, Ernest","Fantasy","en"
"1441",1077,"deficient in lustre as a half-shuttered window; their hands are","The Mirror of Kong Ho","Bramah, Ernest","Fantasy","en"
