"","gutenberg_id","text","title","author","gutenberg_bookshelf","language"
"2678",1077,"himself the person who is inscribing these words, ""here is an individual","The Mirror of Kong Ho","Bramah, Ernest","Fantasy","en"
"2679",1077,"into whose discriminating ear it would be well to pour the exact","The Mirror of Kong Ho","Bramah, Ernest","Fantasy","en"
"2680",1077,"happening without evasion. Then even if the accusation against you be","The Mirror of Kong Ho","Bramah, Ernest","Fantasy","en"
"2681",1077,"that of resembling another or trafficking with unlawful Forces, he will","The Mirror of Kong Ho","Bramah, Ernest","Fantasy","en"
"2682",1077,"doubtless arrange the matter so that the expiation shall be as light and","The Mirror of Kong Ho","Bramah, Ernest","Fantasy","en"
"2683",1077,"inexpensive as possible.""","The Mirror of Kong Ho","Bramah, Ernest","Fantasy","en"
"2684",1077,"","The Mirror of Kong Ho","Bramah, Ernest","Fantasy","en"
"2685",1077,"By this time certain other officials had drawn near. ""What is it?"" I","The Mirror of Kong Ho","Bramah, Ernest","Fantasy","en"
"2686",1077,"heard one demand, and another replied, ""Brooklyn Ben and Jimmie the","The Mirror of Kong Ho","Bramah, Ernest","Fantasy","en"
"2687",1077,"Butterman again. Ah, they aren't artful, are they!"" but at this moment","The Mirror of Kong Ho","Bramah, Ernest","Fantasy","en"
"2688",1077,"the two into whose power I had chiefly fallen having conversed together,","The Mirror of Kong Ho","Bramah, Ernest","Fantasy","en"
"2689",1077,"I was commanded to advance towards them and reveal my name.","The Mirror of Kong Ho","Bramah, Ernest","Fantasy","en"
"2690",1077,"","The Mirror of Kong Ho","Bramah, Ernest","Fantasy","en"
"2691",1077,"""Kong,"" I replied freely; and I had formed a design to explain somewhat","The Mirror of Kong Ho","Bramah, Ernest","Fantasy","en"
"2692",1077,"of the many illustrious ancestors of the House, when the one at the","The Mirror of Kong Ho","Bramah, Ernest","Fantasy","en"
"2693",1077,"desk, pausing to inscribe my answer in a book, spoke out.","The Mirror of Kong Ho","Bramah, Ernest","Fantasy","en"
"2694",1077,"","The Mirror of Kong Ho","Bramah, Ernest","Fantasy","en"
"2695",1077,"""Kong?"" he said. ""Is that the christian or surname?""","The Mirror of Kong Ho","Bramah, Ernest","Fantasy","en"
"2696",1077,"","The Mirror of Kong Ho","Bramah, Ernest","Fantasy","en"
"2697",1077,"""Sir-name?"" replied this person between two thoughts. ""Undoubtedly","The Mirror of Kong Ho","Bramah, Ernest","Fantasy","en"
"2698",1077,"the one before you is entitled by public examination to the degree","The Mirror of Kong Ho","Bramah, Ernest","Fantasy","en"
"2699",1077,"'Recognised Talent,' which may, as a meritorious distinction, be held","The Mirror of Kong Ho","Bramah, Ernest","Fantasy","en"
"2700",1077,"equal to your title of a warrior clad in armour. Yet, if it is so held,","The Mirror of Kong Ho","Bramah, Ernest","Fantasy","en"
"2701",1077,"that would rightly be this person's official name of Paik.""","The Mirror of Kong Ho","Bramah, Ernest","Fantasy","en"
"2702",1077,"","The Mirror of Kong Ho","Bramah, Ernest","Fantasy","en"
"2703",1077,"""Oh, it would, would it?"" said the one seated upon the high chair.","The Mirror of Kong Ho","Bramah, Ernest","Fantasy","en"
"2704",1077,"""That's quite clear. Are there any other names as well?""","The Mirror of Kong Ho","Bramah, Ernest","Fantasy","en"
"2705",1077,"","The Mirror of Kong Ho","Bramah, Ernest","Fantasy","en"
"2706",1077,"""Assuredly,"" I explained, pained inwardly that one of official rank","The Mirror of Kong Ho","Bramah, Ernest","Fantasy","en"
"2707",1077,"should so slightly esteem my appearance as to judge that I was so","The Mirror of Kong Ho","Bramah, Ernest","Fantasy","en"
"2708",1077,"meagrely endowed. ""The milk name of Ho; Tsin upon entering the Classes;","The Mirror of Kong Ho","Bramah, Ernest","Fantasy","en"
"2709",1077,"as a Great Name Cheng; another style in Quank; the official title","The Mirror of Kong Ho","Bramah, Ernest","Fantasy","en"
"2710",1077,"already expressed, and T'chun, Li, Yuen and Nung as the various","The Mirror of Kong Ho","Bramah, Ernest","Fantasy","en"
"2711",1077,"emergencies of life arise.""","The Mirror of Kong Ho","Bramah, Ernest","Fantasy","en"
"2712",1077,"","The Mirror of Kong Ho","Bramah, Ernest","Fantasy","en"
"2713",1077,"""Thank you,"" said the high-chair official courteously. ""Now, just the","The Mirror of Kong Ho","Bramah, Ernest","Fantasy","en"
"2714",1077,"name in full, please, without any velvet trimmings.""","The Mirror of Kong Ho","Bramah, Ernest","Fantasy","en"
"2715",1077,"","The Mirror of Kong Ho","Bramah, Ernest","Fantasy","en"
"2716",1077,"""Kong,"" began this person, desirous above all things of putting","The Mirror of Kong Ho","Bramah, Ernest","Fantasy","en"
"2717",1077,"the matter competently, yet secretly perturbed as to what might be","The Mirror of Kong Ho","Bramah, Ernest","Fantasy","en"
"2718",1077,"considered superfluous and what deemed a perfidious suppression, ""Ho","The Mirror of Kong Ho","Bramah, Ernest","Fantasy","en"
"2719",1077,"Tsin Cheng Quank--""","The Mirror of Kong Ho","Bramah, Ernest","Fantasy","en"
"2720",1077,"","The Mirror of Kong Ho","Bramah, Ernest","Fantasy","en"
"2721",1077,"""Hold hard,"" cried this same one, restraining me with an uplifted pen.","The Mirror of Kong Ho","Bramah, Ernest","Fantasy","en"
"2722",1077,"""Did you say 'Quack'?""","The Mirror of Kong Ho","Bramah, Ernest","Fantasy","en"
"2723",1077,"","The Mirror of Kong Ho","Bramah, Ernest","Fantasy","en"
"2724",1077,"""Quack?"" repeated this person, beginning to become involved within","The Mirror of Kong Ho","Bramah, Ernest","Fantasy","en"
"2725",1077,"himself, and not grasping the detail in the right position. ""In a manner","The Mirror of Kong Ho","Bramah, Ernest","Fantasy","en"
"2726",1077,"of setting the expression forth--""","The Mirror of Kong Ho","Bramah, Ernest","Fantasy","en"
"2727",1077,"","The Mirror of Kong Ho","Bramah, Ernest","Fantasy","en"
"2728",1077,"""Put him down, 'Quack Duck,' sir,"" exclaimed one of dog-like dejection","The Mirror of Kong Ho","Bramah, Ernest","Fantasy","en"
"2729",1077,"who stood by. ""Most of these Lascars haven't got any real names--they","The Mirror of Kong Ho","Bramah, Ernest","Fantasy","en"
"2730",1077,"just go by what any one happens to call them at the time, like 'Burmese","The Mirror of Kong Ho","Bramah, Ernest","Fantasy","en"
"2731",1077,"Ike' down at the Mint,"" and this person unfortunately chancing to smile","The Mirror of Kong Ho","Bramah, Ernest","Fantasy","en"
"2732",1077,"and bow acquiescently at that moment (not with any set intention, but","The Mirror of Kong Ho","Bramah, Ernest","Fantasy","en"
"2733",1077,"as a general principle of courteous urbanity), in place of his really","The Mirror of Kong Ho","Bramah, Ernest","Fantasy","en"
"2734",1077,"distinguished titles he will henceforth appear among the historical","The Mirror of Kong Ho","Bramah, Ernest","Fantasy","en"
"2735",1077,"records of this dynasty under what he cannot disguise from his inner","The Mirror of Kong Ho","Bramah, Ernest","Fantasy","en"
"2736",1077,"misgivings to be the low-caste appellation of Quack Duck.","The Mirror of Kong Ho","Bramah, Ernest","Fantasy","en"
"2737",1077,"","The Mirror of Kong Ho","Bramah, Ernest","Fantasy","en"
"2738",1077,"""Now the address, please,"" continued the high one, again preparing to","The Mirror of Kong Ho","Bramah, Ernest","Fantasy","en"
"2739",1077,"inscribe the word, and being determined that by no mischance should this","The Mirror of Kong Ho","Bramah, Ernest","Fantasy","en"
"2740",1077,"particular be offensively reported, I unhesitatingly replied, ""Beneath","The Mirror of Kong Ho","Bramah, Ernest","Fantasy","en"
"2741",1077,"the Sign of the Lead Tortoise, on the northern course from the Lotus","The Mirror of Kong Ho","Bramah, Ernest","Fantasy","en"
"2742",1077,"Pools outside the walls of Yuen-ping.""","The Mirror of Kong Ho","Bramah, Ernest","Fantasy","en"
"2743",1077,"","The Mirror of Kong Ho","Bramah, Ernest","Fantasy","en"
"2744",1077,"This answer the one with the book did not immediately record. ""I","The Mirror of Kong Ho","Bramah, Ernest","Fantasy","en"
"2745",1077,"don't say it isn't all right when you know the parts,"" he remarked","The Mirror of Kong Ho","Bramah, Ernest","Fantasy","en"
"2746",1077,"broad-mindedly, ""but it does sound a trifle irregular. Can't you give it","The Mirror of Kong Ho","Bramah, Ernest","Fantasy","en"
"2747",1077,"a number and a street?""","The Mirror of Kong Ho","Bramah, Ernest","Fantasy","en"
"2748",1077,"","The Mirror of Kong Ho","Bramah, Ernest","Fantasy","en"
"2749",1077,"""I fancy it must be a pub, sir,"" observed another. ""He said that it had","The Mirror of Kong Ho","Bramah, Ernest","Fantasy","en"
"2750",1077,"a sign--the Red Tortoise.""","The Mirror of Kong Ho","Bramah, Ernest","Fantasy","en"
"2751",1077,"","The Mirror of Kong Ho","Bramah, Ernest","Fantasy","en"
"2752",1077,"""Well, haven't you got a London address?"" said the high one, and this","The Mirror of Kong Ho","Bramah, Ernest","Fantasy","en"
"2753",1077,"person being able to supply a street and a number as desired, this part","The Mirror of Kong Ho","Bramah, Ernest","Fantasy","en"
"2754",1077,"of the undertaking was disposed of, to his cordial satisfaction.","The Mirror of Kong Ho","Bramah, Ernest","Fantasy","en"
"2755",1077,"","The Mirror of Kong Ho","Bramah, Ernest","Fantasy","en"
"2756",1077,"""Now let me see the articles which these men left with you,"" commanded","The Mirror of Kong Ho","Bramah, Ernest","Fantasy","en"
"2757",1077,"the chieftain of the band, and without any misleading discrepancies I at","The Mirror of Kong Ho","Bramah, Ernest","Fantasy","en"
"2758",1077,"once drew forth from an inner sleeve the two scrips, of which adequate","The Mirror of Kong Ho","Bramah, Ernest","Fantasy","en"
"2759",1077,"mention has already been made, another hitherto undescribed, two","The Mirror of Kong Ho","Bramah, Ernest","Fantasy","en"
"2760",1077,"instruments for measuring the passing hours of the day, together with a","The Mirror of Kong Ho","Bramah, Ernest","Fantasy","en"
"2761",1077,"chain of fine gold ingeniously wrought into the semblance of a cable,","The Mirror of Kong Ho","Bramah, Ernest","Fantasy","en"
"2762",1077,"an ornament for the breast, set about with a jewel, two neck-cloths of","The Mirror of Kong Ho","Bramah, Ernest","Fantasy","en"
"2763",1077,"a kind usually carried in the pocket, a book for recording happenings of","The Mirror of Kong Ho","Bramah, Ernest","Fantasy","en"
"2764",1077,"any moment, pieces of money to the value of about eleven taels, a silver","The Mirror of Kong Ho","Bramah, Ernest","Fantasy","en"
"2765",1077,"flagon, a sheathed weapon and a few lesser objects of insignificant","The Mirror of Kong Ho","Bramah, Ernest","Fantasy","en"
"2766",1077,"value. These various details I laid obsequiously before the one who had","The Mirror of Kong Ho","Bramah, Ernest","Fantasy","en"
"2767",1077,"commanded it, while the others stood around either in explicit silence","The Mirror of Kong Ho","Bramah, Ernest","Fantasy","en"
"2768",1077,"or speaking softly beneath their breath.","The Mirror of Kong Ho","Bramah, Ernest","Fantasy","en"
"2769",1077,"","The Mirror of Kong Ho","Bramah, Ernest","Fantasy","en"
"2770",1077,"""Do I understand that the two persons left all these things with you,","The Mirror of Kong Ho","Bramah, Ernest","Fantasy","en"
"2771",1077,"while they took your purse in exchange?"" said the high official, after","The Mirror of Kong Ho","Bramah, Ernest","Fantasy","en"
"2772",1077,"examining certain obscure signs upon the metals, the contents of the","The Mirror of Kong Ho","Bramah, Ernest","Fantasy","en"
"2773",1077,"third scrip, and the like.","The Mirror of Kong Ho","Bramah, Ernest","Fantasy","en"
"2774",1077,"","The Mirror of Kong Ho","Bramah, Ernest","Fantasy","en"
"2775",1077,"""It cannot reasonably be denied,"" I replied; ""inasmuch as they departed","The Mirror of Kong Ho","Bramah, Ernest","Fantasy","en"
"2776",1077,"without them.""","The Mirror of Kong Ho","Bramah, Ernest","Fantasy","en"
"2777",1077,"","The Mirror of Kong Ho","Bramah, Ernest","Fantasy","en"
"2778",1077,"""Spontaneously?"" he demanded, and in spite of the unevadible severity of","The Mirror of Kong Ho","Bramah, Ernest","Fantasy","en"
"2779",1077,"his voice the expression of his nearer eye deviated somewhat.","The Mirror of Kong Ho","Bramah, Ernest","Fantasy","en"
"2780",1077,"","The Mirror of Kong Ho","Bramah, Ernest","Fantasy","en"
"2781",1077,"""The spoken and conclusive word of the first was that it was his","The Mirror of Kong Ho","Bramah, Ernest","Fantasy","en"
"2782",1077,"intention to commit to this one's keeping everything which he had; the","The Mirror of Kong Ho","Bramah, Ernest","Fantasy","en"
"2783",1077,"assertion of the second being that with this scrip I received all that","The Mirror of Kong Ho","Bramah, Ernest","Fantasy","en"
"2784",1077,"he possessed.""","The Mirror of Kong Ho","Bramah, Ernest","Fantasy","en"
"2785",1077,"","The Mirror of Kong Ho","Bramah, Ernest","Fantasy","en"
"2786",1077,"""While of yours, what did they get, Mr. Quack?"" and the tone of the one","The Mirror of Kong Ho","Bramah, Ernest","Fantasy","en"
"2787",1077,"who spoke had a much more gratifying modulation than before, while the","The Mirror of Kong Ho","Bramah, Ernest","Fantasy","en"
"2788",1077,"attitudes of those who stood around had favourably changed, until they","The Mirror of Kong Ho","Bramah, Ernest","Fantasy","en"
"2789",1077,"now conveyed a message of deliberate esteem.","The Mirror of Kong Ho","Bramah, Ernest","Fantasy","en"
"2790",1077,"","The Mirror of Kong Ho","Bramah, Ernest","Fantasy","en"
"2791",1077,"""A serpent-skin case of two enclosures,"" I replied. ""On the one side","The Mirror of Kong Ho","Bramah, Ernest","Fantasy","en"
"2792",1077,"was a handcount of the small copper-pieces of this Island, which I had","The Mirror of Kong Ho","Bramah, Ernest","Fantasy","en"
"2793",1077,"caused to be burnished and gilt for the purpose of taking back to amuse","The Mirror of Kong Ho","Bramah, Ernest","Fantasy","en"
"2794",1077,"those of Yuen-ping. On the other side were two or three pages from a","The Mirror of Kong Ho","Bramah, Ernest","Fantasy","en"
"2795",1077,"gravity-removing printed leaf entitled 'Bits of Tits,' with which","The Mirror of Kong Ho","Bramah, Ernest","Fantasy","en"
"2796",1077,"this person weekly instructs himself in the simpler rudiments of the","The Mirror of Kong Ho","Bramah, Ernest","Fantasy","en"
"2797",1077,"language. For the rest the case was controlled by a hidden spring, and","The Mirror of Kong Ho","Bramah, Ernest","Fantasy","en"
"2798",1077,"inscribed about with a charm against loss, consumption by fire, or being","The Mirror of Kong Ho","Bramah, Ernest","Fantasy","en"
"2799",1077,"secretly acquired by the unworthy.""","The Mirror of Kong Ho","Bramah, Ernest","Fantasy","en"
"2800",1077,"","The Mirror of Kong Ho","Bramah, Ernest","Fantasy","en"
"2801",1077,"""I don't think you stand in much need of that charm, Mr. Quack,""","The Mirror of Kong Ho","Bramah, Ernest","Fantasy","en"
"2802",1077,"remarked another of more than ordinary rank, who was also present. ""Then","The Mirror of Kong Ho","Bramah, Ernest","Fantasy","en"
"2803",1077,"they really got practically no money from you?""","The Mirror of Kong Ho","Bramah, Ernest","Fantasy","en"
"2804",1077,"","The Mirror of Kong Ho","Bramah, Ernest","Fantasy","en"
"2805",1077,"""By no means,"" I admitted. ""It was never literally stipulated, and","The Mirror of Kong Ho","Bramah, Ernest","Fantasy","en"
"2806",1077,"whatever of wealth he possesses this person carries in a concealed spot","The Mirror of Kong Ho","Bramah, Ernest","Fantasy","en"
"2807",1077,"beneath his waistbelt."" (For even to these, virtuous sire, I did not","The Mirror of Kong Ho","Bramah, Ernest","Fantasy","en"
"2808",1077,"deem it expedient to reveal the fact that in reality it is hidden within","The Mirror of Kong Ho","Bramah, Ernest","Fantasy","en"
"2809",1077,"the sole of my left sandal.)","The Mirror of Kong Ho","Bramah, Ernest","Fantasy","en"
"2810",1077,"","The Mirror of Kong Ho","Bramah, Ernest","Fantasy","en"
"2811",1077,"""I congratulate you,"" he said with lavish refinement. ""Ben and the","The Mirror of Kong Ho","Bramah, Ernest","Fantasy","en"
"2812",1077,"Butterman can be very bland and persuasive. Could you tell me, as a","The Mirror of Kong Ho","Bramah, Ernest","Fantasy","en"
"2813",1077,"matter of professional curiosity, what first put you on your guard?""","The Mirror of Kong Ho","Bramah, Ernest","Fantasy","en"
"2814",1077,"","The Mirror of Kong Ho","Bramah, Ernest","Fantasy","en"
"2815",1077,"""In this person's country,"" I replied, ""there is an apt saying, 'The","The Mirror of Kong Ho","Bramah, Ernest","Fantasy","en"
"2816",1077,"sagacious bird does not build his nest twice in the empty soup-toureen,'","The Mirror of Kong Ho","Bramah, Ernest","Fantasy","en"
"2817",1077,"and by observing closely what has gone before one may accurately","The Mirror of Kong Ho","Bramah, Ernest","Fantasy","en"
"2818",1077,"conjecture much that will follow after."" It may be, that out of my","The Mirror of Kong Ho","Bramah, Ernest","Fantasy","en"
"2819",1077,"insufferable shortcomings of style and expression, this answer did not","The Mirror of Kong Ho","Bramah, Ernest","Fantasy","en"
"2820",1077,"convey to his mind the logical sequence of the warning; yet it would","The Mirror of Kong Ho","Bramah, Ernest","Fantasy","en"
"2821",1077,"have been more difficult to show him how everything arose from the","The Mirror of Kong Ho","Bramah, Ernest","Fantasy","en"
"2822",1077,"faultlessly-balanced system of the heroic Wei Chung, or the exact","The Mirror of Kong Ho","Bramah, Ernest","Fantasy","en"
"2823",1077,"parallel lying between the ill-clad outcast who demanded a portion of","The Mirror of Kong Ho","Bramah, Ernest","Fantasy","en"
"2824",1077,"tobacco and the cheerfully unassuming stranger who had in his possession","The Mirror of Kong Ho","Bramah, Ernest","Fantasy","en"
"2825",1077,"a larger accumulation of money than he could conveniently disperse.","The Mirror of Kong Ho","Bramah, Ernest","Fantasy","en"
"2826",1077,"","The Mirror of Kong Ho","Bramah, Ernest","Fantasy","en"
"2827",1077,"In such a manner I took leave of the station and those connected with","The Mirror of Kong Ho","Bramah, Ernest","Fantasy","en"
"2828",1077,"it, after directing that the share of the spoil which fell by the law","The Mirror of Kong Ho","Bramah, Ernest","Fantasy","en"
"2829",1077,"of this Island to my lot should be sold and the money of exchange","The Mirror of Kong Ho","Bramah, Ernest","Fantasy","en"
"2830",1077,"faithfully divided among the virtuous and necessitous of both sexes. The","The Mirror of Kong Ho","Bramah, Ernest","Fantasy","en"
"2831",1077,"higher officials each waved me pleasantly by the hand, according to the","The Mirror of Kong Ho","Bramah, Ernest","Fantasy","en"
"2832",1077,"striking and picturesque custom of the land, while the lesser ones stood","The Mirror of Kong Ho","Bramah, Ernest","Fantasy","en"
"2833",1077,"around and spoke flattering words as I departed, as ""honourable,"" ""a","The Mirror of Kong Ho","Bramah, Ernest","Fantasy","en"
"2834",1077,"small piece of all-right,"" ""astute ancient male fowl,"" ""ah!"" and the","The Mirror of Kong Ho","Bramah, Ernest","Fantasy","en"
"2835",1077,"like.","The Mirror of Kong Ho","Bramah, Ernest","Fantasy","en"
"2836",1077,"","The Mirror of Kong Ho","Bramah, Ernest","Fantasy","en"
"2837",1077,"With repeated assurances that however ineptly the adventure may at the","The Mirror of Kong Ho","Bramah, Ernest","Fantasy","en"
"2838",1077,"time appear to be tending, as regards the essentials of true dignity","The Mirror of Kong Ho","Bramah, Ernest","Fantasy","en"
"2839",1077,"and an undeviating grasp upon articles of negotiable value, nothing of a","The Mirror of Kong Ho","Bramah, Ernest","Fantasy","en"
"2840",1077,"regrettable incident need be feared.","The Mirror of Kong Ho","Bramah, Ernest","Fantasy","en"
"2841",1077,"","The Mirror of Kong Ho","Bramah, Ernest","Fantasy","en"
"2842",1077,"KONG HO.","The Mirror of Kong Ho","Bramah, Ernest","Fantasy","en"
"2843",1077,"","The Mirror of Kong Ho","Bramah, Ernest","Fantasy","en"
"2844",1077,"","The Mirror of Kong Ho","Bramah, Ernest","Fantasy","en"
"2845",1077,"","The Mirror of Kong Ho","Bramah, Ernest","Fantasy","en"
"2846",1077,"","The Mirror of Kong Ho","Bramah, Ernest","Fantasy","en"
"2847",1077,"LETTER IX","The Mirror of Kong Ho","Bramah, Ernest","Fantasy","en"
"2848",1077,"","The Mirror of Kong Ho","Bramah, Ernest","Fantasy","en"
"2849",1077,"","The Mirror of Kong Ho","Bramah, Ernest","Fantasy","en"
"2850",1077," Concerning the proverb of the highly-accomplished horse. The","The Mirror of Kong Ho","Bramah, Ernest","Fantasy","en"
"2851",1077," various perils to be encountered in the Beneath Parts. The","The Mirror of Kong Ho","Bramah, Ernest","Fantasy","en"
"2852",1077," inexplicable journey performed by this one, and concerning","The Mirror of Kong Ho","Bramah, Ernest","Fantasy","en"
"2853",1077," the obscurity of the witchcraft employed.","The Mirror of Kong Ho","Bramah, Ernest","Fantasy","en"
"2854",1077,"","The Mirror of Kong Ho","Bramah, Ernest","Fantasy","en"
"2855",1077,"","The Mirror of Kong Ho","Bramah, Ernest","Fantasy","en"
"2856",1077,"VENERATED SIRE,--Among these islanders there is a proverb, ""Do not place","The Mirror of Kong Ho","Bramah, Ernest","Fantasy","en"
"2857",1077,"the carte"" (or card, the two words having an identical purport, and","The Mirror of Kong Ho","Bramah, Ernest","Fantasy","en"
"2858",1077,"both signifying the inscribed tablet of viands prepared for a banquet,)","The Mirror of Kong Ho","Bramah, Ernest","Fantasy","en"
"2859",1077,"""before the horse."" Doubtless the saying first arose as a timely rebuke","The Mirror of Kong Ho","Bramah, Ernest","Fantasy","en"
"2860",1077,"to a certain barbarian emperor who announced his contempt for the","The Mirror of Kong Ho","Bramah, Ernest","Fantasy","en"
"2861",1077,"intelligence of his subjects by conferring high mandarin rank upon a","The Mirror of Kong Ho","Bramah, Ernest","Fantasy","en"
"2862",1077,"favourite steed and ceremoniously appointing it to be his chancellor;","The Mirror of Kong Ho","Bramah, Ernest","Fantasy","en"
"2863",1077,"but from the narrower moral that an unreasoning animal is out of place,","The Mirror of Kong Ho","Bramah, Ernest","Fantasy","en"
"2864",1077,"and even unseemly, in the entertaining hall or council chamber, the","The Mirror of Kong Ho","Bramah, Ernest","Fantasy","en"
"2865",1077,"expression has in the course of time taken a wider application and is","The Mirror of Kong Ho","Bramah, Ernest","Fantasy","en"
"2866",1077,"now freely used as an insidious thrust at one who may be suspected of","The Mirror of Kong Ho","Bramah, Ernest","Fantasy","en"
"2867",1077,"contrariness of character, of confusing issues, or of acting in a vain","The Mirror of Kong Ho","Bramah, Ernest","Fantasy","en"
"2868",1077,"or illogical manner. I had already preserved the saying among other","The Mirror of Kong Ho","Bramah, Ernest","Fantasy","en"
"2869",1077,"instances of foreign thought and expression which I am collecting for","The Mirror of Kong Ho","Bramah, Ernest","Fantasy","en"
"2870",1077,"your dignified amusement, as it is very characteristic of the wisdom and","The Mirror of Kong Ho","Bramah, Ernest","Fantasy","en"
"2871",1077,"humour of these Outer Lands. The imagination is essentially barbaric. A","The Mirror of Kong Ho","Bramah, Ernest","Fantasy","en"
"2872",1077,"horse--doubtless well-groomed, richly-caparisoned, and as intellectual","The Mirror of Kong Ho","Bramah, Ernest","Fantasy","en"
"2873",1077,"as the circumstances will permit, but inevitably an animal of degraded","The Mirror of Kong Ho","Bramah, Ernest","Fantasy","en"
"2874",1077,"attributes and untraceable ancestry--a horse reclining before a lavishly","The Mirror of Kong Ho","Bramah, Ernest","Fantasy","en"
"2875",1077,"set-out table and considering well of what dish it shall next partake!","The Mirror of Kong Ho","Bramah, Ernest","Fantasy","en"
"2876",1077,"Could anything, it appears, be more diverting! Truly to our more refined","The Mirror of Kong Ho","Bramah, Ernest","Fantasy","en"
"2877",1077,"outlook the analogy is lacking both in delicacy of wit and in exactitude","The Mirror of Kong Ho","Bramah, Ernest","Fantasy","en"
"2878",1077,"of balance, but to the grosser barbarian conception of what is","The Mirror of Kong Ho","Bramah, Ernest","Fantasy","en"
"2879",1077,"gravity-removing it is irresistible.","The Mirror of Kong Ho","Bramah, Ernest","Fantasy","en"
"2880",1077,"","The Mirror of Kong Ho","Bramah, Ernest","Fantasy","en"
"2881",1077,"I am, however, reminded of the saying by perceiving that I was on the","The Mirror of Kong Ho","Bramah, Ernest","Fantasy","en"
"2882",1077,"point of recording certain details of recent occurrence without first","The Mirror of Kong Ho","Bramah, Ernest","Fantasy","en"
"2883",1077,"unrolling to your mind the incidents from which it has arisen that the","The Mirror of Kong Ho","Bramah, Ernest","Fantasy","en"
"2884",1077,"person who is now communicating with you is no longer reposing in the","The Mirror of Kong Ho","Bramah, Ernest","Fantasy","en"
"2885",1077,"Capital, but spending a period profitably in observing the habits of","The Mirror of Kong Ho","Bramah, Ernest","Fantasy","en"
"2886",1077,"those who dwell in the more secluded recesses on the outskirts of the","The Mirror of Kong Ho","Bramah, Ernest","Fantasy","en"
"2887",1077,"Island. This reversal of the proper sequence of affairs would doubtless","The Mirror of Kong Ho","Bramah, Ernest","Fantasy","en"
