"","gutenberg_id","text","title","author","gutenberg_bookshelf","language"
"1677",10806,"their demoniac shapes in the night, and the grass was cold and wet,","The Sword of Welleran and Other Stories","Dunsany, Lord","Fantasy","en"
"1678",10806,"and the night-mist floated over it.  And a great white owl came by,","The Sword of Welleran and Other Stories","Dunsany, Lord","Fantasy","en"
"1679",10806,"going up and down in the dark.  And at all these things the little","The Sword of Welleran and Other Stories","Dunsany, Lord","Fantasy","en"
"1680",10806,"Wild Thing rejoiced elvishly.","The Sword of Welleran and Other Stories","Dunsany, Lord","Fantasy","en"
"1681",10806,"","The Sword of Welleran and Other Stories","Dunsany, Lord","Fantasy","en"
"1682",10806,"And it left London far behind it, reddening the sky, and could","The Sword of Welleran and Other Stories","Dunsany, Lord","Fantasy","en"
"1683",10806,"distinguish no longer its unlovely roar, but heard again the noises","The Sword of Welleran and Other Stories","Dunsany, Lord","Fantasy","en"
"1684",10806,"of the night.","The Sword of Welleran and Other Stories","Dunsany, Lord","Fantasy","en"
"1685",10806,"","The Sword of Welleran and Other Stories","Dunsany, Lord","Fantasy","en"
"1686",10806,"And now it would come through a hamlet glowing and comfortable in","The Sword of Welleran and Other Stories","Dunsany, Lord","Fantasy","en"
"1687",10806,"the night; and now to the dark, wet, open fields again; and many an","The Sword of Welleran and Other Stories","Dunsany, Lord","Fantasy","en"
"1688",10806,"owl it overtook as they drifted through the night, a people friendly","The Sword of Welleran and Other Stories","Dunsany, Lord","Fantasy","en"
"1689",10806,"to the Elf-folk.  Sometimes it crossed wide rivers, leaping from star","The Sword of Welleran and Other Stories","Dunsany, Lord","Fantasy","en"
"1690",10806,"to star; and, choosing its way as it went, to avoid the hard rough","The Sword of Welleran and Other Stories","Dunsany, Lord","Fantasy","en"
"1691",10806,"roads, came before midnight to the East Anglian lands.","The Sword of Welleran and Other Stories","Dunsany, Lord","Fantasy","en"
"1692",10806,"","The Sword of Welleran and Other Stories","Dunsany, Lord","Fantasy","en"
"1693",10806,"And it heard","The Sword of Welleran and Other Stories","Dunsany, Lord","Fantasy","en"
"1694",10806,"there the shout of the North Wind, who was dominant and angry, as he","The Sword of Welleran and Other Stories","Dunsany, Lord","Fantasy","en"
"1695",10806,"drove southwards his adventurous geese; while the rushes bent before","The Sword of Welleran and Other Stories","Dunsany, Lord","Fantasy","en"
"1696",10806,"him chaunting plaintively and low, like enslaved rowers of some","The Sword of Welleran and Other Stories","Dunsany, Lord","Fantasy","en"
"1697",10806,"fabulous trireme, bending and swinging under blows of the lash, and","The Sword of Welleran and Other Stories","Dunsany, Lord","Fantasy","en"
"1698",10806,"singing all the while a doleful song.","The Sword of Welleran and Other Stories","Dunsany, Lord","Fantasy","en"
"1699",10806,"","The Sword of Welleran and Other Stories","Dunsany, Lord","Fantasy","en"
"1700",10806,"And it felt the good dank air that clothes by night the broad East","The Sword of Welleran and Other Stories","Dunsany, Lord","Fantasy","en"
"1701",10806,"Anglian lands, and came again to some old perilous pool where the","The Sword of Welleran and Other Stories","Dunsany, Lord","Fantasy","en"
"1702",10806,"soft green mosses grew, and there plunged downward and downward into","The Sword of Welleran and Other Stories","Dunsany, Lord","Fantasy","en"
"1703",10806,"the dear dark water till it felt the homely ooze once more coming","The Sword of Welleran and Other Stories","Dunsany, Lord","Fantasy","en"
"1704",10806,"up between its toes.  Thence, out of the lovely chill that is in the","The Sword of Welleran and Other Stories","Dunsany, Lord","Fantasy","en"
"1705",10806,"heart of the ooze, it arose renewed and rejoicing to dance upon the","The Sword of Welleran and Other Stories","Dunsany, Lord","Fantasy","en"
"1706",10806,"image of the stars.","The Sword of Welleran and Other Stories","Dunsany, Lord","Fantasy","en"
"1707",10806,"","The Sword of Welleran and Other Stories","Dunsany, Lord","Fantasy","en"
"1708",10806,"I chanced to stand that night by the marsh's edge, forgetting in my","The Sword of Welleran and Other Stories","Dunsany, Lord","Fantasy","en"
"1709",10806,"mind the affairs of men; and I saw the marsh-fires come leaping up","The Sword of Welleran and Other Stories","Dunsany, Lord","Fantasy","en"
"1710",10806,"from all the perilous places.  And they came up by flocks the whole","The Sword of Welleran and Other Stories","Dunsany, Lord","Fantasy","en"
"1711",10806,"night long to the number of a great multitude, and danced away","The Sword of Welleran and Other Stories","Dunsany, Lord","Fantasy","en"
"1712",10806,"together over the marshes.","The Sword of Welleran and Other Stories","Dunsany, Lord","Fantasy","en"
"1713",10806,"","The Sword of Welleran and Other Stories","Dunsany, Lord","Fantasy","en"
"1714",10806,"And I believe that there was a great rejoicing all that night among","The Sword of Welleran and Other Stories","Dunsany, Lord","Fantasy","en"
"1715",10806,"the kith of the Elf-folk.","The Sword of Welleran and Other Stories","Dunsany, Lord","Fantasy","en"
"1716",10806,"","The Sword of Welleran and Other Stories","Dunsany, Lord","Fantasy","en"
"1717",10806,"","The Sword of Welleran and Other Stories","Dunsany, Lord","Fantasy","en"
"1718",10806,"","The Sword of Welleran and Other Stories","Dunsany, Lord","Fantasy","en"
"1719",10806,"","The Sword of Welleran and Other Stories","Dunsany, Lord","Fantasy","en"
"1720",10806,"The Highwaymen","The Sword of Welleran and Other Stories","Dunsany, Lord","Fantasy","en"
"1721",10806,"","The Sword of Welleran and Other Stories","Dunsany, Lord","Fantasy","en"
"1722",10806,"Tom o' the Roads had ridden his last ride, and was now alone in the","The Sword of Welleran and Other Stories","Dunsany, Lord","Fantasy","en"
"1723",10806,"night.  From where he was, a man might see the white recumbent sheep","The Sword of Welleran and Other Stories","Dunsany, Lord","Fantasy","en"
"1724",10806,"and the black outline of the lonely downs, and the grey line of the","The Sword of Welleran and Other Stories","Dunsany, Lord","Fantasy","en"
"1725",10806,"farther and lonelier downs beyond them; or in hollows far below him,","The Sword of Welleran and Other Stories","Dunsany, Lord","Fantasy","en"
"1726",10806,"out of the pitiless wind, he might see the grey smoke of hamlets","The Sword of Welleran and Other Stories","Dunsany, Lord","Fantasy","en"
"1727",10806,"arising from black valleys.  But all alike was black to the eyes of","The Sword of Welleran and Other Stories","Dunsany, Lord","Fantasy","en"
"1728",10806,"Tom, and all the sounds were silence in his ears; only his soul","The Sword of Welleran and Other Stories","Dunsany, Lord","Fantasy","en"
"1729",10806,"struggled to slip from the iron chains and to pass southwards into","The Sword of Welleran and Other Stories","Dunsany, Lord","Fantasy","en"
"1730",10806,"Paradise.  And the wind blew and blew.","The Sword of Welleran and Other Stories","Dunsany, Lord","Fantasy","en"
"1731",10806,"","The Sword of Welleran and Other Stories","Dunsany, Lord","Fantasy","en"
"1732",10806,"For Tom tonight had nought but the wind to ride; they had taken his","The Sword of Welleran and Other Stories","Dunsany, Lord","Fantasy","en"
"1733",10806,"true black horse on the day when they took from him the green fields","The Sword of Welleran and Other Stories","Dunsany, Lord","Fantasy","en"
"1734",10806,"and the sky, men's voices and the laughter of women, and had left","The Sword of Welleran and Other Stories","Dunsany, Lord","Fantasy","en"
"1735",10806,"him alone with chains about his neck to swing in the wind for ever.","The Sword of Welleran and Other Stories","Dunsany, Lord","Fantasy","en"
"1736",10806,"And the wind blew and blew.","The Sword of Welleran and Other Stories","Dunsany, Lord","Fantasy","en"
"1737",10806,"","The Sword of Welleran and Other Stories","Dunsany, Lord","Fantasy","en"
"1738",10806,"But the soul of Tom o' the Roads was nipped by the cruel chains, and","The Sword of Welleran and Other Stories","Dunsany, Lord","Fantasy","en"
"1739",10806,"whenever it struggled to escape it was beaten backwards into the","The Sword of Welleran and Other Stories","Dunsany, Lord","Fantasy","en"
"1740",10806,"iron collar by the wind that blows from Paradise from the south.","The Sword of Welleran and Other Stories","Dunsany, Lord","Fantasy","en"
"1741",10806,"And swinging there by the neck, there fell away old sneers from off","The Sword of Welleran and Other Stories","Dunsany, Lord","Fantasy","en"
"1742",10806,"his lips, and scoffs that he had long since scoffed at God fell from","The Sword of Welleran and Other Stories","Dunsany, Lord","Fantasy","en"
"1743",10806,"his tongue, and there rotted old bad lusts out of his heart, and","The Sword of Welleran and Other Stories","Dunsany, Lord","Fantasy","en"
"1744",10806,"from his fingers the stains of deeds that were evil; and they all","The Sword of Welleran and Other Stories","Dunsany, Lord","Fantasy","en"
"1745",10806,"fell to the ground and grew there in pallid rings and clusters.  And","The Sword of Welleran and Other Stories","Dunsany, Lord","Fantasy","en"
"1746",10806,"when these ill things had all fallen away, Tom's soul was clean","The Sword of Welleran and Other Stories","Dunsany, Lord","Fantasy","en"
"1747",10806,"again, as his early love had found it, a long while since in spring;","The Sword of Welleran and Other Stories","Dunsany, Lord","Fantasy","en"
"1748",10806,"and it swung up there in the wind with the bones of Tom, and with","The Sword of Welleran and Other Stories","Dunsany, Lord","Fantasy","en"
"1749",10806,"his old torn coat and rusty chains.","The Sword of Welleran and Other Stories","Dunsany, Lord","Fantasy","en"
"1750",10806,"","The Sword of Welleran and Other Stories","Dunsany, Lord","Fantasy","en"
"1751",10806,"And the wind blew and blew.","The Sword of Welleran and Other Stories","Dunsany, Lord","Fantasy","en"
"1752",10806,"","The Sword of Welleran and Other Stories","Dunsany, Lord","Fantasy","en"
"1753",10806,"And ever and anon the souls of the sepultured, coming from","The Sword of Welleran and Other Stories","Dunsany, Lord","Fantasy","en"
"1754",10806,"consecrated acres, would go by beating up wind to Paradise past the","The Sword of Welleran and Other Stories","Dunsany, Lord","Fantasy","en"
"1755",10806,"Gallows Tree and past the soul of Tom, that might not go free.","The Sword of Welleran and Other Stories","Dunsany, Lord","Fantasy","en"
"1756",10806,"","The Sword of Welleran and Other Stories","Dunsany, Lord","Fantasy","en"
"1757",10806,"Night after night Tom watched the sheep upon the downs with empty","The Sword of Welleran and Other Stories","Dunsany, Lord","Fantasy","en"
"1758",10806,"hollow sockets, till his dead hair grew and covered his poor dead","The Sword of Welleran and Other Stories","Dunsany, Lord","Fantasy","en"
"1759",10806,"face, and hid the shame of it from the sheep.  And the wind blew and","The Sword of Welleran and Other Stories","Dunsany, Lord","Fantasy","en"
"1760",10806,"blew.","The Sword of Welleran and Other Stories","Dunsany, Lord","Fantasy","en"
"1761",10806,"","The Sword of Welleran and Other Stories","Dunsany, Lord","Fantasy","en"
"1762",10806,"Sometimes on gusts of the wind came someone's tears, and beat and","The Sword of Welleran and Other Stories","Dunsany, Lord","Fantasy","en"
"1763",10806,"beat against the iron chains, but could not rust them through.","The Sword of Welleran and Other Stories","Dunsany, Lord","Fantasy","en"
"1764",10806,"And the wind blew and blew.","The Sword of Welleran and Other Stories","Dunsany, Lord","Fantasy","en"
"1765",10806,"","The Sword of Welleran and Other Stories","Dunsany, Lord","Fantasy","en"
"1766",10806,"And every evening all the thoughts that Tom had ever uttered came","The Sword of Welleran and Other Stories","Dunsany, Lord","Fantasy","en"
"1767",10806,"flocking in from doing their work in the world, the work that may","The Sword of Welleran and Other Stories","Dunsany, Lord","Fantasy","en"
"1768",10806,"not cease, and sat along the gallows branches and chirrupped to the","The Sword of Welleran and Other Stories","Dunsany, Lord","Fantasy","en"
"1769",10806,"soul of Tom, the soul that might not go free.  All the thoughts that","The Sword of Welleran and Other Stories","Dunsany, Lord","Fantasy","en"
"1770",10806,"he had ever uttered!  And the evil thoughts rebuked the soul that","The Sword of Welleran and Other Stories","Dunsany, Lord","Fantasy","en"
"1771",10806,"bore them because they might not die.  And all those that he had","The Sword of Welleran and Other Stories","Dunsany, Lord","Fantasy","en"
"1772",10806,"uttered the most furtively, chirrupped the loudest and the shrillest","The Sword of Welleran and Other Stories","Dunsany, Lord","Fantasy","en"
"1773",10806,"in the branches all the night.","The Sword of Welleran and Other Stories","Dunsany, Lord","Fantasy","en"
"1774",10806,"","The Sword of Welleran and Other Stories","Dunsany, Lord","Fantasy","en"
"1775",10806,"And all the thoughts that Tom had ever thought about himself now","The Sword of Welleran and Other Stories","Dunsany, Lord","Fantasy","en"
"1776",10806,"pointed at the wet bones and mocked at the old torn coat.  But the","The Sword of Welleran and Other Stories","Dunsany, Lord","Fantasy","en"
"1777",10806,"thoughts that he had had of others were the only companions that his","The Sword of Welleran and Other Stories","Dunsany, Lord","Fantasy","en"
"1778",10806,"soul had to soothe it in the night as it swung to and fro.  And they","The Sword of Welleran and Other Stories","Dunsany, Lord","Fantasy","en"
"1779",10806,"twittered to the soul and cheered the poor dumb thing that could","The Sword of Welleran and Other Stories","Dunsany, Lord","Fantasy","en"
"1780",10806,"have dreams no more, till there came a murderous thought and drove","The Sword of Welleran and Other Stories","Dunsany, Lord","Fantasy","en"
"1781",10806,"them all away.","The Sword of Welleran and Other Stories","Dunsany, Lord","Fantasy","en"
"1782",10806,"","The Sword of Welleran and Other Stories","Dunsany, Lord","Fantasy","en"
"1783",10806,"And the wind blew and blew.","The Sword of Welleran and Other Stories","Dunsany, Lord","Fantasy","en"
"1784",10806,"","The Sword of Welleran and Other Stories","Dunsany, Lord","Fantasy","en"
"1785",10806,"Paul, Archbishop of Alois and Vayence, lay in his white sepulchre of","The Sword of Welleran and Other Stories","Dunsany, Lord","Fantasy","en"
"1786",10806,"marble, facing full to the southwards towards Paradise.  And over","The Sword of Welleran and Other Stories","Dunsany, Lord","Fantasy","en"
"1787",10806,"his tomb was sculptured the Cross of Christ, that his soul might","The Sword of Welleran and Other Stories","Dunsany, Lord","Fantasy","en"
"1788",10806,"have repose.  No wind howled here as it howled in lonely tree-tops","The Sword of Welleran and Other Stories","Dunsany, Lord","Fantasy","en"
"1789",10806,"up upon the downs, but came with gentle breezes, orchard scented,","The Sword of Welleran and Other Stories","Dunsany, Lord","Fantasy","en"
"1790",10806,"over the low lands from Paradise from the southwards, and played","The Sword of Welleran and Other Stories","Dunsany, Lord","Fantasy","en"
"1791",10806,"about forget-me-nots and grasses in the consecrated land where lay","The Sword of Welleran and Other Stories","Dunsany, Lord","Fantasy","en"
"1792",10806,"the Reposeful round the sepulchre of Paul, Archbishop of Alois and","The Sword of Welleran and Other Stories","Dunsany, Lord","Fantasy","en"
"1793",10806,"Vayence.  Easy it was for a man's soul to pass from such a","The Sword of Welleran and Other Stories","Dunsany, Lord","Fantasy","en"
"1794",10806,"sepulchre, and, flitting low over remembered fields, to come upon","The Sword of Welleran and Other Stories","Dunsany, Lord","Fantasy","en"
"1795",10806,"the garden lands of Paradise and find eternal ease.","The Sword of Welleran and Other Stories","Dunsany, Lord","Fantasy","en"
"1796",10806,"","The Sword of Welleran and Other Stories","Dunsany, Lord","Fantasy","en"
"1797",10806,"And the wind blew and blew.","The Sword of Welleran and Other Stories","Dunsany, Lord","Fantasy","en"
"1798",10806,"","The Sword of Welleran and Other Stories","Dunsany, Lord","Fantasy","en"
"1799",10806,"In a tavern of foul repute three men were lapping gin.  Their names","The Sword of Welleran and Other Stories","Dunsany, Lord","Fantasy","en"
"1800",10806,"were Joe and Will and the gypsy Puglioni; none other names had they,","The Sword of Welleran and Other Stories","Dunsany, Lord","Fantasy","en"
"1801",10806,"for of whom their fathers were they had no knowledge, but only dark","The Sword of Welleran and Other Stories","Dunsany, Lord","Fantasy","en"
"1802",10806,"suspicions.","The Sword of Welleran and Other Stories","Dunsany, Lord","Fantasy","en"
"1803",10806,"","The Sword of Welleran and Other Stories","Dunsany, Lord","Fantasy","en"
"1804",10806,"Sin had caressed and stroked their faces often with its paws, but","The Sword of Welleran and Other Stories","Dunsany, Lord","Fantasy","en"
"1805",10806,"the face of Puglioni Sin had kissed all over the mouth and chin.","The Sword of Welleran and Other Stories","Dunsany, Lord","Fantasy","en"
"1806",10806,"Their food was robbery and their pastime murder.  All of them had","The Sword of Welleran and Other Stories","Dunsany, Lord","Fantasy","en"
"1807",10806,"incurred the sorrow of God and the enmity of man.  They sat at a","The Sword of Welleran and Other Stories","Dunsany, Lord","Fantasy","en"
"1808",10806,"table with a pack of cards before them, all greasy with the marks of","The Sword of Welleran and Other Stories","Dunsany, Lord","Fantasy","en"
"1809",10806,"cheating thumbs.  And they whispered to one another over their gin,","The Sword of Welleran and Other Stories","Dunsany, Lord","Fantasy","en"
"1810",10806,"but so low that the landlord of the tavern at the other end of the","The Sword of Welleran and Other Stories","Dunsany, Lord","Fantasy","en"
"1811",10806,"room could hear only muffled oaths, and knew not by Whom they swore","The Sword of Welleran and Other Stories","Dunsany, Lord","Fantasy","en"
"1812",10806,"or what they said.","The Sword of Welleran and Other Stories","Dunsany, Lord","Fantasy","en"
"1813",10806,"","The Sword of Welleran and Other Stories","Dunsany, Lord","Fantasy","en"
"1814",10806,"These three were the staunchest friends that ever God had given unto","The Sword of Welleran and Other Stories","Dunsany, Lord","Fantasy","en"
"1815",10806,"a man.  And he to whom their friendship had been given had nothing","The Sword of Welleran and Other Stories","Dunsany, Lord","Fantasy","en"
"1816",10806,"else besides, saving some bones that swung in the wind and rain, and","The Sword of Welleran and Other Stories","Dunsany, Lord","Fantasy","en"
"1817",10806,"an old torn coat and iron chains, and a soul that might not go free.","The Sword of Welleran and Other Stories","Dunsany, Lord","Fantasy","en"
"1818",10806,"","The Sword of Welleran and Other Stories","Dunsany, Lord","Fantasy","en"
"1819",10806,"But as the night wore on the three friends left their gin and stole","The Sword of Welleran and Other Stories","Dunsany, Lord","Fantasy","en"
"1820",10806,"away, and crept down to that graveyard where rested in his sepulchre","The Sword of Welleran and Other Stories","Dunsany, Lord","Fantasy","en"
"1821",10806,"Paul, Archbishop of Alois and Vayence.  At the edge of the","The Sword of Welleran and Other Stories","Dunsany, Lord","Fantasy","en"
"1822",10806,"graveyard, but outside the consecrated ground, they dug a hasty","The Sword of Welleran and Other Stories","Dunsany, Lord","Fantasy","en"
"1823",10806,"grave, two digging while one watched in the wind and rain.  And","The Sword of Welleran and Other Stories","Dunsany, Lord","Fantasy","en"
"1824",10806,"the worms that crept in the unhallowed ground wondered and waited.","The Sword of Welleran and Other Stories","Dunsany, Lord","Fantasy","en"
"1825",10806,"","The Sword of Welleran and Other Stories","Dunsany, Lord","Fantasy","en"
"1826",10806,"And the terrible hour of midnight came upon them with its fears, and","The Sword of Welleran and Other Stories","Dunsany, Lord","Fantasy","en"
"1827",10806,"found them still beside the place of tombs.  And the three friends","The Sword of Welleran and Other Stories","Dunsany, Lord","Fantasy","en"
"1828",10806,"trembled at the horror of such an hour in such a place, and shivered","The Sword of Welleran and Other Stories","Dunsany, Lord","Fantasy","en"
"1829",10806,"in the wind and drenching rain, but still worked on.  And the wind","The Sword of Welleran and Other Stories","Dunsany, Lord","Fantasy","en"
"1830",10806,"blew and blew.","The Sword of Welleran and Other Stories","Dunsany, Lord","Fantasy","en"
"1831",10806,"","The Sword of Welleran and Other Stories","Dunsany, Lord","Fantasy","en"
"1832",10806,"Soon they had finished.  And at once they left the hungry grave with","The Sword of Welleran and Other Stories","Dunsany, Lord","Fantasy","en"
"1833",10806,"all its worms unfed, and went away over the wet fields stealthily","The Sword of Welleran and Other Stories","Dunsany, Lord","Fantasy","en"
"1834",10806,"but in haste, leaving the place of tombs behind them in the","The Sword of Welleran and Other Stories","Dunsany, Lord","Fantasy","en"
"1835",10806,"midnight.  And as they went they shivered, and each man as he","The Sword of Welleran and Other Stories","Dunsany, Lord","Fantasy","en"
"1836",10806,"shivered cursed the rain aloud.  And so they came to the spot where","The Sword of Welleran and Other Stories","Dunsany, Lord","Fantasy","en"
"1837",10806,"they had hidden a ladder and a lantern.  There they held long debate","The Sword of Welleran and Other Stories","Dunsany, Lord","Fantasy","en"
"1838",10806,"whether they should light the lantern, or whether they should go","The Sword of Welleran and Other Stories","Dunsany, Lord","Fantasy","en"
"1839",10806,"without it for fear of the King's men.  But in the end it seemed to","The Sword of Welleran and Other Stories","Dunsany, Lord","Fantasy","en"
"1840",10806,"them better that they should have the light of their lantern, and","The Sword of Welleran and Other Stories","Dunsany, Lord","Fantasy","en"
"1841",10806,"risk being taken by the King's men and hanged, than that they should","The Sword of Welleran and Other Stories","Dunsany, Lord","Fantasy","en"
"1842",10806,"come suddenly face to face in the darkness with whatever one might","The Sword of Welleran and Other Stories","Dunsany, Lord","Fantasy","en"
"1843",10806,"come face to face with a little after midnight about the Gallows","The Sword of Welleran and Other Stories","Dunsany, Lord","Fantasy","en"
"1844",10806,"Tree.","The Sword of Welleran and Other Stories","Dunsany, Lord","Fantasy","en"
"1845",10806,"","The Sword of Welleran and Other Stories","Dunsany, Lord","Fantasy","en"
"1846",10806,"On three roads in England whereon it was not the wont of folk to go","The Sword of Welleran and Other Stories","Dunsany, Lord","Fantasy","en"
"1847",10806,"their ways in safety, travellers tonight went unmolested.  But the","The Sword of Welleran and Other Stories","Dunsany, Lord","Fantasy","en"
"1848",10806,"three friends, walking several paces wide of the King's highway,","The Sword of Welleran and Other Stories","Dunsany, Lord","Fantasy","en"
"1849",10806,"approached the Gallows Tree, and Will carried the lantern and Joe","The Sword of Welleran and Other Stories","Dunsany, Lord","Fantasy","en"
"1850",10806,"the ladder, but Puglioni carried a great sword wherewith to do the","The Sword of Welleran and Other Stories","Dunsany, Lord","Fantasy","en"
"1851",10806,"work which must be done.  When they came close, they saw how bad was","The Sword of Welleran and Other Stories","Dunsany, Lord","Fantasy","en"
"1852",10806,"the case with Tom, for little remained of that fine figure of a man","The Sword of Welleran and Other Stories","Dunsany, Lord","Fantasy","en"
"1853",10806,"and nothing at all of his great resolute spirit, only as they came","The Sword of Welleran and Other Stories","Dunsany, Lord","Fantasy","en"
"1854",10806,"they thought they heard a whimpering cry like the sound of a thing","The Sword of Welleran and Other Stories","Dunsany, Lord","Fantasy","en"
"1855",10806,"that was caged and unfree.","The Sword of Welleran and Other Stories","Dunsany, Lord","Fantasy","en"
"1856",10806,"","The Sword of Welleran and Other Stories","Dunsany, Lord","Fantasy","en"
"1857",10806,"To and fro, to and fro in the winds swung the bones and the soul of","The Sword of Welleran and Other Stories","Dunsany, Lord","Fantasy","en"
"1858",10806,"Tom, for the sins that he had sinned on the King's highway against","The Sword of Welleran and Other Stories","Dunsany, Lord","Fantasy","en"
"1859",10806,"the laws of the King; and with shadows and a lantern through the","The Sword of Welleran and Other Stories","Dunsany, Lord","Fantasy","en"
"1860",10806,"darkness, at the peril of their lives, came the three friends that","The Sword of Welleran and Other Stories","Dunsany, Lord","Fantasy","en"
"1861",10806,"his soul had won before it swung in chains.  Thus the seeds of Tom's","The Sword of Welleran and Other Stories","Dunsany, Lord","Fantasy","en"
"1862",10806,"own soul that he had sown all his life had grown into a Gallows Tree","The Sword of Welleran and Other Stories","Dunsany, Lord","Fantasy","en"
