"","gutenberg_id","text","title","author","gutenberg_bookshelf","language"
"2574",10806,"grinned, and the grin went flickering from face to face right up","The Sword of Welleran and Other Stories","Dunsany, Lord","Fantasy","en"
"2575",10806,"into the cloud-abiding gables.","The Sword of Welleran and Other Stories","Dunsany, Lord","Fantasy","en"
"2576",10806,"","The Sword of Welleran and Other Stories","Dunsany, Lord","Fantasy","en"
"2577",10806,"And when Sacnoth was revealed and all the gargoyles grinned, it was","The Sword of Welleran and Other Stories","Dunsany, Lord","Fantasy","en"
"2578",10806,"like the moonlight emerging from a cloud to look for the first time","The Sword of Welleran and Other Stories","Dunsany, Lord","Fantasy","en"
"2579",10806,"upon a field of blood, and passing swiftly over the wet faces of the","The Sword of Welleran and Other Stories","Dunsany, Lord","Fantasy","en"
"2580",10806,"slain that lie together in the horrible night.  Then Leothric","The Sword of Welleran and Other Stories","Dunsany, Lord","Fantasy","en"
"2581",10806,"advanced towards a door, and it was mightier than the marble quarry,","The Sword of Welleran and Other Stories","Dunsany, Lord","Fantasy","en"
"2582",10806,"Sacremona, from which of old men cut enormous slabs to build the","The Sword of Welleran and Other Stories","Dunsany, Lord","Fantasy","en"
"2583",10806,"Abbey of the Holy Tears.  Day after day they wrenched out the very","The Sword of Welleran and Other Stories","Dunsany, Lord","Fantasy","en"
"2584",10806,"ribs of the hill until the Abbey was builded, and it was more","The Sword of Welleran and Other Stories","Dunsany, Lord","Fantasy","en"
"2585",10806,"beautiful than anything in stone.  Then the priests blessed","The Sword of Welleran and Other Stories","Dunsany, Lord","Fantasy","en"
"2586",10806,"Sacremona, and it had rest, and no more stone was ever taken from it","The Sword of Welleran and Other Stories","Dunsany, Lord","Fantasy","en"
"2587",10806,"to build the houses of men.  And the hill stood looking southwards","The Sword of Welleran and Other Stories","Dunsany, Lord","Fantasy","en"
"2588",10806,"lonely in the sunlight, defaced by that mighty scar.  So vast was","The Sword of Welleran and Other Stories","Dunsany, Lord","Fantasy","en"
"2589",10806,"the door of steel.  And the name of the door was The Porte Resonant,","The Sword of Welleran and Other Stories","Dunsany, Lord","Fantasy","en"
"2590",10806,"the Way of Egress for War.","The Sword of Welleran and Other Stories","Dunsany, Lord","Fantasy","en"
"2591",10806,"","The Sword of Welleran and Other Stories","Dunsany, Lord","Fantasy","en"
"2592",10806,"Then Leothric smote upon the Porte Resonant with Sacnoth, and the","The Sword of Welleran and Other Stories","Dunsany, Lord","Fantasy","en"
"2593",10806,"echo of Sacnoth went ringing through the halls, and all the dragons","The Sword of Welleran and Other Stories","Dunsany, Lord","Fantasy","en"
"2594",10806,"in the fortress barked.  And when the baying of the remotest dragon","The Sword of Welleran and Other Stories","Dunsany, Lord","Fantasy","en"
"2595",10806,"had faintly joined in the tumult, a window opened far up among the","The Sword of Welleran and Other Stories","Dunsany, Lord","Fantasy","en"
"2596",10806,"clouds below the twilit gables, and a woman screamed, and far away","The Sword of Welleran and Other Stories","Dunsany, Lord","Fantasy","en"
"2597",10806,"in Hell her father heard her and knew that her doom was come.","The Sword of Welleran and Other Stories","Dunsany, Lord","Fantasy","en"
"2598",10806,"","The Sword of Welleran and Other Stories","Dunsany, Lord","Fantasy","en"
"2599",10806,"And Leothric went on smiting terribly with Sacnoth, and the grey","The Sword of Welleran and Other Stories","Dunsany, Lord","Fantasy","en"
"2600",10806,"steel of the Porte Resonant, the Way of Egress for War, that was","The Sword of Welleran and Other Stories","Dunsany, Lord","Fantasy","en"
"2601",10806,"tempered to resist the swords of the world, came away in ringing","The Sword of Welleran and Other Stories","Dunsany, Lord","Fantasy","en"
"2602",10806,"slices.","The Sword of Welleran and Other Stories","Dunsany, Lord","Fantasy","en"
"2603",10806,"","The Sword of Welleran and Other Stories","Dunsany, Lord","Fantasy","en"
"2604",10806,"Then Leothric, holding Sacnoth in his hand, went in through the hole","The Sword of Welleran and Other Stories","Dunsany, Lord","Fantasy","en"
"2605",10806,"that he had hewn in the door, and came into the unlit, cavernous","The Sword of Welleran and Other Stories","Dunsany, Lord","Fantasy","en"
"2606",10806,"hall.","The Sword of Welleran and Other Stories","Dunsany, Lord","Fantasy","en"
"2607",10806,"","The Sword of Welleran and Other Stories","Dunsany, Lord","Fantasy","en"
"2608",10806,"An elephant fled trumpeting.  And Leothric stood still, holding","The Sword of Welleran and Other Stories","Dunsany, Lord","Fantasy","en"
"2609",10806,"Sacnoth.  When the sound of the feet of the elephant had died away in","The Sword of Welleran and Other Stories","Dunsany, Lord","Fantasy","en"
"2610",10806,"the remoter corridors, nothing more stirred, and the cavernous hall","The Sword of Welleran and Other Stories","Dunsany, Lord","Fantasy","en"
"2611",10806,"was still.","The Sword of Welleran and Other Stories","Dunsany, Lord","Fantasy","en"
"2612",10806,"","The Sword of Welleran and Other Stories","Dunsany, Lord","Fantasy","en"
"2613",10806,"Presently the darkness of the distant halls became musical with the","The Sword of Welleran and Other Stories","Dunsany, Lord","Fantasy","en"
"2614",10806,"sound of bells, all coming nearer and nearer.","The Sword of Welleran and Other Stories","Dunsany, Lord","Fantasy","en"
"2615",10806,"","The Sword of Welleran and Other Stories","Dunsany, Lord","Fantasy","en"
"2616",10806,"Still Leothric waited in the dark, and the bells rang louder and","The Sword of Welleran and Other Stories","Dunsany, Lord","Fantasy","en"
"2617",10806,"louder, echoing through the halls, and there appeared a procession","The Sword of Welleran and Other Stories","Dunsany, Lord","Fantasy","en"
"2618",10806,"of men on camels riding two by two from the interior of the","The Sword of Welleran and Other Stories","Dunsany, Lord","Fantasy","en"
"2619",10806,"fortress, and they were armed with scimitars of Assyrian make and","The Sword of Welleran and Other Stories","Dunsany, Lord","Fantasy","en"
"2620",10806,"were all clad with mail, and chain-mail hung from their helmets","The Sword of Welleran and Other Stories","Dunsany, Lord","Fantasy","en"
"2621",10806,"about their faces, and flapped as the camels moved.  And they all","The Sword of Welleran and Other Stories","Dunsany, Lord","Fantasy","en"
"2622",10806,"halted before Leothric in the cavernous hall, and the camel bells","The Sword of Welleran and Other Stories","Dunsany, Lord","Fantasy","en"
"2623",10806,"clanged and stopped.  And the leader said to Leothric:","The Sword of Welleran and Other Stories","Dunsany, Lord","Fantasy","en"
"2624",10806,"","The Sword of Welleran and Other Stories","Dunsany, Lord","Fantasy","en"
"2625",10806,"'The Lord Gaznak has desired to see you die before him.  Be pleased","The Sword of Welleran and Other Stories","Dunsany, Lord","Fantasy","en"
"2626",10806,"to come with us, and we can discourse by the way of the manner in","The Sword of Welleran and Other Stories","Dunsany, Lord","Fantasy","en"
"2627",10806,"which the Lord Gaznak has desired to see you die.'","The Sword of Welleran and Other Stories","Dunsany, Lord","Fantasy","en"
"2628",10806,"","The Sword of Welleran and Other Stories","Dunsany, Lord","Fantasy","en"
"2629",10806,"And as he said this he unwound a chain of iron that was coiled upon","The Sword of Welleran and Other Stories","Dunsany, Lord","Fantasy","en"
"2630",10806,"his saddle, and Leothric answered:","The Sword of Welleran and Other Stories","Dunsany, Lord","Fantasy","en"
"2631",10806,"","The Sword of Welleran and Other Stories","Dunsany, Lord","Fantasy","en"
"2632",10806,"'I would fain go with you, for I am come to slay Gaznak.'","The Sword of Welleran and Other Stories","Dunsany, Lord","Fantasy","en"
"2633",10806,"","The Sword of Welleran and Other Stories","Dunsany, Lord","Fantasy","en"
"2634",10806,"Then all the camel-guard of Gaznak laughed hideously, disturbing the","The Sword of Welleran and Other Stories","Dunsany, Lord","Fantasy","en"
"2635",10806,"vampires that were asleep in the measureless vault of the roof.  And","The Sword of Welleran and Other Stories","Dunsany, Lord","Fantasy","en"
"2636",10806,"the leader said:","The Sword of Welleran and Other Stories","Dunsany, Lord","Fantasy","en"
"2637",10806,"","The Sword of Welleran and Other Stories","Dunsany, Lord","Fantasy","en"
"2638",10806,"'The Lord Gaznak is immortal, save for Sacnoth, and weareth armour","The Sword of Welleran and Other Stories","Dunsany, Lord","Fantasy","en"
"2639",10806,"that is proof even against Sacnoth himself, and hath a sword the","The Sword of Welleran and Other Stories","Dunsany, Lord","Fantasy","en"
"2640",10806,"second most terrible in the world.'","The Sword of Welleran and Other Stories","Dunsany, Lord","Fantasy","en"
"2641",10806,"","The Sword of Welleran and Other Stories","Dunsany, Lord","Fantasy","en"
"2642",10806,"Then Leothric said: 'I am the Lord of the sword Sacnoth.'","The Sword of Welleran and Other Stories","Dunsany, Lord","Fantasy","en"
"2643",10806,"","The Sword of Welleran and Other Stories","Dunsany, Lord","Fantasy","en"
"2644",10806,"And he advanced towards the camel-guard of Gaznak, and Sacnoth","The Sword of Welleran and Other Stories","Dunsany, Lord","Fantasy","en"
"2645",10806,"lifted up and down in his hand as though stirred by an exultant","The Sword of Welleran and Other Stories","Dunsany, Lord","Fantasy","en"
"2646",10806,"pulse.  Then the camel-guard of Gaznak fled, and the riders leaned","The Sword of Welleran and Other Stories","Dunsany, Lord","Fantasy","en"
"2647",10806,"forward and smote their camels with whips, and they went away with a","The Sword of Welleran and Other Stories","Dunsany, Lord","Fantasy","en"
"2648",10806,"great clamour of bells through colonnades and corridors and vaulted","The Sword of Welleran and Other Stories","Dunsany, Lord","Fantasy","en"
"2649",10806,"halls, and scattered into the inner darknesses of the fortress.  When","The Sword of Welleran and Other Stories","Dunsany, Lord","Fantasy","en"
"2650",10806,"the last sound of them had died away, Leothric was in doubt which","The Sword of Welleran and Other Stories","Dunsany, Lord","Fantasy","en"
"2651",10806,"way to go, for the camel-guard was dispersed in many directions, so","The Sword of Welleran and Other Stories","Dunsany, Lord","Fantasy","en"
"2652",10806,"he went straight on till he came to a great stairway in the midst of","The Sword of Welleran and Other Stories","Dunsany, Lord","Fantasy","en"
"2653",10806,"the hall.  Then Leothric set his foot in the middle of a wide step,","The Sword of Welleran and Other Stories","Dunsany, Lord","Fantasy","en"
"2654",10806,"and climbed steadily up the stairway for five minutes.  Little light","The Sword of Welleran and Other Stories","Dunsany, Lord","Fantasy","en"
"2655",10806,"was there in the great hall through which Leothric ascended, for it","The Sword of Welleran and Other Stories","Dunsany, Lord","Fantasy","en"
"2656",10806,"only entered through arrow slits here and there, and in the world","The Sword of Welleran and Other Stories","Dunsany, Lord","Fantasy","en"
"2657",10806,"outside evening was waning fast.  The stairway led up to two folding","The Sword of Welleran and Other Stories","Dunsany, Lord","Fantasy","en"
"2658",10806,"doors, and they stood a little ajar, and through the crack Leothric","The Sword of Welleran and Other Stories","Dunsany, Lord","Fantasy","en"
"2659",10806,"entered and tried to continue straight on, but could get no farther,","The Sword of Welleran and Other Stories","Dunsany, Lord","Fantasy","en"
"2660",10806,"for the whole room seemed to be full of festoons of ropes which","The Sword of Welleran and Other Stories","Dunsany, Lord","Fantasy","en"
"2661",10806,"swung from wall to wall and were looped and draped from the ceiling.","The Sword of Welleran and Other Stories","Dunsany, Lord","Fantasy","en"
"2662",10806,"The whole chamber was thick and black with them.  They were soft and","The Sword of Welleran and Other Stories","Dunsany, Lord","Fantasy","en"
"2663",10806,"light to the touch, like fine silk, but Leothric was unable to break","The Sword of Welleran and Other Stories","Dunsany, Lord","Fantasy","en"
"2664",10806,"any one of them, and though they swung away from him as he pressed","The Sword of Welleran and Other Stories","Dunsany, Lord","Fantasy","en"
"2665",10806,"forward, yet by the time he had gone three yards they were all about","The Sword of Welleran and Other Stories","Dunsany, Lord","Fantasy","en"
"2666",10806,"him like a heavy cloak.  Then Leothric stepped back and drew Sacnoth,","The Sword of Welleran and Other Stories","Dunsany, Lord","Fantasy","en"
"2667",10806,"and Sacnoth divided the ropes without a sound, and without a sound","The Sword of Welleran and Other Stories","Dunsany, Lord","Fantasy","en"
"2668",10806,"the severed pieces fell to the floor.  Leothric went forward slowly,","The Sword of Welleran and Other Stories","Dunsany, Lord","Fantasy","en"
"2669",10806,"moving Sacnoth in front of him up and down as he went.  When he was","The Sword of Welleran and Other Stories","Dunsany, Lord","Fantasy","en"
"2670",10806,"come into the middle of the chamber, suddenly, as he parted with","The Sword of Welleran and Other Stories","Dunsany, Lord","Fantasy","en"
"2671",10806,"Sacnoth a great hammock of strands, he saw a spider before him that","The Sword of Welleran and Other Stories","Dunsany, Lord","Fantasy","en"
"2672",10806,"was larger than a ram, and the spider looked at him with eyes that","The Sword of Welleran and Other Stories","Dunsany, Lord","Fantasy","en"
"2673",10806,"were little, but in which there was much sin, and said:","The Sword of Welleran and Other Stories","Dunsany, Lord","Fantasy","en"
"2674",10806,"","The Sword of Welleran and Other Stories","Dunsany, Lord","Fantasy","en"
"2675",10806,"'Who are you that spoil the labour of years all done to the honour","The Sword of Welleran and Other Stories","Dunsany, Lord","Fantasy","en"
"2676",10806,"of Satan?'","The Sword of Welleran and Other Stories","Dunsany, Lord","Fantasy","en"
"2677",10806,"","The Sword of Welleran and Other Stories","Dunsany, Lord","Fantasy","en"
"2678",10806,"And Leothric answered: 'I am Leothric, son of Lorendiac.'","The Sword of Welleran and Other Stories","Dunsany, Lord","Fantasy","en"
"2679",10806,"","The Sword of Welleran and Other Stories","Dunsany, Lord","Fantasy","en"
"2680",10806,"And the spider said: 'I will make a rope at once to hang you with.'","The Sword of Welleran and Other Stories","Dunsany, Lord","Fantasy","en"
"2681",10806,"","The Sword of Welleran and Other Stories","Dunsany, Lord","Fantasy","en"
"2682",10806,"Then Leothric parted another bunch of strands, and came nearer to","The Sword of Welleran and Other Stories","Dunsany, Lord","Fantasy","en"
"2683",10806,"the spider as he sat making his rope, and the spider, looking up","The Sword of Welleran and Other Stories","Dunsany, Lord","Fantasy","en"
"2684",10806,"from his work, said: 'What is that sword which is able to sever my","The Sword of Welleran and Other Stories","Dunsany, Lord","Fantasy","en"
"2685",10806,"ropes?'","The Sword of Welleran and Other Stories","Dunsany, Lord","Fantasy","en"
"2686",10806,"","The Sword of Welleran and Other Stories","Dunsany, Lord","Fantasy","en"
"2687",10806,"And Leothric said: 'It is Sacnoth.'","The Sword of Welleran and Other Stories","Dunsany, Lord","Fantasy","en"
"2688",10806,"","The Sword of Welleran and Other Stories","Dunsany, Lord","Fantasy","en"
"2689",10806,"Thereat the black hair that hung over the face of the spider parted","The Sword of Welleran and Other Stories","Dunsany, Lord","Fantasy","en"
"2690",10806,"to left and right, and the spider frowned; then the hair fell back","The Sword of Welleran and Other Stories","Dunsany, Lord","Fantasy","en"
"2691",10806,"into its place, and hid everything except the sin of the little eyes","The Sword of Welleran and Other Stories","Dunsany, Lord","Fantasy","en"
"2692",10806,"which went on gleaming lustfully in the dark.  But before Leothric","The Sword of Welleran and Other Stories","Dunsany, Lord","Fantasy","en"
"2693",10806,"could reach him, he climbed away with his hands, going up by one of","The Sword of Welleran and Other Stories","Dunsany, Lord","Fantasy","en"
"2694",10806,"his ropes to a lofty rafter, and there sat, growling.  But clearing","The Sword of Welleran and Other Stories","Dunsany, Lord","Fantasy","en"
"2695",10806,"his way with Sacnoth, Leothric passed through the chamber, and came","The Sword of Welleran and Other Stories","Dunsany, Lord","Fantasy","en"
"2696",10806,"to the farther door; and the door being shut, and the handle far up","The Sword of Welleran and Other Stories","Dunsany, Lord","Fantasy","en"
"2697",10806,"out of his reach, he hewed his way through it with Sacnoth in the","The Sword of Welleran and Other Stories","Dunsany, Lord","Fantasy","en"
"2698",10806,"same way as he had through the Porte Resonant, the Way of Egress for","The Sword of Welleran and Other Stories","Dunsany, Lord","Fantasy","en"
"2699",10806,"War.  And so Leothric came into a well-lit chamber, where Queens and","The Sword of Welleran and Other Stories","Dunsany, Lord","Fantasy","en"
"2700",10806,"Princes were banqueting together, all at a great table; and","The Sword of Welleran and Other Stories","Dunsany, Lord","Fantasy","en"
"2701",10806,"thousands of candles were glowing all about, and their light shone","The Sword of Welleran and Other Stories","Dunsany, Lord","Fantasy","en"
"2702",10806,"in the wine that the Princes drank and on the huge gold candelabra,","The Sword of Welleran and Other Stories","Dunsany, Lord","Fantasy","en"
"2703",10806,"and the royal faces were irradiant with the glow, and the white","The Sword of Welleran and Other Stories","Dunsany, Lord","Fantasy","en"
"2704",10806,"table-cloth and the silver plates and the jewels in the hair of the","The Sword of Welleran and Other Stories","Dunsany, Lord","Fantasy","en"
"2705",10806,"Queens, each jewel having a historian all to itself, who wrote no","The Sword of Welleran and Other Stories","Dunsany, Lord","Fantasy","en"
"2706",10806,"other chronicles all his days.  Between the table and the door there","The Sword of Welleran and Other Stories","Dunsany, Lord","Fantasy","en"
"2707",10806,"stood two hundred footmen in two rows of one hundred facing one","The Sword of Welleran and Other Stories","Dunsany, Lord","Fantasy","en"
"2708",10806,"another.  Nobody looked at Leothric as he entered through the hole in","The Sword of Welleran and Other Stories","Dunsany, Lord","Fantasy","en"
"2709",10806,"the door, but one of the Princes asked a question of a footman, and","The Sword of Welleran and Other Stories","Dunsany, Lord","Fantasy","en"
"2710",10806,"the question was passed from mouth to mouth by all the hundred","The Sword of Welleran and Other Stories","Dunsany, Lord","Fantasy","en"
"2711",10806,"footmen till it came to the last one nearest Leothric; and he said","The Sword of Welleran and Other Stories","Dunsany, Lord","Fantasy","en"
"2712",10806,"to Leothric, without looking at him:","The Sword of Welleran and Other Stories","Dunsany, Lord","Fantasy","en"
"2713",10806,"","The Sword of Welleran and Other Stories","Dunsany, Lord","Fantasy","en"
"2714",10806,"'What do you seek here?'","The Sword of Welleran and Other Stories","Dunsany, Lord","Fantasy","en"
"2715",10806,"","The Sword of Welleran and Other Stories","Dunsany, Lord","Fantasy","en"
"2716",10806,"And Leothric answered: 'I seek to slay Gaznak.'","The Sword of Welleran and Other Stories","Dunsany, Lord","Fantasy","en"
"2717",10806,"","The Sword of Welleran and Other Stories","Dunsany, Lord","Fantasy","en"
"2718",10806,"And footman to footman repeated all the way to the table: 'He seeks","The Sword of Welleran and Other Stories","Dunsany, Lord","Fantasy","en"
"2719",10806,"to slay Gaznak.'","The Sword of Welleran and Other Stories","Dunsany, Lord","Fantasy","en"
"2720",10806,"","The Sword of Welleran and Other Stories","Dunsany, Lord","Fantasy","en"
"2721",10806,"And another question came down the line of footmen: 'What is your","The Sword of Welleran and Other Stories","Dunsany, Lord","Fantasy","en"
"2722",10806,"name?'","The Sword of Welleran and Other Stories","Dunsany, Lord","Fantasy","en"
"2723",10806,"","The Sword of Welleran and Other Stories","Dunsany, Lord","Fantasy","en"
"2724",10806,"And the line that stood opposite took his answer back.","The Sword of Welleran and Other Stories","Dunsany, Lord","Fantasy","en"
"2725",10806,"","The Sword of Welleran and Other Stories","Dunsany, Lord","Fantasy","en"
"2726",10806,"Then one of the Princes said: 'Take him away where we shall not hear","The Sword of Welleran and Other Stories","Dunsany, Lord","Fantasy","en"
"2727",10806,"his screams.'","The Sword of Welleran and Other Stories","Dunsany, Lord","Fantasy","en"
"2728",10806,"","The Sword of Welleran and Other Stories","Dunsany, Lord","Fantasy","en"
"2729",10806,"And footman repeated it to footman till it came to the last two, and","The Sword of Welleran and Other Stories","Dunsany, Lord","Fantasy","en"
"2730",10806,"they advanced to seize Leothric.","The Sword of Welleran and Other Stories","Dunsany, Lord","Fantasy","en"
"2731",10806,"","The Sword of Welleran and Other Stories","Dunsany, Lord","Fantasy","en"
"2732",10806,"Then Leothric showed to them his sword, saying, 'This is Sacnoth,'","The Sword of Welleran and Other Stories","Dunsany, Lord","Fantasy","en"
"2733",10806,"and both of them said to the man nearest: 'It is Sacnoth;' then","The Sword of Welleran and Other Stories","Dunsany, Lord","Fantasy","en"
"2734",10806,"screamed and fled away.","The Sword of Welleran and Other Stories","Dunsany, Lord","Fantasy","en"
"2735",10806,"","The Sword of Welleran and Other Stories","Dunsany, Lord","Fantasy","en"
"2736",10806,"And two by two, all up the double line, footman to footman repeated,","The Sword of Welleran and Other Stories","Dunsany, Lord","Fantasy","en"
"2737",10806,"'It is Sacnoth,' then screamed and fled, till the last two gave the","The Sword of Welleran and Other Stories","Dunsany, Lord","Fantasy","en"
"2738",10806,"message to the table, and all the rest had gone.  Hurriedly then","The Sword of Welleran and Other Stories","Dunsany, Lord","Fantasy","en"
"2739",10806,"arose the Queens and Princes, and fled out of the chamber.  And the","The Sword of Welleran and Other Stories","Dunsany, Lord","Fantasy","en"
"2740",10806,"goodly table, when they were all gone, looked small and disorderly","The Sword of Welleran and Other Stories","Dunsany, Lord","Fantasy","en"
"2741",10806,"and awry.  And to Leothric, pondering in the desolate chamber by what","The Sword of Welleran and Other Stories","Dunsany, Lord","Fantasy","en"
"2742",10806,"door he should pass onwards, there came from far away the sounds of","The Sword of Welleran and Other Stories","Dunsany, Lord","Fantasy","en"
"2743",10806,"music, and he knew that it was the magical musicians playing to","The Sword of Welleran and Other Stories","Dunsany, Lord","Fantasy","en"
"2744",10806,"Gaznak while he slept.","The Sword of Welleran and Other Stories","Dunsany, Lord","Fantasy","en"
"2745",10806,"","The Sword of Welleran and Other Stories","Dunsany, Lord","Fantasy","en"
"2746",10806,"Then Leothric, walking towards the distant music, passed out by the","The Sword of Welleran and Other Stories","Dunsany, Lord","Fantasy","en"
"2747",10806,"door opposite to the one through which he had cloven his entrance,","The Sword of Welleran and Other Stories","Dunsany, Lord","Fantasy","en"
"2748",10806,"and so passed into a chamber vast as the other, in which were many","The Sword of Welleran and Other Stories","Dunsany, Lord","Fantasy","en"
"2749",10806,"women, weirdly beautiful.  And they all asked him of his quest, and","The Sword of Welleran and Other Stories","Dunsany, Lord","Fantasy","en"
"2750",10806,"when they heard that it was to slay Gaznak, they all besought him to","The Sword of Welleran and Other Stories","Dunsany, Lord","Fantasy","en"
"2751",10806,"tarry among them, saying that Gaznak was immortal, save for Sacnoth,","The Sword of Welleran and Other Stories","Dunsany, Lord","Fantasy","en"
"2752",10806,"and also that they had need of a knight to protect them from the","The Sword of Welleran and Other Stories","Dunsany, Lord","Fantasy","en"
"2753",10806,"wolves that rushed round and round the wainscot all the night and","The Sword of Welleran and Other Stories","Dunsany, Lord","Fantasy","en"
"2754",10806,"sometimes broke in upon them through the mouldering oak.  Perhaps","The Sword of Welleran and Other Stories","Dunsany, Lord","Fantasy","en"
"2755",10806,"Leothric had been tempted to tarry had they been human women, for","The Sword of Welleran and Other Stories","Dunsany, Lord","Fantasy","en"
"2756",10806,"theirs was a strange beauty, but he perceived that instead of eyes","The Sword of Welleran and Other Stories","Dunsany, Lord","Fantasy","en"
"2757",10806,"they had little flames that flickered in their sockets, and knew","The Sword of Welleran and Other Stories","Dunsany, Lord","Fantasy","en"
"2758",10806,"them to be the fevered dreams of Gaznak.  Therefore he said:","The Sword of Welleran and Other Stories","Dunsany, Lord","Fantasy","en"
"2759",10806,"","The Sword of Welleran and Other Stories","Dunsany, Lord","Fantasy","en"
