"","gutenberg_id","text","title","author","gutenberg_bookshelf","language"
"5073",11752,"Richard recalled it, being King was rather tedious. Richard was not","Chivalry: Dizain des Reines","Cabell, James Branch","Fantasy","en"
"5074",11752,"now quite sure that he wanted to be King, and, in consequence, be","Chivalry: Dizain des Reines","Cabell, James Branch","Fantasy","en"
"5075",11752,"daily plagued by a host of vexatious and ever-squabbling barons. ""I","Chivalry: Dizain des Reines","Cabell, James Branch","Fantasy","en"
"5076",11752,"shall miss the little huzzy, too,"" he thought.","Chivalry: Dizain des Reines","Cabell, James Branch","Fantasy","en"
"5077",11752,"","Chivalry: Dizain des Reines","Cabell, James Branch","Fantasy","en"
"5078",11752,"""Heigho!"" said Richard, ""I shall console myself with purchasing all","Chivalry: Dizain des Reines","Cabell, James Branch","Fantasy","en"
"5079",11752,"beautiful things that can be touched and handled. Life is a flimsy","Chivalry: Dizain des Reines","Cabell, James Branch","Fantasy","en"
"5080",11752,"vapor which passes and is not any more: presently Branwen will be","Chivalry: Dizain des Reines","Cabell, James Branch","Fantasy","en"
"5081",11752,"married to this Gwyllem and will be grown fat and old, and I shall be","Chivalry: Dizain des Reines","Cabell, James Branch","Fantasy","en"
"5082",11752,"remarried to little Dame Isabel, and shall be King of England: and a","Chivalry: Dizain des Reines","Cabell, James Branch","Fantasy","en"
"5083",11752,"trifle later all four of us shall be dead. Pending this deplorable","Chivalry: Dizain des Reines","Cabell, James Branch","Fantasy","en"
"5084",11752,"consummation a wise man will endeavor to amuse himself.""","Chivalry: Dizain des Reines","Cabell, James Branch","Fantasy","en"
"5085",11752,"","Chivalry: Dizain des Reines","Cabell, James Branch","Fantasy","en"
"5086",11752,"Next day he despatched Caradawc to Owain Glyndwyr to bid the latter","Chivalry: Dizain des Reines","Cabell, James Branch","Fantasy","en"
"5087",11752,"send the promised implements to Caer Idion. Richard, returning to the","Chivalry: Dizain des Reines","Cabell, James Branch","Fantasy","en"
"5088",11752,"hut the same evening, found Alundyne there, alone, and grovelling at","Chivalry: Dizain des Reines","Cabell, James Branch","Fantasy","en"
"5089",11752,"the threshold. Her forehead was bloodied when she raised it and","Chivalry: Dizain des Reines","Cabell, James Branch","Fantasy","en"
"5090",11752,"through tearless sobs told of what had happened. A half-hour earlier,","Chivalry: Dizain des Reines","Cabell, James Branch","Fantasy","en"
"5091",11752,"while she and Branwen were intent upon their milking, Gwyllem had","Chivalry: Dizain des Reines","Cabell, James Branch","Fantasy","en"
"5092",11752,"ridden up, somewhat the worse for liquor. Branwen had called him sot,","Chivalry: Dizain des Reines","Cabell, James Branch","Fantasy","en"
"5093",11752,"had bidden him go home. ""That I will do,"" said Gwyllem and suddenly","Chivalry: Dizain des Reines","Cabell, James Branch","Fantasy","en"
"5094",11752,"caught up the girl. Alundyne sprang for him, and with clenched fist","Chivalry: Dizain des Reines","Cabell, James Branch","Fantasy","en"
"5095",11752,"Gwyllem struck her twice full in the face, and laughing, rode away","Chivalry: Dizain des Reines","Cabell, James Branch","Fantasy","en"
"5096",11752,"with Branwen.","Chivalry: Dizain des Reines","Cabell, James Branch","Fantasy","en"
"5097",11752,"","Chivalry: Dizain des Reines","Cabell, James Branch","Fantasy","en"
"5098",11752,"Richard made no observation. In silence he fetched his horse, and did","Chivalry: Dizain des Reines","Cabell, James Branch","Fantasy","en"
"5099",11752,"not pause to saddle it. Quickly he rode to Gwyllem's house, and broke","Chivalry: Dizain des Reines","Cabell, James Branch","Fantasy","en"
"5100",11752,"in the door. Against the farther wall stood lithe Branwen fighting","Chivalry: Dizain des Reines","Cabell, James Branch","Fantasy","en"
"5101",11752,"silently: her breasts and shoulders were naked, where Gwyllem had torn","Chivalry: Dizain des Reines","Cabell, James Branch","Fantasy","en"
"5102",11752,"away her garments. He wheedled, laughed, swore, and hiccoughed, turn","Chivalry: Dizain des Reines","Cabell, James Branch","Fantasy","en"
"5103",11752,"by turn, but she was silent.","Chivalry: Dizain des Reines","Cabell, James Branch","Fantasy","en"
"5104",11752,"","Chivalry: Dizain des Reines","Cabell, James Branch","Fantasy","en"
"5105",11752,"""On guard!"" Richard barked. Gwyllem wheeled. His head twisted toward","Chivalry: Dizain des Reines","Cabell, James Branch","Fantasy","en"
"5106",11752,"his left shoulder, and one corner of his mouth convulsively snapped","Chivalry: Dizain des Reines","Cabell, James Branch","Fantasy","en"
"5107",11752,"upward, so that his teeth were bared. There was a knife at Richard's","Chivalry: Dizain des Reines","Cabell, James Branch","Fantasy","en"
"5108",11752,"girdle, which he now unsheathed and flung away. He stepped eagerly","Chivalry: Dizain des Reines","Cabell, James Branch","Fantasy","en"
"5109",11752,"toward the snarling Welshman, and with both hands seized the thick and","Chivalry: Dizain des Reines","Cabell, James Branch","Fantasy","en"
"5110",11752,"hairy throat. What followed was brutal.","Chivalry: Dizain des Reines","Cabell, James Branch","Fantasy","en"
"5111",11752,"","Chivalry: Dizain des Reines","Cabell, James Branch","Fantasy","en"
"5112",11752,"For many minutes Branwen stood with averted face, shuddering. She very","Chivalry: Dizain des Reines","Cabell, James Branch","Fantasy","en"
"5113",11752,"dimly heard the sound of Gwyllem's impotent fists as they beat against","Chivalry: Dizain des Reines","Cabell, James Branch","Fantasy","en"
"5114",11752,"the countenance and body of Richard, and heard the thin splitting","Chivalry: Dizain des Reines","Cabell, James Branch","Fantasy","en"
"5115",11752,"vicious noise of torn cloth as Gwyllem clutched at Richard's tunic and","Chivalry: Dizain des Reines","Cabell, James Branch","Fantasy","en"
"5116",11752,"tore it many times. Richard did not utter any articulate word, and","Chivalry: Dizain des Reines","Cabell, James Branch","Fantasy","en"
"5117",11752,"Gwyllem could not. There was entire silence for a heart-beat, and the","Chivalry: Dizain des Reines","Cabell, James Branch","Fantasy","en"
"5118",11752,"thudding fall of something ponderous and limp.","Chivalry: Dizain des Reines","Cabell, James Branch","Fantasy","en"
"5119",11752,"","Chivalry: Dizain des Reines","Cabell, James Branch","Fantasy","en"
"5120",11752,"""Come!"" Richard said then. Through the hut's twilight he came, as","Chivalry: Dizain des Reines","Cabell, James Branch","Fantasy","en"
"5121",11752,"glorious in her eyes as Michael fresh from that primal battle with old","Chivalry: Dizain des Reines","Cabell, James Branch","Fantasy","en"
"5122",11752,"Satan. Tall Richard came to her, his face all blood, and lifted her in","Chivalry: Dizain des Reines","Cabell, James Branch","Fantasy","en"
"5123",11752,"his arms lest Branwen's skirt be soiled by the demolished thing which","Chivalry: Dizain des Reines","Cabell, James Branch","Fantasy","en"
"5124",11752,"sprawled across their path. She never spoke. She could not speak. In","Chivalry: Dizain des Reines","Cabell, James Branch","Fantasy","en"
"5125",11752,"his arms she rode homeward, passive, and content. The horse trod with","Chivalry: Dizain des Reines","Cabell, James Branch","Fantasy","en"
"5126",11752,"deliberation. In the east the young moon was taking heart as the","Chivalry: Dizain des Reines","Cabell, James Branch","Fantasy","en"
"5127",11752,"darkness thickened, and innumerable stars awoke. Branwen noted these","Chivalry: Dizain des Reines","Cabell, James Branch","Fantasy","en"
"5128",11752,"things incuriously.","Chivalry: Dizain des Reines","Cabell, James Branch","Fantasy","en"
"5129",11752,"","Chivalry: Dizain des Reines","Cabell, James Branch","Fantasy","en"
"5130",11752,"Richard was horribly afraid. He it had been, in sober verity it had","Chivalry: Dizain des Reines","Cabell, James Branch","Fantasy","en"
"5131",11752,"been Richard of Bordeaux, that some monstrous force had seized, and","Chivalry: Dizain des Reines","Cabell, James Branch","Fantasy","en"
"5132",11752,"had lifted, and had curtly utilized as its handiest implement. He had","Chivalry: Dizain des Reines","Cabell, James Branch","Fantasy","en"
"5133",11752,"been, and in the moment had known himself to be, the thrown spear as","Chivalry: Dizain des Reines","Cabell, James Branch","Fantasy","en"
"5134",11752,"yet in air, about to kill and quite powerless to refrain from killing.","Chivalry: Dizain des Reines","Cabell, James Branch","Fantasy","en"
"5135",11752,"It was a full three minutes before he had got the better of his","Chivalry: Dizain des Reines","Cabell, James Branch","Fantasy","en"
"5136",11752,"bewilderment and laughed, very softly, lest he disturb this Branwen,","Chivalry: Dizain des Reines","Cabell, James Branch","Fantasy","en"
"5137",11752,"who was so near his heart....","Chivalry: Dizain des Reines","Cabell, James Branch","Fantasy","en"
"5138",11752,"","Chivalry: Dizain des Reines","Cabell, James Branch","Fantasy","en"
"5139",11752,"Next day she came to him at noon, bearing as always the little basket.","Chivalry: Dizain des Reines","Cabell, James Branch","Fantasy","en"
"5140",11752,"It contained to-day a napkin, some garlic, a ham, and a small soft","Chivalry: Dizain des Reines","Cabell, James Branch","Fantasy","en"
"5141",11752,"cheese; some shalots, salt, nuts, wild apples, lettuce, onions, and","Chivalry: Dizain des Reines","Cabell, James Branch","Fantasy","en"
"5142",11752,"mushrooms. ""Behold a feast!"" said Richard. He noted then that she","Chivalry: Dizain des Reines","Cabell, James Branch","Fantasy","en"
"5143",11752,"carried also a blue pitcher filled with thin wine, and two cups of","Chivalry: Dizain des Reines","Cabell, James Branch","Fantasy","en"
"5144",11752,"oak-bark. She thanked him for last night's performance, and drank a","Chivalry: Dizain des Reines","Cabell, James Branch","Fantasy","en"
"5145",11752,"mouthful of wine to his health.","Chivalry: Dizain des Reines","Cabell, James Branch","Fantasy","en"
"5146",11752,"","Chivalry: Dizain des Reines","Cabell, James Branch","Fantasy","en"
"5147",11752,"""Decidedly, I shall be sorry to have done with shepherding,"" said","Chivalry: Dizain des Reines","Cabell, James Branch","Fantasy","en"
"5148",11752,"Richard as he ate.","Chivalry: Dizain des Reines","Cabell, James Branch","Fantasy","en"
"5149",11752,"","Chivalry: Dizain des Reines","Cabell, James Branch","Fantasy","en"
"5150",11752,"Branwen answered, ""I too shall be sorry, lord, when the masquerade is","Chivalry: Dizain des Reines","Cabell, James Branch","Fantasy","en"
"5151",11752,"ended."" And it seemed to Richard that she sighed, and he was the","Chivalry: Dizain des Reines","Cabell, James Branch","Fantasy","en"
"5152",11752,"happier.","Chivalry: Dizain des Reines","Cabell, James Branch","Fantasy","en"
"5153",11752,"","Chivalry: Dizain des Reines","Cabell, James Branch","Fantasy","en"
"5154",11752,"But he only shrugged. ""I am the wisest person unhanged, since I","Chivalry: Dizain des Reines","Cabell, James Branch","Fantasy","en"
"5155",11752,"comprehend my own folly. Yet I grant you that he was wise, too, the","Chivalry: Dizain des Reines","Cabell, James Branch","Fantasy","en"
"5156",11752,"minstrel of old time that sang: 'Over wild lands and tumbling seas","Chivalry: Dizain des Reines","Cabell, James Branch","Fantasy","en"
"5157",11752,"flits Love, at will, and maddens the heart and beguiles the senses of","Chivalry: Dizain des Reines","Cabell, James Branch","Fantasy","en"
"5158",11752,"all whom he attacks, whether his quarry be some monster of the ocean","Chivalry: Dizain des Reines","Cabell, James Branch","Fantasy","en"
"5159",11752,"or some fierce denizen of the forest, or man; for thine, O Love, thine","Chivalry: Dizain des Reines","Cabell, James Branch","Fantasy","en"
"5160",11752,"alone is the power to make playthings of us all.'""","Chivalry: Dizain des Reines","Cabell, James Branch","Fantasy","en"
"5161",11752,"","Chivalry: Dizain des Reines","Cabell, James Branch","Fantasy","en"
"5162",11752,"""Your bard was wise, no doubt, yet it was not in such terms that","Chivalry: Dizain des Reines","Cabell, James Branch","Fantasy","en"
"5163",11752,"Gwyllem sang of this passion. Lord,"" she demanded shyly, ""how would","Chivalry: Dizain des Reines","Cabell, James Branch","Fantasy","en"
"5164",11752,"you sing of love?""","Chivalry: Dizain des Reines","Cabell, James Branch","Fantasy","en"
"5165",11752,"","Chivalry: Dizain des Reines","Cabell, James Branch","Fantasy","en"
"5166",11752,"Richard was replete and contented with the world. He took up the lute,","Chivalry: Dizain des Reines","Cabell, James Branch","Fantasy","en"
"5167",11752,"in full consciousness that his compliance was in large part cenatory.","Chivalry: Dizain des Reines","Cabell, James Branch","Fantasy","en"
"5168",11752,"""In courtesy, thus--""","Chivalry: Dizain des Reines","Cabell, James Branch","Fantasy","en"
"5169",11752,"","Chivalry: Dizain des Reines","Cabell, James Branch","Fantasy","en"
"5170",11752,"Sang Richard:","Chivalry: Dizain des Reines","Cabell, James Branch","Fantasy","en"
"5171",11752,"","Chivalry: Dizain des Reines","Cabell, James Branch","Fantasy","en"
"5172",11752,"  ""The gods in honor of fair Branwen's worth","Chivalry: Dizain des Reines","Cabell, James Branch","Fantasy","en"
"5173",11752,"  Bore gifts to her:--and Jove, Olympus' lord,","Chivalry: Dizain des Reines","Cabell, James Branch","Fantasy","en"
"5174",11752,"  Co-rule of Earth and Heaven did accord,","Chivalry: Dizain des Reines","Cabell, James Branch","Fantasy","en"
"5175",11752,"  And Hermes brought that lyre he framed at birth,","Chivalry: Dizain des Reines","Cabell, James Branch","Fantasy","en"
"5176",11752,"  And Venus her famed girdle (to engirth","Chivalry: Dizain des Reines","Cabell, James Branch","Fantasy","en"
"5177",11752,"  A fairer beauty now), and Mars his sword,","Chivalry: Dizain des Reines","Cabell, James Branch","Fantasy","en"
"5178",11752,"  And wrinkled Plutus half the secret hoard","Chivalry: Dizain des Reines","Cabell, James Branch","Fantasy","en"
"5179",11752,"  And immemorial treasure of mid-earth;--","Chivalry: Dizain des Reines","Cabell, James Branch","Fantasy","en"
"5180",11752,"","Chivalry: Dizain des Reines","Cabell, James Branch","Fantasy","en"
"5181",11752,"  ""And while the careful gods were pondering","Chivalry: Dizain des Reines","Cabell, James Branch","Fantasy","en"
"5182",11752,"  Which of these goodly gifts the goodliest was,","Chivalry: Dizain des Reines","Cabell, James Branch","Fantasy","en"
"5183",11752,"  Young Cupid came among them carolling","Chivalry: Dizain des Reines","Cabell, James Branch","Fantasy","en"
"5184",11752,"  And proffered unto her a looking-glass,","Chivalry: Dizain des Reines","Cabell, James Branch","Fantasy","en"
"5185",11752,"  Wherein she gazed, and saw the goodliest thing","Chivalry: Dizain des Reines","Cabell, James Branch","Fantasy","en"
"5186",11752,"  That Earth had borne, and Heaven might not surpass.""","Chivalry: Dizain des Reines","Cabell, James Branch","Fantasy","en"
"5187",11752,"","Chivalry: Dizain des Reines","Cabell, James Branch","Fantasy","en"
"5188",11752,"""Three sounds are rarely heard,"" said Branwen; ""and these are the song","Chivalry: Dizain des Reines","Cabell, James Branch","Fantasy","en"
"5189",11752,"of the birds of Rhiannon, an invitation to feast with a miser, and a","Chivalry: Dizain des Reines","Cabell, James Branch","Fantasy","en"
"5190",11752,"speech of wisdom from the mouth of a Saxon. The song you have made of","Chivalry: Dizain des Reines","Cabell, James Branch","Fantasy","en"
"5191",11752,"courtesy is tinsel. Sing now in verity.""","Chivalry: Dizain des Reines","Cabell, James Branch","Fantasy","en"
"5192",11752,"","Chivalry: Dizain des Reines","Cabell, James Branch","Fantasy","en"
"5193",11752,"Richard laughed, though he was sensibly nettled and perhaps a shade","Chivalry: Dizain des Reines","Cabell, James Branch","Fantasy","en"
"5194",11752,"abashed. Presently he sang again.","Chivalry: Dizain des Reines","Cabell, James Branch","Fantasy","en"
"5195",11752,"","Chivalry: Dizain des Reines","Cabell, James Branch","Fantasy","en"
"5196",11752,"Sang Richard:","Chivalry: Dizain des Reines","Cabell, James Branch","Fantasy","en"
"5197",11752,"","Chivalry: Dizain des Reines","Cabell, James Branch","Fantasy","en"
"5198",11752,"  ""Catullus might have made of words that seek","Chivalry: Dizain des Reines","Cabell, James Branch","Fantasy","en"
"5199",11752,"  With rippling sound, in soft recurrent ways,","Chivalry: Dizain des Reines","Cabell, James Branch","Fantasy","en"
"5200",11752,"  The perfect song, or in remoter days","Chivalry: Dizain des Reines","Cabell, James Branch","Fantasy","en"
"5201",11752,"  Theocritus have hymned you in glad Greek;","Chivalry: Dizain des Reines","Cabell, James Branch","Fantasy","en"
"5202",11752,"  But I am not as they,--and dare not speak","Chivalry: Dizain des Reines","Cabell, James Branch","Fantasy","en"
"5203",11752,"  Of you unworthily, and dare not praise","Chivalry: Dizain des Reines","Cabell, James Branch","Fantasy","en"
"5204",11752,"  Perfection with imperfect roundelays,","Chivalry: Dizain des Reines","Cabell, James Branch","Fantasy","en"
"5205",11752,"  And desecrate the prize I dare to seek.","Chivalry: Dizain des Reines","Cabell, James Branch","Fantasy","en"
"5206",11752,"","Chivalry: Dizain des Reines","Cabell, James Branch","Fantasy","en"
"5207",11752,"  ""I do not woo you, then, by fashioning","Chivalry: Dizain des Reines","Cabell, James Branch","Fantasy","en"
"5208",11752,"  Vext analogues 'twixt you and Guenevere,","Chivalry: Dizain des Reines","Cabell, James Branch","Fantasy","en"
"5209",11752,"  Nor do I come with agile lips that bring","Chivalry: Dizain des Reines","Cabell, James Branch","Fantasy","en"
"5210",11752,"  The sugared periods of a sonneteer,","Chivalry: Dizain des Reines","Cabell, James Branch","Fantasy","en"
"5211",11752,"  And bring no more--but just with, lips that cling","Chivalry: Dizain des Reines","Cabell, James Branch","Fantasy","en"
"5212",11752,"  To yours, in murmuring, 'I love you, dear!'""","Chivalry: Dizain des Reines","Cabell, James Branch","Fantasy","en"
"5213",11752,"","Chivalry: Dizain des Reines","Cabell, James Branch","Fantasy","en"
"5214",11752,"Richard had resolved that Branwen should believe him. Tinsel, indeed!","Chivalry: Dizain des Reines","Cabell, James Branch","Fantasy","en"
"5215",11752,"then here was yet more tinsel which she must receive as gold. He was","Chivalry: Dizain des Reines","Cabell, James Branch","Fantasy","en"
"5216",11752,"very angry, because his vanity was hurt, and the pin-prick spurred him","Chivalry: Dizain des Reines","Cabell, James Branch","Fantasy","en"
"5217",11752,"to a counterfeit so specious that consciously he gloried in it. He was","Chivalry: Dizain des Reines","Cabell, James Branch","Fantasy","en"
"5218",11752,"superb, and she believed him now; there was no questioning the fact,","Chivalry: Dizain des Reines","Cabell, James Branch","Fantasy","en"
"5219",11752,"he saw it plainly, and with exultant cruelty; then curt as lightning","Chivalry: Dizain des Reines","Cabell, James Branch","Fantasy","en"
"5220",11752,"came the knowledge that what Branwen believed was the truth.","Chivalry: Dizain des Reines","Cabell, James Branch","Fantasy","en"
"5221",11752,"","Chivalry: Dizain des Reines","Cabell, James Branch","Fantasy","en"
"5222",11752,"Richard had taken just two strides toward this fair girl. Branwen","Chivalry: Dizain des Reines","Cabell, James Branch","Fantasy","en"
"5223",11752,"stayed motionless, her lips a little parted. The affairs of earth and","Chivalry: Dizain des Reines","Cabell, James Branch","Fantasy","en"
"5224",11752,"heaven were motionless throughout the moment, attendant, it seemed to","Chivalry: Dizain des Reines","Cabell, James Branch","Fantasy","en"
"5225",11752,"him; and to him his whole life was like a wave that trembled now at","Chivalry: Dizain des Reines","Cabell, James Branch","Fantasy","en"
"5226",11752,"full height, and he was aware of a new world all made of beauty and of","Chivalry: Dizain des Reines","Cabell, James Branch","Fantasy","en"
"5227",11752,"pity. Then the lute fell from his spread out hands, and Richard","Chivalry: Dizain des Reines","Cabell, James Branch","Fantasy","en"
"5228",11752,"sighed, and shrugged.","Chivalry: Dizain des Reines","Cabell, James Branch","Fantasy","en"
"5229",11752,"","Chivalry: Dizain des Reines","Cabell, James Branch","Fantasy","en"
"5230",11752,"""There is a task set me,"" he said--""it is God's work, I think. But I","Chivalry: Dizain des Reines","Cabell, James Branch","Fantasy","en"
"5231",11752,"do not know--I only know that you are very beautiful, Branwen,"" he","Chivalry: Dizain des Reines","Cabell, James Branch","Fantasy","en"
"5232",11752,"said, and in the name he found a new and piercing loveliness.","Chivalry: Dizain des Reines","Cabell, James Branch","Fantasy","en"
"5233",11752,"","Chivalry: Dizain des Reines","Cabell, James Branch","Fantasy","en"
"5234",11752,"And he said also: ""Go! For I have loved many women, and, God help me!","Chivalry: Dizain des Reines","Cabell, James Branch","Fantasy","en"
"5235",11752,"I know that I have but to wheedle you and you, too, will yield! Yonder","Chivalry: Dizain des Reines","Cabell, James Branch","Fantasy","en"
"5236",11752,"is God's work to be done, and within me rages a commonwealth of","Chivalry: Dizain des Reines","Cabell, James Branch","Fantasy","en"
"5237",11752,"devils. Child! child!"" he cried, ""I am, and ever was, a coward, too","Chivalry: Dizain des Reines","Cabell, James Branch","Fantasy","en"
"5238",11752,"timid to face life without reserve, and always I laughed because I was","Chivalry: Dizain des Reines","Cabell, James Branch","Fantasy","en"
"5239",11752,"afraid to concede that anything is serious!""","Chivalry: Dizain des Reines","Cabell, James Branch","Fantasy","en"
"5240",11752,"","Chivalry: Dizain des Reines","Cabell, James Branch","Fantasy","en"
"5241",11752,"For a long while Richard lay at his ease in the lengthening shadows of","Chivalry: Dizain des Reines","Cabell, James Branch","Fantasy","en"
"5242",11752,"the afternoon.","Chivalry: Dizain des Reines","Cabell, James Branch","Fantasy","en"
"5243",11752,"","Chivalry: Dizain des Reines","Cabell, James Branch","Fantasy","en"
"5244",11752,"""I love her. She thinks me an elderly imbecile with a flat and reedy","Chivalry: Dizain des Reines","Cabell, James Branch","Fantasy","en"
"5245",11752,"singing-voice, and she is perfectly right. She has never even","Chivalry: Dizain des Reines","Cabell, James Branch","Fantasy","en"
"5246",11752,"entertained the notion of loving me. That is well, for to-morrow, or,","Chivalry: Dizain des Reines","Cabell, James Branch","Fantasy","en"
"5247",11752,"it may be, the day after, we must part forever. I would not have the","Chivalry: Dizain des Reines","Cabell, James Branch","Fantasy","en"
"5248",11752,"parting make her sorrowful--or not, at least, too unalterably","Chivalry: Dizain des Reines","Cabell, James Branch","Fantasy","en"
"5249",11752,"sorrowful. It is very well that Branwen does not love me.","Chivalry: Dizain des Reines","Cabell, James Branch","Fantasy","en"
"5250",11752,"","Chivalry: Dizain des Reines","Cabell, James Branch","Fantasy","en"
"5251",11752,"""Why should she? I am almost twice her age, an aging fellow now,","Chivalry: Dizain des Reines","Cabell, James Branch","Fantasy","en"
"5252",11752,"battered and selfish and too indolent to love her--say, as Gwyllem","Chivalry: Dizain des Reines","Cabell, James Branch","Fantasy","en"
"5253",11752,"loved her. I did well to kill that Gwyllem. I am profoundly glad I","Chivalry: Dizain des Reines","Cabell, James Branch","Fantasy","en"
"5254",11752,"killed him, and I thoroughly enjoyed doing it; but, after all, the man","Chivalry: Dizain des Reines","Cabell, James Branch","Fantasy","en"
"5255",11752,"loved her in his fashion, and to the uttermost reach of his gross","Chivalry: Dizain des Reines","Cabell, James Branch","Fantasy","en"
"5256",11752,"nature. I love her in a rather more decorous and acceptable fashion,","Chivalry: Dizain des Reines","Cabell, James Branch","Fantasy","en"
"5257",11752,"it is true, but only a half of me loves her. The other half of me","Chivalry: Dizain des Reines","Cabell, James Branch","Fantasy","en"
"5258",11752,"remembers that I am aging, that Caradawc's hut is leaky, that, in","Chivalry: Dizain des Reines","Cabell, James Branch","Fantasy","en"
"5259",11752,"fine, bodily comfort is the single luxury of which one never tires. I","Chivalry: Dizain des Reines","Cabell, James Branch","Fantasy","en"
"5260",11752,"am a very contemptible creature, the empty scabbard of a man,","Chivalry: Dizain des Reines","Cabell, James Branch","Fantasy","en"
"5261",11752,"precisely as Owain said."" This settled, Richard whistled to his dog.","Chivalry: Dizain des Reines","Cabell, James Branch","Fantasy","en"
"5262",11752,"","Chivalry: Dizain des Reines","Cabell, James Branch","Fantasy","en"
"5263",11752,"The sun had set. There were no shadows anywhere as Richard and his","Chivalry: Dizain des Reines","Cabell, James Branch","Fantasy","en"
"5264",11752,"sheep went homeward, but on every side the colors of the world were","Chivalry: Dizain des Reines","Cabell, James Branch","Fantasy","en"
"5265",11752,"more sombre. Twice his flock roused a covey of partridges which had","Chivalry: Dizain des Reines","Cabell, James Branch","Fantasy","en"
