"","gutenberg_id","text","title","author","gutenberg_bookshelf","language"
"3531",11752,"vexed. He has always wanted to conquer France. I shall visit the","Chivalry: Dizain des Reines","Cabell, James Branch","Fantasy","en"
"3532",11752,"Marquess as soon as Lionel is fed,--do you know, John Copeland, I am","Chivalry: Dizain des Reines","Cabell, James Branch","Fantasy","en"
"3533",11752,"anxious about Lionel; he is irritable and coughed five times during","Chivalry: Dizain des Reines","Cabell, James Branch","Fantasy","en"
"3534",11752,"the night,--and then I will attend to this affair.""","Chivalry: Dizain des Reines","Cabell, James Branch","Fantasy","en"
"3535",11752,"","Chivalry: Dizain des Reines","Cabell, James Branch","Fantasy","en"
"3536",11752,"She found the Marquess in bed, groaning, the coverlet pulled up to his","Chivalry: Dizain des Reines","Cabell, James Branch","Fantasy","en"
"3537",11752,"chin. ""Pardon, Highness,"" said Lord Hastings, ""but I am an ill man. I","Chivalry: Dizain des Reines","Cabell, James Branch","Fantasy","en"
"3538",11752,"cannot rise from this couch.""","Chivalry: Dizain des Reines","Cabell, James Branch","Fantasy","en"
"3539",11752,"","Chivalry: Dizain des Reines","Cabell, James Branch","Fantasy","en"
"3540",11752,"""I do not question the gravity of your disorder,"" the Queen retorted,","Chivalry: Dizain des Reines","Cabell, James Branch","Fantasy","en"
"3541",11752,"""since it is well known that the same illness brought about the death","Chivalry: Dizain des Reines","Cabell, James Branch","Fantasy","en"
"3542",11752,"of Iscariot. Nevertheless, I bid you get up and lead our troops","Chivalry: Dizain des Reines","Cabell, James Branch","Fantasy","en"
"3543",11752,"against the Scot.""","Chivalry: Dizain des Reines","Cabell, James Branch","Fantasy","en"
"3544",11752,"","Chivalry: Dizain des Reines","Cabell, James Branch","Fantasy","en"
"3545",11752,"Now the hand of the Marquess veiled his countenance. ""I am an ill","Chivalry: Dizain des Reines","Cabell, James Branch","Fantasy","en"
"3546",11752,"man,"" he muttered, doggedly. ""I cannot rise from this couch.""","Chivalry: Dizain des Reines","Cabell, James Branch","Fantasy","en"
"3547",11752,"","Chivalry: Dizain des Reines","Cabell, James Branch","Fantasy","en"
"3548",11752,"There was a silence.","Chivalry: Dizain des Reines","Cabell, James Branch","Fantasy","en"
"3549",11752,"","Chivalry: Dizain des Reines","Cabell, James Branch","Fantasy","en"
"3550",11752,"""My lord,"" the Queen presently began, ""without is an army","Chivalry: Dizain des Reines","Cabell, James Branch","Fantasy","en"
"3551",11752,"prepared--yes, and quite able--to defend our England. The one","Chivalry: Dizain des Reines","Cabell, James Branch","Fantasy","en"
"3552",11752,"requirement of this army is a leader. Afford them that, my lord--ah, I","Chivalry: Dizain des Reines","Cabell, James Branch","Fantasy","en"
"3553",11752,"know that our peers are sold to the Bruce, yet our yeomen at least are","Chivalry: Dizain des Reines","Cabell, James Branch","Fantasy","en"
"3554",11752,"honest. Give them, then, a leader, and they cannot but conquer, since","Chivalry: Dizain des Reines","Cabell, James Branch","Fantasy","en"
"3555",11752,"God also is honest and incorruptible. Pardieu! a woman might lead","Chivalry: Dizain des Reines","Cabell, James Branch","Fantasy","en"
"3556",11752,"these men, and lead them to victory!""","Chivalry: Dizain des Reines","Cabell, James Branch","Fantasy","en"
"3557",11752,"","Chivalry: Dizain des Reines","Cabell, James Branch","Fantasy","en"
"3558",11752,"Hastings answered: ""I am ill. I cannot rise from this couch.""","Chivalry: Dizain des Reines","Cabell, James Branch","Fantasy","en"
"3559",11752,"","Chivalry: Dizain des Reines","Cabell, James Branch","Fantasy","en"
"3560",11752,"""There is no man left in England,"" said the Queen, ""since Sire Edward","Chivalry: Dizain des Reines","Cabell, James Branch","Fantasy","en"
"3561",11752,"went into France. Praise God, I am his wife!"" She went away without","Chivalry: Dizain des Reines","Cabell, James Branch","Fantasy","en"
"3562",11752,"flurry.","Chivalry: Dizain des Reines","Cabell, James Branch","Fantasy","en"
"3563",11752,"","Chivalry: Dizain des Reines","Cabell, James Branch","Fantasy","en"
"3564",11752,"Through the tent-flap Hastings beheld all that which followed. The","Chivalry: Dizain des Reines","Cabell, James Branch","Fantasy","en"
"3565",11752,"English force was marshalled in four divisions, each commanded by a","Chivalry: Dizain des Reines","Cabell, James Branch","Fantasy","en"
"3566",11752,"bishop and a baron. You could see the men fidgeting, puzzled by the","Chivalry: Dizain des Reines","Cabell, James Branch","Fantasy","en"
"3567",11752,"delay; as a wind goes about a corn-field, vague rumors were going","Chivalry: Dizain des Reines","Cabell, James Branch","Fantasy","en"
"3568",11752,"about those wavering spears. Toward them rode Philippa, upon a white","Chivalry: Dizain des Reines","Cabell, James Branch","Fantasy","en"
"3569",11752,"palfrey, alone and perfectly tranquil. Her eight lieutenants were now","Chivalry: Dizain des Reines","Cabell, James Branch","Fantasy","en"
"3570",11752,"gathered about her in voluble protestation, and she heard them out.","Chivalry: Dizain des Reines","Cabell, James Branch","Fantasy","en"
"3571",11752,"Afterward she spoke, without any particular violence, as one might","Chivalry: Dizain des Reines","Cabell, James Branch","Fantasy","en"
"3572",11752,"order a strange cur from his room. Then the Queen rode on, as though","Chivalry: Dizain des Reines","Cabell, James Branch","Fantasy","en"
"3573",11752,"these eight declaiming persons had ceased to be of interest. She","Chivalry: Dizain des Reines","Cabell, James Branch","Fantasy","en"
"3574",11752,"reined up before her standard-bearer, and took the standard in her","Chivalry: Dizain des Reines","Cabell, James Branch","Fantasy","en"
"3575",11752,"hand. She began again to speak, and immediately the army was in an","Chivalry: Dizain des Reines","Cabell, James Branch","Fantasy","en"
"3576",11752,"uproar; the barons were clustering behind her, in stealthy groups of","Chivalry: Dizain des Reines","Cabell, James Branch","Fantasy","en"
"3577",11752,"two or three whisperers each; all were in the greatest amazement and","Chivalry: Dizain des Reines","Cabell, James Branch","Fantasy","en"
"3578",11752,"knew not what to do; but the army was shouting the Queen's name.","Chivalry: Dizain des Reines","Cabell, James Branch","Fantasy","en"
"3579",11752,"","Chivalry: Dizain des Reines","Cabell, James Branch","Fantasy","en"
"3580",11752,"""Now is England shamed,"" said Hastings, ""since a woman alone dares to","Chivalry: Dizain des Reines","Cabell, James Branch","Fantasy","en"
"3581",11752,"encounter the Scot. She will lead them into battle--and by God! there","Chivalry: Dizain des Reines","Cabell, James Branch","Fantasy","en"
"3582",11752,"is no braver person under heaven than yonder Dutch Frau! Friend David,","Chivalry: Dizain des Reines","Cabell, James Branch","Fantasy","en"
"3583",11752,"I perceive that your venture is lost, for those men would follow her","Chivalry: Dizain des Reines","Cabell, James Branch","Fantasy","en"
"3584",11752,"to storm hell if she desired it.""","Chivalry: Dizain des Reines","Cabell, James Branch","Fantasy","en"
"3585",11752,"","Chivalry: Dizain des Reines","Cabell, James Branch","Fantasy","en"
"3586",11752,"He meditated, and shrugged. ""And so would I,"" said Hastings.","Chivalry: Dizain des Reines","Cabell, James Branch","Fantasy","en"
"3587",11752,"","Chivalry: Dizain des Reines","Cabell, James Branch","Fantasy","en"
"3588",11752,"A little afterward a gaunt and haggard old man, bareheaded and very","Chivalry: Dizain des Reines","Cabell, James Branch","Fantasy","en"
"3589",11752,"hastily dressed, reined his horse by the Queen's side. ""Madame and","Chivalry: Dizain des Reines","Cabell, James Branch","Fantasy","en"
"3590",11752,"Queen,"" said Hastings, ""I rejoice that my recent illness is departed.","Chivalry: Dizain des Reines","Cabell, James Branch","Fantasy","en"
"3591",11752,"I shall, by God's grace, on this day drive the Bruce from England.""","Chivalry: Dizain des Reines","Cabell, James Branch","Fantasy","en"
"3592",11752,"","Chivalry: Dizain des Reines","Cabell, James Branch","Fantasy","en"
"3593",11752,"Philippa was not given to verbiage. Doubtless she had her emotions,","Chivalry: Dizain des Reines","Cabell, James Branch","Fantasy","en"
"3594",11752,"but none was visible upon the honest face. She rested one plump hand","Chivalry: Dizain des Reines","Cabell, James Branch","Fantasy","en"
"3595",11752,"upon the big-veined hand of Hastings. That was all. ""I welcome back","Chivalry: Dizain des Reines","Cabell, James Branch","Fantasy","en"
"3596",11752,"the gallant gentleman of yesterday. I was about to lead your army, my","Chivalry: Dizain des Reines","Cabell, James Branch","Fantasy","en"
"3597",11752,"friend, since there was no one else to do it, but I was hideously","Chivalry: Dizain des Reines","Cabell, James Branch","Fantasy","en"
"3598",11752,"afraid. At bottom every woman is a coward.""","Chivalry: Dizain des Reines","Cabell, James Branch","Fantasy","en"
"3599",11752,"","Chivalry: Dizain des Reines","Cabell, James Branch","Fantasy","en"
"3600",11752,"""You were afraid to do it,"" said the Marquess, ""but you were going to","Chivalry: Dizain des Reines","Cabell, James Branch","Fantasy","en"
"3601",11752,"do it, because there was no one else to do it! Ho, madame! had I an","Chivalry: Dizain des Reines","Cabell, James Branch","Fantasy","en"
"3602",11752,"army of such cowards I would drive the Scot not past the Border but","Chivalry: Dizain des Reines","Cabell, James Branch","Fantasy","en"
"3603",11752,"beyond the Orkneys.""","Chivalry: Dizain des Reines","Cabell, James Branch","Fantasy","en"
"3604",11752,"","Chivalry: Dizain des Reines","Cabell, James Branch","Fantasy","en"
"3605",11752,"The Queen then said, ""But you are unarmed.""","Chivalry: Dizain des Reines","Cabell, James Branch","Fantasy","en"
"3606",11752,"","Chivalry: Dizain des Reines","Cabell, James Branch","Fantasy","en"
"3607",11752,"""Highness,"" he replied, ""it is surely apparent that I, who have played","Chivalry: Dizain des Reines","Cabell, James Branch","Fantasy","en"
"3608",11752,"the traitor to two monarchs within the same day, cannot with either","Chivalry: Dizain des Reines","Cabell, James Branch","Fantasy","en"
"3609",11752,"decency or comfort survive that day."" He turned upon the lords and","Chivalry: Dizain des Reines","Cabell, James Branch","Fantasy","en"
"3610",11752,"bishops twittering about his horse's tail. ""You merchandise, get back","Chivalry: Dizain des Reines","Cabell, James Branch","Fantasy","en"
"3611",11752,"to your stations, and if there was ever an honest woman in any of your","Chivalry: Dizain des Reines","Cabell, James Branch","Fantasy","en"
"3612",11752,"families, the which I doubt, contrive to get yourselves killed this","Chivalry: Dizain des Reines","Cabell, James Branch","Fantasy","en"
"3613",11752,"day, as I mean to do, in the cause of the honestest and bravest woman","Chivalry: Dizain des Reines","Cabell, James Branch","Fantasy","en"
"3614",11752,"our time has known."" Immediately the English forces marched toward","Chivalry: Dizain des Reines","Cabell, James Branch","Fantasy","en"
"3615",11752,"Merrington.","Chivalry: Dizain des Reines","Cabell, James Branch","Fantasy","en"
"3616",11752,"","Chivalry: Dizain des Reines","Cabell, James Branch","Fantasy","en"
"3617",11752,"Philippa returned to her pavilion and inquired for John Copeland. She","Chivalry: Dizain des Reines","Cabell, James Branch","Fantasy","en"
"3618",11752,"was informed that he had ridden off, armed, in company with five of","Chivalry: Dizain des Reines","Cabell, James Branch","Fantasy","en"
"3619",11752,"her immediate retainers. She considered this strange, but made no","Chivalry: Dizain des Reines","Cabell, James Branch","Fantasy","en"
"3620",11752,"comment.","Chivalry: Dizain des Reines","Cabell, James Branch","Fantasy","en"
"3621",11752,"","Chivalry: Dizain des Reines","Cabell, James Branch","Fantasy","en"
"3622",11752,"You picture her, perhaps, as spending the morning in prayer, in","Chivalry: Dizain des Reines","Cabell, James Branch","Fantasy","en"
"3623",11752,"beatings upon her breast, and in lamentations. Philippa did nothing of","Chivalry: Dizain des Reines","Cabell, James Branch","Fantasy","en"
"3624",11752,"the sort. She considered her cause to be so clamantly just that to","Chivalry: Dizain des Reines","Cabell, James Branch","Fantasy","en"
"3625",11752,"expatiate to the Holy Father upon its merits would be an impertinence;","Chivalry: Dizain des Reines","Cabell, James Branch","Fantasy","en"
"3626",11752,"it was not conceivable that He would fail her; and in any event, she","Chivalry: Dizain des Reines","Cabell, James Branch","Fantasy","en"
"3627",11752,"had in hand a deal of sewing which required immediate attention.","Chivalry: Dizain des Reines","Cabell, James Branch","Fantasy","en"
"3628",11752,"Accordingly she settled down to her needlework, while the Regent of","Chivalry: Dizain des Reines","Cabell, James Branch","Fantasy","en"
"3629",11752,"England leaned his head against her knee, and his mother told him that","Chivalry: Dizain des Reines","Cabell, James Branch","Fantasy","en"
"3630",11752,"ageless tale of Lord Huon, who in a wood near Babylon encountered the","Chivalry: Dizain des Reines","Cabell, James Branch","Fantasy","en"
"3631",11752,"King of Faery, and subsequently bereaved an atrocious Emir of his","Chivalry: Dizain des Reines","Cabell, James Branch","Fantasy","en"
"3632",11752,"beard and daughter. All this the industrious woman narrated in a low","Chivalry: Dizain des Reines","Cabell, James Branch","Fantasy","en"
"3633",11752,"and pleasant voice, while the wide-eyed Regent attended and at the","Chivalry: Dizain des Reines","Cabell, James Branch","Fantasy","en"
"3634",11752,"proper intervals gulped his cough-mixture.","Chivalry: Dizain des Reines","Cabell, James Branch","Fantasy","en"
"3635",11752,"","Chivalry: Dizain des Reines","Cabell, James Branch","Fantasy","en"
"3636",11752,"You must know that about noon Master John Copeland came into the tent.","Chivalry: Dizain des Reines","Cabell, James Branch","Fantasy","en"
"3637",11752,"""We have conquered,"" he said. ""Now, by the Face!""--thus, scoffingly,","Chivalry: Dizain des Reines","Cabell, James Branch","Fantasy","en"
"3638",11752,"he used her husband's favorite oath,--""now, by the Face! there was","Chivalry: Dizain des Reines","Cabell, James Branch","Fantasy","en"
"3639",11752,"never a victory more complete! The Scottish army is fled, it is as","Chivalry: Dizain des Reines","Cabell, James Branch","Fantasy","en"
"3640",11752,"utterly dispersed from man's seeing as are the sands which dried the","Chivalry: Dizain des Reines","Cabell, James Branch","Fantasy","en"
"3641",11752,"letters King Ahasuerus gave the admirable Esther!""","Chivalry: Dizain des Reines","Cabell, James Branch","Fantasy","en"
"3642",11752,"","Chivalry: Dizain des Reines","Cabell, James Branch","Fantasy","en"
"3643",11752,"""I rejoice,"" the Queen said, looking up from her sewing, ""that we have","Chivalry: Dizain des Reines","Cabell, James Branch","Fantasy","en"
"3644",11752,"conquered, though in nature I expected nothing else--Oh, horrible!""","Chivalry: Dizain des Reines","Cabell, James Branch","Fantasy","en"
"3645",11752,"She sprang to her feet with a cry of anguish. Here in little you have","Chivalry: Dizain des Reines","Cabell, James Branch","Fantasy","en"
"3646",11752,"the entire woman; the victory of her armament was to her a thing of","Chivalry: Dizain des Reines","Cabell, James Branch","Fantasy","en"
"3647",11752,"course, since her cause was just, whereas the loss of two front teeth","Chivalry: Dizain des Reines","Cabell, James Branch","Fantasy","en"
"3648",11752,"by John Copeland was a calamity.","Chivalry: Dizain des Reines","Cabell, James Branch","Fantasy","en"
"3649",11752,"","Chivalry: Dizain des Reines","Cabell, James Branch","Fantasy","en"
"3650",11752,"He drew her toward the tent-flap, which he opened. Without was a","Chivalry: Dizain des Reines","Cabell, James Branch","Fantasy","en"
"3651",11752,"mounted knight, in full panoply, his arms bound behind him, surrounded","Chivalry: Dizain des Reines","Cabell, James Branch","Fantasy","en"
"3652",11752,"by the Queen's five retainers. ""In the rout I took him,"" said John","Chivalry: Dizain des Reines","Cabell, James Branch","Fantasy","en"
"3653",11752,"Copeland; ""though, as my mouth witnesses, I did not find this David","Chivalry: Dizain des Reines","Cabell, James Branch","Fantasy","en"
"3654",11752,"Bruce a tractable prisoner.""","Chivalry: Dizain des Reines","Cabell, James Branch","Fantasy","en"
"3655",11752,"","Chivalry: Dizain des Reines","Cabell, James Branch","Fantasy","en"
"3656",11752,"""Is that, then, the King of Scots?"" Philippa demanded, as she mixed","Chivalry: Dizain des Reines","Cabell, James Branch","Fantasy","en"
"3657",11752,"salt and water for a mouthwash. ""Sire Edward should be pleased, I","Chivalry: Dizain des Reines","Cabell, James Branch","Fantasy","en"
"3658",11752,"think. Will he not love me a little now, John Copeland?""","Chivalry: Dizain des Reines","Cabell, James Branch","Fantasy","en"
"3659",11752,"","Chivalry: Dizain des Reines","Cabell, James Branch","Fantasy","en"
"3660",11752,"John Copeland lifted both plump hands toward his lips. ""He could not","Chivalry: Dizain des Reines","Cabell, James Branch","Fantasy","en"
"3661",11752,"choose,"" John Copeland said; ""madame, he could no more choose but love","Chivalry: Dizain des Reines","Cabell, James Branch","Fantasy","en"
"3662",11752,"you than I could choose.""","Chivalry: Dizain des Reines","Cabell, James Branch","Fantasy","en"
"3663",11752,"","Chivalry: Dizain des Reines","Cabell, James Branch","Fantasy","en"
"3664",11752,"Philippa sighed. Afterward she bade John Copeland rinse his gums and","Chivalry: Dizain des Reines","Cabell, James Branch","Fantasy","en"
"3665",11752,"then take his prisoner to Hastings. He told her the Marquess was dead,","Chivalry: Dizain des Reines","Cabell, James Branch","Fantasy","en"
"3666",11752,"slain by the Knight of Liddesdale. ""That is a pity,"" the Queen said.","Chivalry: Dizain des Reines","Cabell, James Branch","Fantasy","en"
"3667",11752,"She reflected a while, reached her decision. ""There is left alive in","Chivalry: Dizain des Reines","Cabell, James Branch","Fantasy","en"
"3668",11752,"England but one man to whom I dare entrust the keeping of the King of","Chivalry: Dizain des Reines","Cabell, James Branch","Fantasy","en"
"3669",11752,"Scots. My barons are sold to him; if I retain Messire David by me, one","Chivalry: Dizain des Reines","Cabell, James Branch","Fantasy","en"
"3670",11752,"or another lord will engineer his escape within the week, and Sire","Chivalry: Dizain des Reines","Cabell, James Branch","Fantasy","en"
"3671",11752,"Edward will be vexed. Yet listen, John--"" She unfolded her plan.","Chivalry: Dizain des Reines","Cabell, James Branch","Fantasy","en"
"3672",11752,"","Chivalry: Dizain des Reines","Cabell, James Branch","Fantasy","en"
"3673",11752,"""I have long known,"" he said, when she had done, ""that in all the","Chivalry: Dizain des Reines","Cabell, James Branch","Fantasy","en"
"3674",11752,"world there was no lady more lovable. Twenty years I have loved you,","Chivalry: Dizain des Reines","Cabell, James Branch","Fantasy","en"
"3675",11752,"my Queen, and yet it is only to-day I perceive that in all the world","Chivalry: Dizain des Reines","Cabell, James Branch","Fantasy","en"
"3676",11752,"there is no lady more wise than you.""","Chivalry: Dizain des Reines","Cabell, James Branch","Fantasy","en"
"3677",11752,"","Chivalry: Dizain des Reines","Cabell, James Branch","Fantasy","en"
"3678",11752,"Philippa touched his cheek, maternally. ""Foolish boy! You tell me the","Chivalry: Dizain des Reines","Cabell, James Branch","Fantasy","en"
"3679",11752,"King of Scots has an arrow-wound in his nose? I think a bread poultice","Chivalry: Dizain des Reines","Cabell, James Branch","Fantasy","en"
"3680",11752,"would be best."" She told him how to make this poultice, and gave other","Chivalry: Dizain des Reines","Cabell, James Branch","Fantasy","en"
"3681",11752,"instructions. Then John Copeland left the tent and presently rode away","Chivalry: Dizain des Reines","Cabell, James Branch","Fantasy","en"
"3682",11752,"with his company.","Chivalry: Dizain des Reines","Cabell, James Branch","Fantasy","en"
"3683",11752,"","Chivalry: Dizain des Reines","Cabell, James Branch","Fantasy","en"
"3684",11752,"Philippa saw that the Regent had his dinner, and afterward mounted her","Chivalry: Dizain des Reines","Cabell, James Branch","Fantasy","en"
"3685",11752,"white palfrey and set out for the battle-field. There the Earl of","Chivalry: Dizain des Reines","Cabell, James Branch","Fantasy","en"
"3686",11752,"Neville, as second in command, received her with great courtesy. God","Chivalry: Dizain des Reines","Cabell, James Branch","Fantasy","en"
"3687",11752,"had shown to her Majesty's servants most singular favor: despite the","Chivalry: Dizain des Reines","Cabell, James Branch","Fantasy","en"
"3688",11752,"calculations of reasonable men,--to which, she might remember, he had","Chivalry: Dizain des Reines","Cabell, James Branch","Fantasy","en"
"3689",11752,"that morning taken the liberty to assent,--some fifteen thousand Scots","Chivalry: Dizain des Reines","Cabell, James Branch","Fantasy","en"
"3690",11752,"were slain. True, her gallant general was no longer extant, though","Chivalry: Dizain des Reines","Cabell, James Branch","Fantasy","en"
"3691",11752,"this was scarcely astounding when one considered the fact that he had","Chivalry: Dizain des Reines","Cabell, James Branch","Fantasy","en"
"3692",11752,"voluntarily entered the melee quite unarmed. A touch of age, perhaps;","Chivalry: Dizain des Reines","Cabell, James Branch","Fantasy","en"
"3693",11752,"Hastings was always an eccentric man: in any event, as epilogue, this","Chivalry: Dizain des Reines","Cabell, James Branch","Fantasy","en"
"3694",11752,"Neville congratulated the Queen that--by blind luck, he was forced to","Chivalry: Dizain des Reines","Cabell, James Branch","Fantasy","en"
"3695",11752,"concede,--her worthy secretary had made a prisoner of the Scottish","Chivalry: Dizain des Reines","Cabell, James Branch","Fantasy","en"
"3696",11752,"King. Doubtless, Master Copeland was an estimable scribe, and yet--Ah,","Chivalry: Dizain des Reines","Cabell, James Branch","Fantasy","en"
"3697",11752,"yes, Lord Neville quite followed her Majesty--beyond doubt, the","Chivalry: Dizain des Reines","Cabell, James Branch","Fantasy","en"
"3698",11752,"wardage of a king was an honor not lightly to be conferred. Oh, yes,","Chivalry: Dizain des Reines","Cabell, James Branch","Fantasy","en"
"3699",11752,"he understood; her Majesty desired that the office should be given","Chivalry: Dizain des Reines","Cabell, James Branch","Fantasy","en"
"3700",11752,"some person of rank. And pardie! her Majesty was in the right. Eh?","Chivalry: Dizain des Reines","Cabell, James Branch","Fantasy","en"
"3701",11752,"said the Earl of Neville.","Chivalry: Dizain des Reines","Cabell, James Branch","Fantasy","en"
"3702",11752,"","Chivalry: Dizain des Reines","Cabell, James Branch","Fantasy","en"
"3703",11752,"Intently gazing into the man's shallow eyes, Philippa assented. Master","Chivalry: Dizain des Reines","Cabell, James Branch","Fantasy","en"
"3704",11752,"Copeland had acted unwarrantably in riding off with his captive. Let","Chivalry: Dizain des Reines","Cabell, James Branch","Fantasy","en"
"3705",11752,"him be sought at once. She dictated to Neville's secretary a letter,","Chivalry: Dizain des Reines","Cabell, James Branch","Fantasy","en"
"3706",11752,"which informed John Copeland that he had done what was not agreeable","Chivalry: Dizain des Reines","Cabell, James Branch","Fantasy","en"
"3707",11752,"in purloining her prisoner. Let him without delay deliver the King to","Chivalry: Dizain des Reines","Cabell, James Branch","Fantasy","en"
"3708",11752,"her good friend the Earl of Neville.","Chivalry: Dizain des Reines","Cabell, James Branch","Fantasy","en"
"3709",11752,"","Chivalry: Dizain des Reines","Cabell, James Branch","Fantasy","en"
"3710",11752,"To Neville this was satisfactory, since he intended that once in his","Chivalry: Dizain des Reines","Cabell, James Branch","Fantasy","en"
"3711",11752,"possession David Bruce should escape forthwith. The letter, I repeat,","Chivalry: Dizain des Reines","Cabell, James Branch","Fantasy","en"
"3712",11752,"suited this smirking gentleman in its tiniest syllable, and the single","Chivalry: Dizain des Reines","Cabell, James Branch","Fantasy","en"
"3713",11752,"difficulty was to convey it to John Copeland, for as to his","Chivalry: Dizain des Reines","Cabell, James Branch","Fantasy","en"
"3714",11752,"whereabouts neither Neville nor any one else had the least notion.","Chivalry: Dizain des Reines","Cabell, James Branch","Fantasy","en"
"3715",11752,"","Chivalry: Dizain des Reines","Cabell, James Branch","Fantasy","en"
"3716",11752,"This was immaterial, however, for they narrate that next day a letter","Chivalry: Dizain des Reines","Cabell, James Branch","Fantasy","en"
"3717",11752,"signed with John Copeland's name was found pinned to the front of","Chivalry: Dizain des Reines","Cabell, James Branch","Fantasy","en"
"3718",11752,"Neville's tent. I cite a passage therefrom: ""I will not give up my","Chivalry: Dizain des Reines","Cabell, James Branch","Fantasy","en"
"3719",11752,"royal prisoner to a woman or a child, but only to my own lord, Sire","Chivalry: Dizain des Reines","Cabell, James Branch","Fantasy","en"
