"","gutenberg_id","text","title","author","gutenberg_bookshelf","language"
"329",18188,"original setting of the work gradually became obscured. The more the","Homer and Classical Philology","Nietzsche, Friedrich Wilhelm","Philosophy","en"
"330",18188,"first school looked for inequalities, contradictions, perplexities, the","Homer and Classical Philology","Nietzsche, Friedrich Wilhelm","Philosophy","en"
"331",18188,"more energetically did the other school brush aside what in their","Homer and Classical Philology","Nietzsche, Friedrich Wilhelm","Philosophy","en"
"332",18188,"opinion obscured the original plan, in order, if possible, that nothing","Homer and Classical Philology","Nietzsche, Friedrich Wilhelm","Philosophy","en"
"333",18188,"might be left remaining but the actual words of the original epic","Homer and Classical Philology","Nietzsche, Friedrich Wilhelm","Philosophy","en"
"334",18188,"itself. The second school of thought of course held fast by the","Homer and Classical Philology","Nietzsche, Friedrich Wilhelm","Philosophy","en"
"335",18188,"conception of an epoch-making genius as the composer of the great works.","Homer and Classical Philology","Nietzsche, Friedrich Wilhelm","Philosophy","en"
"336",18188,"The first school, on the other hand, wavered between the supposition of","Homer and Classical Philology","Nietzsche, Friedrich Wilhelm","Philosophy","en"
"337",18188,"one genius plus a number of minor poets, and another hypothesis which","Homer and Classical Philology","Nietzsche, Friedrich Wilhelm","Philosophy","en"
"338",18188,"assumed only a number of superior and even mediocre individual bards,","Homer and Classical Philology","Nietzsche, Friedrich Wilhelm","Philosophy","en"
"339",18188,"but also postulated a mysterious discharging, a deep, national, artistic","Homer and Classical Philology","Nietzsche, Friedrich Wilhelm","Philosophy","en"
"340",18188,"impulse, which shows itself in individual minstrels as an almost","Homer and Classical Philology","Nietzsche, Friedrich Wilhelm","Philosophy","en"
"341",18188,"indifferent medium. It is to this latter school that we must attribute","Homer and Classical Philology","Nietzsche, Friedrich Wilhelm","Philosophy","en"
"342",18188,"the representation of the Homeric poems as the expression of that","Homer and Classical Philology","Nietzsche, Friedrich Wilhelm","Philosophy","en"
"343",18188,"mysterious impulse.","Homer and Classical Philology","Nietzsche, Friedrich Wilhelm","Philosophy","en"
"344",18188,"","Homer and Classical Philology","Nietzsche, Friedrich Wilhelm","Philosophy","en"
"345",18188,"All these schools of thought start from the assumption that the problem","Homer and Classical Philology","Nietzsche, Friedrich Wilhelm","Philosophy","en"
"346",18188,"of the present form of these epics can be solved from the standpoint of","Homer and Classical Philology","Nietzsche, Friedrich Wilhelm","Philosophy","en"
"347",18188,"an aesthetic judgment--but we must await the decision as to the","Homer and Classical Philology","Nietzsche, Friedrich Wilhelm","Philosophy","en"
"348",18188,"authorised line of demarcation between the man of genius and the","Homer and Classical Philology","Nietzsche, Friedrich Wilhelm","Philosophy","en"
"349",18188,"poetical soul of the people. Are there characteristic differences","Homer and Classical Philology","Nietzsche, Friedrich Wilhelm","Philosophy","en"
"350",18188,"between the utterances of the _man of genius_ and the _poetical soul of","Homer and Classical Philology","Nietzsche, Friedrich Wilhelm","Philosophy","en"
"351",18188,"the people_?","Homer and Classical Philology","Nietzsche, Friedrich Wilhelm","Philosophy","en"
"352",18188,"","Homer and Classical Philology","Nietzsche, Friedrich Wilhelm","Philosophy","en"
"353",18188,"This whole contrast, however, is unjust and misleading. There is no","Homer and Classical Philology","Nietzsche, Friedrich Wilhelm","Philosophy","en"
"354",18188,"more dangerous assumption in modern aesthetics than that of _popular","Homer and Classical Philology","Nietzsche, Friedrich Wilhelm","Philosophy","en"
"355",18188,"poetry_ and _individual poetry_, or, as it is usually called, _artistic","Homer and Classical Philology","Nietzsche, Friedrich Wilhelm","Philosophy","en"
"356",18188,"poetry_. This is the reaction, or, if you will, the superstition, which","Homer and Classical Philology","Nietzsche, Friedrich Wilhelm","Philosophy","en"
"357",18188,"followed upon the most momentous discovery of historico-philological","Homer and Classical Philology","Nietzsche, Friedrich Wilhelm","Philosophy","en"
"358",18188,"science, the discovery and appreciation of the _soul of the people_. For","Homer and Classical Philology","Nietzsche, Friedrich Wilhelm","Philosophy","en"
"359",18188,"this discovery prepared the way for a coming scientific view of history,","Homer and Classical Philology","Nietzsche, Friedrich Wilhelm","Philosophy","en"
"360",18188,"which was until then, and in many respects is even now, a mere","Homer and Classical Philology","Nietzsche, Friedrich Wilhelm","Philosophy","en"
"361",18188,"collection of materials, with the prospect that new materials would","Homer and Classical Philology","Nietzsche, Friedrich Wilhelm","Philosophy","en"
"362",18188,"continue to be added, and that the huge, overflowing pile would never be","Homer and Classical Philology","Nietzsche, Friedrich Wilhelm","Philosophy","en"
"363",18188,"systematically arranged. The people now understood for the first time","Homer and Classical Philology","Nietzsche, Friedrich Wilhelm","Philosophy","en"
"364",18188,"that the long-felt power of greater individualities and wills was larger","Homer and Classical Philology","Nietzsche, Friedrich Wilhelm","Philosophy","en"
"365",18188,"than the pitifully small will of an individual man;[1] they now saw that","Homer and Classical Philology","Nietzsche, Friedrich Wilhelm","Philosophy","en"
"366",18188,"everything truly great in the kingdom of the will could not have its","Homer and Classical Philology","Nietzsche, Friedrich Wilhelm","Philosophy","en"
"367",18188,"deepest root in the inefficacious and ephemeral individual will; and,","Homer and Classical Philology","Nietzsche, Friedrich Wilhelm","Philosophy","en"
"368",18188,"finally, they now discovered the powerful instincts of the masses, and","Homer and Classical Philology","Nietzsche, Friedrich Wilhelm","Philosophy","en"
"369",18188,"diagnosed those unconscious impulses to be the foundations and supports","Homer and Classical Philology","Nietzsche, Friedrich Wilhelm","Philosophy","en"
"370",18188,"of the so-called universal history. But the newly-lighted flame also","Homer and Classical Philology","Nietzsche, Friedrich Wilhelm","Philosophy","en"
"371",18188,"cast its shadow: and this shadow was none other than that superstition","Homer and Classical Philology","Nietzsche, Friedrich Wilhelm","Philosophy","en"
"372",18188,"already referred to, which popular poetry set up in opposition to","Homer and Classical Philology","Nietzsche, Friedrich Wilhelm","Philosophy","en"
"373",18188,"individual poetry, and thus enlarged the comprehension of the people's","Homer and Classical Philology","Nietzsche, Friedrich Wilhelm","Philosophy","en"
"374",18188,"soul to that of the people's mind. By the misapplication of a tempting","Homer and Classical Philology","Nietzsche, Friedrich Wilhelm","Philosophy","en"
"375",18188,"analogical inference, people had reached the point of applying in the","Homer and Classical Philology","Nietzsche, Friedrich Wilhelm","Philosophy","en"
"376",18188,"domain of the intellect and artistic ideas that principle of greater","Homer and Classical Philology","Nietzsche, Friedrich Wilhelm","Philosophy","en"
"377",18188,"individuality which is truly applicable only in the domain of the will.","Homer and Classical Philology","Nietzsche, Friedrich Wilhelm","Philosophy","en"
"378",18188,"The masses have never experienced more flattering treatment than in thus","Homer and Classical Philology","Nietzsche, Friedrich Wilhelm","Philosophy","en"
"379",18188,"having the laurel of genius set upon their empty heads. It was imagined","Homer and Classical Philology","Nietzsche, Friedrich Wilhelm","Philosophy","en"
"380",18188,"that new shells were forming round a small kernel, so to speak, and that","Homer and Classical Philology","Nietzsche, Friedrich Wilhelm","Philosophy","en"
"381",18188,"those pieces of popular poetry originated like avalanches, in the drift","Homer and Classical Philology","Nietzsche, Friedrich Wilhelm","Philosophy","en"
"382",18188,"and flow of tradition. They were, however, ready to consider that kernel","Homer and Classical Philology","Nietzsche, Friedrich Wilhelm","Philosophy","en"
"383",18188,"as being of the smallest possible dimensions, so that they might","Homer and Classical Philology","Nietzsche, Friedrich Wilhelm","Philosophy","en"
"384",18188,"occasionally get rid of it altogether without losing anything of the","Homer and Classical Philology","Nietzsche, Friedrich Wilhelm","Philosophy","en"
"385",18188,"mass of the avalanche. According to this view, the text itself and the","Homer and Classical Philology","Nietzsche, Friedrich Wilhelm","Philosophy","en"
"386",18188,"stories built round it are one and the same thing.","Homer and Classical Philology","Nietzsche, Friedrich Wilhelm","Philosophy","en"
"387",18188,"","Homer and Classical Philology","Nietzsche, Friedrich Wilhelm","Philosophy","en"
"388",18188,"[1] Of course Nietzsche saw afterwards that this was not so.--TR.","Homer and Classical Philology","Nietzsche, Friedrich Wilhelm","Philosophy","en"
"389",18188,"","Homer and Classical Philology","Nietzsche, Friedrich Wilhelm","Philosophy","en"
"390",18188,"Now, however, such a contrast between popular poetry and individual","Homer and Classical Philology","Nietzsche, Friedrich Wilhelm","Philosophy","en"
"391",18188,"poetry does not exist at all; on the contrary, all poetry, and of course","Homer and Classical Philology","Nietzsche, Friedrich Wilhelm","Philosophy","en"
"392",18188,"popular poetry also, requires an intermediary individuality. This","Homer and Classical Philology","Nietzsche, Friedrich Wilhelm","Philosophy","en"
"393",18188,"much-abused contrast, therefore, is necessary only when the term","Homer and Classical Philology","Nietzsche, Friedrich Wilhelm","Philosophy","en"
"394",18188,"_individual poem_ is understood to mean a poem which has not grown out","Homer and Classical Philology","Nietzsche, Friedrich Wilhelm","Philosophy","en"
"395",18188,"of the soil of popular feeling, but which has been composed by a","Homer and Classical Philology","Nietzsche, Friedrich Wilhelm","Philosophy","en"
"396",18188,"non-popular poet in a non-popular atmosphere--something which has come","Homer and Classical Philology","Nietzsche, Friedrich Wilhelm","Philosophy","en"
"397",18188,"to maturity in the study of a learned man, for example.","Homer and Classical Philology","Nietzsche, Friedrich Wilhelm","Philosophy","en"
"398",18188,"","Homer and Classical Philology","Nietzsche, Friedrich Wilhelm","Philosophy","en"
"399",18188,"With the superstition which presupposes poetising masses is connected","Homer and Classical Philology","Nietzsche, Friedrich Wilhelm","Philosophy","en"
"400",18188,"another: that popular poetry is limited to one particular period of a","Homer and Classical Philology","Nietzsche, Friedrich Wilhelm","Philosophy","en"
"401",18188,"people's history and afterwards dies out--which indeed follows as a","Homer and Classical Philology","Nietzsche, Friedrich Wilhelm","Philosophy","en"
"402",18188,"consequence of the first superstition I have mentioned. According to","Homer and Classical Philology","Nietzsche, Friedrich Wilhelm","Philosophy","en"
"403",18188,"this school, in the place of the gradually decaying popular poetry we","Homer and Classical Philology","Nietzsche, Friedrich Wilhelm","Philosophy","en"
"404",18188,"have artistic poetry, the work of individual minds, not of masses of","Homer and Classical Philology","Nietzsche, Friedrich Wilhelm","Philosophy","en"
"405",18188,"people. But the same powers which were once active are still so; and the","Homer and Classical Philology","Nietzsche, Friedrich Wilhelm","Philosophy","en"
"406",18188,"form in which they act has remained exactly the same. The great poet of","Homer and Classical Philology","Nietzsche, Friedrich Wilhelm","Philosophy","en"
"407",18188,"a literary period is still a popular poet in no narrower sense than the","Homer and Classical Philology","Nietzsche, Friedrich Wilhelm","Philosophy","en"
"408",18188,"popular poet of an illiterate age. The difference between them is not in","Homer and Classical Philology","Nietzsche, Friedrich Wilhelm","Philosophy","en"
"409",18188,"the way they originate, but it is their diffusion and propagation, in","Homer and Classical Philology","Nietzsche, Friedrich Wilhelm","Philosophy","en"
"410",18188,"short, _tradition_. This tradition is exposed to eternal danger without","Homer and Classical Philology","Nietzsche, Friedrich Wilhelm","Philosophy","en"
"411",18188,"the help of handwriting, and runs the risk of including in the poems the","Homer and Classical Philology","Nietzsche, Friedrich Wilhelm","Philosophy","en"
"412",18188,"remains of those individualities through whose oral tradition they were","Homer and Classical Philology","Nietzsche, Friedrich Wilhelm","Philosophy","en"
"413",18188,"handed down.","Homer and Classical Philology","Nietzsche, Friedrich Wilhelm","Philosophy","en"
"414",18188,"","Homer and Classical Philology","Nietzsche, Friedrich Wilhelm","Philosophy","en"
"415",18188,"If we apply all these principles to the Homeric poems, it follows that","Homer and Classical Philology","Nietzsche, Friedrich Wilhelm","Philosophy","en"
"416",18188,"we gain nothing with our theory of the poetising soul of the people, and","Homer and Classical Philology","Nietzsche, Friedrich Wilhelm","Philosophy","en"
"417",18188,"that we are always referred back to the poetical individual. We are thus","Homer and Classical Philology","Nietzsche, Friedrich Wilhelm","Philosophy","en"
"418",18188,"confronted with the task of distinguishing that which can have","Homer and Classical Philology","Nietzsche, Friedrich Wilhelm","Philosophy","en"
"419",18188,"originated only in a single poetical mind from that which is, so to","Homer and Classical Philology","Nietzsche, Friedrich Wilhelm","Philosophy","en"
"420",18188,"speak, swept up by the tide of oral tradition, and which is a highly","Homer and Classical Philology","Nietzsche, Friedrich Wilhelm","Philosophy","en"
"421",18188,"important constituent part of the Homeric poems.","Homer and Classical Philology","Nietzsche, Friedrich Wilhelm","Philosophy","en"
"422",18188,"","Homer and Classical Philology","Nietzsche, Friedrich Wilhelm","Philosophy","en"
"423",18188,"Since literary history first ceased to be a mere collection of names,","Homer and Classical Philology","Nietzsche, Friedrich Wilhelm","Philosophy","en"
"424",18188,"people have attempted to grasp and formulate the individualities of the","Homer and Classical Philology","Nietzsche, Friedrich Wilhelm","Philosophy","en"
"425",18188,"poets. A certain mechanism forms part of the method: it must be","Homer and Classical Philology","Nietzsche, Friedrich Wilhelm","Philosophy","en"
"426",18188,"explained--i.e., it must be deduced from principles--why this or that","Homer and Classical Philology","Nietzsche, Friedrich Wilhelm","Philosophy","en"
"427",18188,"individuality appears in this way and not in that. People now study","Homer and Classical Philology","Nietzsche, Friedrich Wilhelm","Philosophy","en"
"428",18188,"biographical details, environment, acquaintances, contemporary events,","Homer and Classical Philology","Nietzsche, Friedrich Wilhelm","Philosophy","en"
"429",18188,"and believe that by mixing all these ingredients together they will be","Homer and Classical Philology","Nietzsche, Friedrich Wilhelm","Philosophy","en"
"430",18188,"able to manufacture the wished-for individuality. But they forget that","Homer and Classical Philology","Nietzsche, Friedrich Wilhelm","Philosophy","en"
"431",18188,"the _punctum saliens_, the indefinable individual characteristics, can","Homer and Classical Philology","Nietzsche, Friedrich Wilhelm","Philosophy","en"
"432",18188,"never be obtained from a compound of this nature. The less there is","Homer and Classical Philology","Nietzsche, Friedrich Wilhelm","Philosophy","en"
"433",18188,"known about the life and times of the poet, the less applicable is this","Homer and Classical Philology","Nietzsche, Friedrich Wilhelm","Philosophy","en"
"434",18188,"mechanism. When, however, we have merely the works and the name of the","Homer and Classical Philology","Nietzsche, Friedrich Wilhelm","Philosophy","en"
"435",18188,"writer, it is almost impossible to detect the individuality, at all","Homer and Classical Philology","Nietzsche, Friedrich Wilhelm","Philosophy","en"
"436",18188,"events, for those who put their faith in the mechanism in question; and","Homer and Classical Philology","Nietzsche, Friedrich Wilhelm","Philosophy","en"
"437",18188,"particularly when the works are perfect, when they are pieces of popular","Homer and Classical Philology","Nietzsche, Friedrich Wilhelm","Philosophy","en"
"438",18188,"poetry. For the best way for these mechanicians to grasp individual","Homer and Classical Philology","Nietzsche, Friedrich Wilhelm","Philosophy","en"
"439",18188,"characteristics is by perceiving deviations from the genius of the","Homer and Classical Philology","Nietzsche, Friedrich Wilhelm","Philosophy","en"
"440",18188,"people; the aberrations and hidden allusions: and the fewer","Homer and Classical Philology","Nietzsche, Friedrich Wilhelm","Philosophy","en"
"441",18188,"discrepancies to be found in a poem the fainter will be the traces of","Homer and Classical Philology","Nietzsche, Friedrich Wilhelm","Philosophy","en"
"442",18188,"the individual poet who composed it.","Homer and Classical Philology","Nietzsche, Friedrich Wilhelm","Philosophy","en"
"443",18188,"","Homer and Classical Philology","Nietzsche, Friedrich Wilhelm","Philosophy","en"
"444",18188,"All those deviations, everything dull and below the ordinary standard","Homer and Classical Philology","Nietzsche, Friedrich Wilhelm","Philosophy","en"
"445",18188,"which scholars think they perceive in the Homeric poems, were attributed","Homer and Classical Philology","Nietzsche, Friedrich Wilhelm","Philosophy","en"
"446",18188,"to tradition, which thus became the scapegoat. What was left of Homer's","Homer and Classical Philology","Nietzsche, Friedrich Wilhelm","Philosophy","en"
"447",18188,"own individual work? Nothing but a series of beautiful and prominent","Homer and Classical Philology","Nietzsche, Friedrich Wilhelm","Philosophy","en"
"448",18188,"passages chosen in accordance with subjective taste. The sum total of","Homer and Classical Philology","Nietzsche, Friedrich Wilhelm","Philosophy","en"
"449",18188,"aesthetic singularity which every individual scholar perceived with his","Homer and Classical Philology","Nietzsche, Friedrich Wilhelm","Philosophy","en"
"450",18188,"own artistic gifts, he now called Homer.","Homer and Classical Philology","Nietzsche, Friedrich Wilhelm","Philosophy","en"
"451",18188,"","Homer and Classical Philology","Nietzsche, Friedrich Wilhelm","Philosophy","en"
"452",18188,"This is the central point of the Homeric errors. The name of Homer, from","Homer and Classical Philology","Nietzsche, Friedrich Wilhelm","Philosophy","en"
"453",18188,"the very beginning, has no connection either with the conception of","Homer and Classical Philology","Nietzsche, Friedrich Wilhelm","Philosophy","en"
"454",18188,"aesthetic perfection or yet with the _Iliad_ and the _Odyssey_. Homer as","Homer and Classical Philology","Nietzsche, Friedrich Wilhelm","Philosophy","en"
"455",18188,"the composer of the _Iliad_ and the _Odyssey_ is not a historical","Homer and Classical Philology","Nietzsche, Friedrich Wilhelm","Philosophy","en"
"456",18188,"tradition, but an _aesthetic judgment_.","Homer and Classical Philology","Nietzsche, Friedrich Wilhelm","Philosophy","en"
"457",18188,"","Homer and Classical Philology","Nietzsche, Friedrich Wilhelm","Philosophy","en"
"458",18188,"The only path which leads back beyond the time of Pisistratus and helps","Homer and Classical Philology","Nietzsche, Friedrich Wilhelm","Philosophy","en"
"459",18188,"us to elucidate the meaning of the name Homer, takes its way on the one","Homer and Classical Philology","Nietzsche, Friedrich Wilhelm","Philosophy","en"
"460",18188,"hand through the reports which have reached us concerning Homer's","Homer and Classical Philology","Nietzsche, Friedrich Wilhelm","Philosophy","en"
"461",18188,"birthplace: from which we see that, although his name is always","Homer and Classical Philology","Nietzsche, Friedrich Wilhelm","Philosophy","en"
"462",18188,"associated with heroic epic poems, he is on the other hand no more","Homer and Classical Philology","Nietzsche, Friedrich Wilhelm","Philosophy","en"
"463",18188,"referred to as the composer of the _Iliad_ and the _Odyssey_ than as the","Homer and Classical Philology","Nietzsche, Friedrich Wilhelm","Philosophy","en"
"464",18188,"author of the _Thebais_ or any other cyclical epic. On the other hand,","Homer and Classical Philology","Nietzsche, Friedrich Wilhelm","Philosophy","en"
"465",18188,"again, an old tradition tells of the contest between Homer and Hesiod,","Homer and Classical Philology","Nietzsche, Friedrich Wilhelm","Philosophy","en"
"466",18188,"which proves that when these two names were mentioned people","Homer and Classical Philology","Nietzsche, Friedrich Wilhelm","Philosophy","en"
"467",18188,"instinctively thought of two epic tendencies, the heroic and the","Homer and Classical Philology","Nietzsche, Friedrich Wilhelm","Philosophy","en"
"468",18188,"didactic; and that the signification of the name ""Homer"" was included in","Homer and Classical Philology","Nietzsche, Friedrich Wilhelm","Philosophy","en"
"469",18188,"the material category and not in the formal. This imaginary contest with","Homer and Classical Philology","Nietzsche, Friedrich Wilhelm","Philosophy","en"
"470",18188,"Hesiod did not even yet show the faintest presentiment of individuality.","Homer and Classical Philology","Nietzsche, Friedrich Wilhelm","Philosophy","en"
"471",18188,"From the time of Pisistratus onwards, however, with the surprisingly","Homer and Classical Philology","Nietzsche, Friedrich Wilhelm","Philosophy","en"
"472",18188,"rapid development of the Greek feeling for beauty, the differences in","Homer and Classical Philology","Nietzsche, Friedrich Wilhelm","Philosophy","en"
"473",18188,"the aesthetic value of those epics continued to be felt more and more:","Homer and Classical Philology","Nietzsche, Friedrich Wilhelm","Philosophy","en"
"474",18188,"the _Iliad_ and the _Odyssey_ arose from the depths of the flood and","Homer and Classical Philology","Nietzsche, Friedrich Wilhelm","Philosophy","en"
"475",18188,"have remained on the surface ever since. With this process of aesthetic","Homer and Classical Philology","Nietzsche, Friedrich Wilhelm","Philosophy","en"
"476",18188,"separation, the conception of Homer gradually became narrower: the old","Homer and Classical Philology","Nietzsche, Friedrich Wilhelm","Philosophy","en"
"477",18188,"material meaning of the name ""Homer"" as the father of the heroic epic","Homer and Classical Philology","Nietzsche, Friedrich Wilhelm","Philosophy","en"
"478",18188,"poem, was changed into the aesthetic meaning of Homer, the father of","Homer and Classical Philology","Nietzsche, Friedrich Wilhelm","Philosophy","en"
"479",18188,"poetry in general, and likewise its original prototype. This","Homer and Classical Philology","Nietzsche, Friedrich Wilhelm","Philosophy","en"
"480",18188,"transformation was contemporary with the rationalistic criticism which","Homer and Classical Philology","Nietzsche, Friedrich Wilhelm","Philosophy","en"
"481",18188,"made Homer the magician out to be a possible poet, which vindicated the","Homer and Classical Philology","Nietzsche, Friedrich Wilhelm","Philosophy","en"
"482",18188,"material and formal traditions of those numerous epics as against the","Homer and Classical Philology","Nietzsche, Friedrich Wilhelm","Philosophy","en"
"483",18188,"unity of the poet, and gradually removed that heavy load of cyclical","Homer and Classical Philology","Nietzsche, Friedrich Wilhelm","Philosophy","en"
"484",18188,"epics from Homer's shoulders.","Homer and Classical Philology","Nietzsche, Friedrich Wilhelm","Philosophy","en"
"485",18188,"","Homer and Classical Philology","Nietzsche, Friedrich Wilhelm","Philosophy","en"
"486",18188,"So Homer, the poet of the _Iliad_ and the _Odyssey_, is an aesthetic","Homer and Classical Philology","Nietzsche, Friedrich Wilhelm","Philosophy","en"
"487",18188,"judgment. It is, however, by no means affirmed against the poet of these","Homer and Classical Philology","Nietzsche, Friedrich Wilhelm","Philosophy","en"
"488",18188,"epics that he was merely the imaginary being of an aesthetic","Homer and Classical Philology","Nietzsche, Friedrich Wilhelm","Philosophy","en"
"489",18188,"impossibility, which can be the opinion of only very few philologists","Homer and Classical Philology","Nietzsche, Friedrich Wilhelm","Philosophy","en"
"490",18188,"indeed. The majority contend that a single individual was responsible","Homer and Classical Philology","Nietzsche, Friedrich Wilhelm","Philosophy","en"
"491",18188,"for the general design of a poem such as the _Iliad_, and further that","Homer and Classical Philology","Nietzsche, Friedrich Wilhelm","Philosophy","en"
"492",18188,"this individual was Homer. The first part of this contention may be","Homer and Classical Philology","Nietzsche, Friedrich Wilhelm","Philosophy","en"
