"","gutenberg_id","text","title","author","gutenberg_bookshelf","language"
"169",18188,"example--the centre of discussion may be removed from the problem of the","Homer and Classical Philology","Nietzsche, Friedrich Wilhelm","Philosophy","en"
"170",18188,"poet's personality; for even now a painstaking experiment is being made","Homer and Classical Philology","Nietzsche, Friedrich Wilhelm","Philosophy","en"
"171",18188,"to reconstruct the Homeric poems without the aid of personality,","Homer and Classical Philology","Nietzsche, Friedrich Wilhelm","Philosophy","en"
"172",18188,"treating them as the work of several different persons. But if the","Homer and Classical Philology","Nietzsche, Friedrich Wilhelm","Philosophy","en"
"173",18188,"centre of a scientific question is rightly seen to be where the swelling","Homer and Classical Philology","Nietzsche, Friedrich Wilhelm","Philosophy","en"
"174",18188,"tide of new views has risen up, i.e. where individual scientific","Homer and Classical Philology","Nietzsche, Friedrich Wilhelm","Philosophy","en"
"175",18188,"investigation comes into contact with the whole life of science and","Homer and Classical Philology","Nietzsche, Friedrich Wilhelm","Philosophy","en"
"176",18188,"culture--if any one, in other words, indicates a historico-cultural","Homer and Classical Philology","Nietzsche, Friedrich Wilhelm","Philosophy","en"
"177",18188,"valuation as the central point of the question, he must also, in the","Homer and Classical Philology","Nietzsche, Friedrich Wilhelm","Philosophy","en"
"178",18188,"province of Homeric criticism, take his stand upon the question of","Homer and Classical Philology","Nietzsche, Friedrich Wilhelm","Philosophy","en"
"179",18188,"personality as being the really fruitful oasis in the desert of the","Homer and Classical Philology","Nietzsche, Friedrich Wilhelm","Philosophy","en"
"180",18188,"whole argument. For in Homer the modern world, I will not say has","Homer and Classical Philology","Nietzsche, Friedrich Wilhelm","Philosophy","en"
"181",18188,"learnt, but has examined, a great historical point of view; and, even","Homer and Classical Philology","Nietzsche, Friedrich Wilhelm","Philosophy","en"
"182",18188,"without now putting forward my own opinion as to whether this","Homer and Classical Philology","Nietzsche, Friedrich Wilhelm","Philosophy","en"
"183",18188,"examination has been or can be happily carried out, it was at all","Homer and Classical Philology","Nietzsche, Friedrich Wilhelm","Philosophy","en"
"184",18188,"events the first example of the application of that productive point of","Homer and Classical Philology","Nietzsche, Friedrich Wilhelm","Philosophy","en"
"185",18188,"view. By it scholars learnt to recognise condensed beliefs in the","Homer and Classical Philology","Nietzsche, Friedrich Wilhelm","Philosophy","en"
"186",18188,"apparently firm, immobile figures of the life of ancient peoples; by it","Homer and Classical Philology","Nietzsche, Friedrich Wilhelm","Philosophy","en"
"187",18188,"they for the first time perceived the wonderful capability of the soul","Homer and Classical Philology","Nietzsche, Friedrich Wilhelm","Philosophy","en"
"188",18188,"of a people to represent the conditions of its morals and beliefs in the","Homer and Classical Philology","Nietzsche, Friedrich Wilhelm","Philosophy","en"
"189",18188,"form of a personality. When historical criticism has confidently seized","Homer and Classical Philology","Nietzsche, Friedrich Wilhelm","Philosophy","en"
"190",18188,"upon this method of evaporating apparently concrete personalities, it is","Homer and Classical Philology","Nietzsche, Friedrich Wilhelm","Philosophy","en"
"191",18188,"permissible to point to the first experiment as an important event in","Homer and Classical Philology","Nietzsche, Friedrich Wilhelm","Philosophy","en"
"192",18188,"the history of sciences, without considering whether it was successful","Homer and Classical Philology","Nietzsche, Friedrich Wilhelm","Philosophy","en"
"193",18188,"in this instance or not.","Homer and Classical Philology","Nietzsche, Friedrich Wilhelm","Philosophy","en"
"194",18188,"","Homer and Classical Philology","Nietzsche, Friedrich Wilhelm","Philosophy","en"
"195",18188,"It is a common occurrence for a series of striking signs and wonderful","Homer and Classical Philology","Nietzsche, Friedrich Wilhelm","Philosophy","en"
"196",18188,"emotions to precede an epoch-making discovery. Even the experiment I","Homer and Classical Philology","Nietzsche, Friedrich Wilhelm","Philosophy","en"
"197",18188,"have just referred to has its own attractive history; but it goes back","Homer and Classical Philology","Nietzsche, Friedrich Wilhelm","Philosophy","en"
"198",18188,"to a surprisingly ancient era. Friedrich August Wolf has exactly","Homer and Classical Philology","Nietzsche, Friedrich Wilhelm","Philosophy","en"
"199",18188,"indicated the spot where Greek antiquity dropped the question. The","Homer and Classical Philology","Nietzsche, Friedrich Wilhelm","Philosophy","en"
"200",18188,"zenith of the historico-literary studies of the Greeks, and hence also","Homer and Classical Philology","Nietzsche, Friedrich Wilhelm","Philosophy","en"
"201",18188,"of their point of greatest importance--the Homeric question--was reached","Homer and Classical Philology","Nietzsche, Friedrich Wilhelm","Philosophy","en"
"202",18188,"in the age of the Alexandrian grammarians. Up to this time the Homeric","Homer and Classical Philology","Nietzsche, Friedrich Wilhelm","Philosophy","en"
"203",18188,"question had run through the long chain of a uniform process of","Homer and Classical Philology","Nietzsche, Friedrich Wilhelm","Philosophy","en"
"204",18188,"development, of which the standpoint of those grammarians seemed to be","Homer and Classical Philology","Nietzsche, Friedrich Wilhelm","Philosophy","en"
"205",18188,"the last link, the last, indeed, which was attainable by antiquity. They","Homer and Classical Philology","Nietzsche, Friedrich Wilhelm","Philosophy","en"
"206",18188,"conceived the _Iliad_ and the _Odyssey_ as the creations of _one single_","Homer and Classical Philology","Nietzsche, Friedrich Wilhelm","Philosophy","en"
"207",18188,"Homer; they declared it to be psychologically possible for two such","Homer and Classical Philology","Nietzsche, Friedrich Wilhelm","Philosophy","en"
"208",18188,"different works to have sprung from the brain of _one_ genius, in","Homer and Classical Philology","Nietzsche, Friedrich Wilhelm","Philosophy","en"
"209",18188,"contradiction to the Chorizontes, who represented the extreme limit of","Homer and Classical Philology","Nietzsche, Friedrich Wilhelm","Philosophy","en"
"210",18188,"the scepticism of a few detached individuals of antiquity rather than","Homer and Classical Philology","Nietzsche, Friedrich Wilhelm","Philosophy","en"
"211",18188,"antiquity itself considered as a whole. To explain the different general","Homer and Classical Philology","Nietzsche, Friedrich Wilhelm","Philosophy","en"
"212",18188,"impression of the two books on the assumption that _one_ poet composed","Homer and Classical Philology","Nietzsche, Friedrich Wilhelm","Philosophy","en"
"213",18188,"them both, scholars sought assistance by referring to the seasons of the","Homer and Classical Philology","Nietzsche, Friedrich Wilhelm","Philosophy","en"
"214",18188,"poet's life, and compared the poet of the _Odyssey_ to the setting sun.","Homer and Classical Philology","Nietzsche, Friedrich Wilhelm","Philosophy","en"
"215",18188,"The eyes of those critics were tirelessly on the lookout for","Homer and Classical Philology","Nietzsche, Friedrich Wilhelm","Philosophy","en"
"216",18188,"discrepancies in the language and thoughts of the two poems; but at this","Homer and Classical Philology","Nietzsche, Friedrich Wilhelm","Philosophy","en"
"217",18188,"time also a history of the Homeric poem and its tradition was prepared,","Homer and Classical Philology","Nietzsche, Friedrich Wilhelm","Philosophy","en"
"218",18188,"according to which these discrepancies were not due to Homer, but","Homer and Classical Philology","Nietzsche, Friedrich Wilhelm","Philosophy","en"
"219",18188,"to those who committed his words to writing and those who sang them. It","Homer and Classical Philology","Nietzsche, Friedrich Wilhelm","Philosophy","en"
"220",18188,"was believed that Homer's poem was passed from one generation to another","Homer and Classical Philology","Nietzsche, Friedrich Wilhelm","Philosophy","en"
"221",18188,"_viva voce_, and faults were attributed to the improvising and at times","Homer and Classical Philology","Nietzsche, Friedrich Wilhelm","Philosophy","en"
"222",18188,"forgetful bards. At a certain given date, about the time of Pisistratus,","Homer and Classical Philology","Nietzsche, Friedrich Wilhelm","Philosophy","en"
"223",18188,"the poems which had been repeated orally were said to have been","Homer and Classical Philology","Nietzsche, Friedrich Wilhelm","Philosophy","en"
"224",18188,"collected in manuscript form; but the scribes, it is added, allowed","Homer and Classical Philology","Nietzsche, Friedrich Wilhelm","Philosophy","en"
"225",18188,"themselves to take some liberties with the text by transposing some","Homer and Classical Philology","Nietzsche, Friedrich Wilhelm","Philosophy","en"
"226",18188,"lines and adding extraneous matter here and there. This entire","Homer and Classical Philology","Nietzsche, Friedrich Wilhelm","Philosophy","en"
"227",18188,"hypothesis is the most important in the domain of literary studies that","Homer and Classical Philology","Nietzsche, Friedrich Wilhelm","Philosophy","en"
"228",18188,"antiquity has exhibited; and the acknowledgment of the dissemination of","Homer and Classical Philology","Nietzsche, Friedrich Wilhelm","Philosophy","en"
"229",18188,"the Homeric poems by word of mouth, as opposed to the habits of a","Homer and Classical Philology","Nietzsche, Friedrich Wilhelm","Philosophy","en"
"230",18188,"book-learned age, shows in particular a depth of ancient sagacity worthy","Homer and Classical Philology","Nietzsche, Friedrich Wilhelm","Philosophy","en"
"231",18188,"of our admiration. From those times until the generation that produced","Homer and Classical Philology","Nietzsche, Friedrich Wilhelm","Philosophy","en"
"232",18188,"Friedrich August Wolf we must take a jump over a long historical vacuum;","Homer and Classical Philology","Nietzsche, Friedrich Wilhelm","Philosophy","en"
"233",18188,"but in our own age we find the argument left just as it was at the time","Homer and Classical Philology","Nietzsche, Friedrich Wilhelm","Philosophy","en"
"234",18188,"when the power of controversy departed from antiquity, and it is a","Homer and Classical Philology","Nietzsche, Friedrich Wilhelm","Philosophy","en"
"235",18188,"matter of indifference to us that Wolf accepted as certain tradition","Homer and Classical Philology","Nietzsche, Friedrich Wilhelm","Philosophy","en"
"236",18188,"what antiquity itself had set up only as a hypothesis. It may be","Homer and Classical Philology","Nietzsche, Friedrich Wilhelm","Philosophy","en"
"237",18188,"remarked as most characteristic of this hypothesis that, in the","Homer and Classical Philology","Nietzsche, Friedrich Wilhelm","Philosophy","en"
"238",18188,"strictest sense, the personality of Homer is treated seriously; that a","Homer and Classical Philology","Nietzsche, Friedrich Wilhelm","Philosophy","en"
"239",18188,"certain standard of inner harmony is everywhere presupposed in the","Homer and Classical Philology","Nietzsche, Friedrich Wilhelm","Philosophy","en"
"240",18188,"manifestations of the personality; and that, with these two excellent","Homer and Classical Philology","Nietzsche, Friedrich Wilhelm","Philosophy","en"
"241",18188,"auxiliary hypotheses, whatever is seen to be below this standard and","Homer and Classical Philology","Nietzsche, Friedrich Wilhelm","Philosophy","en"
"242",18188,"opposed to this inner harmony is at once swept aside as un-Homeric. But","Homer and Classical Philology","Nietzsche, Friedrich Wilhelm","Philosophy","en"
"243",18188,"even this distinguishing characteristic, in place of wishing to","Homer and Classical Philology","Nietzsche, Friedrich Wilhelm","Philosophy","en"
"244",18188,"recognise the supernatural existence of a tangible personality, ascends","Homer and Classical Philology","Nietzsche, Friedrich Wilhelm","Philosophy","en"
"245",18188,"likewise through all the stages that lead to that zenith, with","Homer and Classical Philology","Nietzsche, Friedrich Wilhelm","Philosophy","en"
"246",18188,"ever-increasing energy and clearness. Individuality is ever more","Homer and Classical Philology","Nietzsche, Friedrich Wilhelm","Philosophy","en"
"247",18188,"strongly felt and accentuated; the psychological possibility of a","Homer and Classical Philology","Nietzsche, Friedrich Wilhelm","Philosophy","en"
"248",18188,"_single_ Homer is ever more forcibly demanded. If we descend backwards","Homer and Classical Philology","Nietzsche, Friedrich Wilhelm","Philosophy","en"
"249",18188,"from this zenith, step by step, we find a guide to the understanding of","Homer and Classical Philology","Nietzsche, Friedrich Wilhelm","Philosophy","en"
"250",18188,"the Homeric problem in the person of Aristotle. Homer was for him the","Homer and Classical Philology","Nietzsche, Friedrich Wilhelm","Philosophy","en"
"251",18188,"flawless and untiring artist who knew his end and the means to attain","Homer and Classical Philology","Nietzsche, Friedrich Wilhelm","Philosophy","en"
"252",18188,"it; but there is still a trace of infantile criticism to be found in","Homer and Classical Philology","Nietzsche, Friedrich Wilhelm","Philosophy","en"
"253",18188,"Aristotle--i.e., in the naive concession he made to the public opinion","Homer and Classical Philology","Nietzsche, Friedrich Wilhelm","Philosophy","en"
"254",18188,"that considered Homer as the author of the original of all comic epics,","Homer and Classical Philology","Nietzsche, Friedrich Wilhelm","Philosophy","en"
"255",18188,"the _Margites_. If we go still further backwards from Aristotle, the","Homer and Classical Philology","Nietzsche, Friedrich Wilhelm","Philosophy","en"
"256",18188,"inability to create a personality is seen to increase; more and more","Homer and Classical Philology","Nietzsche, Friedrich Wilhelm","Philosophy","en"
"257",18188,"poems are attributed to Homer; and every period lets us see its degree","Homer and Classical Philology","Nietzsche, Friedrich Wilhelm","Philosophy","en"
"258",18188,"of criticism by how much and what it considers as Homeric. In this","Homer and Classical Philology","Nietzsche, Friedrich Wilhelm","Philosophy","en"
"259",18188,"backward examination, we instinctively feel that away beyond Herodotus","Homer and Classical Philology","Nietzsche, Friedrich Wilhelm","Philosophy","en"
"260",18188,"there lies a period in which an immense flood of great epics has been","Homer and Classical Philology","Nietzsche, Friedrich Wilhelm","Philosophy","en"
"261",18188,"identified with the name of Homer.","Homer and Classical Philology","Nietzsche, Friedrich Wilhelm","Philosophy","en"
"262",18188,"","Homer and Classical Philology","Nietzsche, Friedrich Wilhelm","Philosophy","en"
"263",18188,"Let us imagine ourselves as living in the time of Pisistratus: the word","Homer and Classical Philology","Nietzsche, Friedrich Wilhelm","Philosophy","en"
"264",18188,"""Homer"" then comprehended an abundance of dissimilarities. What was","Homer and Classical Philology","Nietzsche, Friedrich Wilhelm","Philosophy","en"
"265",18188,"meant by ""Homer"" at that time? It is evident that that generation found","Homer and Classical Philology","Nietzsche, Friedrich Wilhelm","Philosophy","en"
"266",18188,"itself unable to grasp a personality and the limits of its","Homer and Classical Philology","Nietzsche, Friedrich Wilhelm","Philosophy","en"
"267",18188,"manifestations. Homer had now become of small consequence. And then we","Homer and Classical Philology","Nietzsche, Friedrich Wilhelm","Philosophy","en"
"268",18188,"meet with the weighty question: What lies before this period? Has","Homer and Classical Philology","Nietzsche, Friedrich Wilhelm","Philosophy","en"
"269",18188,"Homer's personality, because it cannot be grasped, gradually faded away","Homer and Classical Philology","Nietzsche, Friedrich Wilhelm","Philosophy","en"
"270",18188,"into an empty name? Or had all the Homeric poems been gathered together","Homer and Classical Philology","Nietzsche, Friedrich Wilhelm","Philosophy","en"
"271",18188,"in a body, the nation naively representing itself by the figure of","Homer and Classical Philology","Nietzsche, Friedrich Wilhelm","Philosophy","en"
"272",18188,"Homer? _Was the person created out of a conception, or the conception","Homer and Classical Philology","Nietzsche, Friedrich Wilhelm","Philosophy","en"
"273",18188,"out of a person?_ This is the real ""Homeric question,"" the central","Homer and Classical Philology","Nietzsche, Friedrich Wilhelm","Philosophy","en"
"274",18188,"problem of the personality.","Homer and Classical Philology","Nietzsche, Friedrich Wilhelm","Philosophy","en"
"275",18188,"","Homer and Classical Philology","Nietzsche, Friedrich Wilhelm","Philosophy","en"
"276",18188,"The difficulty of answering this question, however, is increased when we","Homer and Classical Philology","Nietzsche, Friedrich Wilhelm","Philosophy","en"
"277",18188,"seek a reply in another direction, from the standpoint of the poems","Homer and Classical Philology","Nietzsche, Friedrich Wilhelm","Philosophy","en"
"278",18188,"themselves which have come down to us. As it is difficult for us at the","Homer and Classical Philology","Nietzsche, Friedrich Wilhelm","Philosophy","en"
"279",18188,"present day, and necessitates a serious effort on our part, to","Homer and Classical Philology","Nietzsche, Friedrich Wilhelm","Philosophy","en"
"280",18188,"understand the law of gravitation clearly--that the earth alters its","Homer and Classical Philology","Nietzsche, Friedrich Wilhelm","Philosophy","en"
"281",18188,"form of motion when another heavenly body changes its position in space,","Homer and Classical Philology","Nietzsche, Friedrich Wilhelm","Philosophy","en"
"282",18188,"although no material connection unites one to the other--it likewise","Homer and Classical Philology","Nietzsche, Friedrich Wilhelm","Philosophy","en"
"283",18188,"costs us some trouble to obtain a clear impression of that wonderful","Homer and Classical Philology","Nietzsche, Friedrich Wilhelm","Philosophy","en"
"284",18188,"problem which, like a coin long passed from hand to hand, has lost its","Homer and Classical Philology","Nietzsche, Friedrich Wilhelm","Philosophy","en"
"285",18188,"original and highly conspicuous stamp. Poetical works, which cause the","Homer and Classical Philology","Nietzsche, Friedrich Wilhelm","Philosophy","en"
"286",18188,"hearts of even the greatest geniuses to fail when they endeavour to vie","Homer and Classical Philology","Nietzsche, Friedrich Wilhelm","Philosophy","en"
"287",18188,"with them, and in which unsurpassable images are held up for the","Homer and Classical Philology","Nietzsche, Friedrich Wilhelm","Philosophy","en"
"288",18188,"admiration of posterity--and yet the poet who wrote them with only a","Homer and Classical Philology","Nietzsche, Friedrich Wilhelm","Philosophy","en"
"289",18188,"hollow, shaky name, whenever we do lay hold on him; nowhere the solid","Homer and Classical Philology","Nietzsche, Friedrich Wilhelm","Philosophy","en"
"290",18188,"kernel of a powerful personality. ""For who would wage war with the gods:","Homer and Classical Philology","Nietzsche, Friedrich Wilhelm","Philosophy","en"
"291",18188,"who, even with the one god?"" asks Goethe even, who, though a genius,","Homer and Classical Philology","Nietzsche, Friedrich Wilhelm","Philosophy","en"
"292",18188,"strove in vain to solve that mysterious problem of the Homeric","Homer and Classical Philology","Nietzsche, Friedrich Wilhelm","Philosophy","en"
"293",18188,"inaccessibility.","Homer and Classical Philology","Nietzsche, Friedrich Wilhelm","Philosophy","en"
"294",18188,"","Homer and Classical Philology","Nietzsche, Friedrich Wilhelm","Philosophy","en"
"295",18188,"The conception of popular poetry seemed to lead like a bridge over this","Homer and Classical Philology","Nietzsche, Friedrich Wilhelm","Philosophy","en"
"296",18188,"problem--a deeper and more original power than that of every single","Homer and Classical Philology","Nietzsche, Friedrich Wilhelm","Philosophy","en"
"297",18188,"creative individual was said to have become active; the happiest people,","Homer and Classical Philology","Nietzsche, Friedrich Wilhelm","Philosophy","en"
"298",18188,"in the happiest period of its existence, in the highest activity of","Homer and Classical Philology","Nietzsche, Friedrich Wilhelm","Philosophy","en"
"299",18188,"fantasy and formative power, was said to have created those immeasurable","Homer and Classical Philology","Nietzsche, Friedrich Wilhelm","Philosophy","en"
"300",18188,"poems. In this universality there is something almost intoxicating in","Homer and Classical Philology","Nietzsche, Friedrich Wilhelm","Philosophy","en"
"301",18188,"the thought of a popular poem: we feel, with artistic pleasure, the","Homer and Classical Philology","Nietzsche, Friedrich Wilhelm","Philosophy","en"
"302",18188,"broad, overpowering liberation of a popular gift, and we delight in this","Homer and Classical Philology","Nietzsche, Friedrich Wilhelm","Philosophy","en"
"303",18188,"natural phenomenon as we do in an uncontrollable cataract. But as soon","Homer and Classical Philology","Nietzsche, Friedrich Wilhelm","Philosophy","en"
"304",18188,"as we examine this thought at close quarters, we involuntarily put a","Homer and Classical Philology","Nietzsche, Friedrich Wilhelm","Philosophy","en"
"305",18188,"poetic _mass of people_ in the place of the poetising _soul of the","Homer and Classical Philology","Nietzsche, Friedrich Wilhelm","Philosophy","en"
"306",18188,"people_: a long row of popular poets in whom individuality has no","Homer and Classical Philology","Nietzsche, Friedrich Wilhelm","Philosophy","en"
"307",18188,"meaning, and in whom the tumultuous movement of a people's soul, the","Homer and Classical Philology","Nietzsche, Friedrich Wilhelm","Philosophy","en"
"308",18188,"intuitive strength of a people's eye, and the unabated profusion of a","Homer and Classical Philology","Nietzsche, Friedrich Wilhelm","Philosophy","en"
"309",18188,"people's fantasy, were once powerful: a row of original geniuses,","Homer and Classical Philology","Nietzsche, Friedrich Wilhelm","Philosophy","en"
"310",18188,"attached to a time, to a poetic genus, to a subject-matter.","Homer and Classical Philology","Nietzsche, Friedrich Wilhelm","Philosophy","en"
"311",18188,"","Homer and Classical Philology","Nietzsche, Friedrich Wilhelm","Philosophy","en"
"312",18188,"Such a conception justly made people suspicious. Could it be possible","Homer and Classical Philology","Nietzsche, Friedrich Wilhelm","Philosophy","en"
"313",18188,"that that same Nature who so sparingly distributed her rarest and most","Homer and Classical Philology","Nietzsche, Friedrich Wilhelm","Philosophy","en"
"314",18188,"precious production--genius--should suddenly take the notion of","Homer and Classical Philology","Nietzsche, Friedrich Wilhelm","Philosophy","en"
"315",18188,"lavishing her gifts in one sole direction? And here the thorny question","Homer and Classical Philology","Nietzsche, Friedrich Wilhelm","Philosophy","en"
"316",18188,"again made its appearance: Could we not get along with one genius only,","Homer and Classical Philology","Nietzsche, Friedrich Wilhelm","Philosophy","en"
"317",18188,"and explain the present existence of that unattainable excellence? And","Homer and Classical Philology","Nietzsche, Friedrich Wilhelm","Philosophy","en"
"318",18188,"now eyes were keenly on the lookout for whatever that excellence and","Homer and Classical Philology","Nietzsche, Friedrich Wilhelm","Philosophy","en"
"319",18188,"singularity might consist of. Impossible for it to be in the","Homer and Classical Philology","Nietzsche, Friedrich Wilhelm","Philosophy","en"
"320",18188,"construction of the complete works, said one party, for this is far from","Homer and Classical Philology","Nietzsche, Friedrich Wilhelm","Philosophy","en"
"321",18188,"faultless; but doubtless to be found in single songs: in the single","Homer and Classical Philology","Nietzsche, Friedrich Wilhelm","Philosophy","en"
"322",18188,"pieces above all; not in the whole. A second party, on the other hand,","Homer and Classical Philology","Nietzsche, Friedrich Wilhelm","Philosophy","en"
"323",18188,"sheltered themselves beneath the authority of Aristotle, who especially","Homer and Classical Philology","Nietzsche, Friedrich Wilhelm","Philosophy","en"
"324",18188,"admired Homer's ""divine"" nature in the choice of his entire subject, and","Homer and Classical Philology","Nietzsche, Friedrich Wilhelm","Philosophy","en"
"325",18188,"the manner in which he planned and carried it out. If, however, this","Homer and Classical Philology","Nietzsche, Friedrich Wilhelm","Philosophy","en"
"326",18188,"construction was not clearly seen, this fault was due to the way the","Homer and Classical Philology","Nietzsche, Friedrich Wilhelm","Philosophy","en"
"327",18188,"poems were handed down to posterity and not to the poet himself--it was","Homer and Classical Philology","Nietzsche, Friedrich Wilhelm","Philosophy","en"
"328",18188,"the result of retouchings and interpolations, owing to which the","Homer and Classical Philology","Nietzsche, Friedrich Wilhelm","Philosophy","en"
