"","gutenberg_id","text","title","author","gutenberg_bookshelf","language"
"3073",966,"participated in the happiness he had bestowed.","Maid Marian","Peacock, Thomas Love","Historical Fiction","en"
"3074",966,"","Maid Marian","Peacock, Thomas Love","Historical Fiction","en"
"3075",966,"The casements began to rattle in the wind, and the rain to beat upon","Maid Marian","Peacock, Thomas Love","Historical Fiction","en"
"3076",966,"the windows. The wind swelled to a hurricane, and the rain dashed like","Maid Marian","Peacock, Thomas Love","Historical Fiction","en"
"3077",966,"a flood against the glass. The boy retired to his little bed, the wife","Maid Marian","Peacock, Thomas Love","Historical Fiction","en"
"3078",966,"trimmed the lamp, the husband heaped logs upon the fire: Robin broached","Maid Marian","Peacock, Thomas Love","Historical Fiction","en"
"3079",966,"another flask; and Marian filled the baron's cup, and sweetened Robin's","Maid Marian","Peacock, Thomas Love","Historical Fiction","en"
"3080",966,"by touching its edge with her lips.","Maid Marian","Peacock, Thomas Love","Historical Fiction","en"
"3081",966,"","Maid Marian","Peacock, Thomas Love","Historical Fiction","en"
"3082",966,"""Well,"" said the baron, ""give me a roof over my head, be it never so","Maid Marian","Peacock, Thomas Love","Historical Fiction","en"
"3083",966,"humble. Your greenwood canopy is pretty and pleasant in sunshine; but if","Maid Marian","Peacock, Thomas Love","Historical Fiction","en"
"3084",966,"I were doomed to live under it, I should wish it were water-tight.""","Maid Marian","Peacock, Thomas Love","Historical Fiction","en"
"3085",966,"","Maid Marian","Peacock, Thomas Love","Historical Fiction","en"
"3086",966,"""But,"" said Robin, ""we have tents and caves for foul weather, good store","Maid Marian","Peacock, Thomas Love","Historical Fiction","en"
"3087",966,"of wine and venison, and fuel in abundance.""","Maid Marian","Peacock, Thomas Love","Historical Fiction","en"
"3088",966,"","Maid Marian","Peacock, Thomas Love","Historical Fiction","en"
"3089",966,"""Ay, but,"" said the baron, ""I like to pull off my boots of a night,","Maid Marian","Peacock, Thomas Love","Historical Fiction","en"
"3090",966,"which you foresters seldom do, and to ensconce myself thereafter in","Maid Marian","Peacock, Thomas Love","Historical Fiction","en"
"3091",966,"a comfortable bed. Your beech-root is over-hard for a couch, and your","Maid Marian","Peacock, Thomas Love","Historical Fiction","en"
"3092",966,"mossy stump is somewhat rough for a bolster.""","Maid Marian","Peacock, Thomas Love","Historical Fiction","en"
"3093",966,"","Maid Marian","Peacock, Thomas Love","Historical Fiction","en"
"3094",966,"""Had you not dry leaves,"" said Robin, ""with a bishop's surplice over","Maid Marian","Peacock, Thomas Love","Historical Fiction","en"
"3095",966,"them? What would you have softer? And had you not an abbot's travelling","Maid Marian","Peacock, Thomas Love","Historical Fiction","en"
"3096",966,"cloak for a coverlet? What would you have warmer?""","Maid Marian","Peacock, Thomas Love","Historical Fiction","en"
"3097",966,"","Maid Marian","Peacock, Thomas Love","Historical Fiction","en"
"3098",966,"""Very true,"" said the baron, ""but that was an indulgence to a guest, and","Maid Marian","Peacock, Thomas Love","Historical Fiction","en"
"3099",966,"I dreamed all night of the sheriff of Nottingham. I like to feel myself","Maid Marian","Peacock, Thomas Love","Historical Fiction","en"
"3100",966,"safe,"" he added, stretching out his legs to the fire, and throwing","Maid Marian","Peacock, Thomas Love","Historical Fiction","en"
"3101",966,"himself back in his chair with the air of a man determined to be","Maid Marian","Peacock, Thomas Love","Historical Fiction","en"
"3102",966,"comfortable. ""I like to feel myself safe,"" said the baron.","Maid Marian","Peacock, Thomas Love","Historical Fiction","en"
"3103",966,"","Maid Marian","Peacock, Thomas Love","Historical Fiction","en"
"3104",966,"At that moment the woman caught her husband's arm, and all the party","Maid Marian","Peacock, Thomas Love","Historical Fiction","en"
"3105",966,"following the direction of her eyes, looked simultaneously to the","Maid Marian","Peacock, Thomas Love","Historical Fiction","en"
"3106",966,"window, where they had just time to catch a glimpse of an apparition of","Maid Marian","Peacock, Thomas Love","Historical Fiction","en"
"3107",966,"an armed head, with its plumage tossing in the storm, on which the light","Maid Marian","Peacock, Thomas Love","Historical Fiction","en"
"3108",966,"shone from within, and which disappeared immediately.","Maid Marian","Peacock, Thomas Love","Historical Fiction","en"
"3109",966,"","Maid Marian","Peacock, Thomas Love","Historical Fiction","en"
"3110",966,"","Maid Marian","Peacock, Thomas Love","Historical Fiction","en"
"3111",966,"","Maid Marian","Peacock, Thomas Love","Historical Fiction","en"
"3112",966,"","Maid Marian","Peacock, Thomas Love","Historical Fiction","en"
"3113",966,"CHAPTER XV","Maid Marian","Peacock, Thomas Love","Historical Fiction","en"
"3114",966,"","Maid Marian","Peacock, Thomas Love","Historical Fiction","en"
"3115",966,"","Maid Marian","Peacock, Thomas Love","Historical Fiction","en"
"3116",966,"     O knight, thou lack'st a cup of canary.","Maid Marian","Peacock, Thomas Love","Historical Fiction","en"
"3117",966,"     When did I see thee so put down?--Twelfth Night.","Maid Marian","Peacock, Thomas Love","Historical Fiction","en"
"3118",966,"","Maid Marian","Peacock, Thomas Love","Historical Fiction","en"
"3119",966,"","Maid Marian","Peacock, Thomas Love","Historical Fiction","en"
"3120",966,"Several knocks, as from the knuckles of an iron glove, were given to the","Maid Marian","Peacock, Thomas Love","Historical Fiction","en"
"3121",966,"door of the cottage, and a voice was heard entreating shelter from the","Maid Marian","Peacock, Thomas Love","Historical Fiction","en"
"3122",966,"storm for a traveller who had lost his way. Robin arose and went to the","Maid Marian","Peacock, Thomas Love","Historical Fiction","en"
"3123",966,"door.","Maid Marian","Peacock, Thomas Love","Historical Fiction","en"
"3124",966,"","Maid Marian","Peacock, Thomas Love","Historical Fiction","en"
"3125",966,"""What are you?"" said Robin.","Maid Marian","Peacock, Thomas Love","Historical Fiction","en"
"3126",966,"","Maid Marian","Peacock, Thomas Love","Historical Fiction","en"
"3127",966,"""A soldier,"" replied the voice: ""an unfortunate adherent of Longchamp,","Maid Marian","Peacock, Thomas Love","Historical Fiction","en"
"3128",966,"flying the vengeance of Prince John.""","Maid Marian","Peacock, Thomas Love","Historical Fiction","en"
"3129",966,"","Maid Marian","Peacock, Thomas Love","Historical Fiction","en"
"3130",966,"""Are you alone?"" said Robin.","Maid Marian","Peacock, Thomas Love","Historical Fiction","en"
"3131",966,"","Maid Marian","Peacock, Thomas Love","Historical Fiction","en"
"3132",966,"""Yes,"" said the voice: ""it is a dreadful night. Hospitable cottagers,","Maid Marian","Peacock, Thomas Love","Historical Fiction","en"
"3133",966,"pray give me admittance. I would not have asked it but for the storm. I","Maid Marian","Peacock, Thomas Love","Historical Fiction","en"
"3134",966,"would have kept my watch in the woods.""","Maid Marian","Peacock, Thomas Love","Historical Fiction","en"
"3135",966,"","Maid Marian","Peacock, Thomas Love","Historical Fiction","en"
"3136",966,"""That I believe,"" said Robin. ""You did not reckon on the storm when you","Maid Marian","Peacock, Thomas Love","Historical Fiction","en"
"3137",966,"turned into this pass. Do you know there are rogues this way?""","Maid Marian","Peacock, Thomas Love","Historical Fiction","en"
"3138",966,"","Maid Marian","Peacock, Thomas Love","Historical Fiction","en"
"3139",966,"""I do,"" said the voice.","Maid Marian","Peacock, Thomas Love","Historical Fiction","en"
"3140",966,"","Maid Marian","Peacock, Thomas Love","Historical Fiction","en"
"3141",966,"""So do I,"" said Robin.","Maid Marian","Peacock, Thomas Love","Historical Fiction","en"
"3142",966,"","Maid Marian","Peacock, Thomas Love","Historical Fiction","en"
"3143",966,"A pause ensued, during which Robin listening attentively caught a faint","Maid Marian","Peacock, Thomas Love","Historical Fiction","en"
"3144",966,"sound of whispering.","Maid Marian","Peacock, Thomas Love","Historical Fiction","en"
"3145",966,"","Maid Marian","Peacock, Thomas Love","Historical Fiction","en"
"3146",966,"""You are not alone,"" said Robin. ""Who are your companions?""","Maid Marian","Peacock, Thomas Love","Historical Fiction","en"
"3147",966,"","Maid Marian","Peacock, Thomas Love","Historical Fiction","en"
"3148",966,"""None but the wind and the water,"" said the voice, ""and I would I had","Maid Marian","Peacock, Thomas Love","Historical Fiction","en"
"3149",966,"them not.""","Maid Marian","Peacock, Thomas Love","Historical Fiction","en"
"3150",966,"","Maid Marian","Peacock, Thomas Love","Historical Fiction","en"
"3151",966,"""The wind and the water have many voices,"" said Robin, ""but I never","Maid Marian","Peacock, Thomas Love","Historical Fiction","en"
"3152",966,"before heard them say, What shall we do?""","Maid Marian","Peacock, Thomas Love","Historical Fiction","en"
"3153",966,"","Maid Marian","Peacock, Thomas Love","Historical Fiction","en"
"3154",966,"Another pause ensued: after which,","Maid Marian","Peacock, Thomas Love","Historical Fiction","en"
"3155",966,"","Maid Marian","Peacock, Thomas Love","Historical Fiction","en"
"3156",966,"""Look ye, master cottager,"" said the voice, in an altered tone, ""if you","Maid Marian","Peacock, Thomas Love","Historical Fiction","en"
"3157",966,"do not let us in willingly, we will break down the door.""","Maid Marian","Peacock, Thomas Love","Historical Fiction","en"
"3158",966,"","Maid Marian","Peacock, Thomas Love","Historical Fiction","en"
"3159",966,"""Ho! ho!"" roared the baron, ""you are become plural are you, rascals? How","Maid Marian","Peacock, Thomas Love","Historical Fiction","en"
"3160",966,"many are there of you, thieves? What, I warrant, you thought to rob and","Maid Marian","Peacock, Thomas Love","Historical Fiction","en"
"3161",966,"murder a poor harmless cottager and his wife, and did not dream of a","Maid Marian","Peacock, Thomas Love","Historical Fiction","en"
"3162",966,"garrison? You looked for no weapon of opposition but spit, poker, and","Maid Marian","Peacock, Thomas Love","Historical Fiction","en"
"3163",966,"basting ladle, wielded by unskilful hands: but, rascals, here is short","Maid Marian","Peacock, Thomas Love","Historical Fiction","en"
"3164",966,"sword and long cudgel in hands well tried in war, wherewith you shall be","Maid Marian","Peacock, Thomas Love","Historical Fiction","en"
"3165",966,"drilled into cullenders and beaten into mummy.""","Maid Marian","Peacock, Thomas Love","Historical Fiction","en"
"3166",966,"","Maid Marian","Peacock, Thomas Love","Historical Fiction","en"
"3167",966,"No reply was made, but furious strokes from without resounded upon the","Maid Marian","Peacock, Thomas Love","Historical Fiction","en"
"3168",966,"door. Robin, Marian, and the baron threw by their pilgrim's attire, and","Maid Marian","Peacock, Thomas Love","Historical Fiction","en"
"3169",966,"stood in arms on the defensive. They were provided with swords, and the","Maid Marian","Peacock, Thomas Love","Historical Fiction","en"
"3170",966,"cottager gave them bucklers and helmets, for all Robin's haunts were","Maid Marian","Peacock, Thomas Love","Historical Fiction","en"
"3171",966,"furnished with secret armouries. But they kept their swords sheathed,","Maid Marian","Peacock, Thomas Love","Historical Fiction","en"
"3172",966,"and the baron wielded a ponderous spear, which he pointed towards the","Maid Marian","Peacock, Thomas Love","Historical Fiction","en"
"3173",966,"door ready to run through the first that should enter, and Robin and","Maid Marian","Peacock, Thomas Love","Historical Fiction","en"
"3174",966,"Marian each held a bow with the arrow drawn to its head and pointed in","Maid Marian","Peacock, Thomas Love","Historical Fiction","en"
"3175",966,"the same direction. The cottager flourished a strong cudgel (a weapon","Maid Marian","Peacock, Thomas Love","Historical Fiction","en"
"3176",966,"in the use of which he prided himself on being particularly expert), and","Maid Marian","Peacock, Thomas Love","Historical Fiction","en"
"3177",966,"the wife seized the spit from the fireplace, and held it as she saw the","Maid Marian","Peacock, Thomas Love","Historical Fiction","en"
"3178",966,"baron hold his spear. The storm of wind and rain continued to beat on","Maid Marian","Peacock, Thomas Love","Historical Fiction","en"
"3179",966,"the roof and the casement, and the storm of blows to resound upon the","Maid Marian","Peacock, Thomas Love","Historical Fiction","en"
"3180",966,"door, which at length gave way with a violent crash, and a cluster of","Maid Marian","Peacock, Thomas Love","Historical Fiction","en"
"3181",966,"armed men appeared without, seemingly not less than twelve. Behind","Maid Marian","Peacock, Thomas Love","Historical Fiction","en"
"3182",966,"them rolled the stream now changed from a gentle and shallow river to a","Maid Marian","Peacock, Thomas Love","Historical Fiction","en"
"3183",966,"mighty and impetuous torrent, roaring in waves of yellow foam, partially","Maid Marian","Peacock, Thomas Love","Historical Fiction","en"
"3184",966,"reddened by the light that streamed through the open door, and turning","Maid Marian","Peacock, Thomas Love","Historical Fiction","en"
"3185",966,"up its convulsed surface in flashes of shifting radiance from restless","Maid Marian","Peacock, Thomas Love","Historical Fiction","en"
"3186",966,"masses of half-visible shadow. The stepping-stones, by which the","Maid Marian","Peacock, Thomas Love","Historical Fiction","en"
"3187",966,"intruders must have crossed, were buried under the waters. On the","Maid Marian","Peacock, Thomas Love","Historical Fiction","en"
"3188",966,"opposite bank the light fell on the stems and boughs of the rock-rooted","Maid Marian","Peacock, Thomas Love","Historical Fiction","en"
"3189",966,"oak and ash tossing and swaying in the blast, and sweeping the flashing","Maid Marian","Peacock, Thomas Love","Historical Fiction","en"
"3190",966,"spray with their leaves.","Maid Marian","Peacock, Thomas Love","Historical Fiction","en"
"3191",966,"","Maid Marian","Peacock, Thomas Love","Historical Fiction","en"
"3192",966,"The instant the door broke, Robin and Marian loosed their arrows.","Maid Marian","Peacock, Thomas Love","Historical Fiction","en"
"3193",966,"Robin's arrow struck one of the assailants in the juncture of the","Maid Marian","Peacock, Thomas Love","Historical Fiction","en"
"3194",966,"shoulder, and disabled his right arm: Marian's struck a second in the","Maid Marian","Peacock, Thomas Love","Historical Fiction","en"
"3195",966,"juncture of the knee, and rendered him unserviceable; for the night.","Maid Marian","Peacock, Thomas Love","Historical Fiction","en"
"3196",966,"The baron's long spear struck on the mailed breastplate of a third, and","Maid Marian","Peacock, Thomas Love","Historical Fiction","en"
"3197",966,"being stretched to its full extent by the long-armed hero, drove him to","Maid Marian","Peacock, Thomas Love","Historical Fiction","en"
"3198",966,"the edge of the torrent, and plunged him into its eddies, along which he","Maid Marian","Peacock, Thomas Love","Historical Fiction","en"
"3199",966,"was whirled down the darkness of the descending stream, calling vainly","Maid Marian","Peacock, Thomas Love","Historical Fiction","en"
"3200",966,"on his comrades for aid, till his voice was lost in the mingled roar of","Maid Marian","Peacock, Thomas Love","Historical Fiction","en"
"3201",966,"the waters and the wind. A fourth springing through the door was laid","Maid Marian","Peacock, Thomas Love","Historical Fiction","en"
"3202",966,"prostrate by the cottager's cudgel: but the wife being less dexterous","Maid Marian","Peacock, Thomas Love","Historical Fiction","en"
"3203",966,"than her company, though an Amazon in strength, missed her pass at a","Maid Marian","Peacock, Thomas Love","Historical Fiction","en"
"3204",966,"fifth, and drove the point of the spit several inches into the right","Maid Marian","Peacock, Thomas Love","Historical Fiction","en"
"3205",966,"hand door-post as she stood close to the left, and thus made a new","Maid Marian","Peacock, Thomas Love","Historical Fiction","en"
"3206",966,"barrier which the invaders could not pass without dipping under it and","Maid Marian","Peacock, Thomas Love","Historical Fiction","en"
"3207",966,"submitting their necks to the sword: but one of the assailants seizing","Maid Marian","Peacock, Thomas Love","Historical Fiction","en"
"3208",966,"it with gigantic rage, shook it at once from the grasp of its holder","Maid Marian","Peacock, Thomas Love","Historical Fiction","en"
"3209",966,"and from its lodgment in the post, and at the same time made good the","Maid Marian","Peacock, Thomas Love","Historical Fiction","en"
"3210",966,"irruption of the rest of his party into the cottage.","Maid Marian","Peacock, Thomas Love","Historical Fiction","en"
"3211",966,"","Maid Marian","Peacock, Thomas Love","Historical Fiction","en"
"3212",966,"Now raged an unequal combat, for the assailants fell two to one on","Maid Marian","Peacock, Thomas Love","Historical Fiction","en"
"3213",966,"Robin, Marian, the baron, and the cottager; while the wife, being","Maid Marian","Peacock, Thomas Love","Historical Fiction","en"
"3214",966,"deprived of her spit, converted every thing that was at hand to a","Maid Marian","Peacock, Thomas Love","Historical Fiction","en"
"3215",966,"missile, and rained pots, pans, and pipkins on the armed heads of the","Maid Marian","Peacock, Thomas Love","Historical Fiction","en"
"3216",966,"enemy. The baron raged like a tiger, and the cottager laid about him","Maid Marian","Peacock, Thomas Love","Historical Fiction","en"
"3217",966,"like a thresher. One of the soldiers struck Robin's sword from his hand","Maid Marian","Peacock, Thomas Love","Historical Fiction","en"
"3218",966,"and brought him on his knee, when the boy, who had been roused by the","Maid Marian","Peacock, Thomas Love","Historical Fiction","en"
"3219",966,"tumult and had been peeping through the inner door, leaped forward in","Maid Marian","Peacock, Thomas Love","Historical Fiction","en"
"3220",966,"his shirt, picked up the sword and replaced it in Robin's hand, who","Maid Marian","Peacock, Thomas Love","Historical Fiction","en"
"3221",966,"instantly springing up, disarmed and wounded one of his antagonists,","Maid Marian","Peacock, Thomas Love","Historical Fiction","en"
"3222",966,"while the other was laid prostrate under the dint of a brass cauldron","Maid Marian","Peacock, Thomas Love","Historical Fiction","en"
"3223",966,"launched by the Amazonian dame. Robin now turned to the aid of Marian,","Maid Marian","Peacock, Thomas Love","Historical Fiction","en"
"3224",966,"who was parrying most dexterously the cuts and slashes of her two","Maid Marian","Peacock, Thomas Love","Historical Fiction","en"
"3225",966,"assailants, of whom Robin delivered her from one, while a well-applied","Maid Marian","Peacock, Thomas Love","Historical Fiction","en"
"3226",966,"blow of her sword struck off the helmet of the other, who fell on his","Maid Marian","Peacock, Thomas Love","Historical Fiction","en"
"3227",966,"knees to beg a boon, and she recognised Sir Ralph Montfaucon. The men","Maid Marian","Peacock, Thomas Love","Historical Fiction","en"
"3228",966,"who were engaged with the baron and the peasant, seeing their leader","Maid Marian","Peacock, Thomas Love","Historical Fiction","en"
"3229",966,"subdued, immediately laid down their arms and cried for quarter. The","Maid Marian","Peacock, Thomas Love","Historical Fiction","en"
"3230",966,"wife brought some strong rope, and the baron tied their arms behind","Maid Marian","Peacock, Thomas Love","Historical Fiction","en"
"3231",966,"them.","Maid Marian","Peacock, Thomas Love","Historical Fiction","en"
"3232",966,"","Maid Marian","Peacock, Thomas Love","Historical Fiction","en"
"3233",966,"""Now, Sir Ralph,"" said Marian, ""once more you are at my mercy.""","Maid Marian","Peacock, Thomas Love","Historical Fiction","en"
"3234",966,"","Maid Marian","Peacock, Thomas Love","Historical Fiction","en"
"3235",966,"""That I always am, cruel beauty,"" said the discomfited lover.","Maid Marian","Peacock, Thomas Love","Historical Fiction","en"
"3236",966,"","Maid Marian","Peacock, Thomas Love","Historical Fiction","en"
"3237",966,"""Odso! courteous knight,"" said the baron, ""is this the return you make","Maid Marian","Peacock, Thomas Love","Historical Fiction","en"
"3238",966,"for my beef and canary, when you kissed my daughter's hand in token of","Maid Marian","Peacock, Thomas Love","Historical Fiction","en"
"3239",966,"contrition for your intermeddling at her wedding? Heart, I am glad to","Maid Marian","Peacock, Thomas Love","Historical Fiction","en"
"3240",966,"see she has given you a bloody coxcomb. Slice him down, Mawd! slice him","Maid Marian","Peacock, Thomas Love","Historical Fiction","en"
"3241",966,"down, and fling him into the river.""","Maid Marian","Peacock, Thomas Love","Historical Fiction","en"
"3242",966,"","Maid Marian","Peacock, Thomas Love","Historical Fiction","en"
"3243",966,"""Confess,"" said Marian, ""what brought you here, and how did you trace","Maid Marian","Peacock, Thomas Love","Historical Fiction","en"
"3244",966,"our steps?""","Maid Marian","Peacock, Thomas Love","Historical Fiction","en"
"3245",966,"","Maid Marian","Peacock, Thomas Love","Historical Fiction","en"
"3246",966,"""I will confess nothing,"" said the knight.","Maid Marian","Peacock, Thomas Love","Historical Fiction","en"
"3247",966,"","Maid Marian","Peacock, Thomas Love","Historical Fiction","en"
"3248",966,"""Then confess you, rascal,"" said the baron, holding his sword to the","Maid Marian","Peacock, Thomas Love","Historical Fiction","en"
"3249",966,"throat of the captive squire.","Maid Marian","Peacock, Thomas Love","Historical Fiction","en"
"3250",966,"","Maid Marian","Peacock, Thomas Love","Historical Fiction","en"
"3251",966,"""Take away the sword,"" said the squire, ""it is too near my mouth, and","Maid Marian","Peacock, Thomas Love","Historical Fiction","en"
"3252",966,"my voice will not come out for fear: take away the sword, and I will","Maid Marian","Peacock, Thomas Love","Historical Fiction","en"
"3253",966,"confess all."" The baron dropped his sword, and the squire proceeded;","Maid Marian","Peacock, Thomas Love","Historical Fiction","en"
"3254",966,"""Sir Ralph met you, as you quitted Lady Falkland's castle, and by","Maid Marian","Peacock, Thomas Love","Historical Fiction","en"
"3255",966,"representing to her who you were, borrowed from her such a number of","Maid Marian","Peacock, Thomas Love","Historical Fiction","en"
"3256",966,"her retainers as he deemed must ensure your capture, seeing that your","Maid Marian","Peacock, Thomas Love","Historical Fiction","en"
"3257",966,"familiar the friar was not at your elbow. We set forth without delay,","Maid Marian","Peacock, Thomas Love","Historical Fiction","en"
"3258",966,"and traced you first by means of a peasant who saw you turn into this","Maid Marian","Peacock, Thomas Love","Historical Fiction","en"
"3259",966,"valley, and afterwards by the light from the casement of this solitary","Maid Marian","Peacock, Thomas Love","Historical Fiction","en"
"3260",966,"dwelling. Our design was to have laid an ambush for you in the morning,","Maid Marian","Peacock, Thomas Love","Historical Fiction","en"
"3261",966,"but the storm and your observation of my unlucky face through the","Maid Marian","Peacock, Thomas Love","Historical Fiction","en"
"3262",966,"casement made us change our purpose; and what followed you can tell","Maid Marian","Peacock, Thomas Love","Historical Fiction","en"
"3263",966,"better than I can, being indeed masters of the subject.""","Maid Marian","Peacock, Thomas Love","Historical Fiction","en"
"3264",966,"","Maid Marian","Peacock, Thomas Love","Historical Fiction","en"
"3265",966,"""You are a merry knave,"" said the baron, ""and here is a cup of wine for","Maid Marian","Peacock, Thomas Love","Historical Fiction","en"
"3266",966,"you.""","Maid Marian","Peacock, Thomas Love","Historical Fiction","en"
"3267",966,"","Maid Marian","Peacock, Thomas Love","Historical Fiction","en"
"3268",966,"""Gramercy,"" said the squire, ""and better late than never: but I lacked a","Maid Marian","Peacock, Thomas Love","Historical Fiction","en"
"3269",966,"cup of this before. Had I been pot-valiant, I had held you play.""","Maid Marian","Peacock, Thomas Love","Historical Fiction","en"
"3270",966,"","Maid Marian","Peacock, Thomas Love","Historical Fiction","en"
"3271",966,"""Sir knight,"" said Marian, ""this is the third time you have sought the","Maid Marian","Peacock, Thomas Love","Historical Fiction","en"
"3272",966,"life of my lord and of me, for mine is interwoven with his. And do you","Maid Marian","Peacock, Thomas Love","Historical Fiction","en"
"3273",966,"think me so spiritless as to believe that I can be yours by compulsion?","Maid Marian","Peacock, Thomas Love","Historical Fiction","en"
"3274",966,"Tempt me not again, for the next time shall be the last, and the fish of","Maid Marian","Peacock, Thomas Love","Historical Fiction","en"
"3275",966,"the nearest river shall commute the flesh of a recreant knight into the","Maid Marian","Peacock, Thomas Love","Historical Fiction","en"
"3276",966,"fast-day dinner of an uncarnivorous friar. I spare you now, not in pity","Maid Marian","Peacock, Thomas Love","Historical Fiction","en"
