"","gutenberg_id","text","title","author","gutenberg_bookshelf","language"
"2050",966,"to arm, which he did in haste, and beheld the machine in flames, and","Maid Marian","Peacock, Thomas Love","Historical Fiction","en"
"2051",966,"a furious conflict raging around it. He hurried to the spot, and found","Maid Marian","Peacock, Thomas Love","Historical Fiction","en"
"2052",966,"that his camp had been suddenly assailed from one side by a party of","Maid Marian","Peacock, Thomas Love","Historical Fiction","en"
"2053",966,"foresters, and that the baron's people had made a sortie on the other,","Maid Marian","Peacock, Thomas Love","Historical Fiction","en"
"2054",966,"and that they had killed the guards, and set fire to the machine, before","Maid Marian","Peacock, Thomas Love","Historical Fiction","en"
"2055",966,"the rest of the camp could come to the assistance of their fellows.","Maid Marian","Peacock, Thomas Love","Historical Fiction","en"
"2056",966,"","Maid Marian","Peacock, Thomas Love","Historical Fiction","en"
"2057",966,"The night was in itself intensely dark, and the fire-light shed around","Maid Marian","Peacock, Thomas Love","Historical Fiction","en"
"2058",966,"it a vivid and unnatural radiance. On one side, the crimson light","Maid Marian","Peacock, Thomas Love","Historical Fiction","en"
"2059",966,"quivered by its own agitation on the waveless moat, and on the bastions","Maid Marian","Peacock, Thomas Love","Historical Fiction","en"
"2060",966,"and buttresses of the castle, and their shadows lay in massy blackness","Maid Marian","Peacock, Thomas Love","Historical Fiction","en"
"2061",966,"on the illuminated walls: on the other, it shone upon the woods,","Maid Marian","Peacock, Thomas Love","Historical Fiction","en"
"2062",966,"streaming far within among the open trunks, or resting on the closer","Maid Marian","Peacock, Thomas Love","Historical Fiction","en"
"2063",966,"foliage. The circumference of darkness bounded the scene on all sides:","Maid Marian","Peacock, Thomas Love","Historical Fiction","en"
"2064",966,"and in the centre raged the war; shields, helmets, and bucklers gleaming","Maid Marian","Peacock, Thomas Love","Historical Fiction","en"
"2065",966,"and glittering as they rang and clashed against each other; plumes","Maid Marian","Peacock, Thomas Love","Historical Fiction","en"
"2066",966,"confusedly tossing in the crimson light, and the messy light and shade","Maid Marian","Peacock, Thomas Love","Historical Fiction","en"
"2067",966,"that fell on the faces of the combatants, giving additional energy to","Maid Marian","Peacock, Thomas Love","Historical Fiction","en"
"2068",966,"their ferocious expression.","Maid Marian","Peacock, Thomas Love","Historical Fiction","en"
"2069",966,"","Maid Marian","Peacock, Thomas Love","Historical Fiction","en"
"2070",966,"John, drawing nearer to the scene of action, observed two young warriors","Maid Marian","Peacock, Thomas Love","Historical Fiction","en"
"2071",966,"fighting side by side, one of whom wore the habit of a forester, the","Maid Marian","Peacock, Thomas Love","Historical Fiction","en"
"2072",966,"other that of a retainer of Arlingford. He looked intently on them both:","Maid Marian","Peacock, Thomas Love","Historical Fiction","en"
"2073",966,"their position towards the fire favoured the scrutiny; and the hawk's","Maid Marian","Peacock, Thomas Love","Historical Fiction","en"
"2074",966,"eye of love very speedily discovered that the latter was the fair","Maid Marian","Peacock, Thomas Love","Historical Fiction","en"
"2075",966,"Matilda. The forester he did not know: but he had sufficient tact to","Maid Marian","Peacock, Thomas Love","Historical Fiction","en"
"2076",966,"discern that his success would be very much facilitated by separating","Maid Marian","Peacock, Thomas Love","Historical Fiction","en"
"2077",966,"her from this companion, above all others. He therefore formed a party","Maid Marian","Peacock, Thomas Love","Historical Fiction","en"
"2078",966,"of men into a wedge, only taking especial care not to be the point of","Maid Marian","Peacock, Thomas Love","Historical Fiction","en"
"2079",966,"it himself, and drove it between them with so much precision, that they","Maid Marian","Peacock, Thomas Love","Historical Fiction","en"
"2080",966,"were in a moment far asunder.","Maid Marian","Peacock, Thomas Love","Historical Fiction","en"
"2081",966,"","Maid Marian","Peacock, Thomas Love","Historical Fiction","en"
"2082",966,"""Lady Matilda,"" said John, ""yield yourself my prisoner.""","Maid Marian","Peacock, Thomas Love","Historical Fiction","en"
"2083",966,"","Maid Marian","Peacock, Thomas Love","Historical Fiction","en"
"2084",966,"""If you would wear me, prince,"" said Matilda, ""you must win me:"" and","Maid Marian","Peacock, Thomas Love","Historical Fiction","en"
"2085",966,"without giving him time to deliberate on the courtesy of fighting with","Maid Marian","Peacock, Thomas Love","Historical Fiction","en"
"2086",966,"the lady of his love, she raised her sword in the air, and lowered it on","Maid Marian","Peacock, Thomas Love","Historical Fiction","en"
"2087",966,"his head with an impetus that would have gone nigh to fathom even that","Maid Marian","Peacock, Thomas Love","Historical Fiction","en"
"2088",966,"extraordinary depth of brain which always by divine grace furnishes the","Maid Marian","Peacock, Thomas Love","Historical Fiction","en"
"2089",966,"interior of a head-royal, if he had not very dexterously parried the","Maid Marian","Peacock, Thomas Love","Historical Fiction","en"
"2090",966,"blow. Prince John wished to disarm and take captive, not in any way to","Maid Marian","Peacock, Thomas Love","Historical Fiction","en"
"2091",966,"wound or injure, least of all to kill, his fair opponent. Matilda was","Maid Marian","Peacock, Thomas Love","Historical Fiction","en"
"2092",966,"only intent to get rid of her antagonist at any rate: the edge of her","Maid Marian","Peacock, Thomas Love","Historical Fiction","en"
"2093",966,"weapon painted his complexion with streaks of very unloverlike crimson,","Maid Marian","Peacock, Thomas Love","Historical Fiction","en"
"2094",966,"and she would probably have marred John's hand for ever signing Magna","Maid Marian","Peacock, Thomas Love","Historical Fiction","en"
"2095",966,"Charta, but that he was backed by the advantage of numbers, and that her","Maid Marian","Peacock, Thomas Love","Historical Fiction","en"
"2096",966,"sword broke short on the boss of his buckler. John was following up his","Maid Marian","Peacock, Thomas Love","Historical Fiction","en"
"2097",966,"advantage to make a captive of the lady, when he was suddenly felled to","Maid Marian","Peacock, Thomas Love","Historical Fiction","en"
"2098",966,"the earth by an unseen antagonist. Some of his men picked him carefully","Maid Marian","Peacock, Thomas Love","Historical Fiction","en"
"2099",966,"up, and conveyed him to his tent, stunned and stupified.","Maid Marian","Peacock, Thomas Love","Historical Fiction","en"
"2100",966,"","Maid Marian","Peacock, Thomas Love","Historical Fiction","en"
"2101",966,"When he recovered, he found Harpiton diligently assisting in his","Maid Marian","Peacock, Thomas Love","Historical Fiction","en"
"2102",966,"recovery, more in the fear of losing his place than in that of losing","Maid Marian","Peacock, Thomas Love","Historical Fiction","en"
"2103",966,"his master: the prince's first inquiry was for the prisoner he had","Maid Marian","Peacock, Thomas Love","Historical Fiction","en"
"2104",966,"been on the point of taking at the moment when his habeas corpus was","Maid Marian","Peacock, Thomas Love","Historical Fiction","en"
"2105",966,"so unseasonably suspended. He was told that his people had been on the","Maid Marian","Peacock, Thomas Love","Historical Fiction","en"
"2106",966,"point of securing the said prisoner, when the devil suddenly appeared","Maid Marian","Peacock, Thomas Love","Historical Fiction","en"
"2107",966,"among them in the likeness of a tall friar, having his grey frock","Maid Marian","Peacock, Thomas Love","Historical Fiction","en"
"2108",966,"cinctured with a sword-belt, and his crown, which whether it were shaven","Maid Marian","Peacock, Thomas Love","Historical Fiction","en"
"2109",966,"or no they could not see, surmounted with a helmet, and flourishing an","Maid Marian","Peacock, Thomas Love","Historical Fiction","en"
"2110",966,"eight-foot staff, with which he laid about him to the right and to the","Maid Marian","Peacock, Thomas Love","Historical Fiction","en"
"2111",966,"left, knocking down the prince and his men as if they had been so","Maid Marian","Peacock, Thomas Love","Historical Fiction","en"
"2112",966,"many nine-pins: in fine, he had rescued the prisoner, and made a clear","Maid Marian","Peacock, Thomas Love","Historical Fiction","en"
"2113",966,"passage through friend and foe, and in conjunction with a chosen","Maid Marian","Peacock, Thomas Love","Historical Fiction","en"
"2114",966,"party of archers, had covered the retreat of the baron's men and the","Maid Marian","Peacock, Thomas Love","Historical Fiction","en"
"2115",966,"foresters, who had all gone off in a body towards Sherwood forest.","Maid Marian","Peacock, Thomas Love","Historical Fiction","en"
"2116",966,"","Maid Marian","Peacock, Thomas Love","Historical Fiction","en"
"2117",966,"Harpiton suggested that it would be desirable to sack the castle, and","Maid Marian","Peacock, Thomas Love","Historical Fiction","en"
"2118",966,"volunteered to lead the van on the occasion, as the defenders were","Maid Marian","Peacock, Thomas Love","Historical Fiction","en"
"2119",966,"withdrawn, and the exploit seemed to promise much profit and little","Maid Marian","Peacock, Thomas Love","Historical Fiction","en"
"2120",966,"danger: John considered that the castle would in itself be a great","Maid Marian","Peacock, Thomas Love","Historical Fiction","en"
"2121",966,"acquisition to him, as a stronghold in furtherance of his design on his","Maid Marian","Peacock, Thomas Love","Historical Fiction","en"
"2122",966,"brother's throne; and was determining to take possession with the first","Maid Marian","Peacock, Thomas Love","Historical Fiction","en"
"2123",966,"light of morning, when he had the mortification to see the castle burst","Maid Marian","Peacock, Thomas Love","Historical Fiction","en"
"2124",966,"into flames in several places at once. A piteous cry was heard from","Maid Marian","Peacock, Thomas Love","Historical Fiction","en"
"2125",966,"within, and while the prince was proclaiming a reward to any one who","Maid Marian","Peacock, Thomas Love","Historical Fiction","en"
"2126",966,"would enter into the burning pile, and elucidate the mystery of the","Maid Marian","Peacock, Thomas Love","Historical Fiction","en"
"2127",966,"doleful voice, forth waddled the little fat friar in an agony of fear,","Maid Marian","Peacock, Thomas Love","Historical Fiction","en"
"2128",966,"out of the fire into the frying-pan; for he was instantly taken into","Maid Marian","Peacock, Thomas Love","Historical Fiction","en"
"2129",966,"custody and carried before Prince John, wringing his hands and tearing","Maid Marian","Peacock, Thomas Love","Historical Fiction","en"
"2130",966,"his hair.","Maid Marian","Peacock, Thomas Love","Historical Fiction","en"
"2131",966,"","Maid Marian","Peacock, Thomas Love","Historical Fiction","en"
"2132",966,"""Are you the friar,"" said Prince John, in a terrible voice, ""that","Maid Marian","Peacock, Thomas Love","Historical Fiction","en"
"2133",966,"laid me prostrate in battle, mowed down my men like grass, rescued my","Maid Marian","Peacock, Thomas Love","Historical Fiction","en"
"2134",966,"captive, and covered the retreat of my enemies? And, not content with","Maid Marian","Peacock, Thomas Love","Historical Fiction","en"
"2135",966,"this, have you now set fire to the castle in which I intended to take up","Maid Marian","Peacock, Thomas Love","Historical Fiction","en"
"2136",966,"my royal quarters?""","Maid Marian","Peacock, Thomas Love","Historical Fiction","en"
"2137",966,"","Maid Marian","Peacock, Thomas Love","Historical Fiction","en"
"2138",966,"The little friar quaked like a jelly: he fell on his knees, and","Maid Marian","Peacock, Thomas Love","Historical Fiction","en"
"2139",966,"attempted to speak; but in his eagerness to vindicate himself from this","Maid Marian","Peacock, Thomas Love","Historical Fiction","en"
"2140",966,"accumulation of alarming charges, he knew not where to begin; his ideas","Maid Marian","Peacock, Thomas Love","Historical Fiction","en"
"2141",966,"rolled round upon each other like the radii of a wheel; the words he","Maid Marian","Peacock, Thomas Love","Historical Fiction","en"
"2142",966,"desired to utter, instead of issuing, as it were, in a right line from","Maid Marian","Peacock, Thomas Love","Historical Fiction","en"
"2143",966,"his lips, seemed to conglobate themselves into a sphere turning on its","Maid Marian","Peacock, Thomas Love","Historical Fiction","en"
"2144",966,"own axis in his throat: after several ineffectual efforts, his utterance","Maid Marian","Peacock, Thomas Love","Historical Fiction","en"
"2145",966,"totally failed him, and he remained gasping, with his mouth open, his","Maid Marian","Peacock, Thomas Love","Historical Fiction","en"
"2146",966,"lips quivering, his hands clasped together, and the whites of his eyes","Maid Marian","Peacock, Thomas Love","Historical Fiction","en"
"2147",966,"turned up towards the prince with an expression most ruefully imploring.","Maid Marian","Peacock, Thomas Love","Historical Fiction","en"
"2148",966,"","Maid Marian","Peacock, Thomas Love","Historical Fiction","en"
"2149",966,"""Are you that friar?"" repeated the prince.","Maid Marian","Peacock, Thomas Love","Historical Fiction","en"
"2150",966,"","Maid Marian","Peacock, Thomas Love","Historical Fiction","en"
"2151",966,"Several of the by-standers declared that he was not that friar. The","Maid Marian","Peacock, Thomas Love","Historical Fiction","en"
"2152",966,"little friar, encouraged by this patronage, found his voice, and pleaded","Maid Marian","Peacock, Thomas Love","Historical Fiction","en"
"2153",966,"for mercy. The prince questioned him closely concerning the burning of","Maid Marian","Peacock, Thomas Love","Historical Fiction","en"
"2154",966,"the castle. The little friar declared, that he had been in too great","Maid Marian","Peacock, Thomas Love","Historical Fiction","en"
"2155",966,"fear during the siege to know much of what was going forward, except","Maid Marian","Peacock, Thomas Love","Historical Fiction","en"
"2156",966,"that he had been conscious during the last few days of a lamentable","Maid Marian","Peacock, Thomas Love","Historical Fiction","en"
"2157",966,"deficiency of provisions, and had been present that very morning at the","Maid Marian","Peacock, Thomas Love","Historical Fiction","en"
"2158",966,"broaching of the last butt of sack. Harpiton groaned in sympathy. The","Maid Marian","Peacock, Thomas Love","Historical Fiction","en"
"2159",966,"little friar added, that he knew nothing of what had passed since till","Maid Marian","Peacock, Thomas Love","Historical Fiction","en"
"2160",966,"he heard the flames roaring at his elbow.","Maid Marian","Peacock, Thomas Love","Historical Fiction","en"
"2161",966,"","Maid Marian","Peacock, Thomas Love","Historical Fiction","en"
"2162",966,"""Take him away, Harpiton,"" said the prince, ""fill him with sack, and","Maid Marian","Peacock, Thomas Love","Historical Fiction","en"
"2163",966,"turn him out.""","Maid Marian","Peacock, Thomas Love","Historical Fiction","en"
"2164",966,"","Maid Marian","Peacock, Thomas Love","Historical Fiction","en"
"2165",966,"""Never mind the sack,"" said the little friar, ""turn me out at once.""","Maid Marian","Peacock, Thomas Love","Historical Fiction","en"
"2166",966,"","Maid Marian","Peacock, Thomas Love","Historical Fiction","en"
"2167",966,"""A sad chance,"" said Harpiton, ""to be turned out without sack.""","Maid Marian","Peacock, Thomas Love","Historical Fiction","en"
"2168",966,"","Maid Marian","Peacock, Thomas Love","Historical Fiction","en"
"2169",966,"But what Harpiton thought a sad chance the little friar thought a merry","Maid Marian","Peacock, Thomas Love","Historical Fiction","en"
"2170",966,"one, and went bounding like a fat buck towards the abbey of Rubygill.","Maid Marian","Peacock, Thomas Love","Historical Fiction","en"
"2171",966,"","Maid Marian","Peacock, Thomas Love","Historical Fiction","en"
"2172",966,"An arrow, with a letter attached to it, was shot into the camp, and","Maid Marian","Peacock, Thomas Love","Historical Fiction","en"
"2173",966,"carried to the prince. The contents were these:--","Maid Marian","Peacock, Thomas Love","Historical Fiction","en"
"2174",966,"","Maid Marian","Peacock, Thomas Love","Historical Fiction","en"
"2175",966,"""Prince John,--I do not consider myself to have resisted lawful","Maid Marian","Peacock, Thomas Love","Historical Fiction","en"
"2176",966,"authority in defending my castle against you, seeing that you are at","Maid Marian","Peacock, Thomas Love","Historical Fiction","en"
"2177",966,"present in a state of active rebellion against your liege sovereign","Maid Marian","Peacock, Thomas Love","Historical Fiction","en"
"2178",966,"Richard: and if my provisions had not failed me, I would have maintained","Maid Marian","Peacock, Thomas Love","Historical Fiction","en"
"2179",966,"it till doomsday. As it is, I have so well disposed my combustibles that","Maid Marian","Peacock, Thomas Love","Historical Fiction","en"
"2180",966,"it shall not serve you as a strong hold in your rebellion. If you hunt","Maid Marian","Peacock, Thomas Love","Historical Fiction","en"
"2181",966,"in the chases of Nottinghamshire, you may catch other game than my","Maid Marian","Peacock, Thomas Love","Historical Fiction","en"
"2182",966,"daughter. Both she and I are content to be houseless for a time, in","Maid Marian","Peacock, Thomas Love","Historical Fiction","en"
"2183",966,"the reflection that we have deserved your enmity, and the friendship of","Maid Marian","Peacock, Thomas Love","Historical Fiction","en"
"2184",966,"Coeur-de-Lion.","Maid Marian","Peacock, Thomas Love","Historical Fiction","en"
"2185",966,"","Maid Marian","Peacock, Thomas Love","Historical Fiction","en"
"2186",966,"""FITZWATER.""","Maid Marian","Peacock, Thomas Love","Historical Fiction","en"
"2187",966,"","Maid Marian","Peacock, Thomas Love","Historical Fiction","en"
"2188",966,"","Maid Marian","Peacock, Thomas Love","Historical Fiction","en"
"2189",966,"","Maid Marian","Peacock, Thomas Love","Historical Fiction","en"
"2190",966,"","Maid Marian","Peacock, Thomas Love","Historical Fiction","en"
"2191",966,"CHAPTER XI","Maid Marian","Peacock, Thomas Love","Historical Fiction","en"
"2192",966,"","Maid Marian","Peacock, Thomas Love","Historical Fiction","en"
"2193",966,"     --Tuck, the merry friar, who many a sermon made In praise of","Maid Marian","Peacock, Thomas Love","Historical Fiction","en"
"2194",966,"     Robin Hood, his outlaws, and their trade.--DRAYTON.","Maid Marian","Peacock, Thomas Love","Historical Fiction","en"
"2195",966,"","Maid Marian","Peacock, Thomas Love","Historical Fiction","en"
"2196",966,"","Maid Marian","Peacock, Thomas Love","Historical Fiction","en"
"2197",966,"The baron, with some of his retainers and all the foresters, halted at","Maid Marian","Peacock, Thomas Love","Historical Fiction","en"
"2198",966,"daybreak in Sherwood forest. The foresters quickly erected tents, and","Maid Marian","Peacock, Thomas Love","Historical Fiction","en"
"2199",966,"prepared an abundant breakfast of venison and ale.","Maid Marian","Peacock, Thomas Love","Historical Fiction","en"
"2200",966,"","Maid Marian","Peacock, Thomas Love","Historical Fiction","en"
"2201",966,"""Now, Lord Fitzwater,"" said the chief forester, ""recognise your","Maid Marian","Peacock, Thomas Love","Historical Fiction","en"
"2202",966,"son-in-law that was to have been, in the outlaw Robin Hood.""","Maid Marian","Peacock, Thomas Love","Historical Fiction","en"
"2203",966,"","Maid Marian","Peacock, Thomas Love","Historical Fiction","en"
"2204",966,"""Ay, ay,"" said the baron, ""I have recognised you long ago.""","Maid Marian","Peacock, Thomas Love","Historical Fiction","en"
"2205",966,"","Maid Marian","Peacock, Thomas Love","Historical Fiction","en"
"2206",966,"""And recognise your young friend Gamwell,"" said the second, ""in the","Maid Marian","Peacock, Thomas Love","Historical Fiction","en"
"2207",966,"outlaw Scarlet.""","Maid Marian","Peacock, Thomas Love","Historical Fiction","en"
"2208",966,"","Maid Marian","Peacock, Thomas Love","Historical Fiction","en"
"2209",966,"""And Little John, the page,"" said the third, ""in Little John the","Maid Marian","Peacock, Thomas Love","Historical Fiction","en"
"2210",966,"outlaw.""","Maid Marian","Peacock, Thomas Love","Historical Fiction","en"
"2211",966,"","Maid Marian","Peacock, Thomas Love","Historical Fiction","en"
"2212",966,"""And Father Michael, of Rubygill Abbey,"" said the friar, ""in Friar Tuck,","Maid Marian","Peacock, Thomas Love","Historical Fiction","en"
"2213",966,"of Sherwood forest. Truly, I have a chapel here hard by, in the shape of","Maid Marian","Peacock, Thomas Love","Historical Fiction","en"
"2214",966,"a hollow tree, where I put up my prayers for travellers, and Little John","Maid Marian","Peacock, Thomas Love","Historical Fiction","en"
"2215",966,"holds the plate at the door, for good praying deserves good paying.""","Maid Marian","Peacock, Thomas Love","Historical Fiction","en"
"2216",966,"","Maid Marian","Peacock, Thomas Love","Historical Fiction","en"
"2217",966,"""I am in fine company,"" said the baron.","Maid Marian","Peacock, Thomas Love","Historical Fiction","en"
"2218",966,"","Maid Marian","Peacock, Thomas Love","Historical Fiction","en"
"2219",966,"""In the very best of company,"" said the friar, ""in the high court of","Maid Marian","Peacock, Thomas Love","Historical Fiction","en"
"2220",966,"Nature, and in the midst of her own nobility. Is it not so? This goodly","Maid Marian","Peacock, Thomas Love","Historical Fiction","en"
"2221",966,"grove is our palace: the oak and the beech are its colonnade and its","Maid Marian","Peacock, Thomas Love","Historical Fiction","en"
"2222",966,"canopy: the sun and the moon and the stars are its everlasting lamps:","Maid Marian","Peacock, Thomas Love","Historical Fiction","en"
"2223",966,"the grass, and the daisy, and the primrose, and the violet, are its","Maid Marian","Peacock, Thomas Love","Historical Fiction","en"
"2224",966,"many-coloured floor of green, white, yellow, and blue; the may-flower,","Maid Marian","Peacock, Thomas Love","Historical Fiction","en"
"2225",966,"and the woodbine, and the eglantine, and the ivy, are its decorations,","Maid Marian","Peacock, Thomas Love","Historical Fiction","en"
"2226",966,"its curtains, and its tapestry: the lark, and the thrush, and the","Maid Marian","Peacock, Thomas Love","Historical Fiction","en"
"2227",966,"linnet, and the nightingale, are its unhired minstrels and musicians.","Maid Marian","Peacock, Thomas Love","Historical Fiction","en"
"2228",966,"Robin Hood is king of the forest both by dignity of birth and by virtue","Maid Marian","Peacock, Thomas Love","Historical Fiction","en"
"2229",966,"of his standing army: to say nothing of the free choice of his people,","Maid Marian","Peacock, Thomas Love","Historical Fiction","en"
"2230",966,"which he has indeed, but I pass it by as an illegitimate basis of power.","Maid Marian","Peacock, Thomas Love","Historical Fiction","en"
"2231",966,"He holds his dominion over the forest, and its horned multitude of","Maid Marian","Peacock, Thomas Love","Historical Fiction","en"
"2232",966,"citizen-deer, and its swinish multitude or peasantry of wild boars, by","Maid Marian","Peacock, Thomas Love","Historical Fiction","en"
"2233",966,"right of conquest and force of arms. He levies contributions among them","Maid Marian","Peacock, Thomas Love","Historical Fiction","en"
"2234",966,"by the free consent of his archers, their virtual representatives. If","Maid Marian","Peacock, Thomas Love","Historical Fiction","en"
"2235",966,"they should find a voice to complain that we are 'tyrants and usurpers","Maid Marian","Peacock, Thomas Love","Historical Fiction","en"
"2236",966,"to kill and cook them up in their assigned and native dwelling-place,'","Maid Marian","Peacock, Thomas Love","Historical Fiction","en"
"2237",966,"we should most convincingly admonish them, with point of arrow, that","Maid Marian","Peacock, Thomas Love","Historical Fiction","en"
"2238",966,"they have nothing to do with our laws but to obey them. Is it not","Maid Marian","Peacock, Thomas Love","Historical Fiction","en"
"2239",966,"written that the fat ribs of the herd shall be fed upon by the mighty in","Maid Marian","Peacock, Thomas Love","Historical Fiction","en"
"2240",966,"the land? And have not they withal my blessing? my orthodox, canonical,","Maid Marian","Peacock, Thomas Love","Historical Fiction","en"
"2241",966,"and archiepiscopal blessing? Do I not give thanks for them when they","Maid Marian","Peacock, Thomas Love","Historical Fiction","en"
"2242",966,"are well roasted and smoking under my nose? What title had William of","Maid Marian","Peacock, Thomas Love","Historical Fiction","en"
"2243",966,"Normandy to England, that Robin of Locksley has not to merry Sherwood?","Maid Marian","Peacock, Thomas Love","Historical Fiction","en"
"2244",966,"William fought for his claim. So does Robin. With whom, both? With any","Maid Marian","Peacock, Thomas Love","Historical Fiction","en"
"2245",966,"that would or will dispute it. William raised contributions. So does","Maid Marian","Peacock, Thomas Love","Historical Fiction","en"
