"","gutenberg_id","text","title","author","gutenberg_bookshelf","language"
"1058",966,"The friar had often had experience of the baron's testy humour; but","Maid Marian","Peacock, Thomas Love","Historical Fiction","en"
"1059",966,"it had always before confined itself to words, in which the habit of","Maid Marian","Peacock, Thomas Love","Historical Fiction","en"
"1060",966,"testiness often mingled more expression of displeasure than the internal","Maid Marian","Peacock, Thomas Love","Historical Fiction","en"
"1061",966,"feeling prompted. He knew the baron to be hot and choleric, but at the","Maid Marian","Peacock, Thomas Love","Historical Fiction","en"
"1062",966,"same time hospitable and generous; passionately fond of his daughter,","Maid Marian","Peacock, Thomas Love","Historical Fiction","en"
"1063",966,"often thwarting her in seeming, but always yielding to her in fact. The","Maid Marian","Peacock, Thomas Love","Historical Fiction","en"
"1064",966,"early attachment between Matilda and the Earl of Huntingdon had given","Maid Marian","Peacock, Thomas Love","Historical Fiction","en"
"1065",966,"the baron no serious reason to interfere with her habits and","Maid Marian","Peacock, Thomas Love","Historical Fiction","en"
"1066",966,"pursuits, which were so congenial to those of her lover; and not being","Maid Marian","Peacock, Thomas Love","Historical Fiction","en"
"1067",966,"over-burdened with orthodoxy, that is to say, not being seasoned with","Maid Marian","Peacock, Thomas Love","Historical Fiction","en"
"1068",966,"more of the salt of the spirit than was necessary to preserve him from","Maid Marian","Peacock, Thomas Love","Historical Fiction","en"
"1069",966,"excommunication, confiscation, and philotheoparoptesism, [1] he was not","Maid Marian","Peacock, Thomas Love","Historical Fiction","en"
"1070",966,"sorry to encourage his daughter's choice of her confessor in brother","Maid Marian","Peacock, Thomas Love","Historical Fiction","en"
"1071",966,"Michael, who had more jollity and less hypocrisy than any of his","Maid Marian","Peacock, Thomas Love","Historical Fiction","en"
"1072",966,"fraternity, and was very little anxious to disguise his love of the good","Maid Marian","Peacock, Thomas Love","Historical Fiction","en"
"1073",966,"things of this world under the semblance of a sanctified exterior. The","Maid Marian","Peacock, Thomas Love","Historical Fiction","en"
"1074",966,"friar and Matilda had often sung duets together, and had been accustomed","Maid Marian","Peacock, Thomas Love","Historical Fiction","en"
"1075",966,"to the baron's chiming in with a stormy capriccio, which was usually","Maid Marian","Peacock, Thomas Love","Historical Fiction","en"
"1076",966,"charmed into silence by some sudden turn in the witching melodies of","Maid Marian","Peacock, Thomas Love","Historical Fiction","en"
"1077",966,"Matilda. They had therefore naturally calculated, as far as their wild","Maid Marian","Peacock, Thomas Love","Historical Fiction","en"
"1078",966,"spirits calculated at all, on the same effects from the same causes. But","Maid Marian","Peacock, Thomas Love","Historical Fiction","en"
"1079",966,"the circumstances of the preceding day had made an essential alteration","Maid Marian","Peacock, Thomas Love","Historical Fiction","en"
"1080",966,"in the case. The baron knew well, from the intelligence he had received,","Maid Marian","Peacock, Thomas Love","Historical Fiction","en"
"1081",966,"that the earl's offence was past remission: which would have been of","Maid Marian","Peacock, Thomas Love","Historical Fiction","en"
"1082",966,"less moment but for the awful fact of his castle being in the possession","Maid Marian","Peacock, Thomas Love","Historical Fiction","en"
"1083",966,"of the king's forces, and in those days possession was considerably more","Maid Marian","Peacock, Thomas Love","Historical Fiction","en"
"1084",966,"than eleven points of the law. The baron was therefore convinced","Maid Marian","Peacock, Thomas Love","Historical Fiction","en"
"1085",966,"that the earl's outlawry was infallible, and that Matilda must either","Maid Marian","Peacock, Thomas Love","Historical Fiction","en"
"1086",966,"renounce her lover, or become with him an outlaw and a fugitive. In","Maid Marian","Peacock, Thomas Love","Historical Fiction","en"
"1087",966,"proportion, therefore, to the baron's knowledge of the strength and","Maid Marian","Peacock, Thomas Love","Historical Fiction","en"
"1088",966,"duration of her attachment, was his fear of the difficulty of its ever","Maid Marian","Peacock, Thomas Love","Historical Fiction","en"
"1089",966,"being overcome: her love of the forest and the chase, which he had never","Maid Marian","Peacock, Thomas Love","Historical Fiction","en"
"1090",966,"before discouraged, now presented itself to him as matter of serious","Maid Marian","Peacock, Thomas Love","Historical Fiction","en"
"1091",966,"alarm; and if her cheerfulness gave him hope on the one hand by","Maid Marian","Peacock, Thomas Love","Historical Fiction","en"
"1092",966,"indicating a spirit superior to all disappointments, it was suspicious","Maid Marian","Peacock, Thomas Love","Historical Fiction","en"
"1093",966,"to him on the other, as arising from some latent certainty of being soon","Maid Marian","Peacock, Thomas Love","Historical Fiction","en"
"1094",966,"united to the earl. All these circumstances concurred to render","Maid Marian","Peacock, Thomas Love","Historical Fiction","en"
"1095",966,"their songs of the vanished deer and greenwood archery and Yoicks and","Maid Marian","Peacock, Thomas Love","Historical Fiction","en"
"1096",966,"Harkaway, extremely mal-a-propos, and to make his anger boil and bubble","Maid Marian","Peacock, Thomas Love","Historical Fiction","en"
"1097",966,"in the cauldron of his spirit, till its more than ordinary excitement","Maid Marian","Peacock, Thomas Love","Historical Fiction","en"
"1098",966,"burst forth with sudden impulse into active manifestation.","Maid Marian","Peacock, Thomas Love","Historical Fiction","en"
"1099",966,"","Maid Marian","Peacock, Thomas Love","Historical Fiction","en"
"1100",966," But as it sometimes happens, from the might","Maid Marian","Peacock, Thomas Love","Historical Fiction","en"
"1101",966,"     Of rage in minds that can no farther go,","Maid Marian","Peacock, Thomas Love","Historical Fiction","en"
"1102",966," As high as they have mounted in despite","Maid Marian","Peacock, Thomas Love","Historical Fiction","en"
"1103",966,"     In their remission do they sink as low,","Maid Marian","Peacock, Thomas Love","Historical Fiction","en"
"1104",966," To our bold baron did it happen so. [2]","Maid Marian","Peacock, Thomas Love","Historical Fiction","en"
"1105",966,"","Maid Marian","Peacock, Thomas Love","Historical Fiction","en"
"1106",966,"","Maid Marian","Peacock, Thomas Love","Historical Fiction","en"
"1107",966,"For his discobolic exploit proved the climax of his rage, and was","Maid Marian","Peacock, Thomas Love","Historical Fiction","en"
"1108",966,"succeeded by an immediate sense that he had passed the bounds of","Maid Marian","Peacock, Thomas Love","Historical Fiction","en"
"1109",966,"legitimate passion; and he sunk immediately from the very pinnacle of","Maid Marian","Peacock, Thomas Love","Historical Fiction","en"
"1110",966,"opposition to the level of implicit acquiescence. The friar's spirits","Maid Marian","Peacock, Thomas Love","Historical Fiction","en"
"1111",966,"were not to be marred by such a little incident. He was half-inclined,","Maid Marian","Peacock, Thomas Love","Historical Fiction","en"
"1112",966,"at first, to return the baron's compliment; but his love of Matilda","Maid Marian","Peacock, Thomas Love","Historical Fiction","en"
"1113",966,"checked him; and when the baron held out his hand, the friar seized it","Maid Marian","Peacock, Thomas Love","Historical Fiction","en"
"1114",966,"cordially, and they drowned all recollection of the affair by pledging","Maid Marian","Peacock, Thomas Love","Historical Fiction","en"
"1115",966,"each other in a cup of canary.","Maid Marian","Peacock, Thomas Love","Historical Fiction","en"
"1116",966,"","Maid Marian","Peacock, Thomas Love","Historical Fiction","en"
"1117",966,"The friar, having stayed long enough to see every thing replaced on a","Maid Marian","Peacock, Thomas Love","Historical Fiction","en"
"1118",966,"friendly footing, rose, and moved to take his leave. Matilda told him","Maid Marian","Peacock, Thomas Love","Historical Fiction","en"
"1119",966,"he must come again on the morrow, for she had a very long confession","Maid Marian","Peacock, Thomas Love","Historical Fiction","en"
"1120",966,"to make to him. This the friar promised to do, and departed with the","Maid Marian","Peacock, Thomas Love","Historical Fiction","en"
"1121",966,"knight.","Maid Marian","Peacock, Thomas Love","Historical Fiction","en"
"1122",966,"","Maid Marian","Peacock, Thomas Love","Historical Fiction","en"
"1123",966,"Sir Ralph, on reaching the abbey, drew his followers together, and","Maid Marian","Peacock, Thomas Love","Historical Fiction","en"
"1124",966,"led them to Locksley Castle, which he found in the possession of his","Maid Marian","Peacock, Thomas Love","Historical Fiction","en"
"1125",966,"lieutenant; whom he again left there with a sufficient force to hold it","Maid Marian","Peacock, Thomas Love","Historical Fiction","en"
"1126",966,"in safe keeping in the king's name, and proceeded to London to report","Maid Marian","Peacock, Thomas Love","Historical Fiction","en"
"1127",966,"the results of his enterprise.","Maid Marian","Peacock, Thomas Love","Historical Fiction","en"
"1128",966,"","Maid Marian","Peacock, Thomas Love","Historical Fiction","en"
"1129",966,"Now Henry our royal king was very wroth at the earl's evasion, and swore","Maid Marian","Peacock, Thomas Love","Historical Fiction","en"
"1130",966,"by Saint Thomas-a-Becket (whom he had himself translated into a saint by","Maid Marian","Peacock, Thomas Love","Historical Fiction","en"
"1131",966,"having him knocked on the head), that he would give the castle and lands","Maid Marian","Peacock, Thomas Love","Historical Fiction","en"
"1132",966,"of Locksley to the man who should bring in the earl. Hereupon ensued","Maid Marian","Peacock, Thomas Love","Historical Fiction","en"
"1133",966,"a process of thought in the mind of the knight. The eyes of the fair","Maid Marian","Peacock, Thomas Love","Historical Fiction","en"
"1134",966,"huntress of Arlingford had left a wound in his heart which only she who","Maid Marian","Peacock, Thomas Love","Historical Fiction","en"
"1135",966,"gave could heal. He had seen that the baron was no longer very partial","Maid Marian","Peacock, Thomas Love","Historical Fiction","en"
"1136",966,"to the outlawed earl, but that he still retained his old affection for","Maid Marian","Peacock, Thomas Love","Historical Fiction","en"
"1137",966,"the lands and castle of Locksley. Now the lands and castle were very","Maid Marian","Peacock, Thomas Love","Historical Fiction","en"
"1138",966,"fair things in themselves, and would be pretty appurtenances to an","Maid Marian","Peacock, Thomas Love","Historical Fiction","en"
"1139",966,"adventurous knight; but they would be doubly valuable as certain","Maid Marian","Peacock, Thomas Love","Historical Fiction","en"
"1140",966,"passports to the father's favour, which was one step towards that of the","Maid Marian","Peacock, Thomas Love","Historical Fiction","en"
"1141",966,"daughter, or at least towards obtaining possession of her either quietly","Maid Marian","Peacock, Thomas Love","Historical Fiction","en"
"1142",966,"or perforce; for the knight was not so nice in his love as to consider","Maid Marian","Peacock, Thomas Love","Historical Fiction","en"
"1143",966,"the lady's free grace a sine qua non: and to think of being, by any","Maid Marian","Peacock, Thomas Love","Historical Fiction","en"
"1144",966,"means whatever, the lord of Locksley and Arlingford, and the husband","Maid Marian","Peacock, Thomas Love","Historical Fiction","en"
"1145",966,"of the bewitching Matilda, was to cut in the shades of futurity a vista","Maid Marian","Peacock, Thomas Love","Historical Fiction","en"
"1146",966,"very tempting to a soldier of fortune. He set out in high spirits with","Maid Marian","Peacock, Thomas Love","Historical Fiction","en"
"1147",966,"a chosen band of followers, and beat up all the country far and wide","Maid Marian","Peacock, Thomas Love","Historical Fiction","en"
"1148",966,"around both the Ouse and the Trent; but fortune did not seem disposed","Maid Marian","Peacock, Thomas Love","Historical Fiction","en"
"1149",966,"to second his diligence, for no vestige whatever could he trace of the","Maid Marian","Peacock, Thomas Love","Historical Fiction","en"
"1150",966,"earl. His followers, who were only paid with the wages of hope, began to","Maid Marian","Peacock, Thomas Love","Historical Fiction","en"
"1151",966,"murmur and fall off; for, as those unenlightened days were ignorant of","Maid Marian","Peacock, Thomas Love","Historical Fiction","en"
"1152",966,"the happy invention of paper machinery, by which one promise to pay is","Maid Marian","Peacock, Thomas Love","Historical Fiction","en"
"1153",966,"satisfactorily paid with another promise to pay, and that again with","Maid Marian","Peacock, Thomas Love","Historical Fiction","en"
"1154",966,"another in infinite series, they would not, as their wiser posterity has","Maid Marian","Peacock, Thomas Love","Historical Fiction","en"
"1155",966,"done, take those tenders for true pay which were not sterling; so that,","Maid Marian","Peacock, Thomas Love","Historical Fiction","en"
"1156",966,"one fine morning, the knight found himself sitting on a pleasant bank of","Maid Marian","Peacock, Thomas Love","Historical Fiction","en"
"1157",966,"the Trent, with only a solitary squire, who still clung to the shadow","Maid Marian","Peacock, Thomas Love","Historical Fiction","en"
"1158",966,"of preferment, because he did not see at the moment any better chance of","Maid Marian","Peacock, Thomas Love","Historical Fiction","en"
"1159",966,"the substance.","Maid Marian","Peacock, Thomas Love","Historical Fiction","en"
"1160",966,"","Maid Marian","Peacock, Thomas Love","Historical Fiction","en"
"1161",966,"The knight did not despair because of the desertion of his followers: he","Maid Marian","Peacock, Thomas Love","Historical Fiction","en"
"1162",966,"was well aware that he could easily raise recruits if he could once find","Maid Marian","Peacock, Thomas Love","Historical Fiction","en"
"1163",966,"trace of his game; he, therefore, rode about indefatigably over hill","Maid Marian","Peacock, Thomas Love","Historical Fiction","en"
"1164",966,"and dale, to the great sharpening of his own appetite and that of his","Maid Marian","Peacock, Thomas Love","Historical Fiction","en"
"1165",966,"squire, living gallantly from inn to inn when his purse was full, and","Maid Marian","Peacock, Thomas Love","Historical Fiction","en"
"1166",966,"quartering himself in the king's name on the nearest ghostly brotherhood","Maid Marian","Peacock, Thomas Love","Historical Fiction","en"
"1167",966,"when it happened to be empty. An autumn and a winter had passed away,","Maid Marian","Peacock, Thomas Love","Historical Fiction","en"
"1168",966,"when the course of his perlustations brought him one evening into a","Maid Marian","Peacock, Thomas Love","Historical Fiction","en"
"1169",966,"beautiful sylvan valley, where he found a number of young women weaving","Maid Marian","Peacock, Thomas Love","Historical Fiction","en"
"1170",966,"garlands of flowers, and singing over their pleasant occupation. He","Maid Marian","Peacock, Thomas Love","Historical Fiction","en"
"1171",966,"approached them, and courteously inquired the way to the nearest town.","Maid Marian","Peacock, Thomas Love","Historical Fiction","en"
"1172",966,"","Maid Marian","Peacock, Thomas Love","Historical Fiction","en"
"1173",966,"""There is no town within several miles,"" was the answer.","Maid Marian","Peacock, Thomas Love","Historical Fiction","en"
"1174",966,"","Maid Marian","Peacock, Thomas Love","Historical Fiction","en"
"1175",966,"""A village, then, if it be but large enough to furnish an inn?""","Maid Marian","Peacock, Thomas Love","Historical Fiction","en"
"1176",966,"","Maid Marian","Peacock, Thomas Love","Historical Fiction","en"
"1177",966,"""There is Gamwell just by, but there is no inn nearer than the nearest","Maid Marian","Peacock, Thomas Love","Historical Fiction","en"
"1178",966,"town.""","Maid Marian","Peacock, Thomas Love","Historical Fiction","en"
"1179",966,"","Maid Marian","Peacock, Thomas Love","Historical Fiction","en"
"1180",966,"""An abbey, then?""","Maid Marian","Peacock, Thomas Love","Historical Fiction","en"
"1181",966,"","Maid Marian","Peacock, Thomas Love","Historical Fiction","en"
"1182",966,"""There is no abbey nearer than the nearest inn.""","Maid Marian","Peacock, Thomas Love","Historical Fiction","en"
"1183",966,"","Maid Marian","Peacock, Thomas Love","Historical Fiction","en"
"1184",966,"""A house then, or a cottage, where I may obtain hospitality for the","Maid Marian","Peacock, Thomas Love","Historical Fiction","en"
"1185",966,"night?""","Maid Marian","Peacock, Thomas Love","Historical Fiction","en"
"1186",966,"","Maid Marian","Peacock, Thomas Love","Historical Fiction","en"
"1187",966,"""Hospitality!"" said one of the young women; ""you have not far to","Maid Marian","Peacock, Thomas Love","Historical Fiction","en"
"1188",966,"seek for that. Do you not know that you are in the neighbourhood of","Maid Marian","Peacock, Thomas Love","Historical Fiction","en"
"1189",966,"Gamwell-Hall?""","Maid Marian","Peacock, Thomas Love","Historical Fiction","en"
"1190",966,"","Maid Marian","Peacock, Thomas Love","Historical Fiction","en"
"1191",966,"""So far from it,"" said the knight, ""that I never heard the name of","Maid Marian","Peacock, Thomas Love","Historical Fiction","en"
"1192",966,"Gamwell-Hall before.""","Maid Marian","Peacock, Thomas Love","Historical Fiction","en"
"1193",966,"","Maid Marian","Peacock, Thomas Love","Historical Fiction","en"
"1194",966,"""Never heard of Gamwell-Hall?"" exclaimed all the young women together,","Maid Marian","Peacock, Thomas Love","Historical Fiction","en"
"1195",966,"who could as soon have dreamed of his never having heard of the sky.","Maid Marian","Peacock, Thomas Love","Historical Fiction","en"
"1196",966,"","Maid Marian","Peacock, Thomas Love","Historical Fiction","en"
"1197",966,"""Indeed, no,"" said Sir Ralph; ""but I shall be very happy to get rid of","Maid Marian","Peacock, Thomas Love","Historical Fiction","en"
"1198",966,"my ignorance.""","Maid Marian","Peacock, Thomas Love","Historical Fiction","en"
"1199",966,"","Maid Marian","Peacock, Thomas Love","Historical Fiction","en"
"1200",966,"""And so shall I,"" said his squire; ""for it seems that in this case","Maid Marian","Peacock, Thomas Love","Historical Fiction","en"
"1201",966,"knowledge will for once be a cure for hunger, wherewith I am grievously","Maid Marian","Peacock, Thomas Love","Historical Fiction","en"
"1202",966,"afflicted.""","Maid Marian","Peacock, Thomas Love","Historical Fiction","en"
"1203",966,"","Maid Marian","Peacock, Thomas Love","Historical Fiction","en"
"1204",966,"""And why are you so busy, my pretty damsels, weaving these garlands?""","Maid Marian","Peacock, Thomas Love","Historical Fiction","en"
"1205",966,"said the knight.","Maid Marian","Peacock, Thomas Love","Historical Fiction","en"
"1206",966,"","Maid Marian","Peacock, Thomas Love","Historical Fiction","en"
"1207",966,"""Why, do you not know, sir,"" said one of the young women, ""that","Maid Marian","Peacock, Thomas Love","Historical Fiction","en"
"1208",966,"to-morrow is Gamwell feast?""","Maid Marian","Peacock, Thomas Love","Historical Fiction","en"
"1209",966,"","Maid Marian","Peacock, Thomas Love","Historical Fiction","en"
"1210",966,"The knight was again obliged, with all humility, to confess his","Maid Marian","Peacock, Thomas Love","Historical Fiction","en"
"1211",966,"ignorance.","Maid Marian","Peacock, Thomas Love","Historical Fiction","en"
"1212",966,"","Maid Marian","Peacock, Thomas Love","Historical Fiction","en"
"1213",966,"""Oh! sir,"" said his informant, ""then you will have something to see,","Maid Marian","Peacock, Thomas Love","Historical Fiction","en"
"1214",966,"that I can tell you; for we shall choose a Queen of the May, and we","Maid Marian","Peacock, Thomas Love","Historical Fiction","en"
"1215",966,"shall crown her with flowers, and place her in a chariot of flowers,","Maid Marian","Peacock, Thomas Love","Historical Fiction","en"
"1216",966,"and draw it with lines of flowers, and we shall hang all the trees with","Maid Marian","Peacock, Thomas Love","Historical Fiction","en"
"1217",966,"flowers, and we shall strew all the ground with flowers, and we shall","Maid Marian","Peacock, Thomas Love","Historical Fiction","en"
"1218",966,"dance with flowers, and in flowers, and on flowers, and we shall be all","Maid Marian","Peacock, Thomas Love","Historical Fiction","en"
"1219",966,"flowers.""","Maid Marian","Peacock, Thomas Love","Historical Fiction","en"
"1220",966,"","Maid Marian","Peacock, Thomas Love","Historical Fiction","en"
"1221",966,"""That you will,"" said the knight; ""and the sweetest and brightest of","Maid Marian","Peacock, Thomas Love","Historical Fiction","en"
"1222",966,"all the flowers of the May, my pretty damsels."" On which all the pretty","Maid Marian","Peacock, Thomas Love","Historical Fiction","en"
"1223",966,"damsels smiled at him and each other.","Maid Marian","Peacock, Thomas Love","Historical Fiction","en"
"1224",966,"","Maid Marian","Peacock, Thomas Love","Historical Fiction","en"
"1225",966,"""And there will be all sorts of May-games, and there will be prizes for","Maid Marian","Peacock, Thomas Love","Historical Fiction","en"
"1226",966,"archery, and there will be the knight's ale, and the foresters' venison,","Maid Marian","Peacock, Thomas Love","Historical Fiction","en"
"1227",966,"and there will be Kit Scrapesqueak with his fiddle, and little Tom","Maid Marian","Peacock, Thomas Love","Historical Fiction","en"
"1228",966,"Whistlerap with his fife and tabor, and Sam Trumtwang with his harp,","Maid Marian","Peacock, Thomas Love","Historical Fiction","en"
"1229",966,"and Peter Muggledrone with his bagpipe, and how I shall dance with","Maid Marian","Peacock, Thomas Love","Historical Fiction","en"
"1230",966,"Will Whitethorn!"" added the girl, clapping her hands as she spoke, and","Maid Marian","Peacock, Thomas Love","Historical Fiction","en"
"1231",966,"bounding from the ground with the pleasure of the anticipation.","Maid Marian","Peacock, Thomas Love","Historical Fiction","en"
"1232",966,"","Maid Marian","Peacock, Thomas Love","Historical Fiction","en"
"1233",966,"A tall athletic young man approached, to whom the rustic maidens","Maid Marian","Peacock, Thomas Love","Historical Fiction","en"
"1234",966,"courtesied with great respect; and one of them informed Sir Ralph that","Maid Marian","Peacock, Thomas Love","Historical Fiction","en"
"1235",966,"it was young Master William Gamwell. The young gentleman invited and","Maid Marian","Peacock, Thomas Love","Historical Fiction","en"
"1236",966,"conducted the knight to the hall, where he introduced him to the old","Maid Marian","Peacock, Thomas Love","Historical Fiction","en"
"1237",966,"knight his father, and to the old lady his mother, and to the young lady","Maid Marian","Peacock, Thomas Love","Historical Fiction","en"
"1238",966,"his sister, and to a number of bold yeomen, who were laying siege to","Maid Marian","Peacock, Thomas Love","Historical Fiction","en"
"1239",966,"beef, brawn, and plum pie around a ponderous table, and taking copious","Maid Marian","Peacock, Thomas Love","Historical Fiction","en"
"1240",966,"draughts of old October. A motto was inscribed over the interior door,--","Maid Marian","Peacock, Thomas Love","Historical Fiction","en"
"1241",966,"","Maid Marian","Peacock, Thomas Love","Historical Fiction","en"
"1242",966,"EAT, DRINK, AND BE MERRY:","Maid Marian","Peacock, Thomas Love","Historical Fiction","en"
"1243",966,"","Maid Marian","Peacock, Thomas Love","Historical Fiction","en"
"1244",966,"an injunction which Sir Ralph and his squire showed remarkable alacrity","Maid Marian","Peacock, Thomas Love","Historical Fiction","en"
"1245",966,"in obeying. Old Sir Guy of Gamwell gave Sir Ralph a very cordial","Maid Marian","Peacock, Thomas Love","Historical Fiction","en"
"1246",966,"welcome, and entertained him during supper with several of his best","Maid Marian","Peacock, Thomas Love","Historical Fiction","en"
"1247",966,"stories, enforced with an occasional slap on the back, and pointed with","Maid Marian","Peacock, Thomas Love","Historical Fiction","en"
"1248",966,"a peg in the ribs; a species of vivacious eloquence in which the old","Maid Marian","Peacock, Thomas Love","Historical Fiction","en"
"1249",966,"gentleman excelled, and which is supposed by many of that pleasant","Maid Marian","Peacock, Thomas Love","Historical Fiction","en"
"1250",966,"variety of the human spectes, known by the name of choice fellows and","Maid Marian","Peacock, Thomas Love","Historical Fiction","en"
"1251",966,"comical dogs, to be the genuine tangible shape of the cream of a good","Maid Marian","Peacock, Thomas Love","Historical Fiction","en"
"1252",966,"joke.","Maid Marian","Peacock, Thomas Love","Historical Fiction","en"
"1253",966,"","Maid Marian","Peacock, Thomas Love","Historical Fiction","en"
"1254",966,"","Maid Marian","Peacock, Thomas Love","Historical Fiction","en"
"1255",966,"","Maid Marian","Peacock, Thomas Love","Historical Fiction","en"
"1256",966,"","Maid Marian","Peacock, Thomas Love","Historical Fiction","en"
"1257",966,"CHAPTER VI","Maid Marian","Peacock, Thomas Love","Historical Fiction","en"
