"","gutenberg_id","text","title","author","gutenberg_bookshelf","language"
"1914",1557,"honest solidity to Gascoyne's somewhat weathercock nature, and to","Men of Iron","Pyle, Howard","Fantasy","en"
"1915",1557,"Myles's ruder and more uncouth character Gascoyne lent a tone of his","Men of Iron","Pyle, Howard","Fantasy","en"
"1916",1557,"gentler manners, learned in his pagehood service as attendant upon the","Men of Iron","Pyle, Howard","Fantasy","en"
"1917",1557,"Countess and her ladies.","Men of Iron","Pyle, Howard","Fantasy","en"
"1918",1557,"","Men of Iron","Pyle, Howard","Fantasy","en"
"1919",1557,"In other things, also, the character and experience of the one lad","Men of Iron","Pyle, Howard","Fantasy","en"
"1920",1557,"helped to supply what was lacking in the other. Myles was replete with","Men of Iron","Pyle, Howard","Fantasy","en"
"1921",1557,"old Latin gestes, fables, and sermons picked up during his school life,","Men of Iron","Pyle, Howard","Fantasy","en"
"1922",1557,"in those intervals of his more serious studies when Prior Edward had","Men of Iron","Pyle, Howard","Fantasy","en"
"1923",1557,"permitted him to browse in the greener pastures of the Gesta Romanorum","Men of Iron","Pyle, Howard","Fantasy","en"
"1924",1557,"and the Disciplina Clericalis of the monastery library, and Gascoyne was","Men of Iron","Pyle, Howard","Fantasy","en"
"1925",1557,"never weary of hearing him tell those marvellous stories culled from the","Men of Iron","Pyle, Howard","Fantasy","en"
"1926",1557,"crabbed Latin of the old manuscript volumes.","Men of Iron","Pyle, Howard","Fantasy","en"
"1927",1557,"","Men of Iron","Pyle, Howard","Fantasy","en"
"1928",1557,"Upon his part Gascoyne was full of the lore of the waiting-room and","Men of Iron","Pyle, Howard","Fantasy","en"
"1929",1557,"the antechamber, and Myles, who in all his life had never known a lady,","Men of Iron","Pyle, Howard","Fantasy","en"
"1930",1557,"young or old, excepting his mother, was never tired of lying silently","Men of Iron","Pyle, Howard","Fantasy","en"
"1931",1557,"listening to Gascoyne's chatter of the gay doings of the castle","Men of Iron","Pyle, Howard","Fantasy","en"
"1932",1557,"gentle-life, in which he had taken part so often in the merry days of","Men of Iron","Pyle, Howard","Fantasy","en"
"1933",1557,"his pagehood.","Men of Iron","Pyle, Howard","Fantasy","en"
"1934",1557,"","Men of Iron","Pyle, Howard","Fantasy","en"
"1935",1557,"""I do wonder,"" said Myles, quaintly, ""that thou couldst ever find the","Men of Iron","Pyle, Howard","Fantasy","en"
"1936",1557,"courage to bespeak a young maid, Francis. Never did I do so, nor ever","Men of Iron","Pyle, Howard","Fantasy","en"
"1937",1557,"could. Rather would I face three strong men than one young damsel.""","Men of Iron","Pyle, Howard","Fantasy","en"
"1938",1557,"","Men of Iron","Pyle, Howard","Fantasy","en"
"1939",1557,"Whereupon Gascoyne burst out laughing. ""Marry!"" quoth he, ""they be","Men of Iron","Pyle, Howard","Fantasy","en"
"1940",1557,"no such terrible things, but gentle and pleasant spoken, and soft and","Men of Iron","Pyle, Howard","Fantasy","en"
"1941",1557,"smooth as any cat.""","Men of Iron","Pyle, Howard","Fantasy","en"
"1942",1557,"","Men of Iron","Pyle, Howard","Fantasy","en"
"1943",1557,"""No matter for that,"" said Myles; ""I would not face one such for","Men of Iron","Pyle, Howard","Fantasy","en"
"1944",1557,"worlds.""","Men of Iron","Pyle, Howard","Fantasy","en"
"1945",1557,"","Men of Iron","Pyle, Howard","Fantasy","en"
"1946",1557,"It was during the short time when, so to speak, the two owned the","Men of Iron","Pyle, Howard","Fantasy","en"
"1947",1557,"solitude of the Brutus Tower, that Myles told his friend of his father's","Men of Iron","Pyle, Howard","Fantasy","en"
"1948",1557,"outlawry and of the peril in which the family stood. And thus it was.","Men of Iron","Pyle, Howard","Fantasy","en"
"1949",1557,"","Men of Iron","Pyle, Howard","Fantasy","en"
"1950",1557,"""I do marvel,"" said Gascoyne one day, as the two lay stretched in the","Men of Iron","Pyle, Howard","Fantasy","en"
"1951",1557,"Eyry, looking down into the castle court-yard below--""I do marvel, now","Men of Iron","Pyle, Howard","Fantasy","en"
"1952",1557,"that thou art 'stablished here this month and more, that my Lord doth","Men of Iron","Pyle, Howard","Fantasy","en"
"1953",1557,"never have thee called to service upon household duty. Canst thou riddle","Men of Iron","Pyle, Howard","Fantasy","en"
"1954",1557,"me why it is so, Myles?""","Men of Iron","Pyle, Howard","Fantasy","en"
"1955",1557,"","Men of Iron","Pyle, Howard","Fantasy","en"
"1956",1557,"The subject was a very sore one with Myles. Until Sir James had told him","Men of Iron","Pyle, Howard","Fantasy","en"
"1957",1557,"of the matter in his office that day he had never known that his father","Men of Iron","Pyle, Howard","Fantasy","en"
"1958",1557,"was attainted and outlawed. He had accepted the change from their","Men of Iron","Pyle, Howard","Fantasy","en"
"1959",1557,"earlier state and the bald poverty of their life at Crosbey-Holt with","Men of Iron","Pyle, Howard","Fantasy","en"
"1960",1557,"the easy carelessness of boyhood, and Sir James's words were the first","Men of Iron","Pyle, Howard","Fantasy","en"
"1961",1557,"to awaken him to a realization of the misfortunes of the house of","Men of Iron","Pyle, Howard","Fantasy","en"
"1962",1557,"Falworth. His was a brooding nature, and in the three or four weeks","Men of Iron","Pyle, Howard","Fantasy","en"
"1963",1557,"that passed he had meditated so much over what had been told him, that","Men of Iron","Pyle, Howard","Fantasy","en"
"1964",1557,"by-and-by it almost seemed as if a shadow of shame rested upon his","Men of Iron","Pyle, Howard","Fantasy","en"
"1965",1557,"father's fair fame, even though the attaint set upon him was unrighteous","Men of Iron","Pyle, Howard","Fantasy","en"
"1966",1557,"and unjust, as Myles knew it must be. He had felt angry and resentful","Men of Iron","Pyle, Howard","Fantasy","en"
"1967",1557,"at the Earl's neglect, and as days passed and he was not noticed in any","Men of Iron","Pyle, Howard","Fantasy","en"
"1968",1557,"way, his heart was at times very bitter.","Men of Iron","Pyle, Howard","Fantasy","en"
"1969",1557,"","Men of Iron","Pyle, Howard","Fantasy","en"
"1970",1557,"So now Gascoyne's innocent question touched a sore spot, and Myles spoke","Men of Iron","Pyle, Howard","Fantasy","en"
"1971",1557,"with a sharp, angry pain in his voice that made the other look quickly","Men of Iron","Pyle, Howard","Fantasy","en"
"1972",1557,"up. ""Sooner would my Lord have yonder swineherd serve him in the","Men of Iron","Pyle, Howard","Fantasy","en"
"1973",1557,"household than me,"" said he.","Men of Iron","Pyle, Howard","Fantasy","en"
"1974",1557,"","Men of Iron","Pyle, Howard","Fantasy","en"
"1975",1557,"""Why may that be, Myles?"" said Gascoyne.","Men of Iron","Pyle, Howard","Fantasy","en"
"1976",1557,"","Men of Iron","Pyle, Howard","Fantasy","en"
"1977",1557,"""Because,"" answered Myles, with the same angry bitterness in his voice,","Men of Iron","Pyle, Howard","Fantasy","en"
"1978",1557,"""either the Earl is a coward that feareth to befriend me, or else he is","Men of Iron","Pyle, Howard","Fantasy","en"
"1979",1557,"a caitiff, ashamed of his own flesh and blood, and of me, the son of his","Men of Iron","Pyle, Howard","Fantasy","en"
"1980",1557,"one-time comrade.""","Men of Iron","Pyle, Howard","Fantasy","en"
"1981",1557,"","Men of Iron","Pyle, Howard","Fantasy","en"
"1982",1557,"Gascoyne raised himself upon his elbow, and opened his eyes wide in","Men of Iron","Pyle, Howard","Fantasy","en"
"1983",1557,"wonder. ""Afeard of thee, Myles!"" quoth he. ""Why should he be afeared to","Men of Iron","Pyle, Howard","Fantasy","en"
"1984",1557,"befriend thee? Who art thou that the Earl should fear thee?""","Men of Iron","Pyle, Howard","Fantasy","en"
"1985",1557,"","Men of Iron","Pyle, Howard","Fantasy","en"
"1986",1557,"Myles hesitated for a moment or two; wisdom bade him remain silent","Men of Iron","Pyle, Howard","Fantasy","en"
"1987",1557,"upon the dangerous topic, but his heart yearned for sympathy and","Men of Iron","Pyle, Howard","Fantasy","en"
"1988",1557,"companionship in his trouble. ""I will tell thee,"" said he, suddenly,","Men of Iron","Pyle, Howard","Fantasy","en"
"1989",1557,"and therewith poured out all of the story, so far as he knew it, to his","Men of Iron","Pyle, Howard","Fantasy","en"
"1990",1557,"listening, wondering friend, and his heart felt lighter to be thus eased","Men of Iron","Pyle, Howard","Fantasy","en"
"1991",1557,"of its burden. ""And now,"" said he, as he concluded, ""is not this Earl","Men of Iron","Pyle, Howard","Fantasy","en"
"1992",1557,"a mean-hearted caitiff to leave me, the son of his one-time friend and","Men of Iron","Pyle, Howard","Fantasy","en"
"1993",1557,"kinsman, thus to stand or to fall alone among strangers and in a","Men of Iron","Pyle, Howard","Fantasy","en"
"1994",1557,"strange place without once stretching me a helping hand?"" He waited, and","Men of Iron","Pyle, Howard","Fantasy","en"
"1995",1557,"Gascoyne knew that he expected an answer.","Men of Iron","Pyle, Howard","Fantasy","en"
"1996",1557,"","Men of Iron","Pyle, Howard","Fantasy","en"
"1997",1557,"""I know not that he is a mean-hearted caitiff, Myles,"" said he at last,","Men of Iron","Pyle, Howard","Fantasy","en"
"1998",1557,"hesitatingly. ""The Earl hath many enemies, and I have heard that he hath","Men of Iron","Pyle, Howard","Fantasy","en"
"1999",1557,"stood more than once in peril, having been accused of dealings with","Men of Iron","Pyle, Howard","Fantasy","en"
"2000",1557,"the King's foes. He was cousin to the Earl of Kent, and I do remember","Men of Iron","Pyle, Howard","Fantasy","en"
"2001",1557,"hearing that he had a narrow escape at that time from ruin. There be","Men of Iron","Pyle, Howard","Fantasy","en"
"2002",1557,"more reasons than thou wottest of why he should not have dealings with","Men of Iron","Pyle, Howard","Fantasy","en"
"2003",1557,"thy father.""","Men of Iron","Pyle, Howard","Fantasy","en"
"2004",1557,"","Men of Iron","Pyle, Howard","Fantasy","en"
"2005",1557,"""I had not thought,"" said Myles, bitterly, after a little pause, ""that","Men of Iron","Pyle, Howard","Fantasy","en"
"2006",1557,"thou wouldst stand up for him and against me in this quarrel, Gascoyne.","Men of Iron","Pyle, Howard","Fantasy","en"
"2007",1557,"Him will I never forgive so long as I may live, and I had thought that","Men of Iron","Pyle, Howard","Fantasy","en"
"2008",1557,"thou wouldst have stood by me.""","Men of Iron","Pyle, Howard","Fantasy","en"
"2009",1557,"","Men of Iron","Pyle, Howard","Fantasy","en"
"2010",1557,"""So I do,"" said Gascoyne, hastily, ""and do love thee more than any one","Men of Iron","Pyle, Howard","Fantasy","en"
"2011",1557,"in all the world, Myles; but I had thought that it would make thee feel","Men of Iron","Pyle, Howard","Fantasy","en"
"2012",1557,"more easy, to think that the Earl was not against thee. And, indeed,","Men of Iron","Pyle, Howard","Fantasy","en"
"2013",1557,"from all thou has told me, I do soothly think that he and Sir James mean","Men of Iron","Pyle, Howard","Fantasy","en"
"2014",1557,"to befriend thee and hold thee privily in kind regard.""","Men of Iron","Pyle, Howard","Fantasy","en"
"2015",1557,"","Men of Iron","Pyle, Howard","Fantasy","en"
"2016",1557,"""Then why doth he not stand forth like a man and befriend me and my","Men of Iron","Pyle, Howard","Fantasy","en"
"2017",1557,"father openly, even if it be to his own peril?"" said Myles, reverting","Men of Iron","Pyle, Howard","Fantasy","en"
"2018",1557,"stubbornly to what he had first spoken.","Men of Iron","Pyle, Howard","Fantasy","en"
"2019",1557,"","Men of Iron","Pyle, Howard","Fantasy","en"
"2020",1557,"Gascoyne did not answer, but lay for a long while in silence. ""Knowest","Men of Iron","Pyle, Howard","Fantasy","en"
"2021",1557,"thou,"" he suddenly asked, after a while, ""who is this great enemy of","Men of Iron","Pyle, Howard","Fantasy","en"
"2022",1557,"whom Sir James speaketh, and who seeketh so to drive thy father to","Men of Iron","Pyle, Howard","Fantasy","en"
"2023",1557,"ruin?""","Men of Iron","Pyle, Howard","Fantasy","en"
"2024",1557,"","Men of Iron","Pyle, Howard","Fantasy","en"
"2025",1557,"""Nay,"" said Myles, ""I know not, for my father hath never spoken of these","Men of Iron","Pyle, Howard","Fantasy","en"
"2026",1557,"things, and Sir James would not tell me. But this I know,"" said he,","Men of Iron","Pyle, Howard","Fantasy","en"
"2027",1557,"suddenly, grinding his teeth together, ""an I do not hunt him out some","Men of Iron","Pyle, Howard","Fantasy","en"
"2028",1557,"day and slay him like a dog--"" He stopped abruptly, and Gascoyne,","Men of Iron","Pyle, Howard","Fantasy","en"
"2029",1557,"looking askance at him, saw that his eyes were full of tears, whereupon","Men of Iron","Pyle, Howard","Fantasy","en"
"2030",1557,"he turned his looks away again quickly, and fell to shooting pebbles out","Men of Iron","Pyle, Howard","Fantasy","en"
"2031",1557,"through the open window with his finger and thumb.","Men of Iron","Pyle, Howard","Fantasy","en"
"2032",1557,"","Men of Iron","Pyle, Howard","Fantasy","en"
"2033",1557,"""Thou wilt tell no one of these things that I have said?"" said Myles,","Men of Iron","Pyle, Howard","Fantasy","en"
"2034",1557,"after a while.","Men of Iron","Pyle, Howard","Fantasy","en"
"2035",1557,"","Men of Iron","Pyle, Howard","Fantasy","en"
"2036",1557,"""Not I,"" said Gascoyne. ""Thinkest thou I could do such a thing?""","Men of Iron","Pyle, Howard","Fantasy","en"
"2037",1557,"","Men of Iron","Pyle, Howard","Fantasy","en"
"2038",1557,"""Nay,"" said Myles, briefly.","Men of Iron","Pyle, Howard","Fantasy","en"
"2039",1557,"","Men of Iron","Pyle, Howard","Fantasy","en"
"2040",1557,"Perhaps this talk more than anything else that had ever passed between","Men of Iron","Pyle, Howard","Fantasy","en"
"2041",1557,"them knit the two friends the closer together, for, as I have said,","Men of Iron","Pyle, Howard","Fantasy","en"
"2042",1557,"Myles felt easier now that he had poured out his bitter thoughts and","Men of Iron","Pyle, Howard","Fantasy","en"
"2043",1557,"words; and as for Gascoyne, I think that there is nothing so flattering","Men of Iron","Pyle, Howard","Fantasy","en"
"2044",1557,"to one's soul as to be made the confidant of a stronger nature.","Men of Iron","Pyle, Howard","Fantasy","en"
"2045",1557,"","Men of Iron","Pyle, Howard","Fantasy","en"
"2046",1557,"","Men of Iron","Pyle, Howard","Fantasy","en"
"2047",1557,"But the old tower served another purpose than that of a spot in which","Men of Iron","Pyle, Howard","Fantasy","en"
"2048",1557,"to pass away a few idle hours, or in which to indulge the confidences of","Men of Iron","Pyle, Howard","Fantasy","en"
"2049",1557,"friendship, for it was there that Myles gathered a backing of strength","Men of Iron","Pyle, Howard","Fantasy","en"
"2050",1557,"for resistance against the tyranny of the bachelors, and it is for that","Men of Iron","Pyle, Howard","Fantasy","en"
"2051",1557,"more than for any other reason that it has been told how they found the","Men of Iron","Pyle, Howard","Fantasy","en"
"2052",1557,"place and of what they did there, feeling secure against interruption.","Men of Iron","Pyle, Howard","Fantasy","en"
"2053",1557,"","Men of Iron","Pyle, Howard","Fantasy","en"
"2054",1557,"Myles Falworth was not of a kind that forgets or neglects a thing upon","Men of Iron","Pyle, Howard","Fantasy","en"
"2055",1557,"which the mind has once been set. Perhaps his chief objective since","Men of Iron","Pyle, Howard","Fantasy","en"
"2056",1557,"the talk with Sir James following his fight in the dormitory had been","Men of Iron","Pyle, Howard","Fantasy","en"
"2057",1557,"successful resistance to the exactions of the head of the body of","Men of Iron","Pyle, Howard","Fantasy","en"
"2058",1557,"squires. He was now (more than a month had passed) looked upon by nearly","Men of Iron","Pyle, Howard","Fantasy","en"
"2059",1557,"if not all of the younger lads as an acknowledged leader in his own","Men of Iron","Pyle, Howard","Fantasy","en"
"2060",1557,"class. So one day he broached a matter to Gascoyne that had for some","Men of Iron","Pyle, Howard","Fantasy","en"
"2061",1557,"time been digesting in his mind. It was the formation of a secret order,","Men of Iron","Pyle, Howard","Fantasy","en"
"2062",1557,"calling themselves the ""Knights of the Rose,"" their meeting-place to be","Men of Iron","Pyle, Howard","Fantasy","en"
"2063",1557,"the chapel of the Brutus Tower, and their object to be the righting","Men of Iron","Pyle, Howard","Fantasy","en"
"2064",1557,"of wrongs, ""as they,"" said Myles, ""of Arthur his Round-table did right","Men of Iron","Pyle, Howard","Fantasy","en"
"2065",1557,"wrongs.""","Men of Iron","Pyle, Howard","Fantasy","en"
"2066",1557,"","Men of Iron","Pyle, Howard","Fantasy","en"
"2067",1557,"""But, prithee, what wrongs are there to right in this place?"" quoth","Men of Iron","Pyle, Howard","Fantasy","en"
"2068",1557,"Gascoyne, after listening intently to the plan which Myles set forth.","Men of Iron","Pyle, Howard","Fantasy","en"
"2069",1557,"","Men of Iron","Pyle, Howard","Fantasy","en"
"2070",1557,"""Why, first of all, this,"" said Myles, clinching his fists, as he had a","Men of Iron","Pyle, Howard","Fantasy","en"
"2071",1557,"habit of doing when anything stirred him deeply, ""that we set those vile","Men of Iron","Pyle, Howard","Fantasy","en"
"2072",1557,"bachelors to their right place; and that is, that they be no longer our","Men of Iron","Pyle, Howard","Fantasy","en"
"2073",1557,"masters, but our fellows.""","Men of Iron","Pyle, Howard","Fantasy","en"
"2074",1557,"","Men of Iron","Pyle, Howard","Fantasy","en"
"2075",1557,"Gascoyne shook his head. He hated clashing and conflict above all","Men of Iron","Pyle, Howard","Fantasy","en"
"2076",1557,"things, and was for peace. Why should they thus rush to thrust","Men of Iron","Pyle, Howard","Fantasy","en"
"2077",1557,"themselves into trouble? Let matters abide as they were a little longer;","Men of Iron","Pyle, Howard","Fantasy","en"
"2078",1557,"surely life was pleasant enough without turning it all topsy-turvy.","Men of Iron","Pyle, Howard","Fantasy","en"
"2079",1557,"Then, with a sort of indignation, why should Myles, who had only come","Men of Iron","Pyle, Howard","Fantasy","en"
"2080",1557,"among them a month, take such service more to heart than they who had","Men of Iron","Pyle, Howard","Fantasy","en"
"2081",1557,"endured it for years? And, finally, with the hopefulness of so many of","Men of Iron","Pyle, Howard","Fantasy","en"
"2082",1557,"the rest of us, he advised Myles to let matters alone, and they would","Men of Iron","Pyle, Howard","Fantasy","en"
"2083",1557,"right themselves in time.","Men of Iron","Pyle, Howard","Fantasy","en"
"2084",1557,"","Men of Iron","Pyle, Howard","Fantasy","en"
"2085",1557,"But Myles's mind was determined; his active spirit could not brook","Men of Iron","Pyle, Howard","Fantasy","en"
"2086",1557,"resting passively under a wrong; he would endure no longer, and now or","Men of Iron","Pyle, Howard","Fantasy","en"
"2087",1557,"never they must make their stand.","Men of Iron","Pyle, Howard","Fantasy","en"
"2088",1557,"","Men of Iron","Pyle, Howard","Fantasy","en"
"2089",1557,"""But look thee, Myles Falworth,"" said Gascoyne, ""all this is not to","Men of Iron","Pyle, Howard","Fantasy","en"
"2090",1557,"be done withouten fighting shrewdly. Wilt thou take that fighting upon","Men of Iron","Pyle, Howard","Fantasy","en"
"2091",1557,"thine own self? As for me, I tell thee I love it not.""","Men of Iron","Pyle, Howard","Fantasy","en"
"2092",1557,"","Men of Iron","Pyle, Howard","Fantasy","en"
"2093",1557,"""Why, aye,"" said Myles; ""I ask no man to do what I will not do myself.""","Men of Iron","Pyle, Howard","Fantasy","en"
"2094",1557,"","Men of Iron","Pyle, Howard","Fantasy","en"
"2095",1557,"Gascoyne shrugged his shoulders. ""So be it,"" said he. ""An thou hast","Men of Iron","Pyle, Howard","Fantasy","en"
"2096",1557,"appetite to run thy head against hard knocks, do it i' mercy's name! I","Men of Iron","Pyle, Howard","Fantasy","en"
"2097",1557,"for one will stand thee back while thou art taking thy raps.""","Men of Iron","Pyle, Howard","Fantasy","en"
"2098",1557,"","Men of Iron","Pyle, Howard","Fantasy","en"
"2099",1557,"There was a spirit of drollery in Gascoyne's speech that rubbed against","Men of Iron","Pyle, Howard","Fantasy","en"
"2100",1557,"Myles's earnestness.","Men of Iron","Pyle, Howard","Fantasy","en"
"2101",1557,"","Men of Iron","Pyle, Howard","Fantasy","en"
"2102",1557,"""Out upon it!"" cried he, his patience giving way. ""Seest not that I","Men of Iron","Pyle, Howard","Fantasy","en"
"2103",1557,"am in serious earnest? Why then dost thou still jest like Mad Noll, my","Men of Iron","Pyle, Howard","Fantasy","en"
"2104",1557,"Lord's fool? An thou wilt not lend me thine aid in this matter, say so","Men of Iron","Pyle, Howard","Fantasy","en"
"2105",1557,"and ha' done with it, and I will bethink me of somewhere else to turn.""","Men of Iron","Pyle, Howard","Fantasy","en"
"2106",1557,"","Men of Iron","Pyle, Howard","Fantasy","en"
"2107",1557,"Then Gascoyne yielded at once, as he always did when his friend lost his","Men of Iron","Pyle, Howard","Fantasy","en"
"2108",1557,"temper, and having once assented to it, entered into the scheme heart","Men of Iron","Pyle, Howard","Fantasy","en"
"2109",1557,"and soul. Three other lads--one of them that tall thin squire Edmund","Men of Iron","Pyle, Howard","Fantasy","en"
"2110",1557,"Wilkes, before spoken of--were sounded upon the subject. They also","Men of Iron","Pyle, Howard","Fantasy","en"
"2111",1557,"entered into the plan of the secret organization with an enthusiasm","Men of Iron","Pyle, Howard","Fantasy","en"
"2112",1557,"which might perhaps not have been quite so glowing had they realized how","Men of Iron","Pyle, Howard","Fantasy","en"
"2113",1557,"very soon Myles designed embarking upon active practical operations.","Men of Iron","Pyle, Howard","Fantasy","en"
"2114",1557,"One day Myles and Gascoyne showed them the strange things that they","Men of Iron","Pyle, Howard","Fantasy","en"
"2115",1557,"had discovered in the old tower--the inner staircases, the winding","Men of Iron","Pyle, Howard","Fantasy","en"
"2116",1557,"passage-ways, the queer niches and cupboard, and the black shaft of a","Men of Iron","Pyle, Howard","Fantasy","en"
"2117",1557,"well that pierced down into the solid wall, and whence, perhaps, the old","Men of Iron","Pyle, Howard","Fantasy","en"
"2118",1557,"castle folk had one time drawn their supply of water in time of siege,","Men of Iron","Pyle, Howard","Fantasy","en"
"2119",1557,"and with every new wonder of the marvellous place the enthusiasm of the","Men of Iron","Pyle, Howard","Fantasy","en"
"2120",1557,"three recruits rose higher and higher. They rummaged through the lumber","Men of Iron","Pyle, Howard","Fantasy","en"
"2121",1557,"pile in the great circular room as Myles and Gascoyne had done, and at","Men of Iron","Pyle, Howard","Fantasy","en"
"2122",1557,"last, tired out, they ascended to the airy chapel, and there sat cooling","Men of Iron","Pyle, Howard","Fantasy","en"
"2123",1557,"themselves in the rustling freshness of the breeze that came blowing","Men of Iron","Pyle, Howard","Fantasy","en"
"2124",1557,"briskly in through the arched windows.","Men of Iron","Pyle, Howard","Fantasy","en"
"2125",1557,"","Men of Iron","Pyle, Howard","Fantasy","en"
"2126",1557,"It was then and there that the five discussed and finally determined","Men of Iron","Pyle, Howard","Fantasy","en"
"2127",1557,"upon the detailed plans of their organization, canvassing the names of","Men of Iron","Pyle, Howard","Fantasy","en"
"2128",1557,"the squirehood, and selecting from it a sufficient number of bold and","Men of Iron","Pyle, Howard","Fantasy","en"
"2129",1557,"daring spirits to make up a roll of twenty names in all.","Men of Iron","Pyle, Howard","Fantasy","en"
"2130",1557,"","Men of Iron","Pyle, Howard","Fantasy","en"
"2131",1557,"Gascoyne had, as I said, entered into the matter with spirit, and","Men of Iron","Pyle, Howard","Fantasy","en"
"2132",1557,"perhaps it was owing more to him than to any other that the project","Men of Iron","Pyle, Howard","Fantasy","en"
"2133",1557,"caught its delightful flavor of romance.","Men of Iron","Pyle, Howard","Fantasy","en"
"2134",1557,"","Men of Iron","Pyle, Howard","Fantasy","en"
"2135",1557,"""Perchance,"" said he, as the five lads lay in the rustling stillness","Men of Iron","Pyle, Howard","Fantasy","en"
"2136",1557,"through which sounded the monotonous and ceaseless cooing of the","Men of Iron","Pyle, Howard","Fantasy","en"
"2137",1557,"pigeons--""perchance there may be dwarfs and giants and dragons and","Men of Iron","Pyle, Howard","Fantasy","en"
"2138",1557,"enchanters and evil knights and what not even nowadays. And who knows","Men of Iron","Pyle, Howard","Fantasy","en"
"2139",1557,"but that if we Knights of the Rose hold together we may go forth into","Men of Iron","Pyle, Howard","Fantasy","en"
"2140",1557,"the world, and do battle with them, and save beautiful ladies, and","Men of Iron","Pyle, Howard","Fantasy","en"
"2141",1557,"have tales and gestes written about us as they are writ about the Seven","Men of Iron","Pyle, Howard","Fantasy","en"
"2142",1557,"Champions and Arthur his Round-table.""","Men of Iron","Pyle, Howard","Fantasy","en"
"2143",1557,"","Men of Iron","Pyle, Howard","Fantasy","en"
"2144",1557,"Perhaps Myles, who lay silently listening to all that was said, was the","Men of Iron","Pyle, Howard","Fantasy","en"
"2145",1557,"only one who looked upon the scheme at all in the light of real utility,","Men of Iron","Pyle, Howard","Fantasy","en"
