"","gutenberg_id","text","title","author","gutenberg_bookshelf","language"
"3594",1557,"a long row of rosebushes that screened him from the Countess's terrace,","Men of Iron","Pyle, Howard","Fantasy","en"
"3595",1557,"came to a little summer-house where the two young ladies had appointed","Men of Iron","Pyle, Howard","Fantasy","en"
"3596",1557,"to meet him that day.","Men of Iron","Pyle, Howard","Fantasy","en"
"3597",1557,"","Men of Iron","Pyle, Howard","Fantasy","en"
"3598",1557,"A pleasant half-hour or so was passed, and then it was time for Myles","Men of Iron","Pyle, Howard","Fantasy","en"
"3599",1557,"to go. He lingered for a while before he took his final leave, leaning","Men of Iron","Pyle, Howard","Fantasy","en"
"3600",1557,"against the door-post, and laughingly telling how he and some of his","Men of Iron","Pyle, Howard","Fantasy","en"
"3601",1557,"brother squires had made a figure of straw dressed in men's clothes, and","Men of Iron","Pyle, Howard","Fantasy","en"
"3602",1557,"had played a trick with it one night upon a watchman against whom they","Men of Iron","Pyle, Howard","Fantasy","en"
"3603",1557,"bore a grudge.","Men of Iron","Pyle, Howard","Fantasy","en"
"3604",1557,"","Men of Iron","Pyle, Howard","Fantasy","en"
"3605",1557,"The young ladies were listening with laughing faces, when suddenly, as","Men of Iron","Pyle, Howard","Fantasy","en"
"3606",1557,"Myles looked, he saw the smile vanish from Lady Alice's eyes and a wide","Men of Iron","Pyle, Howard","Fantasy","en"
"3607",1557,"terror take its place. She gave a half-articulate cry, and rose abruptly","Men of Iron","Pyle, Howard","Fantasy","en"
"3608",1557,"from the bench upon which she was sitting.","Men of Iron","Pyle, Howard","Fantasy","en"
"3609",1557,"","Men of Iron","Pyle, Howard","Fantasy","en"
"3610",1557,"Myles turned sharply, and then his very heart seemed to stand still","Men of Iron","Pyle, Howard","Fantasy","en"
"3611",1557,"within him; for there, standing in the broad sunlight without, and","Men of Iron","Pyle, Howard","Fantasy","en"
"3612",1557,"glaring in upon the party with baleful eyes, was the Earl of Mackworth","Men of Iron","Pyle, Howard","Fantasy","en"
"3613",1557,"himself.","Men of Iron","Pyle, Howard","Fantasy","en"
"3614",1557,"","Men of Iron","Pyle, Howard","Fantasy","en"
"3615",1557,"How long was the breathless silence that followed, Myles could never","Men of Iron","Pyle, Howard","Fantasy","en"
"3616",1557,"tell. He knew that the Lady Anne had also risen, and that she and her","Men of Iron","Pyle, Howard","Fantasy","en"
"3617",1557,"cousin were standing as still as statues. Presently the Earl pointed to","Men of Iron","Pyle, Howard","Fantasy","en"
"3618",1557,"the house with his staff, and Myles noted stupidly how it trembled in","Men of Iron","Pyle, Howard","Fantasy","en"
"3619",1557,"his hand.","Men of Iron","Pyle, Howard","Fantasy","en"
"3620",1557,"","Men of Iron","Pyle, Howard","Fantasy","en"
"3621",1557,"""Ye wenches,"" said he at last, in a hard, harsh voice--""ye wenches, what","Men of Iron","Pyle, Howard","Fantasy","en"
"3622",1557,"meaneth this? Would ye deceive me so, and hold parlance thus secretly","Men of Iron","Pyle, Howard","Fantasy","en"
"3623",1557,"with this fellow? I will settle with him anon. Meantime get ye","Men of Iron","Pyle, Howard","Fantasy","en"
"3624",1557,"straightway to the house and to your rooms, and there abide until I give","Men of Iron","Pyle, Howard","Fantasy","en"
"3625",1557,"ye leave to come forth again. Go, I say!""","Men of Iron","Pyle, Howard","Fantasy","en"
"3626",1557,"","Men of Iron","Pyle, Howard","Fantasy","en"
"3627",1557,"""Father,"" said Lady Anne, in a breathless voice--she was as white as","Men of Iron","Pyle, Howard","Fantasy","en"
"3628",1557,"death, and moistened her lips with her tongue before she spoke--""father,","Men of Iron","Pyle, Howard","Fantasy","en"
"3629",1557,"thou wilt not do harm to this young man. Spare him, I do beseech thee,","Men of Iron","Pyle, Howard","Fantasy","en"
"3630",1557,"for truly it was I who bade him come hither. I know that he would not","Men of Iron","Pyle, Howard","Fantasy","en"
"3631",1557,"have come but at our bidding.""","Men of Iron","Pyle, Howard","Fantasy","en"
"3632",1557,"","Men of Iron","Pyle, Howard","Fantasy","en"
"3633",1557,"The Earl stamped his foot upon the gravel. ""Did ye not hear me?"" said","Men of Iron","Pyle, Howard","Fantasy","en"
"3634",1557,"he, still pointing towards the house with his trembling staff. ""I bade","Men of Iron","Pyle, Howard","Fantasy","en"
"3635",1557,"ye go to your rooms. I will settle with this fellow, I say, as I deem","Men of Iron","Pyle, Howard","Fantasy","en"
"3636",1557,"fitting.""","Men of Iron","Pyle, Howard","Fantasy","en"
"3637",1557,"","Men of Iron","Pyle, Howard","Fantasy","en"
"3638",1557,"""Father,"" began Lady Anne again; but the Earl made such a savage gesture","Men of Iron","Pyle, Howard","Fantasy","en"
"3639",1557,"that poor Lady Alice uttered a faint shriek, and Lady Anne stopped","Men of Iron","Pyle, Howard","Fantasy","en"
"3640",1557,"abruptly, trembling. Then she turned and passed out the farther door of","Men of Iron","Pyle, Howard","Fantasy","en"
"3641",1557,"the summerhouse, poor little Lady Alice following, holding her tight","Men of Iron","Pyle, Howard","Fantasy","en"
"3642",1557,"by the skirts, and trembling and shuddering as though with a fit of the","Men of Iron","Pyle, Howard","Fantasy","en"
"3643",1557,"ague.","Men of Iron","Pyle, Howard","Fantasy","en"
"3644",1557,"","Men of Iron","Pyle, Howard","Fantasy","en"
"3645",1557,"The Earl stood looking grimly after them from under his shaggy eyebrows,","Men of Iron","Pyle, Howard","Fantasy","en"
"3646",1557,"until they passed away behind the yew-trees, appeared again upon the","Men of Iron","Pyle, Howard","Fantasy","en"
"3647",1557,"terrace behind, entered the open doors of the women's house, and were","Men of Iron","Pyle, Howard","Fantasy","en"
"3648",1557,"gone. Myles heard their footsteps growing fainter and fainter, but he","Men of Iron","Pyle, Howard","Fantasy","en"
"3649",1557,"never raised his eyes. Upon the ground at his feet were four pebbles,","Men of Iron","Pyle, Howard","Fantasy","en"
"3650",1557,"and he noticed how they almost made a square, and would do so if he","Men of Iron","Pyle, Howard","Fantasy","en"
"3651",1557,"pushed one of them with his toe, and then it seemed strange to him that","Men of Iron","Pyle, Howard","Fantasy","en"
"3652",1557,"he should think of such a little foolish thing at that dreadful time.","Men of Iron","Pyle, Howard","Fantasy","en"
"3653",1557,"","Men of Iron","Pyle, Howard","Fantasy","en"
"3654",1557,"He knew that the Earl was looking gloomily at him, and that his face","Men of Iron","Pyle, Howard","Fantasy","en"
"3655",1557,"must be very pale. Suddenly Lord Mackworth spoke. ""What hast thou to","Men of Iron","Pyle, Howard","Fantasy","en"
"3656",1557,"say?"" said he, harshly.","Men of Iron","Pyle, Howard","Fantasy","en"
"3657",1557,"","Men of Iron","Pyle, Howard","Fantasy","en"
"3658",1557,"Then Myles raised his eyes, and the Earl smiled grimly as he looked his","Men of Iron","Pyle, Howard","Fantasy","en"
"3659",1557,"victim over. ""I have naught to say,"" said the lad, huskily.","Men of Iron","Pyle, Howard","Fantasy","en"
"3660",1557,"","Men of Iron","Pyle, Howard","Fantasy","en"
"3661",1557,"""Didst thou not hear what my daughter spake but now?"" said the Earl.","Men of Iron","Pyle, Howard","Fantasy","en"
"3662",1557,"""She said that thou came not of thy own free-will; what sayst thou to","Men of Iron","Pyle, Howard","Fantasy","en"
"3663",1557,"that, sirrah--is it true?""","Men of Iron","Pyle, Howard","Fantasy","en"
"3664",1557,"","Men of Iron","Pyle, Howard","Fantasy","en"
"3665",1557,"Myles hesitated for a moment or two; his throat was tight and dry.","Men of Iron","Pyle, Howard","Fantasy","en"
"3666",1557,"""Nay,"" said he at last, ""she belieth herself. It was I who first came","Men of Iron","Pyle, Howard","Fantasy","en"
"3667",1557,"into the garden. I fell by chance from the tree yonder--I was seeking","Men of Iron","Pyle, Howard","Fantasy","en"
"3668",1557,"a ball--then I asked those two if I might not come hither again, and so","Men of Iron","Pyle, Howard","Fantasy","en"
"3669",1557,"have done some several times in all. But as for her--nay; it was not at","Men of Iron","Pyle, Howard","Fantasy","en"
"3670",1557,"her bidding that I came, but through mine own asking.""","Men of Iron","Pyle, Howard","Fantasy","en"
"3671",1557,"","Men of Iron","Pyle, Howard","Fantasy","en"
"3672",1557,"The Earl gave a little grunt in his throat. ""And how often hast thou","Men of Iron","Pyle, Howard","Fantasy","en"
"3673",1557,"been here?"" said he, presently.","Men of Iron","Pyle, Howard","Fantasy","en"
"3674",1557,"","Men of Iron","Pyle, Howard","Fantasy","en"
"3675",1557,"Myles thought a moment or two. ""This maketh the seventh time,"" said he.","Men of Iron","Pyle, Howard","Fantasy","en"
"3676",1557,"","Men of Iron","Pyle, Howard","Fantasy","en"
"3677",1557,"Another pause of silence followed, and Myles began to pluck up some","Men of Iron","Pyle, Howard","Fantasy","en"
"3678",1557,"heart that maybe all would yet be well. The Earl's next speech dashed","Men of Iron","Pyle, Howard","Fantasy","en"
"3679",1557,"that hope into a thousand fragments. ""Well thou knowest,"" said he, ""that","Men of Iron","Pyle, Howard","Fantasy","en"
"3680",1557,"it is forbid for any to come here. Well thou knowest that twice have men","Men of Iron","Pyle, Howard","Fantasy","en"
"3681",1557,"been punished for this thing that thou hast done, and yet thou camest in","Men of Iron","Pyle, Howard","Fantasy","en"
"3682",1557,"spite of all. Now dost thou know what thou wilt suffer?""","Men of Iron","Pyle, Howard","Fantasy","en"
"3683",1557,"","Men of Iron","Pyle, Howard","Fantasy","en"
"3684",1557,"Myles picked with nervous fingers at a crack in the oaken post against","Men of Iron","Pyle, Howard","Fantasy","en"
"3685",1557,"which he leaned. ""Mayhap thou wilt kill me,"" said he at last, in a dull,","Men of Iron","Pyle, Howard","Fantasy","en"
"3686",1557,"choking voice.","Men of Iron","Pyle, Howard","Fantasy","en"
"3687",1557,"","Men of Iron","Pyle, Howard","Fantasy","en"
"3688",1557,"Again the Earl smiled a grim smile. ""Nay,"" said he, ""I would not slay","Men of Iron","Pyle, Howard","Fantasy","en"
"3689",1557,"thee, for thou hast gentle blood. But what sayest thou should I shear","Men of Iron","Pyle, Howard","Fantasy","en"
"3690",1557,"thine ears from thine head, or perchance have thee scourged in the great","Men of Iron","Pyle, Howard","Fantasy","en"
"3691",1557,"court?""","Men of Iron","Pyle, Howard","Fantasy","en"
"3692",1557,"","Men of Iron","Pyle, Howard","Fantasy","en"
"3693",1557,"The sting of the words sent the blood flying back to Myles's face again,","Men of Iron","Pyle, Howard","Fantasy","en"
"3694",1557,"and he looked quickly up. ""Nay,"" said he, with a boldness that surprised","Men of Iron","Pyle, Howard","Fantasy","en"
"3695",1557,"himself; ""thou shalt do no such unlordly thing upon me as that. I be thy","Men of Iron","Pyle, Howard","Fantasy","en"
"3696",1557,"peer, sir, in blood; and though thou mayst kill me, thou hast no right","Men of Iron","Pyle, Howard","Fantasy","en"
"3697",1557,"to shame me.""","Men of Iron","Pyle, Howard","Fantasy","en"
"3698",1557,"","Men of Iron","Pyle, Howard","Fantasy","en"
"3699",1557,"Lord Mackworth bowed with a mocking courtesy. ""Marry!"" said he.","Men of Iron","Pyle, Howard","Fantasy","en"
"3700",1557,"""Methought it was one of mine own saucy popinjay squires that I caught","Men of Iron","Pyle, Howard","Fantasy","en"
"3701",1557,"sneaking here and talking to those two foolish young lasses, and lo! it","Men of Iron","Pyle, Howard","Fantasy","en"
"3702",1557,"is a young Lord--or mayhap thou art a young Prince--and commandeth","Men of Iron","Pyle, Howard","Fantasy","en"
"3703",1557,"me that I shall not do this and I shall not do that. I crave your","Men of Iron","Pyle, Howard","Fantasy","en"
"3704",1557,"Lordship's honorable pardon, if I have said aught that may have galled","Men of Iron","Pyle, Howard","Fantasy","en"
"3705",1557,"you.""","Men of Iron","Pyle, Howard","Fantasy","en"
"3706",1557,"","Men of Iron","Pyle, Howard","Fantasy","en"
"3707",1557,"The fear Myles had felt was now beginning to dissolve in rising wrath.","Men of Iron","Pyle, Howard","Fantasy","en"
"3708",1557,"""Nay,"" said he, stoutly, ""I be no Lord and I be no Prince, but I be as","Men of Iron","Pyle, Howard","Fantasy","en"
"3709",1557,"good as thou. For am I not the son of thy onetime very true comrade and","Men of Iron","Pyle, Howard","Fantasy","en"
"3710",1557,"thy kinsman--to wit, the Lord Falworth, whom, as thou knowest, is poor","Men of Iron","Pyle, Howard","Fantasy","en"
"3711",1557,"and broken, and blind, and helpless, and outlawed, and banned? Yet,""","Men of Iron","Pyle, Howard","Fantasy","en"
"3712",1557,"cried he, grinding his teeth, as the thought of it all rushed in upon","Men of Iron","Pyle, Howard","Fantasy","en"
"3713",1557,"him, ""I would rather be in his place than in yours; for though he be","Men of Iron","Pyle, Howard","Fantasy","en"
"3714",1557,"ruined, you--""","Men of Iron","Pyle, Howard","Fantasy","en"
"3715",1557,"","Men of Iron","Pyle, Howard","Fantasy","en"
"3716",1557,"He had just sense enough to stop there.","Men of Iron","Pyle, Howard","Fantasy","en"
"3717",1557,"","Men of Iron","Pyle, Howard","Fantasy","en"
"3718",1557,"The Earl, gripping his staff behind his back, and with his head a little","Men of Iron","Pyle, Howard","Fantasy","en"
"3719",1557,"bent, was looking keenly at the lad from under his shaggy gray brows.","Men of Iron","Pyle, Howard","Fantasy","en"
"3720",1557,"""Well,"" said he, as Myles stopped, ""thou hast gone too far now to draw","Men of Iron","Pyle, Howard","Fantasy","en"
"3721",1557,"back. Say thy say to the end. Why wouldst thou rather be in thy father's","Men of Iron","Pyle, Howard","Fantasy","en"
"3722",1557,"stead than in mine?""","Men of Iron","Pyle, Howard","Fantasy","en"
"3723",1557,"","Men of Iron","Pyle, Howard","Fantasy","en"
"3724",1557,"Myles did not answer.","Men of Iron","Pyle, Howard","Fantasy","en"
"3725",1557,"","Men of Iron","Pyle, Howard","Fantasy","en"
"3726",1557,"""Thou shalt finish thy speech, or else show thyself a coward. Though thy","Men of Iron","Pyle, Howard","Fantasy","en"
"3727",1557,"father is ruined, thou didst say I am--what?""","Men of Iron","Pyle, Howard","Fantasy","en"
"3728",1557,"","Men of Iron","Pyle, Howard","Fantasy","en"
"3729",1557,"Myles keyed himself up to the effort, and then blurted out, ""Thou art","Men of Iron","Pyle, Howard","Fantasy","en"
"3730",1557,"attainted with shame.""","Men of Iron","Pyle, Howard","Fantasy","en"
"3731",1557,"","Men of Iron","Pyle, Howard","Fantasy","en"
"3732",1557,"A long breathless silence followed.","Men of Iron","Pyle, Howard","Fantasy","en"
"3733",1557,"","Men of Iron","Pyle, Howard","Fantasy","en"
"3734",1557,"""Myles Falworth,"" said the Earl at last (and even in the whirling of his","Men of Iron","Pyle, Howard","Fantasy","en"
"3735",1557,"wits Myles wondered that he had the name so pat)--""Myles Falworth, of","Men of Iron","Pyle, Howard","Fantasy","en"
"3736",1557,"all the bold, mad, hare-brained fools, thou art the most foolish. How","Men of Iron","Pyle, Howard","Fantasy","en"
"3737",1557,"dost thou dare say such words to me? Dost thou not know that thou makest","Men of Iron","Pyle, Howard","Fantasy","en"
"3738",1557,"thy coming punishment ten times more bitter by such a speech?""","Men of Iron","Pyle, Howard","Fantasy","en"
"3739",1557,"","Men of Iron","Pyle, Howard","Fantasy","en"
"3740",1557,"""Aye!"" cried Myles, desperately; ""but what else could I do? An I did not","Men of Iron","Pyle, Howard","Fantasy","en"
"3741",1557,"say the words, thou callest me coward, and coward I am not.""","Men of Iron","Pyle, Howard","Fantasy","en"
"3742",1557,"","Men of Iron","Pyle, Howard","Fantasy","en"
"3743",1557,"""By 'r Lady!"" said the Earl, ""I do believe thee. Thou art a bold,","Men of Iron","Pyle, Howard","Fantasy","en"
"3744",1557,"impudent varlet as ever lived--to beard me so, forsooth! Hark'ee; thou","Men of Iron","Pyle, Howard","Fantasy","en"
"3745",1557,"sayst I think naught of mine old comrade. I will show thee that thou","Men of Iron","Pyle, Howard","Fantasy","en"
"3746",1557,"dost belie me. I will suffer what thou hast said to me for his sake, and","Men of Iron","Pyle, Howard","Fantasy","en"
"3747",1557,"for his sake will forgive thee thy coming hither--which I would not do","Men of Iron","Pyle, Howard","Fantasy","en"
"3748",1557,"in another case to any other man. Now get thee gone straightway, and","Men of Iron","Pyle, Howard","Fantasy","en"
"3749",1557,"come hither no more. Yonder is the postern-gate; mayhap thou knowest the","Men of Iron","Pyle, Howard","Fantasy","en"
"3750",1557,"way. But stay! How camest thou hither?""","Men of Iron","Pyle, Howard","Fantasy","en"
"3751",1557,"","Men of Iron","Pyle, Howard","Fantasy","en"
"3752",1557,"Myles told him of the spikes he had driven in the wall, and the Earl","Men of Iron","Pyle, Howard","Fantasy","en"
"3753",1557,"listened, stroking his beard. When the lad had ended, he fixed a sharp","Men of Iron","Pyle, Howard","Fantasy","en"
"3754",1557,"look upon him. ""But thou drove not those spikes alone,"" said he; ""who","Men of Iron","Pyle, Howard","Fantasy","en"
"3755",1557,"helped thee do it?""","Men of Iron","Pyle, Howard","Fantasy","en"
"3756",1557,"","Men of Iron","Pyle, Howard","Fantasy","en"
"3757",1557,"""That I may not tell,"" said Myles, firmly.","Men of Iron","Pyle, Howard","Fantasy","en"
"3758",1557,"","Men of Iron","Pyle, Howard","Fantasy","en"
"3759",1557,"""So be it,"" said the Earl. ""I will not ask thee to tell his name. Now","Men of Iron","Pyle, Howard","Fantasy","en"
"3760",1557,"get thee gone! And as for those spikes, thou mayst e'en knock them out","Men of Iron","Pyle, Howard","Fantasy","en"
"3761",1557,"of the wall, sin thou drave them in. Play no more pranks an thou wouldst","Men of Iron","Pyle, Howard","Fantasy","en"
"3762",1557,"keep thy skin whole. And now go, I say!""","Men of Iron","Pyle, Howard","Fantasy","en"
"3763",1557,"","Men of Iron","Pyle, Howard","Fantasy","en"
"3764",1557,"Myles needed no further bidding, but turned and left the Earl without","Men of Iron","Pyle, Howard","Fantasy","en"
"3765",1557,"another word. As he went out the postern-gate he looked over his","Men of Iron","Pyle, Howard","Fantasy","en"
"3766",1557,"shoulder, and saw the tall figure, in its long fur-trimmed gown, still","Men of Iron","Pyle, Howard","Fantasy","en"
"3767",1557,"standing in the middle of the path, looking after him from under the","Men of Iron","Pyle, Howard","Fantasy","en"
"3768",1557,"shaggy eyebrows.","Men of Iron","Pyle, Howard","Fantasy","en"
"3769",1557,"","Men of Iron","Pyle, Howard","Fantasy","en"
"3770",1557,"As he ran across the quadrangle, his heart still fluttering in his","Men of Iron","Pyle, Howard","Fantasy","en"
"3771",1557,"breast, he muttered to himself, ""The old grizzle-beard; an I had not","Men of Iron","Pyle, Howard","Fantasy","en"
"3772",1557,"faced him a bold front, mayhap he would have put such shame upon me","Men of Iron","Pyle, Howard","Fantasy","en"
"3773",1557,"as he said. I wonder why he stood so staring after me as I left the","Men of Iron","Pyle, Howard","Fantasy","en"
"3774",1557,"garden.""","Men of Iron","Pyle, Howard","Fantasy","en"
"3775",1557,"","Men of Iron","Pyle, Howard","Fantasy","en"
"3776",1557,"Then for the time the matter slipped from his mind, saving only that","Men of Iron","Pyle, Howard","Fantasy","en"
"3777",1557,"part that smacked of adventure.","Men of Iron","Pyle, Howard","Fantasy","en"
"3778",1557,"","Men of Iron","Pyle, Howard","Fantasy","en"
"3779",1557,"","Men of Iron","Pyle, Howard","Fantasy","en"
"3780",1557,"","Men of Iron","Pyle, Howard","Fantasy","en"
"3781",1557,"CHAPTER 20","Men of Iron","Pyle, Howard","Fantasy","en"
"3782",1557,"","Men of Iron","Pyle, Howard","Fantasy","en"
"3783",1557,"So for a little while Myles was disposed to congratulate himself upon","Men of Iron","Pyle, Howard","Fantasy","en"
"3784",1557,"having come off so well from his adventure with the Earl. But after a","Men of Iron","Pyle, Howard","Fantasy","en"
"3785",1557,"day or two had passed, and he had time for second thought, he began to","Men of Iron","Pyle, Howard","Fantasy","en"
"3786",1557,"misdoubt whether, after all, he might not have carried it with a better","Men of Iron","Pyle, Howard","Fantasy","en"
"3787",1557,"air if he had shown more chivalrous boldness in the presence of his true","Men of Iron","Pyle, Howard","Fantasy","en"
"3788",1557,"lady; whether it would not have redounded more to his credit if he had","Men of Iron","Pyle, Howard","Fantasy","en"
"3789",1557,"in some way asserted his rights as the young dame's knight-errant and","Men of Iron","Pyle, Howard","Fantasy","en"
"3790",1557,"defender. Was it not ignominious to resign his rights and privileges so","Men of Iron","Pyle, Howard","Fantasy","en"
"3791",1557,"easily and tamely at a signal from the Earl?","Men of Iron","Pyle, Howard","Fantasy","en"
"3792",1557,"","Men of Iron","Pyle, Howard","Fantasy","en"
"3793",1557,"""For, in sooth,"" said he to Gascoyne, as the two talked the matter over,","Men of Iron","Pyle, Howard","Fantasy","en"
"3794",1557,"""she hath, in a certain way, accepted me for her knight, and yet I stood","Men of Iron","Pyle, Howard","Fantasy","en"
"3795",1557,"me there without saying so much as one single word in her behalf.""","Men of Iron","Pyle, Howard","Fantasy","en"
"3796",1557,"","Men of Iron","Pyle, Howard","Fantasy","en"
"3797",1557,"""Nay,"" said Gascoyne, ""I would not trouble me on that score. Methinks","Men of Iron","Pyle, Howard","Fantasy","en"
"3798",1557,"that thou didst come off wondrous well out of the business. I would not","Men of Iron","Pyle, Howard","Fantasy","en"
"3799",1557,"have thought it possible that my Lord could ha' been so patient with","Men of Iron","Pyle, Howard","Fantasy","en"
"3800",1557,"thee as he showed himself. Methinks, forsooth, he must hold thee privily","Men of Iron","Pyle, Howard","Fantasy","en"
"3801",1557,"in right high esteem.""","Men of Iron","Pyle, Howard","Fantasy","en"
"3802",1557,"","Men of Iron","Pyle, Howard","Fantasy","en"
"3803",1557,"""Truly,"" said Myles, after a little pause of meditative silence, ""I know","Men of Iron","Pyle, Howard","Fantasy","en"
"3804",1557,"not of any esteem, yet I do think he was passing patient with me in this","Men of Iron","Pyle, Howard","Fantasy","en"
"3805",1557,"matter. But ne'theless, Francis, that changeth not my stand in the case.","Men of Iron","Pyle, Howard","Fantasy","en"
"3806",1557,"Yea, I did shamefully, so to resign my lady without speaking one word;","Men of Iron","Pyle, Howard","Fantasy","en"
"3807",1557,"nor will I so resign her even yet. I have bethought me much of this","Men of Iron","Pyle, Howard","Fantasy","en"
"3808",1557,"matter of late, Francis, and now I come to thee to help me from my evil","Men of Iron","Pyle, Howard","Fantasy","en"
"3809",1557,"case. I would have thee act the part of a true friend to me--like that","Men of Iron","Pyle, Howard","Fantasy","en"
"3810",1557,"one I have told thee of in the story of the Emperor Justinian. I would","Men of Iron","Pyle, Howard","Fantasy","en"
"3811",1557,"have thee, when next thou servest in the house, to so contrive that my","Men of Iron","Pyle, Howard","Fantasy","en"
"3812",1557,"Lady Alice shall get a letter which I shall presently write, and wherein","Men of Iron","Pyle, Howard","Fantasy","en"
"3813",1557,"I may set all that is crooked straight again.""","Men of Iron","Pyle, Howard","Fantasy","en"
"3814",1557,"","Men of Iron","Pyle, Howard","Fantasy","en"
"3815",1557,"""Heaven forbid,"" said Gascoyne, hastily, ""that I should be such a fool","Men of Iron","Pyle, Howard","Fantasy","en"
"3816",1557,"as to burn my fingers in drawing thy nuts from the fire! Deliver thy","Men of Iron","Pyle, Howard","Fantasy","en"
"3817",1557,"letter thyself, good fellow!""","Men of Iron","Pyle, Howard","Fantasy","en"
"3818",1557,"","Men of Iron","Pyle, Howard","Fantasy","en"
"3819",1557,"So spoke Gascoyne, yet after all he ended, as he usually did, by","Men of Iron","Pyle, Howard","Fantasy","en"
"3820",1557,"yielding to Myles's superior will and persistence. So the letter was","Men of Iron","Pyle, Howard","Fantasy","en"
"3821",1557,"written and one day the good-natured Gascoyne carried it with him to the","Men of Iron","Pyle, Howard","Fantasy","en"
"3822",1557,"house, and the opportunity offering, gave it to one of the young ladies","Men of Iron","Pyle, Howard","Fantasy","en"
"3823",1557,"attendant upon the Countess's family--a lass with whom he had friendly","Men of Iron","Pyle, Howard","Fantasy","en"
"3824",1557,"intimacy--to be delivered to Lady Alice.","Men of Iron","Pyle, Howard","Fantasy","en"
"3825",1557,"","Men of Iron","Pyle, Howard","Fantasy","en"
"3826",1557,"But if Myles congratulated himself upon the success of this new","Men of Iron","Pyle, Howard","Fantasy","en"
"3827",1557,"adventure, it was not for long. That night, as the crowd of pages and","Men of Iron","Pyle, Howard","Fantasy","en"
"3828",1557,"squires were making themselves ready for bed, the call came through the","Men of Iron","Pyle, Howard","Fantasy","en"
"3829",1557,"uproar for ""Myles Falworth! Myles Falworth!""","Men of Iron","Pyle, Howard","Fantasy","en"
"3830",1557,"","Men of Iron","Pyle, Howard","Fantasy","en"
"3831",1557,"""Here I be,"" cried Myles, standing up on his cot. ""Who calleth me?""","Men of Iron","Pyle, Howard","Fantasy","en"
"3832",1557,"","Men of Iron","Pyle, Howard","Fantasy","en"
"3833",1557,"It was the groom of the Earl's bedchamber, and seeing Myles standing","Men of Iron","Pyle, Howard","Fantasy","en"
