"","gutenberg_id","text","title","author","gutenberg_bookshelf","language"
"1",1557,"MEN OF IRON","Men of Iron","Pyle, Howard","Fantasy","en"
"2",1557,"","Men of Iron","Pyle, Howard","Fantasy","en"
"3",1557,"by Howard Pyle","Men of Iron","Pyle, Howard","Fantasy","en"
"4",1557,"","Men of Iron","Pyle, Howard","Fantasy","en"
"5",1557,"","Men of Iron","Pyle, Howard","Fantasy","en"
"6",1557,"","Men of Iron","Pyle, Howard","Fantasy","en"
"7",1557,"","Men of Iron","Pyle, Howard","Fantasy","en"
"8",1557,"INTRODUCTION","Men of Iron","Pyle, Howard","Fantasy","en"
"9",1557,"","Men of Iron","Pyle, Howard","Fantasy","en"
"10",1557,"The year 1400 opened with more than usual peacefulness in England. Only","Men of Iron","Pyle, Howard","Fantasy","en"
"11",1557,"a few months before, Richard II--weak, wicked, and treacherous--had been","Men of Iron","Pyle, Howard","Fantasy","en"
"12",1557,"dethroned, and Henry IV declared King in his stead. But it was only a","Men of Iron","Pyle, Howard","Fantasy","en"
"13",1557,"seeming peacefulness, lasting but for a little while; for though King","Men of Iron","Pyle, Howard","Fantasy","en"
"14",1557,"Henry proved himself a just and a merciful man--as justice and mercy","Men of Iron","Pyle, Howard","Fantasy","en"
"15",1557,"went with the men of iron of those days--and though he did not care","Men of Iron","Pyle, Howard","Fantasy","en"
"16",1557,"to shed blood needlessly, there were many noble families who had been","Men of Iron","Pyle, Howard","Fantasy","en"
"17",1557,"benefited by King Richard during his reign, and who had lost somewhat of","Men of Iron","Pyle, Howard","Fantasy","en"
"18",1557,"their power and prestige from the coming in of the new King.","Men of Iron","Pyle, Howard","Fantasy","en"
"19",1557,"","Men of Iron","Pyle, Howard","Fantasy","en"
"20",1557,"Among these were a number of great lords--the Dukes of Albemarle,","Men of Iron","Pyle, Howard","Fantasy","en"
"21",1557,"Surrey, and Exeter, the Marquis of Dorset, the Earl of Gloucester, and","Men of Iron","Pyle, Howard","Fantasy","en"
"22",1557,"others--who had been degraded to their former titles and estates, from","Men of Iron","Pyle, Howard","Fantasy","en"
"23",1557,"which King Richard had lifted them. These and others brewed a secret","Men of Iron","Pyle, Howard","Fantasy","en"
"24",1557,"plot to take King Henry's life, which plot might have succeeded had not","Men of Iron","Pyle, Howard","Fantasy","en"
"25",1557,"one of their own number betrayed them.","Men of Iron","Pyle, Howard","Fantasy","en"
"26",1557,"","Men of Iron","Pyle, Howard","Fantasy","en"
"27",1557,"Their plan had been to fall upon the King and his adherents, and to","Men of Iron","Pyle, Howard","Fantasy","en"
"28",1557,"massacre them during a great tournament, to be held at Oxford. But Henry","Men of Iron","Pyle, Howard","Fantasy","en"
"29",1557,"did not appear at the lists; whereupon, knowing that he had been lodging","Men of Iron","Pyle, Howard","Fantasy","en"
"30",1557,"at Windsor with only a few attendants, the conspirators marched thither","Men of Iron","Pyle, Howard","Fantasy","en"
"31",1557,"against him. In the mean time the King had been warned of the plot,","Men of Iron","Pyle, Howard","Fantasy","en"
"32",1557,"so that, instead of finding him in the royal castle, they discovered","Men of Iron","Pyle, Howard","Fantasy","en"
"33",1557,"through their scouts that he had hurried to London, whence he was","Men of Iron","Pyle, Howard","Fantasy","en"
"34",1557,"even then marching against them at the head of a considerable army. So","Men of Iron","Pyle, Howard","Fantasy","en"
"35",1557,"nothing was left them but flight. Some betook themselves one way, some","Men of Iron","Pyle, Howard","Fantasy","en"
"36",1557,"another; some sought sanctuary here, some there; but one and another,","Men of Iron","Pyle, Howard","Fantasy","en"
"37",1557,"they were all of them caught and killed.","Men of Iron","Pyle, Howard","Fantasy","en"
"38",1557,"","Men of Iron","Pyle, Howard","Fantasy","en"
"39",1557,"The Earl of Kent--one time Duke of Surrey--and the Earl of","Men of Iron","Pyle, Howard","Fantasy","en"
"40",1557,"Salisbury were beheaded in the market-place at Cirencester; Lord Le","Men of Iron","Pyle, Howard","Fantasy","en"
"41",1557,"Despencer--once the Earl of Gloucester--and Lord Lumley met the same","Men of Iron","Pyle, Howard","Fantasy","en"
"42",1557,"fate at Bristol; the Earl of Huntingdon was taken in the Essex fens,","Men of Iron","Pyle, Howard","Fantasy","en"
"43",1557,"carried to the castle of the Duke of Gloucester, whom he had betrayed","Men of Iron","Pyle, Howard","Fantasy","en"
"44",1557,"to his death in King Richard's time, and was there killed by the castle","Men of Iron","Pyle, Howard","Fantasy","en"
"45",1557,"people. Those few who found friends faithful and bold enough to afford","Men of Iron","Pyle, Howard","Fantasy","en"
"46",1557,"them shelter, dragged those friends down in their own ruin.","Men of Iron","Pyle, Howard","Fantasy","en"
"47",1557,"","Men of Iron","Pyle, Howard","Fantasy","en"
"48",1557,"Just such a case was that of the father of the boy hero of this","Men of Iron","Pyle, Howard","Fantasy","en"
"49",1557,"story, the blind Lord Gilbert Reginald Falworth, Baron of Falworth and","Men of Iron","Pyle, Howard","Fantasy","en"
"50",1557,"Easterbridge, who, though having no part in the plot, suffered through","Men of Iron","Pyle, Howard","Fantasy","en"
"51",1557,"it ruin, utter and complete.","Men of Iron","Pyle, Howard","Fantasy","en"
"52",1557,"","Men of Iron","Pyle, Howard","Fantasy","en"
"53",1557,"He had been a faithful counsellor and adviser to King Richard, and","Men of Iron","Pyle, Howard","Fantasy","en"
"54",1557,"perhaps it was this, as much and more than his roundabout connection","Men of Iron","Pyle, Howard","Fantasy","en"
"55",1557,"with the plot, that brought upon him the punishment he suffered.","Men of Iron","Pyle, Howard","Fantasy","en"
"56",1557,"","Men of Iron","Pyle, Howard","Fantasy","en"
"57",1557,"","Men of Iron","Pyle, Howard","Fantasy","en"
"58",1557,"","Men of Iron","Pyle, Howard","Fantasy","en"
"59",1557,"CHAPTER 1","Men of Iron","Pyle, Howard","Fantasy","en"
"60",1557,"","Men of Iron","Pyle, Howard","Fantasy","en"
"61",1557,"Myles Falworth was but eight years of age at that time, and it was only","Men of Iron","Pyle, Howard","Fantasy","en"
"62",1557,"afterwards, and when he grew old enough to know more of the ins and outs","Men of Iron","Pyle, Howard","Fantasy","en"
"63",1557,"of the matter, that he could remember by bits and pieces the things that","Men of Iron","Pyle, Howard","Fantasy","en"
"64",1557,"afterwards happened; how one evening a knight came clattering into the","Men of Iron","Pyle, Howard","Fantasy","en"
"65",1557,"court-yard upon a horse, red-nostrilled and smeared with the sweat and","Men of Iron","Pyle, Howard","Fantasy","en"
"66",1557,"foam of a desperate ride--Sir John Dale, a dear friend of the blind","Men of Iron","Pyle, Howard","Fantasy","en"
"67",1557,"Lord.","Men of Iron","Pyle, Howard","Fantasy","en"
"68",1557,"","Men of Iron","Pyle, Howard","Fantasy","en"
"69",1557,"Even though so young, Myles knew that something very serious had","Men of Iron","Pyle, Howard","Fantasy","en"
"70",1557,"happened to make Sir John so pale and haggard, and he dimly remembered","Men of Iron","Pyle, Howard","Fantasy","en"
"71",1557,"leaning against the knight's iron-covered knees, looking up into his","Men of Iron","Pyle, Howard","Fantasy","en"
"72",1557,"gloomy face, and asking him if he was sick to look so strange. Thereupon","Men of Iron","Pyle, Howard","Fantasy","en"
"73",1557,"those who had been too troubled before to notice him, bethought","Men of Iron","Pyle, Howard","Fantasy","en"
"74",1557,"themselves of him, and sent him to bed, rebellious at having to go so","Men of Iron","Pyle, Howard","Fantasy","en"
"75",1557,"early.","Men of Iron","Pyle, Howard","Fantasy","en"
"76",1557,"","Men of Iron","Pyle, Howard","Fantasy","en"
"77",1557,"He remembered how the next morning, looking out of a window high up","Men of Iron","Pyle, Howard","Fantasy","en"
"78",1557,"under the eaves, he saw a great troop of horsemen come riding into the","Men of Iron","Pyle, Howard","Fantasy","en"
"79",1557,"courtyard beneath, where a powdering of snow had whitened everything,","Men of Iron","Pyle, Howard","Fantasy","en"
"80",1557,"and of how the leader, a knight clad in black armor, dismounted and","Men of Iron","Pyle, Howard","Fantasy","en"
"81",1557,"entered the great hall door-way below, followed by several of the band.","Men of Iron","Pyle, Howard","Fantasy","en"
"82",1557,"","Men of Iron","Pyle, Howard","Fantasy","en"
"83",1557,"He remembered how some of the castle women were standing in a frightened","Men of Iron","Pyle, Howard","Fantasy","en"
"84",1557,"group upon the landing of the stairs, talking together in low voices","Men of Iron","Pyle, Howard","Fantasy","en"
"85",1557,"about a matter he did not understand, excepting that the armed men who","Men of Iron","Pyle, Howard","Fantasy","en"
"86",1557,"had ridden into the courtyard had come for Sir John Dale. None of the","Men of Iron","Pyle, Howard","Fantasy","en"
"87",1557,"women paid any attention to him; so, shunning their notice, he ran off","Men of Iron","Pyle, Howard","Fantasy","en"
"88",1557,"down the winding stairs, expecting every moment to be called back again","Men of Iron","Pyle, Howard","Fantasy","en"
"89",1557,"by some one of them.","Men of Iron","Pyle, Howard","Fantasy","en"
"90",1557,"","Men of Iron","Pyle, Howard","Fantasy","en"
"91",1557,"A crowd of castle people, all very serious and quiet, were gathered","Men of Iron","Pyle, Howard","Fantasy","en"
"92",1557,"in the hall, where a number of strange men-at-arms lounged upon the","Men of Iron","Pyle, Howard","Fantasy","en"
"93",1557,"benches, while two billmen in steel caps and leathern jacks stood","Men of Iron","Pyle, Howard","Fantasy","en"
"94",1557,"guarding the great door, the butts of their weapons resting upon the","Men of Iron","Pyle, Howard","Fantasy","en"
"95",1557,"ground, and the staves crossed, barring the door-way.","Men of Iron","Pyle, Howard","Fantasy","en"
"96",1557,"","Men of Iron","Pyle, Howard","Fantasy","en"
"97",1557,"In the anteroom was the knight in black armor whom Myles had seen from","Men of Iron","Pyle, Howard","Fantasy","en"
"98",1557,"the window. He was sitting at the table, his great helmet lying upon","Men of Iron","Pyle, Howard","Fantasy","en"
"99",1557,"the bench beside him, and a quart beaker of spiced wine at his elbow. A","Men of Iron","Pyle, Howard","Fantasy","en"
"100",1557,"clerk sat at the other end of the same table, with inkhorn in one hand","Men of Iron","Pyle, Howard","Fantasy","en"
"101",1557,"and pen in the other, and a parchment spread in front of him.","Men of Iron","Pyle, Howard","Fantasy","en"
"102",1557,"","Men of Iron","Pyle, Howard","Fantasy","en"
"103",1557,"Master Robert, the castle steward, stood before the knight, who every","Men of Iron","Pyle, Howard","Fantasy","en"
"104",1557,"now and then put to him a question, which the other would answer, and","Men of Iron","Pyle, Howard","Fantasy","en"
"105",1557,"the clerk write the answer down upon the parchment.","Men of Iron","Pyle, Howard","Fantasy","en"
"106",1557,"","Men of Iron","Pyle, Howard","Fantasy","en"
"107",1557,"His father stood with his back to the fireplace, looking down upon the","Men of Iron","Pyle, Howard","Fantasy","en"
"108",1557,"floor with his blind eyes, his brows drawn moodily together, and the","Men of Iron","Pyle, Howard","Fantasy","en"
"109",1557,"scar of the great wound that he had received at the tournament at","Men of Iron","Pyle, Howard","Fantasy","en"
"110",1557,"York--the wound that had made him blind--showing red across his","Men of Iron","Pyle, Howard","Fantasy","en"
"111",1557,"forehead, as it always did when he was angered or troubled.","Men of Iron","Pyle, Howard","Fantasy","en"
"112",1557,"","Men of Iron","Pyle, Howard","Fantasy","en"
"113",1557,"There was something about it all that frightened Myles, who crept to his","Men of Iron","Pyle, Howard","Fantasy","en"
"114",1557,"father's side, and slid his little hand into the palm that hung limp and","Men of Iron","Pyle, Howard","Fantasy","en"
"115",1557,"inert. In answer to the touch, his father grasped the hand tightly,","Men of Iron","Pyle, Howard","Fantasy","en"
"116",1557,"but did not seem otherwise to notice that he was there. Neither did","Men of Iron","Pyle, Howard","Fantasy","en"
"117",1557,"the black knight pay any attention to him, but continued putting his","Men of Iron","Pyle, Howard","Fantasy","en"
"118",1557,"questions to Master Robert.","Men of Iron","Pyle, Howard","Fantasy","en"
"119",1557,"","Men of Iron","Pyle, Howard","Fantasy","en"
"120",1557,"Then, suddenly, there was a commotion in the hall without, loud voices,","Men of Iron","Pyle, Howard","Fantasy","en"
"121",1557,"and a hurrying here and there. The black knight half arose, grasping a","Men of Iron","Pyle, Howard","Fantasy","en"
"122",1557,"heavy iron mace that lay upon the bench beside him, and the next moment","Men of Iron","Pyle, Howard","Fantasy","en"
"123",1557,"Sir John Dale himself, as pale as death, walked into the antechamber. He","Men of Iron","Pyle, Howard","Fantasy","en"
"124",1557,"stopped in the very middle of the room. ""I yield me to my Lord's grace","Men of Iron","Pyle, Howard","Fantasy","en"
"125",1557,"and mercy,"" said he to the black knight, and they were the last words he","Men of Iron","Pyle, Howard","Fantasy","en"
"126",1557,"ever uttered in this world.","Men of Iron","Pyle, Howard","Fantasy","en"
"127",1557,"","Men of Iron","Pyle, Howard","Fantasy","en"
"128",1557,"The black knight shouted out some words of command, and swinging up the","Men of Iron","Pyle, Howard","Fantasy","en"
"129",1557,"iron mace in his hand, strode forward clanking towards Sir John, who","Men of Iron","Pyle, Howard","Fantasy","en"
"130",1557,"raised his arm as though to shield himself from the blow. Two or three","Men of Iron","Pyle, Howard","Fantasy","en"
"131",1557,"of those who stood in the hall without came running into the room with","Men of Iron","Pyle, Howard","Fantasy","en"
"132",1557,"drawn swords and bills, and little Myles, crying out with terror, hid","Men of Iron","Pyle, Howard","Fantasy","en"
"133",1557,"his face in his father's long gown.","Men of Iron","Pyle, Howard","Fantasy","en"
"134",1557,"","Men of Iron","Pyle, Howard","Fantasy","en"
"135",1557,"The next instant came the sound of a heavy blow and of a groan, then","Men of Iron","Pyle, Howard","Fantasy","en"
"136",1557,"another blow and the sound of one falling upon the ground. Then the","Men of Iron","Pyle, Howard","Fantasy","en"
"137",1557,"clashing of steel, and in the midst Lord Falworth crying, in a dreadful","Men of Iron","Pyle, Howard","Fantasy","en"
"138",1557,"voice, ""Thou traitor! thou coward! thou murderer!""","Men of Iron","Pyle, Howard","Fantasy","en"
"139",1557,"","Men of Iron","Pyle, Howard","Fantasy","en"
"140",1557,"Master Robert snatched Myles away from his father, and bore him out of","Men of Iron","Pyle, Howard","Fantasy","en"
"141",1557,"the room in spite of his screams and struggles, and he remembered just","Men of Iron","Pyle, Howard","Fantasy","en"
"142",1557,"one instant's sight of Sir John lying still and silent upon his face,","Men of Iron","Pyle, Howard","Fantasy","en"
"143",1557,"and of the black knight standing above him, with the terrible mace in","Men of Iron","Pyle, Howard","Fantasy","en"
"144",1557,"his hand stained a dreadful red.","Men of Iron","Pyle, Howard","Fantasy","en"
"145",1557,"","Men of Iron","Pyle, Howard","Fantasy","en"
"146",1557,"It was the next day that Lord and Lady Falworth and little Myles,","Men of Iron","Pyle, Howard","Fantasy","en"
"147",1557,"together with three of the more faithful of their people, left the","Men of Iron","Pyle, Howard","Fantasy","en"
"148",1557,"castle.","Men of Iron","Pyle, Howard","Fantasy","en"
"149",1557,"","Men of Iron","Pyle, Howard","Fantasy","en"
"150",1557,"His memory of past things held a picture for Myles of old Diccon Bowman","Men of Iron","Pyle, Howard","Fantasy","en"
"151",1557,"standing over him in the silence of midnight with a lighted lamp in his","Men of Iron","Pyle, Howard","Fantasy","en"
"152",1557,"hand, and with it a recollection of being bidden to hush when he would","Men of Iron","Pyle, Howard","Fantasy","en"
"153",1557,"have spoken, and of being dressed by Diccon and one of the women,","Men of Iron","Pyle, Howard","Fantasy","en"
"154",1557,"bewildered with sleep, shuddering and chattering with cold.","Men of Iron","Pyle, Howard","Fantasy","en"
"155",1557,"","Men of Iron","Pyle, Howard","Fantasy","en"
"156",1557,"He remembered being wrapped in the sheepskin that lay at the foot of","Men of Iron","Pyle, Howard","Fantasy","en"
"157",1557,"his bed, and of being carried in Diccon Bowman's arms down the silent","Men of Iron","Pyle, Howard","Fantasy","en"
"158",1557,"darkness of the winding stair-way, with the great black giant shadows","Men of Iron","Pyle, Howard","Fantasy","en"
"159",1557,"swaying and flickering upon the stone wall as the dull flame of the lamp","Men of Iron","Pyle, Howard","Fantasy","en"
"160",1557,"swayed and flickered in the cold breathing of the night air.","Men of Iron","Pyle, Howard","Fantasy","en"
"161",1557,"","Men of Iron","Pyle, Howard","Fantasy","en"
"162",1557,"Below were his father and mother and two or three others. A stranger","Men of Iron","Pyle, Howard","Fantasy","en"
"163",1557,"stood warming his hands at a newly-made fire, and little Myles, as he","Men of Iron","Pyle, Howard","Fantasy","en"
"164",1557,"peeped from out the warm sheepskin, saw that he was in riding-boots and","Men of Iron","Pyle, Howard","Fantasy","en"
"165",1557,"was covered with mud. He did not know till long years afterwards that","Men of Iron","Pyle, Howard","Fantasy","en"
"166",1557,"the stranger was a messenger sent by a friend at the King's court,","Men of Iron","Pyle, Howard","Fantasy","en"
"167",1557,"bidding his father fly for safety.","Men of Iron","Pyle, Howard","Fantasy","en"
"168",1557,"","Men of Iron","Pyle, Howard","Fantasy","en"
"169",1557,"They who stood there by the red blaze of the fire were all very still,","Men of Iron","Pyle, Howard","Fantasy","en"
"170",1557,"talking in whispers and walking on tiptoes, and Myles's mother hugged","Men of Iron","Pyle, Howard","Fantasy","en"
"171",1557,"him in her arms, sheepskin and all, kissing him, with the tears","Men of Iron","Pyle, Howard","Fantasy","en"
"172",1557,"streaming down her cheeks, and whispering to him, as though he could","Men of Iron","Pyle, Howard","Fantasy","en"
"173",1557,"understand their trouble, that they were about to leave their home","Men of Iron","Pyle, Howard","Fantasy","en"
"174",1557,"forever.","Men of Iron","Pyle, Howard","Fantasy","en"
"175",1557,"","Men of Iron","Pyle, Howard","Fantasy","en"
"176",1557,"Then Diccon Bowman carried him out into the strangeness of the winter","Men of Iron","Pyle, Howard","Fantasy","en"
"177",1557,"midnight.","Men of Iron","Pyle, Howard","Fantasy","en"
"178",1557,"","Men of Iron","Pyle, Howard","Fantasy","en"
"179",1557,"Outside, beyond the frozen moat, where the osiers, stood stark and stiff","Men of Iron","Pyle, Howard","Fantasy","en"
"180",1557,"in their winter nakedness, was a group of dark figures waiting for them","Men of Iron","Pyle, Howard","Fantasy","en"
"181",1557,"with horses. In the pallid moonlight Myles recognized the well-known","Men of Iron","Pyle, Howard","Fantasy","en"
"182",1557,"face of Father Edward, the Prior of St. Mary's.","Men of Iron","Pyle, Howard","Fantasy","en"
"183",1557,"","Men of Iron","Pyle, Howard","Fantasy","en"
"184",1557,"After that came a long ride through that silent night upon the","Men of Iron","Pyle, Howard","Fantasy","en"
"185",1557,"saddle-bow in front of Diccon Bowman; then a deep, heavy sleep, that","Men of Iron","Pyle, Howard","Fantasy","en"
"186",1557,"fell upon him in spite of the galloping of the horses.","Men of Iron","Pyle, Howard","Fantasy","en"
"187",1557,"","Men of Iron","Pyle, Howard","Fantasy","en"
"188",1557,"When next he woke the sun was shining, and his home and his whole life","Men of Iron","Pyle, Howard","Fantasy","en"
"189",1557,"were changed.","Men of Iron","Pyle, Howard","Fantasy","en"
"190",1557,"","Men of Iron","Pyle, Howard","Fantasy","en"
"191",1557,"","Men of Iron","Pyle, Howard","Fantasy","en"
"192",1557,"","Men of Iron","Pyle, Howard","Fantasy","en"
"193",1557,"CHAPTER 2","Men of Iron","Pyle, Howard","Fantasy","en"
"194",1557,"","Men of Iron","Pyle, Howard","Fantasy","en"
"195",1557,"From the time the family escaped from Falworth Castle that midwinter","Men of Iron","Pyle, Howard","Fantasy","en"
"196",1557,"night to the time Myles was sixteen years old he knew nothing of the","Men of Iron","Pyle, Howard","Fantasy","en"
"197",1557,"great world beyond Crosbey-Dale. A fair was held twice in a twelvemonth","Men of Iron","Pyle, Howard","Fantasy","en"
"198",1557,"at the market-town of Wisebey, and three times in the seven years old","Men of Iron","Pyle, Howard","Fantasy","en"
"199",1557,"Diccon Bowman took the lad to see the sights at that place. Beyond these","Men of Iron","Pyle, Howard","Fantasy","en"
"200",1557,"three glimpses of the outer world he lived almost as secluded a life as","Men of Iron","Pyle, Howard","Fantasy","en"
"201",1557,"one of the neighboring monks of St. Mary's Priory.","Men of Iron","Pyle, Howard","Fantasy","en"
"202",1557,"","Men of Iron","Pyle, Howard","Fantasy","en"
"203",1557,"Crosbey-Holt, their new home, was different enough from Falworth or","Men of Iron","Pyle, Howard","Fantasy","en"
"204",1557,"Easterbridge Castle, the former baronial seats of Lord Falworth. It was","Men of Iron","Pyle, Howard","Fantasy","en"
"205",1557,"a long, low, straw-thatched farm-house, once, when the church lands were","Men of Iron","Pyle, Howard","Fantasy","en"
"206",1557,"divided into two holdings, one of the bailiff's houses. All around were","Men of Iron","Pyle, Howard","Fantasy","en"
"207",1557,"the fruitful farms of the priory, tilled by well-to-do tenant holders,","Men of Iron","Pyle, Howard","Fantasy","en"
"208",1557,"and rich with fields of waving grain, and meadow-lands where sheep and","Men of Iron","Pyle, Howard","Fantasy","en"
"209",1557,"cattle grazed in flocks and herds; for in those days the church lands","Men of Iron","Pyle, Howard","Fantasy","en"
"210",1557,"were under church rule, and were governed by church laws, and there,","Men of Iron","Pyle, Howard","Fantasy","en"
"211",1557,"when war and famine and waste and sloth blighted the outside world,","Men of Iron","Pyle, Howard","Fantasy","en"
"212",1557,"harvests flourished and were gathered, and sheep were sheared and cows","Men of Iron","Pyle, Howard","Fantasy","en"
"213",1557,"were milked in peace and quietness.","Men of Iron","Pyle, Howard","Fantasy","en"
"214",1557,"","Men of Iron","Pyle, Howard","Fantasy","en"
"215",1557,"The Prior of St. Mary's owed much if not all of the church's prosperity","Men of Iron","Pyle, Howard","Fantasy","en"
"216",1557,"to the blind Lord Falworth, and now he was paying it back with a haven","Men of Iron","Pyle, Howard","Fantasy","en"
"217",1557,"of refuge from the ruin that his former patron had brought upon himself","Men of Iron","Pyle, Howard","Fantasy","en"
"218",1557,"by giving shelter to Sir John Dale.","Men of Iron","Pyle, Howard","Fantasy","en"
"219",1557,"","Men of Iron","Pyle, Howard","Fantasy","en"
"220",1557,"I fancy that most boys do not love the grinding of school life--the","Men of Iron","Pyle, Howard","Fantasy","en"
"221",1557,"lessons to be conned, the close application during study hours. It is","Men of Iron","Pyle, Howard","Fantasy","en"
"222",1557,"not often pleasant to brisk, lively lads to be so cooped up. I wonder","Men of Iron","Pyle, Howard","Fantasy","en"
"223",1557,"what the boys of to-day would have thought of Myles's training. With him","Men of Iron","Pyle, Howard","Fantasy","en"
"224",1557,"that training was not only of the mind, but of the body as well, and for","Men of Iron","Pyle, Howard","Fantasy","en"
"225",1557,"seven years it was almost unremitting. ""Thou hast thine own way to","Men of Iron","Pyle, Howard","Fantasy","en"
"226",1557,"make in the world, sirrah,"" his father said more than once when the boy","Men of Iron","Pyle, Howard","Fantasy","en"
"227",1557,"complained of the grinding hardness of his life, and to make one's way","Men of Iron","Pyle, Howard","Fantasy","en"
"228",1557,"in those days meant a thousand times more than it does now; it meant not","Men of Iron","Pyle, Howard","Fantasy","en"
"229",1557,"only a heart to feel and a brain to think, but a hand quick and strong","Men of Iron","Pyle, Howard","Fantasy","en"
"230",1557,"to strike in battle, and a body tough to endure the wounds and blows in","Men of Iron","Pyle, Howard","Fantasy","en"
"231",1557,"return. And so it was that Myles's body as well as his mind had to be","Men of Iron","Pyle, Howard","Fantasy","en"
"232",1557,"trained to meet the needs of the dark age in which he lived.","Men of Iron","Pyle, Howard","Fantasy","en"
"233",1557,"","Men of Iron","Pyle, Howard","Fantasy","en"
"234",1557,"Every morning, winter or summer, rain or shine he tramped away six long","Men of Iron","Pyle, Howard","Fantasy","en"
"235",1557,"miles to the priory school, and in the evenings his mother taught him","Men of Iron","Pyle, Howard","Fantasy","en"
"236",1557,"French.","Men of Iron","Pyle, Howard","Fantasy","en"
"237",1557,"","Men of Iron","Pyle, Howard","Fantasy","en"
"238",1557,"Myles, being prejudiced in the school of thought of his day, rebelled","Men of Iron","Pyle, Howard","Fantasy","en"
"239",1557,"not a little at that last branch of his studies. ""Why must I learn that","Men of Iron","Pyle, Howard","Fantasy","en"
"240",1557,"vile tongue?"" said he.","Men of Iron","Pyle, Howard","Fantasy","en"
